"Paul Scherrer Institute, Division for Radiation Safety and Security, CH-5232 Villigen PSI, Switzerland E-mail: sabine.mayer@psi.ch",S. Mayer,lib4ri,10.1093/rpd/nct256,https://doi.org/10.1093/rpd/nct256,./rpd.tar.gz/rpd/abstracts/nct256.xml,Determination of the response function for two personal neutron dosemeter designs based on PADC,,S. Mayer;F. Assenmacher;M. Boschung,2014,Radiation Protection Dosimetry,"Paul Scherrer Institute, Division for Radiation Safety and Security, CH-5232 Villigen PSI, Switzerland E-mail: sabine.mayer@psi.ch;Paul Scherrer Institute, Division for Radiation Safety and Security, CH-5232 Villigen PSI, Switzerland;Paul Scherrer Institute, Division for Radiation Safety and Security, CH-5232 Villigen PSI, Switzerland",Oxford University Press,2017-10-01,161,1-4,82,85,0144-8420,1742-3406,copyright,"© The Author 2013. Published by Oxford University Press. All rights reserved. For Permissions, please email: journals.permissions@oup.com",oxford,https://www.swissbib.ch/Search/Results?lookfor=nationallicenceoxford101093rpdnct256,http://sru.swissbib.ch/sru/search/defaultdb?query=+dc.anywhere+exact+NATIONALLICENCEoxford101093rpdnct256&operation=searchRetrieve&recordSchema=info%3Asrw%2Fschema%2F1%2Fmarcxml-v1.1-light&maximumRecords=10&startRecord=0&recordPacking=XML&availableDBs=defaultdb&sortKeys=Submit+query,http://sru.swissbib.ch/sru/search/defaultdb?query=+dc.anywhere+exact+NATIONALLICENCEoxford101093rpdnct256&operation=searchRetrieve&recordSchema=info%3Asrw%2Fschema%2F1%2Fdc-v1.1-light&maximumRecords=10&startRecord=0&recordPacking=XML&availableDBs=defaultdb&sortKeys=Submit+query,http://sru.swissbib.ch/sru/search/defaultdb?query=+dc.anywhere+exact+NATIONALLICENCEoxford101093rpdnct256&operation=searchRetrieve&recordSchema=info%3Asru%2Fschema%2Fjson&maximumRecords=10&startRecord=0&recordPacking=XML&availableDBs=defaultdb&sortKeys=Submit+query,
"Paul Scherrer Institut, 5232 Villigen PSI, Switzerland",A. Fiechtner-Scharrer,lib4ri,10.1093/rpd/ncq558,https://doi.org/10.1093/rpd/ncq558,./rpd.tar.gz/rpd/abstracts/ncq558.xml,Influence of variation of etching conditions on the sensitivity of PADC detectors with a new evaluation method,,A. Fiechtner-Scharrer;S. Mayer;M. Boschung;A. Whitelaw,2011,Radiation Protection Dosimetry,"Paul Scherrer Institut, 5232 Villigen PSI, Switzerland;Paul Scherrer Institut, 5232 Villigen PSI, Switzerland E-mail: sabine.mayer@psi.ch;Paul Scherrer Institut, 5232 Villigen PSI, Switzerland;University of St. Andrews, St. Andrews KY16 9SS, UK",Oxford University Press,,144,1-4,150,154,0144-8420,1742-3406,copyright,"© The Author 2011. Published by Oxford University Press. All rights reserved. For Permissions, please email: journals.permissions@oup.com",oxford,https://www.swissbib.ch/Search/Results?lookfor=nationallicenceoxford101093rpdncq558,http://sru.swissbib.ch/sru/search/defaultdb?query=+dc.anywhere+exact+NATIONALLICENCEoxford101093rpdncq558&operation=searchRetrieve&recordSchema=info%3Asrw%2Fschema%2F1%2Fmarcxml-v1.1-light&maximumRecords=10&startRecord=0&recordPacking=XML&availableDBs=defaultdb&sortKeys=Submit+query,http://sru.swissbib.ch/sru/search/defaultdb?query=+dc.anywhere+exact+NATIONALLICENCEoxford101093rpdncq558&operation=searchRetrieve&recordSchema=info%3Asrw%2Fschema%2F1%2Fdc-v1.1-light&maximumRecords=10&startRecord=0&recordPacking=XML&availableDBs=defaultdb&sortKeys=Submit+query,http://sru.swissbib.ch/sru/search/defaultdb?query=+dc.anywhere+exact+NATIONALLICENCEoxford101093rpdncq558&operation=searchRetrieve&recordSchema=info%3Asru%2Fschema%2Fjson&maximumRecords=10&startRecord=0&recordPacking=XML&availableDBs=defaultdb&sortKeys=Submit+query,
"Paul Scherrer Institut, 5232 Villigen PSI, Switzerland",G. Butterweck,lib4ri,10.1093/rpd/ncs060,https://doi.org/10.1093/rpd/ncs060,./rpd.tar.gz/rpd/abstracts/ncs060.xml,Investigation of the stability of commercial neutron probes,,H. Hoedlmoser;G. Butterweck;Ch. Schuler;S. Mayer,2012,Radiation Protection Dosimetry,"E-mail: herbert.hoedlmoser@psi.ch;Paul Scherrer Institut, 5232 Villigen PSI, Switzerland;Paul Scherrer Institut, 5232 Villigen PSI, Switzerland;Paul Scherrer Institut, 5232 Villigen PSI, Switzerland",Oxford University Press,,152,4,450,454,0144-8420,1742-3406,copyright,"© The Author 2012. Published by Oxford University Press. All rights reserved. For Permissions, please email: journals.permissions@oup.com",oxford,https://www.swissbib.ch/Search/Results?lookfor=nationallicenceoxford101093rpdncs060,http://sru.swissbib.ch/sru/search/defaultdb?query=+dc.anywhere+exact+NATIONALLICENCEoxford101093rpdncs060&operation=searchRetrieve&recordSchema=info%3Asrw%2Fschema%2F1%2Fmarcxml-v1.1-light&maximumRecords=10&startRecord=0&recordPacking=XML&availableDBs=defaultdb&sortKeys=Submit+query,http://sru.swissbib.ch/sru/search/defaultdb?query=+dc.anywhere+exact+NATIONALLICENCEoxford101093rpdncs060&operation=searchRetrieve&recordSchema=info%3Asrw%2Fschema%2F1%2Fdc-v1.1-light&maximumRecords=10&startRecord=0&recordPacking=XML&availableDBs=defaultdb&sortKeys=Submit+query,http://sru.swissbib.ch/sru/search/defaultdb?query=+dc.anywhere+exact+NATIONALLICENCEoxford101093rpdncs060&operation=searchRetrieve&recordSchema=info%3Asru%2Fschema%2Fjson&maximumRecords=10&startRecord=0&recordPacking=XML&availableDBs=defaultdb&sortKeys=Submit+query,
"Paul Sherrer Institute, 5232 Villigen PSI, Switzerland",C. Wernli,lib4ri,10.1093/rpd/ncl016,https://doi.org/10.1093/rpd/ncl016,./rpd.tar.gz/rpd/abstracts/ncl016.xml,Individual monitoring for internal exposures in Europe: Conclusions of an EURADOS action,,M. A. Lopez;J. W. E. van Dijk;C. M. Castellani;L. Currivan;R. Falk;P. Olko;C. Wernli,2006,Radiation Protection Dosimetry,"CIEMAT-Internal Dosimetry, Avda Complutene 22, 28040 Madrid, Spain E-mail: ma.lopez@ciemat.es;NRG Radiation and Environment, Utrechtseweg 310, Postbus 9034, 6800 AS Arnhem, The Netherlands;ENEA-ION-IRP, via dei Colli 16, 40136 Bologna, Italy;RPII, 3 Clonskeagh Square, Dublin 14, Ireland;SSI, Stockholm, 171 16 Sweden;Institute of Nuclear Physics, Radzikowskiego 152, PL 31 342 Kraków, Poland;Paul Sherrer Institute, 5232 Villigen PSI, Switzerland",Oxford University Press,,118,2,176,181,0144-8420,1742-3406,copyright,"© The Author 2006. Published by Oxford University Press. All rights reserved. For Permissions, please email: journals.permissions@oxfordjournals.org",oxford,https://www.swissbib.ch/Search/Results?lookfor=nationallicenceoxford101093rpdncl016,http://sru.swissbib.ch/sru/search/defaultdb?query=+dc.anywhere+exact+NATIONALLICENCEoxford101093rpdncl016&operation=searchRetrieve&recordSchema=info%3Asrw%2Fschema%2F1%2Fmarcxml-v1.1-light&maximumRecords=10&startRecord=0&recordPacking=XML&availableDBs=defaultdb&sortKeys=Submit+query,http://sru.swissbib.ch/sru/search/defaultdb?query=+dc.anywhere+exact+NATIONALLICENCEoxford101093rpdncl016&operation=searchRetrieve&recordSchema=info%3Asrw%2Fschema%2F1%2Fdc-v1.1-light&maximumRecords=10&startRecord=0&recordPacking=XML&availableDBs=defaultdb&sortKeys=Submit+query,http://sru.swissbib.ch/sru/search/defaultdb?query=+dc.anywhere+exact+NATIONALLICENCEoxford101093rpdncl016&operation=searchRetrieve&recordSchema=info%3Asru%2Fschema%2Fjson&maximumRecords=10&startRecord=0&recordPacking=XML&availableDBs=defaultdb&sortKeys=Submit+query,
"Paul Scherrer Institut, CH-5232 Villigen, Switzerland",M. Boschung,lib4ri,10.1093/rpd/ncj011,https://doi.org/10.1093/rpd/ncj011,./rpd.tar.gz/rpd/abstracts/ncj011.xml,Evaluation of individual monitoring in mixed neutron/photon fields: mid-term results from the EVIDOS project,,F. Vanhavere;D. Bartlett;T. Bolognese-Milsztajn;M. Boschung;M. Coeck;G. Curzio;F. d'Errico;A. Fiechtner;J. Kyllönen;V. Lacoste;T. Lahaye;L. Lindborg;M. Luszik-Bhadra;C. Molinos;H. Muller;M. Reginatto;H. Schuhmacher;R. Tanner,2006,Radiation Protection Dosimetry,"Studiecentrum voor Kernenergie—Centre d'étude de l'énergie nucléaire, B-2400 Mol, Belgium E-mail: fvanhave@sckcen.be;National Radiological Protection Board, Chilton, Didcot OX11 0RQ, UK;Institut de Radioprotection et de Sûreté Nucléaire, F-92265 Fontenay-aux-Roses, France;Paul Scherrer Institut, CH-5232 Villigen, Switzerland;Studiecentrum voor Kernenergie—Centre d'étude de l'énergie nucléaire, B-2400 Mol, Belgium;Dipartimento di Ingegneria Meccanica, Nucleare e della Produzione, I-56126 Pisa, Italy;Dipartimento di Ingegneria Meccanica, Nucleare e della Produzione, I-56126 Pisa, Italy;Paul Scherrer Institut, CH-5232 Villigen, Switzerland;Statens strålskyddsinstitut, SE-171-16 Stockholm, Sweden;Institut de Radioprotection et de Sûreté Nucléaire, F-92265 Fontenay-aux-Roses, France;Institut de Radioprotection et de Sûreté Nucléaire, F-92265 Fontenay-aux-Roses, France;Statens strålskyddsinstitut, SE-171-16 Stockholm, Sweden;Physikalisch-Technische Bundesanstalt, D-38116 Braunschweig, Germany;National Radiological Protection Board, Chilton, Didcot OX11 0RQ, UK;Institut de Radioprotection et de Sûreté Nucléaire, F-92265 Fontenay-aux-Roses, France;Physikalisch-Technische Bundesanstalt, D-38116 Braunschweig, Germany;Physikalisch-Technische Bundesanstalt, D-38116 Braunschweig, Germany;National Radiological Protection Board, Chilton, Didcot OX11 0RQ, UK",Oxford University Press,,120,1-4,263,267,0144-8420,1742-3406,copyright,"© The Author 2006. Published by Oxford University Press. All rights reserved. For Permissions, please email: journals.permissions@oxfordjournals.org",oxford,https://www.swissbib.ch/Search/Results?lookfor=nationallicenceoxford101093rpdncj011,http://sru.swissbib.ch/sru/search/defaultdb?query=+dc.anywhere+exact+NATIONALLICENCEoxford101093rpdncj011&operation=searchRetrieve&recordSchema=info%3Asrw%2Fschema%2F1%2Fmarcxml-v1.1-light&maximumRecords=10&startRecord=0&recordPacking=XML&availableDBs=defaultdb&sortKeys=Submit+query,http://sru.swissbib.ch/sru/search/defaultdb?query=+dc.anywhere+exact+NATIONALLICENCEoxford101093rpdncj011&operation=searchRetrieve&recordSchema=info%3Asrw%2Fschema%2F1%2Fdc-v1.1-light&maximumRecords=10&startRecord=0&recordPacking=XML&availableDBs=defaultdb&sortKeys=Submit+query,http://sru.swissbib.ch/sru/search/defaultdb?query=+dc.anywhere+exact+NATIONALLICENCEoxford101093rpdncj011&operation=searchRetrieve&recordSchema=info%3Asru%2Fschema%2Fjson&maximumRecords=10&startRecord=0&recordPacking=XML&availableDBs=defaultdb&sortKeys=Submit+query,
"Paul Scherrer InstitutCH-5232 Villigen, Switzerland",M. Boschung,lib4ri,10.1093/rpd/ncm189,https://doi.org/10.1093/rpd/ncm189,./rpd.tar.gz/rpd/abstracts/ncm189.xml,Direction distributions of neutrons and reference values of the personal dose equivalent in workplace fields,,M. Luszik-Bhadra;T. Bolognese-Milsztajn;M. Boschung;M. Coeck;G. Curzio;F. d'Errico;A. Fiechtner;V. Lacoste;L. Lindborg;M. Reginatto;H. Schuhmacher;R. Tanner;F. Vanhavere,2007,Radiation Protection Dosimetry,"Physikalisch-Technische BundesanstaltD-38116 Braunschweig, Germany;Institut de Radioprotection et de Sûreté NucléaireF-92265 Fontenay-aux-Roses, France;Paul Scherrer InstitutCH-5232 Villigen, Switzerland;Studiecentrum voor Kernenergie—Centre d'étude de l'énergie nucléaireB-2400 Mol, Belgium;Dipartimento di Ingegneria Meccanica, Nucleare e della ProduzioneI-56126 Pisa, Italy;Dipartimento di Ingegneria Meccanica, Nucleare e della ProduzioneI-56126 Pisa, Italy;Paul Scherrer InstitutCH-5232 Villigen, Switzerland;Institut de Radioprotection et de Sûreté NucléaireF-92265 Fontenay-aux-Roses, France;Swedish Radiation Protection AuthoritySE-171-16 Stockholm, Sweden;Physikalisch-Technische BundesanstaltD-38116 Braunschweig, Germany;Physikalisch-Technische BundesanstaltD-38116 Braunschweig, Germany;Radiation Protection Division, Health Protection AgencyChilton, Didcot OX11 0RQ, UK;Studiecentrum voor Kernenergie—Centre d'étude de l'énergie nucléaireB-2400 Mol, Belgium",Oxford University Press,,125,1-4,364,368,0144-8420,1742-3406,copyright,"© The Author 2007. Published by Oxford University Press. All rights reserved. For Permissions, please email: journals.permissions@oxfordjournals.org",oxford,https://www.swissbib.ch/Search/Results?lookfor=nationallicenceoxford101093rpdncm189,http://sru.swissbib.ch/sru/search/defaultdb?query=+dc.anywhere+exact+NATIONALLICENCEoxford101093rpdncm189&operation=searchRetrieve&recordSchema=info%3Asrw%2Fschema%2F1%2Fmarcxml-v1.1-light&maximumRecords=10&startRecord=0&recordPacking=XML&availableDBs=defaultdb&sortKeys=Submit+query,http://sru.swissbib.ch/sru/search/defaultdb?query=+dc.anywhere+exact+NATIONALLICENCEoxford101093rpdncm189&operation=searchRetrieve&recordSchema=info%3Asrw%2Fschema%2F1%2Fdc-v1.1-light&maximumRecords=10&startRecord=0&recordPacking=XML&availableDBs=defaultdb&sortKeys=Submit+query,http://sru.swissbib.ch/sru/search/defaultdb?query=+dc.anywhere+exact+NATIONALLICENCEoxford101093rpdncm189&operation=searchRetrieve&recordSchema=info%3Asru%2Fschema%2Fjson&maximumRecords=10&startRecord=0&recordPacking=XML&availableDBs=defaultdb&sortKeys=Submit+query,
"Department of Aquatic Ecology, Eawag: Swiss Federal Institute of Aquatic Science and Technology, Dübendorf, Switzerland Institute of Integrative Biology (IBZ), ETH Zurich, Zurich, Switzerland Department of Experimental Limnology, Leibniz Institute of Freshwater Ecology and Inland Fisheries (IGB), Stechlin, Germany E-mail: frossard.aline@gmail.com",Aline Frossard,lib4ri,10.1111/1574-6941.12072,https://doi.org/10.1111/1574-6941.12072,./femsec/femsec84-2/abstracts/84-2-398.xml,Shifts in microbial community structure and function in stream sediments during experimentally simulated riparian succession,,Aline Frossard;Linda Gerull;Michael Mutz;Mark O. Gessner,2013,FEMS Microbiology Ecology,"Department of Aquatic Ecology, Eawag: Swiss Federal Institute of Aquatic Science and Technology, Dübendorf, Switzerland Institute of Integrative Biology (IBZ), ETH Zurich, Zurich, Switzerland Department of Experimental Limnology, Leibniz Institute of Freshwater Ecology and Inland Fisheries (IGB), Stechlin, Germany E-mail: frossard.aline@gmail.com;Department of Freshwater Conservation, Brandenburg University of Technology, Bad Saarow, Germany;Department of Freshwater Conservation, Brandenburg University of Technology, Bad Saarow, Germany;Department of Aquatic Ecology, Eawag: Swiss Federal Institute of Aquatic Science and Technology, Dübendorf, Switzerland Institute of Integrative Biology (IBZ), ETH Zurich, Zurich, Switzerland Department of Experimental Limnology, Leibniz Institute of Freshwater Ecology and Inland Fisheries (IGB), Stechlin, Germany Department of Ecology, Berlin Institute of Technology (TU Berlin), Berlin, Germany",Blackwell Publishing Ltd,,84,2,398,410,,1574-6941,copyright,© 2012 Federation of European Microbiological Societies,oxford,https://www.swissbib.ch/Search/Results?lookfor=nationallicenceoxford1011111574694112072,http://sru.swissbib.ch/sru/search/defaultdb?query=+dc.anywhere+exact+NATIONALLICENCEoxford1011111574694112072&operation=searchRetrieve&recordSchema=info%3Asrw%2Fschema%2F1%2Fmarcxml-v1.1-light&maximumRecords=10&startRecord=0&recordPacking=XML&availableDBs=defaultdb&sortKeys=Submit+query,http://sru.swissbib.ch/sru/search/defaultdb?query=+dc.anywhere+exact+NATIONALLICENCEoxford1011111574694112072&operation=searchRetrieve&recordSchema=info%3Asrw%2Fschema%2F1%2Fdc-v1.1-light&maximumRecords=10&startRecord=0&recordPacking=XML&availableDBs=defaultdb&sortKeys=Submit+query,http://sru.swissbib.ch/sru/search/defaultdb?query=+dc.anywhere+exact+NATIONALLICENCEoxford1011111574694112072&operation=searchRetrieve&recordSchema=info%3Asru%2Fschema%2Fjson&maximumRecords=10&startRecord=0&recordPacking=XML&availableDBs=defaultdb&sortKeys=Submit+query,
"Department of Limnology, EAWAG/ETH, Ueberlandstrasse 133, CH-8600 Dübendorf, Switzerland and",Sandra Lass,lib4ri,10.1093/plankt/22.7.1411,https://doi.org/10.1093/plankt/22.7.1411,./plankt.tar.gz/plankt/abstracts/0221411.xml,How do migrating daphnids cope with fish predation risk in the epilimnion under anoxic conditions in the hypolimnion?,,Sandra Lass;Maarten Boersma;Piet Spaak,2000,Journal of Plankton Research,"Department of Limnology, EAWAG/ETH, Ueberlandstrasse 133, CH-8600 Dübendorf, Switzerland and;Max-Planck-Institut für Limnologie, Postfach 165, D-24302 Plön, Germany;Department of Limnology, EAWAG/ETH, Ueberlandstrasse 133, CH-8600 Dübendorf, Switzerland and",Oxford University Press,,22,7,1411,1418,0142-7873,1464-3774,copyright,© Oxford University Press 2000,oxford,https://www.swissbib.ch/Search/Results?lookfor=nationallicenceoxford101093plankt2271411,http://sru.swissbib.ch/sru/search/defaultdb?query=+dc.anywhere+exact+NATIONALLICENCEoxford101093plankt2271411&operation=searchRetrieve&recordSchema=info%3Asrw%2Fschema%2F1%2Fmarcxml-v1.1-light&maximumRecords=10&startRecord=0&recordPacking=XML&availableDBs=defaultdb&sortKeys=Submit+query,http://sru.swissbib.ch/sru/search/defaultdb?query=+dc.anywhere+exact+NATIONALLICENCEoxford101093plankt2271411&operation=searchRetrieve&recordSchema=info%3Asrw%2Fschema%2F1%2Fdc-v1.1-light&maximumRecords=10&startRecord=0&recordPacking=XML&availableDBs=defaultdb&sortKeys=Submit+query,http://sru.swissbib.ch/sru/search/defaultdb?query=+dc.anywhere+exact+NATIONALLICENCEoxford101093plankt2271411&operation=searchRetrieve&recordSchema=info%3Asru%2Fschema%2Fjson&maximumRecords=10&startRecord=0&recordPacking=XML&availableDBs=defaultdb&sortKeys=Submit+query,
"Institute for Building Materials, ETH-Swiss Federal Institute of Technology Zurich, CH-8093 Zurich, Switzerland Applied Wood Materials Laboratory, EMPA-Swiss Federal Laboratories for Materials Science and Technology, CH-8600 Dübendorf, Switzerland Research Institute of Wood Industry, Chinese Academy of Forestry, Beijing 100091, China",Xiaoqing Wang,lib4ri,10.1093/aob/mcu180,https://doi.org/10.1093/aob/mcu180,./ANNBOT/annbot114-8/abstracts/mcu180.xml,"Plant material features responsible for bamboo's excellent mechanical performance: a comparison of tensile properties of bamboo and spruce at the tissue, fibre and cell wall levels",,Xiaoqing Wang;Tobias Keplinger;Notburga Gierlinger;Ingo Burgert,2014,Annals of Botany,"Institute for Building Materials, ETH-Swiss Federal Institute of Technology Zurich, CH-8093 Zurich, Switzerland Applied Wood Materials Laboratory, EMPA-Swiss Federal Laboratories for Materials Science and Technology, CH-8600 Dübendorf, Switzerland Research Institute of Wood Industry, Chinese Academy of Forestry, Beijing 100091, China;Institute for Building Materials, ETH-Swiss Federal Institute of Technology Zurich, CH-8093 Zurich, Switzerland Applied Wood Materials Laboratory, EMPA-Swiss Federal Laboratories for Materials Science and Technology, CH-8600 Dübendorf, Switzerland;Institute for Building Materials, ETH-Swiss Federal Institute of Technology Zurich, CH-8093 Zurich, Switzerland Applied Wood Materials Laboratory, EMPA-Swiss Federal Laboratories for Materials Science and Technology, CH-8600 Dübendorf, Switzerland;Institute for Building Materials, ETH-Swiss Federal Institute of Technology Zurich, CH-8093 Zurich, Switzerland Applied Wood Materials Laboratory, EMPA-Swiss Federal Laboratories for Materials Science and Technology, CH-8600 Dübendorf, Switzerland",Oxford University Press,2017-12-01,114,8,1627,1635,0305-7364,1095-8290,copyright,"© The Author 2014. Published by Oxford University Press on behalf of the Annals of Botany Company. All rights reserved. For Permissions, please email: journals.permissions@oup.com",oxford,https://www.swissbib.ch/Search/Results?lookfor=nationallicenceoxford101093aobmcu180,http://sru.swissbib.ch/sru/search/defaultdb?query=+dc.anywhere+exact+NATIONALLICENCEoxford101093aobmcu180&operation=searchRetrieve&recordSchema=info%3Asrw%2Fschema%2F1%2Fmarcxml-v1.1-light&maximumRecords=10&startRecord=0&recordPacking=XML&availableDBs=defaultdb&sortKeys=Submit+query,http://sru.swissbib.ch/sru/search/defaultdb?query=+dc.anywhere+exact+NATIONALLICENCEoxford101093aobmcu180&operation=searchRetrieve&recordSchema=info%3Asrw%2Fschema%2F1%2Fdc-v1.1-light&maximumRecords=10&startRecord=0&recordPacking=XML&availableDBs=defaultdb&sortKeys=Submit+query,http://sru.swissbib.ch/sru/search/defaultdb?query=+dc.anywhere+exact+NATIONALLICENCEoxford101093aobmcu180&operation=searchRetrieve&recordSchema=info%3Asru%2Fschema%2Fjson&maximumRecords=10&startRecord=0&recordPacking=XML&availableDBs=defaultdb&sortKeys=Submit+query,
"WSL Institute for Snow and Avalanche Research SLF, Unit of Community Ecology, Mountain Ecosystems, Flüelastrasse 11, 7260 Davos Dorf, Switzerland Ecole Polytechnique Fédérale de Lausanne EPFL, Laboratory of Ecological Systems ECOS, Station 2, 1015 Lausanne, Switzerland",Mandy Pohl,lib4ri,10.1093/aob/mcr169,https://doi.org/10.1093/aob/mcr169,./ANNBOT/annbot108-3/abstracts/mcr169.xml,Functional traits and root morphology of alpine plants,,Mandy Pohl;Raphaël Stroude;Alexandre Buttler;Christian Rixen,2011,Annals of Botany,"WSL Institute for Snow and Avalanche Research SLF, Unit of Community Ecology, Mountain Ecosystems, Flüelastrasse 11, 7260 Davos Dorf, Switzerland Ecole Polytechnique Fédérale de Lausanne EPFL, Laboratory of Ecological Systems ECOS, Station 2, 1015 Lausanne, Switzerland;WSL Institute for Snow and Avalanche Research SLF, Unit of Community Ecology, Mountain Ecosystems, Flüelastrasse 11, 7260 Davos Dorf, Switzerland;Ecole Polytechnique Fédérale de Lausanne EPFL, Laboratory of Ecological Systems ECOS, Station 2, 1015 Lausanne, Switzerland WSL Swiss Federal Institute for Forest, Snow and Landscape Research, Unit of Community Ecology, Pasture Woodlands and Wetlands, POB 96, 1015 Lausanne, Switzerland;WSL Institute for Snow and Avalanche Research SLF, Unit of Community Ecology, Mountain Ecosystems, Flüelastrasse 11, 7260 Davos Dorf, Switzerland",Oxford University Press,,108,3,537,545,0305-7364,1095-8290,copyright,"© The Author 2011. Published by Oxford University Press on behalf of the Annals of Botany Company. All rights reserved. For Permissions, please email: journals.permissions@oup.com",oxford,https://www.swissbib.ch/Search/Results?lookfor=nationallicenceoxford101093aobmcr169,http://sru.swissbib.ch/sru/search/defaultdb?query=+dc.anywhere+exact+NATIONALLICENCEoxford101093aobmcr169&operation=searchRetrieve&recordSchema=info%3Asrw%2Fschema%2F1%2Fmarcxml-v1.1-light&maximumRecords=10&startRecord=0&recordPacking=XML&availableDBs=defaultdb&sortKeys=Submit+query,http://sru.swissbib.ch/sru/search/defaultdb?query=+dc.anywhere+exact+NATIONALLICENCEoxford101093aobmcr169&operation=searchRetrieve&recordSchema=info%3Asrw%2Fschema%2F1%2Fdc-v1.1-light&maximumRecords=10&startRecord=0&recordPacking=XML&availableDBs=defaultdb&sortKeys=Submit+query,http://sru.swissbib.ch/sru/search/defaultdb?query=+dc.anywhere+exact+NATIONALLICENCEoxford101093aobmcr169&operation=searchRetrieve&recordSchema=info%3Asru%2Fschema%2Fjson&maximumRecords=10&startRecord=0&recordPacking=XML&availableDBs=defaultdb&sortKeys=Submit+query,
