"Swiss Light Source, Paul Scherrer Institute, CH-5232 Villigen, Switzerland",Meitian Wang,lib4ri,10.1093/jac/dku183,https://doi.org/10.1093/jac/dku183,./JAC/jac69-10/abstracts/dku183.xml,The M-T hook structure increases the potency of HIV-1 fusion inhibitor sifuvirtide and overcomes drug resistance,,Huihui Chong;Xue Yao;Zonglin Qiu;Jianping Sun;Yuanyuan Qiao;Meng Zhang;Meitian Wang;Sheng Cui;Yuxian He,2014,Journal of Antimicrobial Chemotherapy,"MOH Key Laboratory of Systems Biology of Pathogens and AIDS Research Center, Institute of Pathogen Biology, Chinese Academy of Medical Sciences & Peking Union Medical College, Beijing 100730, China;MOH Key Laboratory of Systems Biology of Pathogens and AIDS Research Center, Institute of Pathogen Biology, Chinese Academy of Medical Sciences & Peking Union Medical College, Beijing 100730, China;MOH Key Laboratory of Systems Biology of Pathogens and AIDS Research Center, Institute of Pathogen Biology, Chinese Academy of Medical Sciences & Peking Union Medical College, Beijing 100730, China;MOH Key Laboratory of Systems Biology of Pathogens and AIDS Research Center, Institute of Pathogen Biology, Chinese Academy of Medical Sciences & Peking Union Medical College, Beijing 100730, China;MOH Key Laboratory of Systems Biology of Pathogens and AIDS Research Center, Institute of Pathogen Biology, Chinese Academy of Medical Sciences & Peking Union Medical College, Beijing 100730, China;MOH Key Laboratory of Systems Biology of Pathogens and AIDS Research Center, Institute of Pathogen Biology, Chinese Academy of Medical Sciences & Peking Union Medical College, Beijing 100730, China;Swiss Light Source, Paul Scherrer Institute, CH-5232 Villigen, Switzerland;MOH Key Laboratory of Systems Biology of Pathogens and AIDS Research Center, Institute of Pathogen Biology, Chinese Academy of Medical Sciences & Peking Union Medical College, Beijing 100730, China;MOH Key Laboratory of Systems Biology of Pathogens and AIDS Research Center, Institute of Pathogen Biology, Chinese Academy of Medical Sciences & Peking Union Medical College, Beijing 100730, China E-mail: yhe@ipb.pumc.edu.cn",Oxford University Press,2017-10-01,69,10,2759,2769,0305-7453,1460-2091,copyright,"© The Author 2014. Published by Oxford University Press on behalf of the British Society for Antimicrobial Chemotherapy. All rights reserved. For Permissions, please e-mail: journals.permissions@oup.com",oxford,https://www.swissbib.ch/Search/Results?lookfor=nationallicenceoxford101093jacdku183,http://sru.swissbib.ch/sru/search/defaultdb?query=+dc.anywhere+exact+NATIONALLICENCEoxford101093jacdku183&operation=searchRetrieve&recordSchema=info%3Asrw%2Fschema%2F1%2Fmarcxml-v1.1-light&maximumRecords=10&startRecord=0&recordPacking=XML&availableDBs=defaultdb&sortKeys=Submit+query,http://sru.swissbib.ch/sru/search/defaultdb?query=+dc.anywhere+exact+NATIONALLICENCEoxford101093jacdku183&operation=searchRetrieve&recordSchema=info%3Asrw%2Fschema%2F1%2Fdc-v1.1-light&maximumRecords=10&startRecord=0&recordPacking=XML&availableDBs=defaultdb&sortKeys=Submit+query,http://sru.swissbib.ch/sru/search/defaultdb?query=+dc.anywhere+exact+NATIONALLICENCEoxford101093jacdku183&operation=searchRetrieve&recordSchema=info%3Asru%2Fschema%2Fjson&maximumRecords=10&startRecord=0&recordPacking=XML&availableDBs=defaultdb&sortKeys=Submit+query,
"Paul Scherrer Institut, SLS, Villigen, Switzerland",Rajmund Mokso,lib4ri,10.1515/hf-2011-0192,https://doi.org/10.1515/hf-2011-0192,./j/hfsg.2012.66.issue-8/hf-2011-0192/hf-2011-0192.xml,Synchrotron-based tomographic microscopy (SbTM) of wood: development of a testing device and observation of plastic deformation of uniaxially compressed Norway spruce samples,,Michaela Zauner;Daniel Keunecke;Rajmund Mokso;Marco Stampanoni;Peter Niemz,2012,Holzforschung,"Department of Civil, Environmental and Geomatic Engineering, Institute for Building Materials, ETH Zurich, Zurich, Switzerland;Department of Civil, Environmental and Geomatic Engineering, Institute for Building Materials, ETH Zurich, Zurich, Switzerland;Paul Scherrer Institut, SLS, Villigen, Switzerland;Paul Scherrer Institut, SLS, Villigen, Switzerland;Department of Civil, Environmental and Geomatic Engineering, Institute for Building Materials, ETH Zurich, Zurich, Switzerland",Walter de Gruyter,,66,8,973,979,0018-3830,1437-434X,copyright,©2012 by Walter de Gruyter Berlin Boston,gruyter,https://www.swissbib.ch/Search/Results?lookfor=nationallicencegruyter101515hf20110192,http://sru.swissbib.ch/sru/search/defaultdb?query=+dc.anywhere+exact+NATIONALLICENCEgruyter101515hf20110192&operation=searchRetrieve&recordSchema=info%3Asrw%2Fschema%2F1%2Fmarcxml-v1.1-light&maximumRecords=10&startRecord=0&recordPacking=XML&availableDBs=defaultdb&sortKeys=Submit+query,http://sru.swissbib.ch/sru/search/defaultdb?query=+dc.anywhere+exact+NATIONALLICENCEgruyter101515hf20110192&operation=searchRetrieve&recordSchema=info%3Asrw%2Fschema%2F1%2Fdc-v1.1-light&maximumRecords=10&startRecord=0&recordPacking=XML&availableDBs=defaultdb&sortKeys=Submit+query,http://sru.swissbib.ch/sru/search/defaultdb?query=+dc.anywhere+exact+NATIONALLICENCEgruyter101515hf20110192&operation=searchRetrieve&recordSchema=info%3Asru%2Fschema%2Fjson&maximumRecords=10&startRecord=0&recordPacking=XML&availableDBs=defaultdb&sortKeys=Submit+query,
"Paul Scherrer Institut, CH-5232 Villigen PSI, Switzerland",Α. Türler,lib4ri,10.1524/ract.1996.73.2.55,https://doi.org/10.1524/ract.1996.73.2.55,./j/ract.1996.73.issue-2/ract.1996.73.2.55/ract.1996.73.2.55.xml,On-line Gas Phase Chromatography with Chlorides of Niobium and Hahnium (Element 105),,Α. Türler;Β. Eichler;D. T. Jost;D. Piguet;H. W. Gäggeler;Κ. E. Gregorich;Β. Kadkhodayan;S. A. Kreek;D. M. Lee;M. Mohar;E. Sylwester;D. C. Hoffman;S. Hübener,1996,Radiochimica Acta,"Paul Scherrer Institut, CH-5232 Villigen PSI, Switzerland;Paul Scherrer Institut, CH-5232 Villigen PSI, Switzerland H. W. Gäggeler Paul Scherrer Institut, CH-5232 Villigen PSI, Switzerland;Paul Scherrer Institut, CH-5232 Villigen PSI, Switzerland;Paul Scherrer Institut, CH-5232 Villigen PSI, Switzerland;Paul Scherrer Institut, CH-5232 Villigen PSI, Switzerland Labor für Radio- und Umweltchemie, Universität Bern, CH-3012 Bern, Switzerland;Lawrence Berkeley Laboratory, Berkeley CA 94720, USA;Lawrence Berkeley Laboratory, Berkeley CA 94720, USA;Lawrence Berkeley Laboratory, Berkeley CA 94720, USA;Lawrence Berkeley Laboratory, Berkeley CA 94720, USA;Lawrence Berkeley Laboratory, Berkeley CA 94720, USA;Lawrence Berkeley Laboratory, Berkeley CA 94720, USA;Lawrence Berkeley Laboratory, Berkeley CA 94720, USA;Institut für Radiochemie, Forschungszentrum Rossendorf, D-01314 Dresden, Germany",OLDENBOURG WISSENSCHAFTSVERLAG,,73,2,55,66,0033-8230,2193-3405,copyright,"© 2013 Oldenbourg Wissenschaftsverlag GmbH, Rosenheimer Str. 145, 81671 München",gruyter,https://www.swissbib.ch/Search/Results?lookfor=nationallicencegruyter101524ract199673255,http://sru.swissbib.ch/sru/search/defaultdb?query=+dc.anywhere+exact+NATIONALLICENCEgruyter101524ract199673255&operation=searchRetrieve&recordSchema=info%3Asrw%2Fschema%2F1%2Fmarcxml-v1.1-light&maximumRecords=10&startRecord=0&recordPacking=XML&availableDBs=defaultdb&sortKeys=Submit+query,http://sru.swissbib.ch/sru/search/defaultdb?query=+dc.anywhere+exact+NATIONALLICENCEgruyter101524ract199673255&operation=searchRetrieve&recordSchema=info%3Asrw%2Fschema%2F1%2Fdc-v1.1-light&maximumRecords=10&startRecord=0&recordPacking=XML&availableDBs=defaultdb&sortKeys=Submit+query,http://sru.swissbib.ch/sru/search/defaultdb?query=+dc.anywhere+exact+NATIONALLICENCEgruyter101524ract199673255&operation=searchRetrieve&recordSchema=info%3Asru%2Fschema%2Fjson&maximumRecords=10&startRecord=0&recordPacking=XML&availableDBs=defaultdb&sortKeys=Submit+query,
"Paul Scherrer Institut, Labor für Radio- und Umweltchemie, CH-5232 Villigen, Switzerland",B. Eichler,lib4ri,10.1524/ract.1999.84.1.43,https://doi.org/10.1524/ract.1999.84.1.43,./j/ract.1999.84.issue-1/ract.1999.84.1.43/ract.1999.84.1.43.xml,Gas Chromatographic Studies of Oxide and Hydroxide Species of Tungsten - Model Experiments with Respect to the Physico-Chemical Characterization of Seaborgium (Element 106),,A. Vahle;S. Hübener;H. Funke;B. Eichler;D. T. Jost;A. Türler;W. Brüchle;E. Jäger,1999,Radiochimica Acta,"Forschungszentrum Rossendorf e.V., Institut für Radiochemie, D-01314 Dresden, Germany;Forschungszentrum Rossendorf e.V., Institut für Radiochemie, D-01314 Dresden, Germany;Forschungszentrum Rossendorf e.V., Institut für Radiochemie, D-01314 Dresden, Germany European Synchrotron Radiation Facility, F-38043 Grenoble Cedex, France;Paul Scherrer Institut, Labor für Radio- und Umweltchemie, CH-5232 Villigen, Switzerland;Paul Scherrer Institut, Labor für Radio- und Umweltchemie, CH-5232 Villigen, Switzerland;Paul Scherrer Institut, Labor für Radio- und Umweltchemie, CH-5232 Villigen, Switzerland;Gesellschaft für Schwerionenforschung, Planckstr. 1, D-64291 Darmstadt, Germany;Gesellschaft für Schwerionenforschung, Planckstr. 1, D-64291 Darmstadt, Germany",OLDENBOURG WISSENSCHAFTSVERLAG,,84,1,43,52,0033-8230,2193-3405,copyright,"© 2013 Oldenbourg Wissenschaftsverlag GmbH, Rosenheimer Str. 145, 81671 München",gruyter,https://www.swissbib.ch/Search/Results?lookfor=nationallicencegruyter101524ract199984143,http://sru.swissbib.ch/sru/search/defaultdb?query=+dc.anywhere+exact+NATIONALLICENCEgruyter101524ract199984143&operation=searchRetrieve&recordSchema=info%3Asrw%2Fschema%2F1%2Fmarcxml-v1.1-light&maximumRecords=10&startRecord=0&recordPacking=XML&availableDBs=defaultdb&sortKeys=Submit+query,http://sru.swissbib.ch/sru/search/defaultdb?query=+dc.anywhere+exact+NATIONALLICENCEgruyter101524ract199984143&operation=searchRetrieve&recordSchema=info%3Asrw%2Fschema%2F1%2Fdc-v1.1-light&maximumRecords=10&startRecord=0&recordPacking=XML&availableDBs=defaultdb&sortKeys=Submit+query,http://sru.swissbib.ch/sru/search/defaultdb?query=+dc.anywhere+exact+NATIONALLICENCEgruyter101524ract199984143&operation=searchRetrieve&recordSchema=info%3Asru%2Fschema%2Fjson&maximumRecords=10&startRecord=0&recordPacking=XML&availableDBs=defaultdb&sortKeys=Submit+query,
"Paul Scherrer Institut, Laboratory for Waste Management, CH-5232 Villigen PSI, Switzerland",Jan Tits,lib4ri,10.1515/ract-2013-2151,https://doi.org/10.1515/ract-2013-2151,./j/ract.2014.102.issue-5/ract-2013-2151/ract-2013-2151.xml,Influence of the redox state on the neptunium sorption under alkaline conditions: Batch sorption studies on titanium dioxide and calcium silicate hydrates,,Jan Tits;Xavier Gaona;Andreas Laube;Erich Wieland,2014,Radiochimica Acta,"Paul Scherrer Institut, Laboratory for Waste Management, CH-5232 Villigen PSI, Switzerland;Karlsruhe Institute of Technology, Institute for Nuclear Waste Disposal P.O. Box 3640, D-76021 Karlsruhe, Germany;Paul Scherrer Institut, Laboratory for Waste Management, CH-5232 Villigen PSI, Switzerland;Paul Scherrer Institut, Laboratory for Waste Management, CH-5232 Villigen PSI, Switzerland",De Gruyter,,102,5,385,400,0033-8230,2193-3405,copyright,©2014 Walter de Gruyter Berlin/Boston,gruyter,https://www.swissbib.ch/Search/Results?lookfor=nationallicencegruyter101515ract20132151,http://sru.swissbib.ch/sru/search/defaultdb?query=+dc.anywhere+exact+NATIONALLICENCEgruyter101515ract20132151&operation=searchRetrieve&recordSchema=info%3Asrw%2Fschema%2F1%2Fmarcxml-v1.1-light&maximumRecords=10&startRecord=0&recordPacking=XML&availableDBs=defaultdb&sortKeys=Submit+query,http://sru.swissbib.ch/sru/search/defaultdb?query=+dc.anywhere+exact+NATIONALLICENCEgruyter101515ract20132151&operation=searchRetrieve&recordSchema=info%3Asrw%2Fschema%2F1%2Fdc-v1.1-light&maximumRecords=10&startRecord=0&recordPacking=XML&availableDBs=defaultdb&sortKeys=Submit+query,http://sru.swissbib.ch/sru/search/defaultdb?query=+dc.anywhere+exact+NATIONALLICENCEgruyter101515ract20132151&operation=searchRetrieve&recordSchema=info%3Asru%2Fschema%2Fjson&maximumRecords=10&startRecord=0&recordPacking=XML&availableDBs=defaultdb&sortKeys=Submit+query,
"PSI, CH-5232 Villigen, Switzerland E-mail: sabine.mayer@psi.ch",S. Mayer,lib4ri,10.1093/rpd/ncm061,https://doi.org/10.1093/rpd/ncm061,./rpd.tar.gz/rpd/abstracts/ncm061.xml,The influence of the type of filling gas on the response of ionisation chambers to a mixed high-energy radiation field,,S. Mayer;D. Forkel-Wirth;M. Fuerstner;S. Roesler;C. Theis;H. Vincke,2007,Radiation Protection Dosimetry,"PSI, CH-5232 Villigen, Switzerland E-mail: sabine.mayer@psi.ch;CERN, CH-1211 Geneva 23, Switzerland;CERN, CH-1211 Geneva 23, Switzerland;CERN, CH-1211 Geneva 23, Switzerland;CERN, CH-1211 Geneva 23, Switzerland;CERN, CH-1211 Geneva 23, Switzerland",Oxford University Press,,126,1-4,294,298,0144-8420,1742-3406,copyright,"© The Author 2007. Published by Oxford University Press. All rights reserved. For Permissions, please email: journals.permissions@oxfordjournals.org",oxford,https://www.swissbib.ch/Search/Results?lookfor=nationallicenceoxford101093rpdncm061,http://sru.swissbib.ch/sru/search/defaultdb?query=+dc.anywhere+exact+NATIONALLICENCEoxford101093rpdncm061&operation=searchRetrieve&recordSchema=info%3Asrw%2Fschema%2F1%2Fmarcxml-v1.1-light&maximumRecords=10&startRecord=0&recordPacking=XML&availableDBs=defaultdb&sortKeys=Submit+query,http://sru.swissbib.ch/sru/search/defaultdb?query=+dc.anywhere+exact+NATIONALLICENCEoxford101093rpdncm061&operation=searchRetrieve&recordSchema=info%3Asrw%2Fschema%2F1%2Fdc-v1.1-light&maximumRecords=10&startRecord=0&recordPacking=XML&availableDBs=defaultdb&sortKeys=Submit+query,http://sru.swissbib.ch/sru/search/defaultdb?query=+dc.anywhere+exact+NATIONALLICENCEoxford101093rpdncm061&operation=searchRetrieve&recordSchema=info%3Asru%2Fschema%2Fjson&maximumRecords=10&startRecord=0&recordPacking=XML&availableDBs=defaultdb&sortKeys=Submit+query,
"Paul Scherrer Institute, CH-5232 Villigen PSI, Switzerland",C. Schuler,lib4ri,10.1093/rpd/nch219,https://doi.org/10.1093/rpd/nch219,./rpd.tar.gz/rpd/abstracts/nch219.xml,Calibration and testing of a TLD dosemeter for area monitoring,,T. Buchillier;A. Aroua;F. Bochud;C. Schuler;N. Stritt;J.-F. Valley;C. Wernli,2004,Radiation Protection Dosimetry,"Institut universitaire de radiophysique appliquée, Grand-Pré 1, CH-1007 Lausanne, Switzerland E-mail: Thierry.Buchillier@hospvd.ch;Institut universitaire de radiophysique appliquée, Grand-Pré 1, CH-1007 Lausanne, Switzerland;Institut universitaire de radiophysique appliquée, Grand-Pré 1, CH-1007 Lausanne, Switzerland;Paul Scherrer Institute, CH-5232 Villigen PSI, Switzerland;Swiss Federal Office of Public Health, CH-3003 Bern, Switzerland;Institut universitaire de radiophysique appliquée, Grand-Pré 1, CH-1007 Lausanne, Switzerland;Paul Scherrer Institute, CH-5232 Villigen PSI, Switzerland",Oxford University Press,,110,1-4,705,710,0144-8420,1742-3406,copyright,Radiation Protection Dosimetry Vol. 110 Nos. 1-4 © Oxford University Press 2004; all rights reserved,oxford,https://www.swissbib.ch/Search/Results?lookfor=nationallicenceoxford101093rpdnch219,http://sru.swissbib.ch/sru/search/defaultdb?query=+dc.anywhere+exact+NATIONALLICENCEoxford101093rpdnch219&operation=searchRetrieve&recordSchema=info%3Asrw%2Fschema%2F1%2Fmarcxml-v1.1-light&maximumRecords=10&startRecord=0&recordPacking=XML&availableDBs=defaultdb&sortKeys=Submit+query,http://sru.swissbib.ch/sru/search/defaultdb?query=+dc.anywhere+exact+NATIONALLICENCEoxford101093rpdnch219&operation=searchRetrieve&recordSchema=info%3Asrw%2Fschema%2F1%2Fdc-v1.1-light&maximumRecords=10&startRecord=0&recordPacking=XML&availableDBs=defaultdb&sortKeys=Submit+query,http://sru.swissbib.ch/sru/search/defaultdb?query=+dc.anywhere+exact+NATIONALLICENCEoxford101093rpdnch219&operation=searchRetrieve&recordSchema=info%3Asru%2Fschema%2Fjson&maximumRecords=10&startRecord=0&recordPacking=XML&availableDBs=defaultdb&sortKeys=Submit+query,
"PSI, 5232 Villigen, Switzerland",C. Wernli,lib4ri,10.1093/rpd/nch284,https://doi.org/10.1093/rpd/nch284,./rpd.tar.gz/rpd/abstracts/nch284.xml,Individual monitoring for internal exposure in Europe and the integration of dosimetric data,,M. A. Lopez Ponte;C. M. Castellani;L. Currivan;R. Falk;P. Olko;C. Wernli,2004,Radiation Protection Dosimetry,"CIEMAT—Internal Dosimetry, Avda. Complutense 22, 28040 Madrid, Spain E-mail: ma.lopez@ciemat.es;ENEA-ION-IRP, via dei Colli 16, 40136 Bologna, Italy;RPII, 3 Clonskeagh Square, Dublin 14, Ireland;SSI, Stockholm, Sweden;Institute of Nuclear Physics, Radzikowskiego 152, PL 31 442 Krakow, Poland;PSI, 5232 Villigen, Switzerland",Oxford University Press,,112,1,69,119,0144-8420,1742-3406,copyright,"Radiation Protection Dosimetry Vol. 112, No. 1 © Oxford University Press 2004; all rights reserved",oxford,https://www.swissbib.ch/Search/Results?lookfor=nationallicenceoxford101093rpdnch284,http://sru.swissbib.ch/sru/search/defaultdb?query=+dc.anywhere+exact+NATIONALLICENCEoxford101093rpdnch284&operation=searchRetrieve&recordSchema=info%3Asrw%2Fschema%2F1%2Fmarcxml-v1.1-light&maximumRecords=10&startRecord=0&recordPacking=XML&availableDBs=defaultdb&sortKeys=Submit+query,http://sru.swissbib.ch/sru/search/defaultdb?query=+dc.anywhere+exact+NATIONALLICENCEoxford101093rpdnch284&operation=searchRetrieve&recordSchema=info%3Asrw%2Fschema%2F1%2Fdc-v1.1-light&maximumRecords=10&startRecord=0&recordPacking=XML&availableDBs=defaultdb&sortKeys=Submit+query,http://sru.swissbib.ch/sru/search/defaultdb?query=+dc.anywhere+exact+NATIONALLICENCEoxford101093rpdnch284&operation=searchRetrieve&recordSchema=info%3Asru%2Fschema%2Fjson&maximumRecords=10&startRecord=0&recordPacking=XML&availableDBs=defaultdb&sortKeys=Submit+query,
"Paul Scherrer Institut, Division for Radiation Safety and Security, Calibration Laboratory, CH-5232 Villigen PSI, Switzerland",C. Schuler,lib4ri,10.1093/rpd/ncr077,https://doi.org/10.1093/rpd/ncr077,./rpd.tar.gz/rpd/abstracts/ncr077.xml,International standardisation work on the measurement of radon in air and water,,D. Calmet;R. Ameon;T. Beck;A. Bombard;M. N. Bourquin;S. Brun;P. De Jong;M. Forte;M. Fournier;M. Herranz;S. Jerome;A. Klett;P. Kwakman;M. Llaurado;J. Loyen;R. Michel;P. Nardoux;T. Richards;C. Schuler;S. Tokonami;M. Woods,2011,Radiation Protection Dosimetry,"Commissariat à l'Energie Atomique, Direction des Applications Militaires, BP12, 91680 Bruyères le Châtel, France;Institut de Radioprotection et de Sûreté Nucléaire, Direction de l'Environnement et de l'Intervention, BP17, 92262 Fontenay-aux-Roses, France E-mail: roselyne.ameon@irsn.fr;Federal Office for Radiation Protection, Koepenicker Allee 120-130, 10318 Berlin, Germany;TrisKem International, Campus de Ker Lann, Parc de Lormandière, Rue Maryse Bastié, 35170 Bruz, France;International Organization for Standardization, 1, ch. de la Voie-Creuse, Case postale 56, CH-1211 Geneva 20, Switzerland;Commissariat à l'Energie Atomique, DEN/DSP/SPR/LRCE, 91191 Gif-sur-Yvette, France;Nuclear Research and Consultancy Group (NRG), PO Box 9034, 6800 ES Arnhem, The Netherlands;ARPA Lombardia, Dipartimento di Milano—U.O. Agenti Fisici, Via Juvara 22, 20129 Milano, Italy;Autorité de Sûreté Nucléaire, Direction de l'environnement et des situations d'urgence, 6 place du Colonel Bourgoin, 75572 Paris Cedex 12, France;Department of Nuclear Engineering and Fluid Mechanics (UPV/EHU), alda Urquijo s/n, 48013 Bilbao, Spain;The National Physical Laboratory, Queens Road, Teddington, Middlesex TW11 0LW, UK;Berthold Technologies GmbH & Co KG, Calmbacherstrasse 22, 75323 Bad Wildbad, Germany;RIVM, Laboratory for Radiation Research, PO Box 1, 3720 BA Bilthoven, The Netherlands;Departamento Química Analytíca, Laboratori de Radiologia Ambiental, Facultat de Química-Universitat de Barcelona, Martí i Franquès, 1-11, 08028 Barcelona, Spain;Institut de Radioprotection et de Sûreté Nucléaire, Direction de l'Environnement et de l'Intervention, BP17, 92262 Fontenay-aux-Roses, France;Strahlenschutz und Radioökologie, Wilh-Henze-Weg 14, D-31303 Burgdorf, Germany;AREVA NC, SEPA/SAN, BP71, 87250 Bessines, France;BSI, 389 Chiswick High Road, London W4 4AL, UK;Paul Scherrer Institut, Division for Radiation Safety and Security, Calibration Laboratory, CH-5232 Villigen PSI, Switzerland;National Institute of Radiological Sciences (NIRS), Research Center for Radiation Protection, 4-9-1 Anagawa, Inage-ku, Chiba 263-8555, Japan;Ionising Radiation Metrology Consultants Ltd, Teddington, Middlesex, UK",Oxford University Press,,145,2-3,267,272,0144-8420,1742-3406,copyright,"© The Author 2011. Published by Oxford University Press. All rights reserved. For Permissions, please email: journals.permissions@oup.com",oxford,https://www.swissbib.ch/Search/Results?lookfor=nationallicenceoxford101093rpdncr077,http://sru.swissbib.ch/sru/search/defaultdb?query=+dc.anywhere+exact+NATIONALLICENCEoxford101093rpdncr077&operation=searchRetrieve&recordSchema=info%3Asrw%2Fschema%2F1%2Fmarcxml-v1.1-light&maximumRecords=10&startRecord=0&recordPacking=XML&availableDBs=defaultdb&sortKeys=Submit+query,http://sru.swissbib.ch/sru/search/defaultdb?query=+dc.anywhere+exact+NATIONALLICENCEoxford101093rpdncr077&operation=searchRetrieve&recordSchema=info%3Asrw%2Fschema%2F1%2Fdc-v1.1-light&maximumRecords=10&startRecord=0&recordPacking=XML&availableDBs=defaultdb&sortKeys=Submit+query,http://sru.swissbib.ch/sru/search/defaultdb?query=+dc.anywhere+exact+NATIONALLICENCEoxford101093rpdncr077&operation=searchRetrieve&recordSchema=info%3Asru%2Fschema%2Fjson&maximumRecords=10&startRecord=0&recordPacking=XML&availableDBs=defaultdb&sortKeys=Submit+query,
"Paul Scherrer Institut, Radiation Metrology Section, CH-5232 Villigen PSI, Switzerland",S. Mayer,lib4ri,10.1093/rpd/nct259,https://doi.org/10.1093/rpd/nct259,./rpd.tar.gz/rpd/abstracts/nct259.xml,High-energy quasi-monoenergetic neutron fields: existing facilities and future needs,,S. Pomp;D. T. Bartlett;S. Mayer;G. Reitz;S. Röttger;M. Silari;F. D. Smit;H. Vincke;H. Yasuda,2014,Radiation Protection Dosimetry,"Department of Physics and Astronomy, Uppsala University, Box 516, 75120 Uppsala, Sweden E-mail: stephan.pomp@physics.uu.se;Abingdon, Oxfordshire, UK;Paul Scherrer Institut, Radiation Metrology Section, CH-5232 Villigen PSI, Switzerland;German Aerospace Center (DLR), Cologne, Germany;Physikalisch-Technische Bundesanstalt, Braunschweig, Germany;CERN, Geneva, Switzerland;iThemba Laboratory for Accelerator Based Sciences, Somerset West 7129, South Africa;CERN, Geneva, Switzerland;UNSCEAR Secretariat, Vienna, Austria",Oxford University Press,2017-10-01,161,1-4,62,66,0144-8420,1742-3406,copyright,"© The Author 2013. Published by Oxford University Press. All rights reserved. For Permissions, please email: journals.permissions@oup.com",oxford,https://www.swissbib.ch/Search/Results?lookfor=nationallicenceoxford101093rpdnct259,http://sru.swissbib.ch/sru/search/defaultdb?query=+dc.anywhere+exact+NATIONALLICENCEoxford101093rpdnct259&operation=searchRetrieve&recordSchema=info%3Asrw%2Fschema%2F1%2Fmarcxml-v1.1-light&maximumRecords=10&startRecord=0&recordPacking=XML&availableDBs=defaultdb&sortKeys=Submit+query,http://sru.swissbib.ch/sru/search/defaultdb?query=+dc.anywhere+exact+NATIONALLICENCEoxford101093rpdnct259&operation=searchRetrieve&recordSchema=info%3Asrw%2Fschema%2F1%2Fdc-v1.1-light&maximumRecords=10&startRecord=0&recordPacking=XML&availableDBs=defaultdb&sortKeys=Submit+query,http://sru.swissbib.ch/sru/search/defaultdb?query=+dc.anywhere+exact+NATIONALLICENCEoxford101093rpdnct259&operation=searchRetrieve&recordSchema=info%3Asru%2Fschema%2Fjson&maximumRecords=10&startRecord=0&recordPacking=XML&availableDBs=defaultdb&sortKeys=Submit+query,
