"Swiss Paraplegic Research, Nottwil, Switzerland, Department of Health Sciences and Health Policy, University of Lucerne, Lucerne, Switzerland,",Jerome Bickenbach,unilu,10.1093/ije/dyw063,./ije.tar.gz/ije/abstracts/dyw063.xml,Health is not just the absence of disease …,Alarcos Cieza;Cornelia Oberhauser;Jerome Bickenbach;Richard N Jones;Tevfik Bedirhan Üstün;Nenad Kostanjsek;John N Morris;Somnath Chatterji,2016,,"Faculty of Social and Human Sciences, University of Southampton, Southampton, UK, Department of Medical Informatics, Biometry and Epidemiology, LMU Munich, Munich, Germany, Swiss Paraplegic Research, Nottwil, Switzerland,;Department of Medical Informatics, Biometry and Epidemiology, LMU Munich, Munich, Germany,;Swiss Paraplegic Research, Nottwil, Switzerland, Department of Health Sciences and Health Policy, University of Lucerne, Lucerne, Switzerland,;Departments of Psychiatry and Human Behavior and Neurology, Warren Alpert Medical School, Brown University, Providence, RI, USA,;Classification, Terminology and Standards, Department of Health Statistics and Informatics, World Health Organization, Geneva, Switzerland,;Classification, Terminology and Standards, Department of Health Statistics and Informatics, World Health Organization, Geneva, Switzerland,;Hebrew Senior Life’s Institute for Aging Research, Social and Health Policy Research, Boston, MA, USA and;Multi-Country Studies, Department of Measurement and Health Information Systems, World Health Organization, Geneva, Switzerland",Oxford University Press,,45,2,586,587,0300-5771,1464-3685,creative-commons,"This is an Open Access article distributed under the terms of the Creative Commons Attribution License (http://creativecommons.org/licenses/by/4.0/), which permits unrestricted reuse, distribution, and reproduction in any medium, provided the original work is properly cited.",https://www.swissbib.ch/Search/Results?lookfor=nationallicenceoxford101093ijedyw063,http://sru.swissbib.ch/sru/search/defaultdb?query=+dc.anywhere+exact+NATIONALLICENCEoxford101093ijedyw063&operation=searchRetrieve&recordSchema=info%3Asrw%2Fschema%2F1%2Fmarcxml-v1.1-light&maximumRecords=10&startRecord=0&recordPacking=XML&availableDBs=defaultdb&sortKeys=Submit+query,http://sru.swissbib.ch/sru/search/defaultdb?query=+dc.anywhere+exact+NATIONALLICENCEoxford101093ijedyw063&operation=searchRetrieve&recordSchema=info%3Asrw%2Fschema%2F1%2Fdc-v1.1-light&maximumRecords=10&startRecord=0&recordPacking=XML&availableDBs=defaultdb&sortKeys=Submit+query,http://sru.swissbib.ch/sru/search/defaultdb?query=+dc.anywhere+exact+NATIONALLICENCEoxford101093ijedyw063&operation=searchRetrieve&recordSchema=info%3Asru%2Fschema%2Fjson&maximumRecords=10&startRecord=0&recordPacking=XML&availableDBs=defaultdb&sortKeys=Submit+query,
"Swiss Paraplegic Research, Nottwil, Switzerland, University of Lucerne, Lucerne, Switzerland",M. Brinkhof,unilu,10.1093/ije/dyv096.160,./ije.tar.gz/ije/abstracts/dyv096.160.xml,"The Impact of Folic Acid Food Fortification on Global Incidence of Neural Tube Defects: Systematic Review, Meta-Analysis and Estimate of Preventable Cases.",M. Brinkhof;S. Meier;J. Chamberlain;L. Mader,2015,,"Swiss Paraplegic Research, Nottwil, Switzerland, University of Lucerne, Lucerne, Switzerland;Swiss Paraplegic Research, Nottwil, Switzerland,;Swiss Paraplegic Research, Nottwil, Switzerland, University of Lucerne, Lucerne, Switzerland;Swiss Paraplegic Research, Nottwil, Switzerland, University of Lucerne, Lucerne, Switzerland",Oxford University Press,,44,,i143,i143,0300-5771,1464-3685,copyright,© The Author 2015; all rights reserved. Published by Oxford University Press on behalf of the International Epidemiological Association,https://www.swissbib.ch/Search/Results?lookfor=nationallicenceoxford101093ijedyv096160,http://sru.swissbib.ch/sru/search/defaultdb?query=+dc.anywhere+exact+NATIONALLICENCEoxford101093ijedyv096160&operation=searchRetrieve&recordSchema=info%3Asrw%2Fschema%2F1%2Fmarcxml-v1.1-light&maximumRecords=10&startRecord=0&recordPacking=XML&availableDBs=defaultdb&sortKeys=Submit+query,http://sru.swissbib.ch/sru/search/defaultdb?query=+dc.anywhere+exact+NATIONALLICENCEoxford101093ijedyv096160&operation=searchRetrieve&recordSchema=info%3Asrw%2Fschema%2F1%2Fdc-v1.1-light&maximumRecords=10&startRecord=0&recordPacking=XML&availableDBs=defaultdb&sortKeys=Submit+query,http://sru.swissbib.ch/sru/search/defaultdb?query=+dc.anywhere+exact+NATIONALLICENCEoxford101093ijedyv096160&operation=searchRetrieve&recordSchema=info%3Asru%2Fschema%2Fjson&maximumRecords=10&startRecord=0&recordPacking=XML&availableDBs=defaultdb&sortKeys=Submit+query,
"Swiss National Science Foundation Research Professor, Institute for Political Science, University of Lucerne, Switzerland",André Bächtiger,unilu,10.1017/S1755773912000239,./EPR/EPR5_03/S1755773912000239h.xml,Deliberative inclusion of minorities: patterns of reciprocity among linguistic groups in Switzerland,Seraina Pedrini;André Bächtiger;Marco R. Steenbergen,2013,,"PhD Student, Institute of Political Science, University of Bern, Bern, Switzerland Research Assistant, Department of Political Science, University of Zurich, Zurich, Switzerland E-mail: pedrini@ipz.uzh.ch;Swiss National Science Foundation Research Professor, Institute for Political Science, University of Lucerne, Switzerland;Professor, Department of Political Science, University of Zurich, Zurich, Switzerland",Cambridge University Press,,5,3,483,512,1755-7739,1755-7747,copyright,Copyright © European Consortium for Political Research 2012 ,https://www.swissbib.ch/Search/Results?lookfor=nationallicencecambridge101017S1755773912000239,http://sru.swissbib.ch/sru/search/defaultdb?query=+dc.anywhere+exact+NATIONALLICENCEcambridge101017S1755773912000239&operation=searchRetrieve&recordSchema=info%3Asrw%2Fschema%2F1%2Fmarcxml-v1.1-light&maximumRecords=10&startRecord=0&recordPacking=XML&availableDBs=defaultdb&sortKeys=Submit+query,http://sru.swissbib.ch/sru/search/defaultdb?query=+dc.anywhere+exact+NATIONALLICENCEcambridge101017S1755773912000239&operation=searchRetrieve&recordSchema=info%3Asrw%2Fschema%2F1%2Fdc-v1.1-light&maximumRecords=10&startRecord=0&recordPacking=XML&availableDBs=defaultdb&sortKeys=Submit+query,http://sru.swissbib.ch/sru/search/defaultdb?query=+dc.anywhere+exact+NATIONALLICENCEcambridge101017S1755773912000239&operation=searchRetrieve&recordSchema=info%3Asru%2Fschema%2Fjson&maximumRecords=10&startRecord=0&recordPacking=XML&availableDBs=defaultdb&sortKeys=Submit+query,
"Department of Economics, University of Lucerne, CH-6002 Lucerne, Switzerland Department of Economics, University of Melbourne, VIC 3110, Australia Study Center Gerzensee, CH-3115 Gerzensee, Switzerland",Roland Hodler,unilu,10.1093/jae/ejr036,./JAFECO/jafeco21-1/abstracts/ejr036.xml,Ethnic Fractionalisation and Aid Effectiveness,Roland Hodler;David S. Knight,2012,,"Department of Economics, University of Lucerne, CH-6002 Lucerne, Switzerland Department of Economics, University of Melbourne, VIC 3110, Australia Study Center Gerzensee, CH-3115 Gerzensee, Switzerland;Department of Economics, University of Melbourne, VIC 3110, Australia",Oxford University Press,,21,1,65,93,0963-8024,1464-3723,copyright,"© The author 2011. Published by Oxford University Press on behalf of the Centre for the Study of African Economies. All rights reserved. For permissions, please email: journals.permissions@oup.com",https://www.swissbib.ch/Search/Results?lookfor=nationallicenceoxford101093jaeejr036,http://sru.swissbib.ch/sru/search/defaultdb?query=+dc.anywhere+exact+NATIONALLICENCEoxford101093jaeejr036&operation=searchRetrieve&recordSchema=info%3Asrw%2Fschema%2F1%2Fmarcxml-v1.1-light&maximumRecords=10&startRecord=0&recordPacking=XML&availableDBs=defaultdb&sortKeys=Submit+query,http://sru.swissbib.ch/sru/search/defaultdb?query=+dc.anywhere+exact+NATIONALLICENCEoxford101093jaeejr036&operation=searchRetrieve&recordSchema=info%3Asrw%2Fschema%2F1%2Fdc-v1.1-light&maximumRecords=10&startRecord=0&recordPacking=XML&availableDBs=defaultdb&sortKeys=Submit+query,http://sru.swissbib.ch/sru/search/defaultdb?query=+dc.anywhere+exact+NATIONALLICENCEoxford101093jaeejr036&operation=searchRetrieve&recordSchema=info%3Asru%2Fschema%2Fjson&maximumRecords=10&startRecord=0&recordPacking=XML&availableDBs=defaultdb&sortKeys=Submit+query,
University of Lucerne and Bauhaus-Universität Weimar,Christoph Hoffmann,unilu,10.1017/S0269889713000033,./SIC/SIC26_02/S0269889713000033h.xml,Introduction: Knowledge in the Making: Drawing and Writing as Research Techniques,Christoph Hoffmann;Barbara Wittmann,2013,,University of Lucerne and Bauhaus-Universität Weimar;University of Lucerne and Bauhaus-Universität Weimar,Cambridge University Press,,26,2,203,213,0269-8897,1474-0664,copyright,Copyright © Cambridge University Press 2013,https://www.swissbib.ch/Search/Results?lookfor=nationallicencecambridge101017S0269889713000033,http://sru.swissbib.ch/sru/search/defaultdb?query=+dc.anywhere+exact+NATIONALLICENCEcambridge101017S0269889713000033&operation=searchRetrieve&recordSchema=info%3Asrw%2Fschema%2F1%2Fmarcxml-v1.1-light&maximumRecords=10&startRecord=0&recordPacking=XML&availableDBs=defaultdb&sortKeys=Submit+query,http://sru.swissbib.ch/sru/search/defaultdb?query=+dc.anywhere+exact+NATIONALLICENCEcambridge101017S0269889713000033&operation=searchRetrieve&recordSchema=info%3Asrw%2Fschema%2F1%2Fdc-v1.1-light&maximumRecords=10&startRecord=0&recordPacking=XML&availableDBs=defaultdb&sortKeys=Submit+query,http://sru.swissbib.ch/sru/search/defaultdb?query=+dc.anywhere+exact+NATIONALLICENCEcambridge101017S0269889713000033&operation=searchRetrieve&recordSchema=info%3Asru%2Fschema%2Fjson&maximumRecords=10&startRecord=0&recordPacking=XML&availableDBs=defaultdb&sortKeys=Submit+query,
"Department of Cardiovascular Surgery, University Hospital Zurich, Switzerland Department of Clinical Research, University Hospital Zurich, Switzerland Center for Integrative Human Physiology, University of Zurich, Switzerland *Corresponding author. Address: Department of Thoracic and Cardiovascular Surgery, Canton Hospital Lucerne, 6000 Lucerne 16, Switzerland. Tel.: +41 41 205 45 02; fax: +41 41 205 45 63.",Reza Tavakoli,unilu,10.1016/j.ejcts.2008.12.049,./ejcts/ejcts35-5/abstracts/35-5-839.xml,Erythropoietin protects from reperfusion-induced myocardial injury by enhancing coronary endothelial nitric oxide production,Deyan Mihov;Nikolay Bogdanov;Beat Grenacher;Max Gassmann;Gregor Zünd;Anna Bogdanova;Reza Tavakoli,2009,,"Institute for Veterinary Physiology, Vetsuisse Faculty, Switzerland;Institute for Veterinary Physiology, Vetsuisse Faculty, Switzerland;Institute for Veterinary Physiology, Vetsuisse Faculty, Switzerland;Institute for Veterinary Physiology, Vetsuisse Faculty, Switzerland Center for Integrative Human Physiology, University of Zurich, Switzerland;Department of Clinical Research, University Hospital Zurich, Switzerland;Institute for Veterinary Physiology, Vetsuisse Faculty, Switzerland Center for Integrative Human Physiology, University of Zurich, Switzerland;Department of Cardiovascular Surgery, University Hospital Zurich, Switzerland Department of Clinical Research, University Hospital Zurich, Switzerland Center for Integrative Human Physiology, University of Zurich, Switzerland *Corresponding author. Address: Department of Thoracic and Cardiovascular Surgery, Canton Hospital Lucerne, 6000 Lucerne 16, Switzerland. Tel.: +41 41 205 45 02; fax: +41 41 205 45 63.",Elsevier Science B.V.,,35,5,839,846,1010-7940,1873-734X,,,https://www.swissbib.ch/Search/Results?lookfor=nationallicenceoxford101016jejcts200812049,http://sru.swissbib.ch/sru/search/defaultdb?query=+dc.anywhere+exact+NATIONALLICENCEoxford101016jejcts200812049&operation=searchRetrieve&recordSchema=info%3Asrw%2Fschema%2F1%2Fmarcxml-v1.1-light&maximumRecords=10&startRecord=0&recordPacking=XML&availableDBs=defaultdb&sortKeys=Submit+query,http://sru.swissbib.ch/sru/search/defaultdb?query=+dc.anywhere+exact+NATIONALLICENCEoxford101016jejcts200812049&operation=searchRetrieve&recordSchema=info%3Asrw%2Fschema%2F1%2Fdc-v1.1-light&maximumRecords=10&startRecord=0&recordPacking=XML&availableDBs=defaultdb&sortKeys=Submit+query,http://sru.swissbib.ch/sru/search/defaultdb?query=+dc.anywhere+exact+NATIONALLICENCEoxford101016jejcts200812049&operation=searchRetrieve&recordSchema=info%3Asru%2Fschema%2Fjson&maximumRecords=10&startRecord=0&recordPacking=XML&availableDBs=defaultdb&sortKeys=Submit+query,
"Faculty of Social and Human Sciences, University of Southampton, Southampton, UK, Department of Medical Informatics, Biometry and Epidemiology, Pettenkofer School of Public Health (PSPH), Research Unit for Biopsychosocial Health, Ludwig-Maximilians University, Munich, Germany, Swiss Paraplegic Research, Nottwil, Switzerland, Department of Health Sciences and Health Policy, University of Lucerne, Lucerne, Switzerland, Department of Psychiatry and Human Behavior, Warren Alpert Medical School, Brown University, Providence, RI, USA, Classification, Terminology and Standards, Department of Health Statistics and Informatics, World Health Organization, Geneva, Switzerland, Institute for Aging Research, Social and Health Policy Research, Hebrew SeniorLife, Boston, MA, USA and Surveys, Measurement and Analysis, Department of Measurement and Health Information Systems, World Health Organization, Geneva, Switzerland E-mail: a.cieza@soton.ac.uk",Alarcos Cieza,unilu,10.1093/ije/dyu182,./IJE/ije44-1/abstracts/dyu182.xml,The English are healthier than the Americans: really?,Alarcos Cieza;Cornelia Oberhauser;Jerome Bickenbach;Richard N Jones;Tevfik Bedirhan Üstün;Nenad Kostanjsek;John N Morris;Somnath Chatterji,2015,,"Faculty of Social and Human Sciences, University of Southampton, Southampton, UK, Department of Medical Informatics, Biometry and Epidemiology, Pettenkofer School of Public Health (PSPH), Research Unit for Biopsychosocial Health, Ludwig-Maximilians University, Munich, Germany, Swiss Paraplegic Research, Nottwil, Switzerland, Department of Health Sciences and Health Policy, University of Lucerne, Lucerne, Switzerland, Department of Psychiatry and Human Behavior, Warren Alpert Medical School, Brown University, Providence, RI, USA, Classification, Terminology and Standards, Department of Health Statistics and Informatics, World Health Organization, Geneva, Switzerland, Institute for Aging Research, Social and Health Policy Research, Hebrew SeniorLife, Boston, MA, USA and Surveys, Measurement and Analysis, Department of Measurement and Health Information Systems, World Health Organization, Geneva, Switzerland E-mail: a.cieza@soton.ac.uk;Faculty of Social and Human Sciences, University of Southampton, Southampton, UK, Department of Medical Informatics, Biometry and Epidemiology, Pettenkofer School of Public Health (PSPH), Research Unit for Biopsychosocial Health, Ludwig-Maximilians University, Munich, Germany, Swiss Paraplegic Research, Nottwil, Switzerland, Department of Health Sciences and Health Policy, University of Lucerne, Lucerne, Switzerland, Department of Psychiatry and Human Behavior, Warren Alpert Medical School, Brown University, Providence, RI, USA, Classification, Terminology and Standards, Department of Health Statistics and Informatics, World Health Organization, Geneva, Switzerland, Institute for Aging Research, Social and Health Policy Research, Hebrew SeniorLife, Boston, MA, USA and Surveys, Measurement and Analysis, Department of Measurement and Health Information Systems, World Health Organization, Geneva, Switzerland;Faculty of Social and Human Sciences, University of Southampton, Southampton, UK, Department of Medical Informatics, Biometry and Epidemiology, Pettenkofer School of Public Health (PSPH), Research Unit for Biopsychosocial Health, Ludwig-Maximilians University, Munich, Germany, Swiss Paraplegic Research, Nottwil, Switzerland, Department of Health Sciences and Health Policy, University of Lucerne, Lucerne, Switzerland, Department of Psychiatry and Human Behavior, Warren Alpert Medical School, Brown University, Providence, RI, USA, Classification, Terminology and Standards, Department of Health Statistics and Informatics, World Health Organization, Geneva, Switzerland, Institute for Aging Research, Social and Health Policy Research, Hebrew SeniorLife, Boston, MA, USA and Surveys, Measurement and Analysis, Department of Measurement and Health Information Systems, World Health Organization, Geneva, Switzerland;Faculty of Social and Human Sciences, University of Southampton, Southampton, UK, Department of Medical Informatics, Biometry and Epidemiology, Pettenkofer School of Public Health (PSPH), Research Unit for Biopsychosocial Health, Ludwig-Maximilians University, Munich, Germany, Swiss Paraplegic Research, Nottwil, Switzerland, Department of Health Sciences and Health Policy, University of Lucerne, Lucerne, Switzerland, Department of Psychiatry and Human Behavior, Warren Alpert Medical School, Brown University, Providence, RI, USA, Classification, Terminology and Standards, Department of Health Statistics and Informatics, World Health Organization, Geneva, Switzerland, Institute for Aging Research, Social and Health Policy Research, Hebrew SeniorLife, Boston, MA, USA and Surveys, Measurement and Analysis, Department of Measurement and Health Information Systems, World Health Organization, Geneva, Switzerland;Faculty of Social and Human Sciences, University of Southampton, Southampton, UK, Department of Medical Informatics, Biometry and Epidemiology, Pettenkofer School of Public Health (PSPH), Research Unit for Biopsychosocial Health, Ludwig-Maximilians University, Munich, Germany, Swiss Paraplegic Research, Nottwil, Switzerland, Department of Health Sciences and Health Policy, University of Lucerne, Lucerne, Switzerland, Department of Psychiatry and Human Behavior, Warren Alpert Medical School, Brown University, Providence, RI, USA, Classification, Terminology and Standards, Department of Health Statistics and Informatics, World Health Organization, Geneva, Switzerland, Institute for Aging Research, Social and Health Policy Research, Hebrew SeniorLife, Boston, MA, USA and Surveys, Measurement and Analysis, Department of Measurement and Health Information Systems, World Health Organization, Geneva, Switzerland;Faculty of Social and Human Sciences, University of Southampton, Southampton, UK, Department of Medical Informatics, Biometry and Epidemiology, Pettenkofer School of Public Health (PSPH), Research Unit for Biopsychosocial Health, Ludwig-Maximilians University, Munich, Germany, Swiss Paraplegic Research, Nottwil, Switzerland, Department of Health Sciences and Health Policy, University of Lucerne, Lucerne, Switzerland, Department of Psychiatry and Human Behavior, Warren Alpert Medical School, Brown University, Providence, RI, USA, Classification, Terminology and Standards, Department of Health Statistics and Informatics, World Health Organization, Geneva, Switzerland, Institute for Aging Research, Social and Health Policy Research, Hebrew SeniorLife, Boston, MA, USA and Surveys, Measurement and Analysis, Department of Measurement and Health Information Systems, World Health Organization, Geneva, Switzerland;Faculty of Social and Human Sciences, University of Southampton, Southampton, UK, Department of Medical Informatics, Biometry and Epidemiology, Pettenkofer School of Public Health (PSPH), Research Unit for Biopsychosocial Health, Ludwig-Maximilians University, Munich, Germany, Swiss Paraplegic Research, Nottwil, Switzerland, Department of Health Sciences and Health Policy, University of Lucerne, Lucerne, Switzerland, Department of Psychiatry and Human Behavior, Warren Alpert Medical School, Brown University, Providence, RI, USA, Classification, Terminology and Standards, Department of Health Statistics and Informatics, World Health Organization, Geneva, Switzerland, Institute for Aging Research, Social and Health Policy Research, Hebrew SeniorLife, Boston, MA, USA and Surveys, Measurement and Analysis, Department of Measurement and Health Information Systems, World Health Organization, Geneva, Switzerland;Faculty of Social and Human Sciences, University of Southampton, Southampton, UK, Department of Medical Informatics, Biometry and Epidemiology, Pettenkofer School of Public Health (PSPH), Research Unit for Biopsychosocial Health, Ludwig-Maximilians University, Munich, Germany, Swiss Paraplegic Research, Nottwil, Switzerland, Department of Health Sciences and Health Policy, University of Lucerne, Lucerne, Switzerland, Department of Psychiatry and Human Behavior, Warren Alpert Medical School, Brown University, Providence, RI, USA, Classification, Terminology and Standards, Department of Health Statistics and Informatics, World Health Organization, Geneva, Switzerland, Institute for Aging Research, Social and Health Policy Research, Hebrew SeniorLife, Boston, MA, USA and Surveys, Measurement and Analysis, Department of Measurement and Health Information Systems, World Health Organization, Geneva, Switzerland",Oxford University Press,,44,1,229,238,0300-5771,1464-3685,creative-commons,"This is an Open Access article distributed under the terms of the Creative Commons Attribution Non-Commercial License (http://creativecommons.org/licenses/by-nc/4.0/), which permits non-commercial re-use, distribution, and reproduction in any medium, provided the original work is properly cited. For commercial re-use, please contact journals.permissions@oup.com",https://www.swissbib.ch/Search/Results?lookfor=nationallicenceoxford101093ijedyu182,http://sru.swissbib.ch/sru/search/defaultdb?query=+dc.anywhere+exact+NATIONALLICENCEoxford101093ijedyu182&operation=searchRetrieve&recordSchema=info%3Asrw%2Fschema%2F1%2Fmarcxml-v1.1-light&maximumRecords=10&startRecord=0&recordPacking=XML&availableDBs=defaultdb&sortKeys=Submit+query,http://sru.swissbib.ch/sru/search/defaultdb?query=+dc.anywhere+exact+NATIONALLICENCEoxford101093ijedyu182&operation=searchRetrieve&recordSchema=info%3Asrw%2Fschema%2F1%2Fdc-v1.1-light&maximumRecords=10&startRecord=0&recordPacking=XML&availableDBs=defaultdb&sortKeys=Submit+query,http://sru.swissbib.ch/sru/search/defaultdb?query=+dc.anywhere+exact+NATIONALLICENCEoxford101093ijedyu182&operation=searchRetrieve&recordSchema=info%3Asru%2Fschema%2Fjson&maximumRecords=10&startRecord=0&recordPacking=XML&availableDBs=defaultdb&sortKeys=Submit+query,
