"University Department of Anaesthesiology and Pain Therapy, University Hospital of Bern and University of Bern, CH-3010 Bern, Switzerland Department of Anaesthesiology, Intensive Care and Pain Medicine, St Anna Clinic, CH-6006 Lucerne, Switzerland E-mail: urs.eichenberger@hirslanden.ch",U. Eichenberger,unilu,10.1093/bja/aet028,./BJAINT/bjaint111-2/abstracts/aet028.xml,Ilioinguinal and iliohypogastric nerves cannot be selectively blocked by using ultrasound guidance: a volunteer study,M. Schmutz;P. M. Schumacher;C. Luyet;M. Curatolo;U. Eichenberger;L. Colvin;L. Colvin,2013,,"University Department of Anaesthesiology and Pain Therapy, University Hospital of Bern and University of Bern, CH-3010 Bern, Switzerland;University Department of Anaesthesiology and Pain Therapy, University Hospital of Bern and University of Bern, CH-3010 Bern, Switzerland;University Department of Anaesthesiology and Pain Therapy, University Hospital of Bern and University of Bern, CH-3010 Bern, Switzerland;University Department of Anaesthesiology and Pain Therapy, University Hospital of Bern and University of Bern, CH-3010 Bern, Switzerland;University Department of Anaesthesiology and Pain Therapy, University Hospital of Bern and University of Bern, CH-3010 Bern, Switzerland Department of Anaesthesiology, Intensive Care and Pain Medicine, St Anna Clinic, CH-6006 Lucerne, Switzerland E-mail: urs.eichenberger@hirslanden.ch;1University Department of Anaesthesiology and Pain Therapy, University Hospital of Bern and University of Bern, CH-3010 Bern, Switzerland 2Department of Anaesthesiology, Intensive Care and Pain Medicine, St Anna Clinic, CH-6006 Lucerne, Switzerland;1University Department of Anaesthesiology and Pain Therapy, University Hospital of Bern and University of Bern, CH-3010 Bern, Switzerland 2Department of Anaesthesiology, Intensive Care and Pain Medicine, St Anna Clinic, CH-6006 Lucerne, Switzerland",Oxford University Press,,111,2,264,270,0007-0912,1471-6771,copyright,"© The Author [2013]. Published by Oxford University Press on behalf of the British Journal of Anaesthesia. All rights reserved. For Permissions, please email: journals.permissions@oup.com",https://www.swissbib.ch/Search/Results?lookfor=nationallicenceoxford101093bjaaet028,http://sru.swissbib.ch/sru/search/defaultdb?query=+dc.anywhere+exact+NATIONALLICENCEoxford101093bjaaet028&operation=searchRetrieve&recordSchema=info%3Asrw%2Fschema%2F1%2Fmarcxml-v1.1-light&maximumRecords=10&startRecord=0&recordPacking=XML&availableDBs=defaultdb&sortKeys=Submit+query,http://sru.swissbib.ch/sru/search/defaultdb?query=+dc.anywhere+exact+NATIONALLICENCEoxford101093bjaaet028&operation=searchRetrieve&recordSchema=info%3Asrw%2Fschema%2F1%2Fdc-v1.1-light&maximumRecords=10&startRecord=0&recordPacking=XML&availableDBs=defaultdb&sortKeys=Submit+query,http://sru.swissbib.ch/sru/search/defaultdb?query=+dc.anywhere+exact+NATIONALLICENCEoxford101093bjaaet028&operation=searchRetrieve&recordSchema=info%3Asru%2Fschema%2Fjson&maximumRecords=10&startRecord=0&recordPacking=XML&availableDBs=defaultdb&sortKeys=Submit+query,
"*Department of Economics, University of Lucerne, PO Box 4466, 6002 Lucerne, Switzerland, KOF-Swiss Economic Institute, and CREMA; e-mail: simon.luechinger@unilu.ch E-mail: simon.luechinger@unilu.ch",Simon Luechinger,unilu,10.1093/oep/gpt006,./OEP/oep66-2/abstracts/gpt006.xml,"Governance, bureaucratic rents, and well-being differentials across US states",Simon Luechinger;Mark Schelker;Alois Stutzer,2014,,"*Department of Economics, University of Lucerne, PO Box 4466, 6002 Lucerne, Switzerland, KOF-Swiss Economic Institute, and CREMA; e-mail: simon.luechinger@unilu.ch E-mail: simon.luechinger@unilu.ch;†SIAW-HSG, University of St. Gallen, CESifo, and CREMA;‡Faculty of Business and Economics, University of Basel, IZA, and CREMA",Oxford University Press,,66,2,443,464,0030-7653,1464-3812,copyright,© Oxford University Press 2013 All rights reserved,https://www.swissbib.ch/Search/Results?lookfor=nationallicenceoxford101093oepgpt006,http://sru.swissbib.ch/sru/search/defaultdb?query=+dc.anywhere+exact+NATIONALLICENCEoxford101093oepgpt006&operation=searchRetrieve&recordSchema=info%3Asrw%2Fschema%2F1%2Fmarcxml-v1.1-light&maximumRecords=10&startRecord=0&recordPacking=XML&availableDBs=defaultdb&sortKeys=Submit+query,http://sru.swissbib.ch/sru/search/defaultdb?query=+dc.anywhere+exact+NATIONALLICENCEoxford101093oepgpt006&operation=searchRetrieve&recordSchema=info%3Asrw%2Fschema%2F1%2Fdc-v1.1-light&maximumRecords=10&startRecord=0&recordPacking=XML&availableDBs=defaultdb&sortKeys=Submit+query,http://sru.swissbib.ch/sru/search/defaultdb?query=+dc.anywhere+exact+NATIONALLICENCEoxford101093oepgpt006&operation=searchRetrieve&recordSchema=info%3Asru%2Fschema%2Fjson&maximumRecords=10&startRecord=0&recordPacking=XML&availableDBs=defaultdb&sortKeys=Submit+query,
"Oxford Heart Centre, NIHR Biomedical Research Centre, Oxford University Hospitals, Headley Way, Oxford OX39DU, UK Department of Cardiology, LuzernerKantonsspital, Luzern, Switzerland",Florim Cuculi,unilu,10.1093/eurheartj/ehv353,./eurheartj/eurheartj36-45/abstracts/ehv353.xml,How does coronary stent implantation impact on the status of the microcirculation during primary percutaneous coronary intervention in patients with ST-elevation myocardial infarction?,Giovanni Luigi De Maria;Florim Cuculi;Niket Patel;Sam Dawkins;Gregor Fahrni;George Kassimis;Robin P. Choudhury;John C. Forfar;Bernard D. Prendergast;Keith M. Channon;Rajesh K. Kharbanda;Adrian P. Banning,2015,,"Oxford Heart Centre, NIHR Biomedical Research Centre, Oxford University Hospitals, Headley Way, Oxford OX39DU, UK;Oxford Heart Centre, NIHR Biomedical Research Centre, Oxford University Hospitals, Headley Way, Oxford OX39DU, UK Department of Cardiology, LuzernerKantonsspital, Luzern, Switzerland;Oxford Heart Centre, NIHR Biomedical Research Centre, Oxford University Hospitals, Headley Way, Oxford OX39DU, UK;Oxford Heart Centre, NIHR Biomedical Research Centre, Oxford University Hospitals, Headley Way, Oxford OX39DU, UK;Oxford Heart Centre, NIHR Biomedical Research Centre, Oxford University Hospitals, Headley Way, Oxford OX39DU, UK;Oxford Heart Centre, NIHR Biomedical Research Centre, Oxford University Hospitals, Headley Way, Oxford OX39DU, UK;Acute Vascular Imaging Centre, Radcliffe Department of Medicine, University of Oxford, Oxford, UK Division of Cardiovascular Medicine, BHF Centre of Research Excellence, University of Oxford, Oxford, UK;Oxford Heart Centre, NIHR Biomedical Research Centre, Oxford University Hospitals, Headley Way, Oxford OX39DU, UK;Oxford Heart Centre, NIHR Biomedical Research Centre, Oxford University Hospitals, Headley Way, Oxford OX39DU, UK;Oxford Heart Centre, NIHR Biomedical Research Centre, Oxford University Hospitals, Headley Way, Oxford OX39DU, UK;Oxford Heart Centre, NIHR Biomedical Research Centre, Oxford University Hospitals, Headley Way, Oxford OX39DU, UK;Oxford Heart Centre, NIHR Biomedical Research Centre, Oxford University Hospitals, Headley Way, Oxford OX39DU, UK E-mail: adrian.banning@ouh.nhs.uk",Oxford University Press,,36,45,3165,3177,0195-668X,1522-9645,creative-commons,"This is an Open Access article distributed under the terms of the Creative Commons Attribution Non-Commercial License (http://creativecommons.org/licenses/by-nc/4.0/), which permits non-commercial re-use, distribution, and reproduction in any medium, provided the original work is properly cited. For commercial re-use, please contact journals.permissions@oup.com",https://www.swissbib.ch/Search/Results?lookfor=nationallicenceoxford101093eurheartjehv353,http://sru.swissbib.ch/sru/search/defaultdb?query=+dc.anywhere+exact+NATIONALLICENCEoxford101093eurheartjehv353&operation=searchRetrieve&recordSchema=info%3Asrw%2Fschema%2F1%2Fmarcxml-v1.1-light&maximumRecords=10&startRecord=0&recordPacking=XML&availableDBs=defaultdb&sortKeys=Submit+query,http://sru.swissbib.ch/sru/search/defaultdb?query=+dc.anywhere+exact+NATIONALLICENCEoxford101093eurheartjehv353&operation=searchRetrieve&recordSchema=info%3Asrw%2Fschema%2F1%2Fdc-v1.1-light&maximumRecords=10&startRecord=0&recordPacking=XML&availableDBs=defaultdb&sortKeys=Submit+query,http://sru.swissbib.ch/sru/search/defaultdb?query=+dc.anywhere+exact+NATIONALLICENCEoxford101093eurheartjehv353&operation=searchRetrieve&recordSchema=info%3Asru%2Fschema%2Fjson&maximumRecords=10&startRecord=0&recordPacking=XML&availableDBs=defaultdb&sortKeys=Submit+query,
"Department of Clinical Research, CTU Bern, University of Bern, Switzerland Swiss Paraplegic Research (SPF), Nottwil, Switzerland Department of Health Sciences and Health Policy, University of Lucerne, Switzerland",A. Gemperli,unilu,10.1017/S0033291714000853,./PSM/PSM44_15/S0033291714000853h.xml,Integrating fragmented evidence by network meta-analysis: relative effectiveness of psychological interventions for adults with post-traumatic stress disorder,H. Gerger;T. Munder;A. Gemperli;E. Nüesch;S. Trelle;P. Jüni;J. Barth,2014,,"Institute of Social and Preventive Medicine (ISPM), University of Bern, Switzerland Division of Clinical Psychology and Psychotherapy, Department of Psychology, University of Basel, Switzerland E-mail: heike.gerger@gmail.com;Institute of Social and Preventive Medicine (ISPM), University of Bern, Switzerland;Department of Clinical Research, CTU Bern, University of Bern, Switzerland Swiss Paraplegic Research (SPF), Nottwil, Switzerland Department of Health Sciences and Health Policy, University of Lucerne, Switzerland;Institute of Social and Preventive Medicine (ISPM), University of Bern, Switzerland Department of Clinical Research, CTU Bern, University of Bern, Switzerland;Department of Clinical Research, CTU Bern, University of Bern, Switzerland;Institute of Social and Preventive Medicine (ISPM), University of Bern, Switzerland Department of Clinical Research, CTU Bern, University of Bern, Switzerland;Institute of Social and Preventive Medicine (ISPM), University of Bern, Switzerland Institute of Complementary and Integrative Medicine, University Hospital of Zurich, Switzerland",Cambridge University Press,,44,15,3151,3164,0033-2917,1469-8978,copyright,Copyright © Cambridge University Press 2014 ,https://www.swissbib.ch/Search/Results?lookfor=nationallicencecambridge101017S0033291714000853,http://sru.swissbib.ch/sru/search/defaultdb?query=+dc.anywhere+exact+NATIONALLICENCEcambridge101017S0033291714000853&operation=searchRetrieve&recordSchema=info%3Asrw%2Fschema%2F1%2Fmarcxml-v1.1-light&maximumRecords=10&startRecord=0&recordPacking=XML&availableDBs=defaultdb&sortKeys=Submit+query,http://sru.swissbib.ch/sru/search/defaultdb?query=+dc.anywhere+exact+NATIONALLICENCEcambridge101017S0033291714000853&operation=searchRetrieve&recordSchema=info%3Asrw%2Fschema%2F1%2Fdc-v1.1-light&maximumRecords=10&startRecord=0&recordPacking=XML&availableDBs=defaultdb&sortKeys=Submit+query,http://sru.swissbib.ch/sru/search/defaultdb?query=+dc.anywhere+exact+NATIONALLICENCEcambridge101017S0033291714000853&operation=searchRetrieve&recordSchema=info%3Asru%2Fschema%2Fjson&maximumRecords=10&startRecord=0&recordPacking=XML&availableDBs=defaultdb&sortKeys=Submit+query,
"Swiss National Science Foundation Research Professor, Institute for Political Science, University of Lucerne, Switzerland E-mail: Andre.Baechtiger@unilu.ch",André Bächtiger,unilu,10.1017/S1755773912000057,./EPR/EPR5_01/S1755773912000057h.xml,Religious reasons in the public sphere: an empirical study of religious actors’ argumentative patterns in Swiss direct democratic campaigns,André Bächtiger;Judith Könemann;Ansgar Jödicke;Dominik Hangartner,2013,,"Swiss National Science Foundation Research Professor, Institute for Political Science, University of Lucerne, Switzerland E-mail: Andre.Baechtiger@unilu.ch;Professor, Department of Catholic Theology, University of Münster, Germany;Senior Researcher, Department of Religious Studies, University of Fribourg, Switzerland;Lecturer, London School of Economics, Methodology Institute, London UK, and University of Zurich, Department of Political Science, Zurich, Switzerland",Cambridge University Press,,5,1,105,131,1755-7739,1755-7747,copyright,Copyright © European Consortium for Political Research 2012,https://www.swissbib.ch/Search/Results?lookfor=nationallicencecambridge101017S1755773912000057,http://sru.swissbib.ch/sru/search/defaultdb?query=+dc.anywhere+exact+NATIONALLICENCEcambridge101017S1755773912000057&operation=searchRetrieve&recordSchema=info%3Asrw%2Fschema%2F1%2Fmarcxml-v1.1-light&maximumRecords=10&startRecord=0&recordPacking=XML&availableDBs=defaultdb&sortKeys=Submit+query,http://sru.swissbib.ch/sru/search/defaultdb?query=+dc.anywhere+exact+NATIONALLICENCEcambridge101017S1755773912000057&operation=searchRetrieve&recordSchema=info%3Asrw%2Fschema%2F1%2Fdc-v1.1-light&maximumRecords=10&startRecord=0&recordPacking=XML&availableDBs=defaultdb&sortKeys=Submit+query,http://sru.swissbib.ch/sru/search/defaultdb?query=+dc.anywhere+exact+NATIONALLICENCEcambridge101017S1755773912000057&operation=searchRetrieve&recordSchema=info%3Asru%2Fschema%2Fjson&maximumRecords=10&startRecord=0&recordPacking=XML&availableDBs=defaultdb&sortKeys=Submit+query,
"Rheumazentrum Ruhrgebiet, Herne, Germany, Department of Rheumatology, Leiden University Medical Center, Leiden, The Netherlands, Institute for Health and Rehabilitation Sciences (IHRS), Research Unit for Biopsychosocial Health, Ludwig-Maximilians-University, Munich, Germany, Swiss Paraplegic Research (SPF), ICF Research Branch, WHO FIC CC Germany (DIMDI) at SPF, Nottwil, Switzerland, Department of Internal Medicine, Division of Rheumatology, Maastricht University Medical Center, Maastricht, The Netherlands, Department of Health Sciences and Health Policy, University of Lucerne, Lucerne, Switzerland and World Health Organization, CTS Team, Geneva, Switzerland. E-mail: kiltz@rheumazentrum-ruhrgebiet.de",Uta Kiltz,unilu,10.1093/rheumatology/keq315,./BRHEUM/brheum50-5/abstracts/keq315.xml,Developing and validating an index for measuring health in patients with ankylosing spondylitis,Uta Kiltz;Désiréé van der Heijde;Alarcos Cieza;Annelies Boonen;Gerold Stucki;Bedirhan Üstün;Juergen Braun,2011,,"Rheumazentrum Ruhrgebiet, Herne, Germany, Department of Rheumatology, Leiden University Medical Center, Leiden, The Netherlands, Institute for Health and Rehabilitation Sciences (IHRS), Research Unit for Biopsychosocial Health, Ludwig-Maximilians-University, Munich, Germany, Swiss Paraplegic Research (SPF), ICF Research Branch, WHO FIC CC Germany (DIMDI) at SPF, Nottwil, Switzerland, Department of Internal Medicine, Division of Rheumatology, Maastricht University Medical Center, Maastricht, The Netherlands, Department of Health Sciences and Health Policy, University of Lucerne, Lucerne, Switzerland and World Health Organization, CTS Team, Geneva, Switzerland. E-mail: kiltz@rheumazentrum-ruhrgebiet.de;Rheumazentrum Ruhrgebiet, Herne, Germany, Department of Rheumatology, Leiden University Medical Center, Leiden, The Netherlands, Institute for Health and Rehabilitation Sciences (IHRS), Research Unit for Biopsychosocial Health, Ludwig-Maximilians-University, Munich, Germany, Swiss Paraplegic Research (SPF), ICF Research Branch, WHO FIC CC Germany (DIMDI) at SPF, Nottwil, Switzerland, Department of Internal Medicine, Division of Rheumatology, Maastricht University Medical Center, Maastricht, The Netherlands, Department of Health Sciences and Health Policy, University of Lucerne, Lucerne, Switzerland and World Health Organization, CTS Team, Geneva, Switzerland.;Rheumazentrum Ruhrgebiet, Herne, Germany, Department of Rheumatology, Leiden University Medical Center, Leiden, The Netherlands, Institute for Health and Rehabilitation Sciences (IHRS), Research Unit for Biopsychosocial Health, Ludwig-Maximilians-University, Munich, Germany, Swiss Paraplegic Research (SPF), ICF Research Branch, WHO FIC CC Germany (DIMDI) at SPF, Nottwil, Switzerland, Department of Internal Medicine, Division of Rheumatology, Maastricht University Medical Center, Maastricht, The Netherlands, Department of Health Sciences and Health Policy, University of Lucerne, Lucerne, Switzerland and World Health Organization, CTS Team, Geneva, Switzerland.;Rheumazentrum Ruhrgebiet, Herne, Germany, Department of Rheumatology, Leiden University Medical Center, Leiden, The Netherlands, Institute for Health and Rehabilitation Sciences (IHRS), Research Unit for Biopsychosocial Health, Ludwig-Maximilians-University, Munich, Germany, Swiss Paraplegic Research (SPF), ICF Research Branch, WHO FIC CC Germany (DIMDI) at SPF, Nottwil, Switzerland, Department of Internal Medicine, Division of Rheumatology, Maastricht University Medical Center, Maastricht, The Netherlands, Department of Health Sciences and Health Policy, University of Lucerne, Lucerne, Switzerland and World Health Organization, CTS Team, Geneva, Switzerland.;Rheumazentrum Ruhrgebiet, Herne, Germany, Department of Rheumatology, Leiden University Medical Center, Leiden, The Netherlands, Institute for Health and Rehabilitation Sciences (IHRS), Research Unit for Biopsychosocial Health, Ludwig-Maximilians-University, Munich, Germany, Swiss Paraplegic Research (SPF), ICF Research Branch, WHO FIC CC Germany (DIMDI) at SPF, Nottwil, Switzerland, Department of Internal Medicine, Division of Rheumatology, Maastricht University Medical Center, Maastricht, The Netherlands, Department of Health Sciences and Health Policy, University of Lucerne, Lucerne, Switzerland and World Health Organization, CTS Team, Geneva, Switzerland.;Rheumazentrum Ruhrgebiet, Herne, Germany, Department of Rheumatology, Leiden University Medical Center, Leiden, The Netherlands, Institute for Health and Rehabilitation Sciences (IHRS), Research Unit for Biopsychosocial Health, Ludwig-Maximilians-University, Munich, Germany, Swiss Paraplegic Research (SPF), ICF Research Branch, WHO FIC CC Germany (DIMDI) at SPF, Nottwil, Switzerland, Department of Internal Medicine, Division of Rheumatology, Maastricht University Medical Center, Maastricht, The Netherlands, Department of Health Sciences and Health Policy, University of Lucerne, Lucerne, Switzerland and World Health Organization, CTS Team, Geneva, Switzerland.;Rheumazentrum Ruhrgebiet, Herne, Germany, Department of Rheumatology, Leiden University Medical Center, Leiden, The Netherlands, Institute for Health and Rehabilitation Sciences (IHRS), Research Unit for Biopsychosocial Health, Ludwig-Maximilians-University, Munich, Germany, Swiss Paraplegic Research (SPF), ICF Research Branch, WHO FIC CC Germany (DIMDI) at SPF, Nottwil, Switzerland, Department of Internal Medicine, Division of Rheumatology, Maastricht University Medical Center, Maastricht, The Netherlands, Department of Health Sciences and Health Policy, University of Lucerne, Lucerne, Switzerland and World Health Organization, CTS Team, Geneva, Switzerland.",Oxford University Press,,50,5,894,898,1462-0324,1462-0332,copyright,"© The Author 2010. Published by Oxford University Press on behalf of the British Society for Rheumatology. All rights reserved. For Permissions, please email: journals.permissions@oup.com",https://www.swissbib.ch/Search/Results?lookfor=nationallicenceoxford101093rheumatologykeq315,http://sru.swissbib.ch/sru/search/defaultdb?query=+dc.anywhere+exact+NATIONALLICENCEoxford101093rheumatologykeq315&operation=searchRetrieve&recordSchema=info%3Asrw%2Fschema%2F1%2Fmarcxml-v1.1-light&maximumRecords=10&startRecord=0&recordPacking=XML&availableDBs=defaultdb&sortKeys=Submit+query,http://sru.swissbib.ch/sru/search/defaultdb?query=+dc.anywhere+exact+NATIONALLICENCEoxford101093rheumatologykeq315&operation=searchRetrieve&recordSchema=info%3Asrw%2Fschema%2F1%2Fdc-v1.1-light&maximumRecords=10&startRecord=0&recordPacking=XML&availableDBs=defaultdb&sortKeys=Submit+query,http://sru.swissbib.ch/sru/search/defaultdb?query=+dc.anywhere+exact+NATIONALLICENCEoxford101093rheumatologykeq315&operation=searchRetrieve&recordSchema=info%3Asru%2Fschema%2Fjson&maximumRecords=10&startRecord=0&recordPacking=XML&availableDBs=defaultdb&sortKeys=Submit+query,
