"Affiliations of authors: F. Levi, F. Lucchini, Cancer Epidemiology Unit and Cancer Registries of Vaud and Neuchâtel, Institut universitaire de médecine sociale et préventive, Lausanne, Switzerland; E. Negri, Laboratory of Epidemiology, Istituto di Ricerche Farmacologiche ‘Mario Negri,’ Milan, Italy; C. La Vecchia, Cancer Epidemiology Unit and Cancer Registries of Vaud and Neuchâtel, Institut universitaire de médecine sociale et préventive, Laboratory of Epidemiology, Istituto di Ricerche Farmacologiche ‘Mario Negri,’ and Istituto di Statistica Medica e Biometria, Università degli Studi di Milano, Milan, Italy.",Fabio Levi,unine,10.1093/jnci/95.8.631-a,https://doi.org/10.1093/jnci/95.8.631-a,./JNCI/jnci95-8/abstracts/0950631a.xml,The End of the Tobacco-Related Lung Cancer Epidemic in Europe,,Fabio Levi;Franca Lucchini;Eva Negri;Carlo La Vecchia,2003,Journal of the National Cancer Institute,"Affiliations of authors: F. Levi, F. Lucchini, Cancer Epidemiology Unit and Cancer Registries of Vaud and Neuchâtel, Institut universitaire de médecine sociale et préventive, Lausanne, Switzerland; E. Negri, Laboratory of Epidemiology, Istituto di Ricerche Farmacologiche ‘Mario Negri,’ Milan, Italy; C. La Vecchia, Cancer Epidemiology Unit and Cancer Registries of Vaud and Neuchâtel, Institut universitaire de médecine sociale et préventive, Laboratory of Epidemiology, Istituto di Ricerche Farmacologiche ‘Mario Negri,’ and Istituto di Statistica Medica e Biometria, Università degli Studi di Milano, Milan, Italy.;Affiliations of authors: F. Levi, F. Lucchini, Cancer Epidemiology Unit and Cancer Registries of Vaud and Neuchâtel, Institut universitaire de médecine sociale et préventive, Lausanne, Switzerland; E. Negri, Laboratory of Epidemiology, Istituto di Ricerche Farmacologiche ‘Mario Negri,’ Milan, Italy; C. La Vecchia, Cancer Epidemiology Unit and Cancer Registries of Vaud and Neuchâtel, Institut universitaire de médecine sociale et préventive, Laboratory of Epidemiology, Istituto di Ricerche Farmacologiche ‘Mario Negri,’ and Istituto di Statistica Medica e Biometria, Università degli Studi di Milano, Milan, Italy.;Affiliations of authors: F. Levi, F. Lucchini, Cancer Epidemiology Unit and Cancer Registries of Vaud and Neuchâtel, Institut universitaire de médecine sociale et préventive, Lausanne, Switzerland; E. Negri, Laboratory of Epidemiology, Istituto di Ricerche Farmacologiche ‘Mario Negri,’ Milan, Italy; C. La Vecchia, Cancer Epidemiology Unit and Cancer Registries of Vaud and Neuchâtel, Institut universitaire de médecine sociale et préventive, Laboratory of Epidemiology, Istituto di Ricerche Farmacologiche ‘Mario Negri,’ and Istituto di Statistica Medica e Biometria, Università degli Studi di Milano, Milan, Italy.;Affiliations of authors: F. Levi, F. Lucchini, Cancer Epidemiology Unit and Cancer Registries of Vaud and Neuchâtel, Institut universitaire de médecine sociale et préventive, Lausanne, Switzerland; E. Negri, Laboratory of Epidemiology, Istituto di Ricerche Farmacologiche ‘Mario Negri,’ Milan, Italy; C. La Vecchia, Cancer Epidemiology Unit and Cancer Registries of Vaud and Neuchâtel, Institut universitaire de médecine sociale et préventive, Laboratory of Epidemiology, Istituto di Ricerche Farmacologiche ‘Mario Negri,’ and Istituto di Statistica Medica e Biometria, Università degli Studi di Milano, Milan, Italy.",Oxford University Press,,95,8,631,632,0027-8874,1460-2105,copyright,© Oxford University Press,oxford,https://www.swissbib.ch/Search/Results?lookfor=nationallicenceoxford101093jnci958631a,http://sru.swissbib.ch/sru/search/defaultdb?query=+dc.anywhere+exact+NATIONALLICENCEoxford101093jnci958631a&operation=searchRetrieve&recordSchema=info%3Asrw%2Fschema%2F1%2Fmarcxml-v1.1-light&maximumRecords=10&startRecord=0&recordPacking=XML&availableDBs=defaultdb&sortKeys=Submit+query,http://sru.swissbib.ch/sru/search/defaultdb?query=+dc.anywhere+exact+NATIONALLICENCEoxford101093jnci958631a&operation=searchRetrieve&recordSchema=info%3Asrw%2Fschema%2F1%2Fdc-v1.1-light&maximumRecords=10&startRecord=0&recordPacking=XML&availableDBs=defaultdb&sortKeys=Submit+query,http://sru.swissbib.ch/sru/search/defaultdb?query=+dc.anywhere+exact+NATIONALLICENCEoxford101093jnci958631a&operation=searchRetrieve&recordSchema=info%3Asru%2Fschema%2Fjson&maximumRecords=10&startRecord=0&recordPacking=XML&availableDBs=defaultdb&sortKeys=Submit+query,
"Laboratoire de Microbiologie, Université de Neuchâtel, Case Postale 2, 2007 Neuchâtel, Switzerland E-mail: sonia.tarnawski@unine.ch",Sonia Tarnawski,unine,10.1016/S0168-6496(03)00130-2,https://doi.org/10.1016/S0168-6496(03)00130-2,./femsec/femsec45-2/abstracts/45-2-97.xml,Examination of Gould's modified S1 (mS1) selective medium and Angle's non-selective medium for describing the diversity of Pseudomonas spp. in soil and root environments,,Sonia Tarnawski;Jérôme Hamelin;Laurent Locatelli;Michel Aragno;Nathalie Fromin,2003,FEMS Microbiology Ecology,"Laboratoire de Microbiologie, Université de Neuchâtel, Case Postale 2, 2007 Neuchâtel, Switzerland E-mail: sonia.tarnawski@unine.ch;Laboratoire de Microbiologie, Université de Neuchâtel, Case Postale 2, 2007 Neuchâtel, Switzerland;Laboratoire de Microbiologie, Université de Neuchâtel, Case Postale 2, 2007 Neuchâtel, Switzerland;Laboratoire de Microbiologie, Université de Neuchâtel, Case Postale 2, 2007 Neuchâtel, Switzerland;Laboratoire de Microbiologie, Université de Neuchâtel, Case Postale 2, 2007 Neuchâtel, Switzerland",Blackwell Publishing Ltd,,45,2,97,104,,1574-6941,copyright,© 2003 Federation of European Microbiological Societies. Published by Elsevier Science B.V. All rights reserved.,oxford,https://www.swissbib.ch/Search/Results?lookfor=nationallicenceoxford101016S0168649603001302,http://sru.swissbib.ch/sru/search/defaultdb?query=+dc.anywhere+exact+NATIONALLICENCEoxford101016S0168649603001302&operation=searchRetrieve&recordSchema=info%3Asrw%2Fschema%2F1%2Fmarcxml-v1.1-light&maximumRecords=10&startRecord=0&recordPacking=XML&availableDBs=defaultdb&sortKeys=Submit+query,http://sru.swissbib.ch/sru/search/defaultdb?query=+dc.anywhere+exact+NATIONALLICENCEoxford101016S0168649603001302&operation=searchRetrieve&recordSchema=info%3Asrw%2Fschema%2F1%2Fdc-v1.1-light&maximumRecords=10&startRecord=0&recordPacking=XML&availableDBs=defaultdb&sortKeys=Submit+query,http://sru.swissbib.ch/sru/search/defaultdb?query=+dc.anywhere+exact+NATIONALLICENCEoxford101016S0168649603001302&operation=searchRetrieve&recordSchema=info%3Asru%2Fschema%2Fjson&maximumRecords=10&startRecord=0&recordPacking=XML&availableDBs=defaultdb&sortKeys=Submit+query,
"Present address: Prefargier Psychiatric Hospital, CH-2074 Marin, Neuchatel, Switzerland Department of Morphology, University Medical Center, 1 rue Michel Servet, CH-1211 Geneva 4, Switzerland",Edgardo Troncoso,unine,10.1093/cercor/bhh195,https://doi.org/10.1093/cercor/bhh195,./CERCOR/cercor15-7/abstracts/bhh195.xml,Structural and Functional Aberrations in the Cerebral Cortex of Tenascin-C Deficient Mice,,Andrey Irintchev;Astrid Rollenhagen;Edgardo Troncoso;Jozsef Z. Kiss;Melitta Schachner,2005,Cerebral Cortex,"Zentrum für Molekulare Neurobiologie, Universität Hamburg, D-20246 Hamburg, Germany and;Present address: Institute of Anatomy and Cell Biology, Albert-Ludwigs-Universität Freiburg, D-79104 Freiburg, Germany Zentrum für Molekulare Neurobiologie, Universität Hamburg, D-20246 Hamburg, Germany and;Present address: Prefargier Psychiatric Hospital, CH-2074 Marin, Neuchatel, Switzerland Department of Morphology, University Medical Center, 1 rue Michel Servet, CH-1211 Geneva 4, Switzerland;Department of Morphology, University Medical Center, 1 rue Michel Servet, CH-1211 Geneva 4, Switzerland;Zentrum für Molekulare Neurobiologie, Universität Hamburg, D-20246 Hamburg, Germany and",Oxford University Press,,15,7,950,962,1047-3211,1460-2199,copyright,Cerebral Cortex V 15 N 7 © Oxford University Press 2004; all rights reserved,oxford,https://www.swissbib.ch/Search/Results?lookfor=nationallicenceoxford101093cercorbhh195,http://sru.swissbib.ch/sru/search/defaultdb?query=+dc.anywhere+exact+NATIONALLICENCEoxford101093cercorbhh195&operation=searchRetrieve&recordSchema=info%3Asrw%2Fschema%2F1%2Fmarcxml-v1.1-light&maximumRecords=10&startRecord=0&recordPacking=XML&availableDBs=defaultdb&sortKeys=Submit+query,http://sru.swissbib.ch/sru/search/defaultdb?query=+dc.anywhere+exact+NATIONALLICENCEoxford101093cercorbhh195&operation=searchRetrieve&recordSchema=info%3Asrw%2Fschema%2F1%2Fdc-v1.1-light&maximumRecords=10&startRecord=0&recordPacking=XML&availableDBs=defaultdb&sortKeys=Submit+query,http://sru.swissbib.ch/sru/search/defaultdb?query=+dc.anywhere+exact+NATIONALLICENCEoxford101093cercorbhh195&operation=searchRetrieve&recordSchema=info%3Asru%2Fschema%2Fjson&maximumRecords=10&startRecord=0&recordPacking=XML&availableDBs=defaultdb&sortKeys=Submit+query,
"Cancer Epidemiology Unit and Cancer Registries of Vaud and Neuchatel, Institut de médecine sociale et préventive (IUMSP); Centre Hospitalier Universitaire Vaudois et, Université de Lausanne, Lausanne, Switzerland",F. Levi,unine,10.1093/annonc/mdn533,https://doi.org/10.1093/annonc/mdn533,./ANNONC/annonc20-1/abstracts/mdn533.xml,Epidemiology of biliary tract cancers: an update,,G. Randi;M. Malvezzi;F. Levi;J. Ferlay;E. Negri;S. Franceschi;C. La Vecchia,2008,Annals of Oncology,"Istituto di Ricerche Farmacologiche ‘Mario Negri’, Milan Istituto di Statistica Medica e Biometria ‘G.A. Maccacaro’, Università degli Studi di Milano, Milan, Italy E-mail: randi@marionegri.it;Istituto di Ricerche Farmacologiche ‘Mario Negri’, Milan Istituto di Statistica Medica e Biometria ‘G.A. Maccacaro’, Università degli Studi di Milano, Milan, Italy;Cancer Epidemiology Unit and Cancer Registries of Vaud and Neuchatel, Institut de médecine sociale et préventive (IUMSP); Centre Hospitalier Universitaire Vaudois et, Université de Lausanne, Lausanne, Switzerland;International Agency for Research on Cancer, Lyon, France;Istituto di Ricerche Farmacologiche ‘Mario Negri’, Milan E-mail: randi@marionegri.it;International Agency for Research on Cancer, Lyon, France;Istituto di Ricerche Farmacologiche ‘Mario Negri’, Milan Istituto di Statistica Medica e Biometria ‘G.A. Maccacaro’, Università degli Studi di Milano, Milan, Italy",Oxford University Press,,20,1,146,159,0923-7534,1569-8041,copyright,"© The Author 2008. Published by Oxford University Press on behalf of the European Society for Medical Oncology. All rights reserved. For permissions, please email: journals.permissions@oxfordjournals.org",oxford,https://www.swissbib.ch/Search/Results?lookfor=nationallicenceoxford101093annoncmdn533,http://sru.swissbib.ch/sru/search/defaultdb?query=+dc.anywhere+exact+NATIONALLICENCEoxford101093annoncmdn533&operation=searchRetrieve&recordSchema=info%3Asrw%2Fschema%2F1%2Fmarcxml-v1.1-light&maximumRecords=10&startRecord=0&recordPacking=XML&availableDBs=defaultdb&sortKeys=Submit+query,http://sru.swissbib.ch/sru/search/defaultdb?query=+dc.anywhere+exact+NATIONALLICENCEoxford101093annoncmdn533&operation=searchRetrieve&recordSchema=info%3Asrw%2Fschema%2F1%2Fdc-v1.1-light&maximumRecords=10&startRecord=0&recordPacking=XML&availableDBs=defaultdb&sortKeys=Submit+query,http://sru.swissbib.ch/sru/search/defaultdb?query=+dc.anywhere+exact+NATIONALLICENCEoxford101093annoncmdn533&operation=searchRetrieve&recordSchema=info%3Asru%2Fschema%2Fjson&maximumRecords=10&startRecord=0&recordPacking=XML&availableDBs=defaultdb&sortKeys=Submit+query,
"Cancer Epidemiology Unit and Cancer Registries of Vaud and Neuchâtel, Institut de médecine sociale et préventive, Centre Hospitalier Universitaire Vaudois et Université de Lausanne, Lausanne, Switzerland",F. Lucchini,unine,10.1093/annonc/mdp530,https://doi.org/10.1093/annonc/mdp530,./ANNONC/annonc21-6/abstracts/mdp530.xml,"Cancer mortality in Europe, 2000–2004, and an overview of trends since 1975",,C. La Vecchia;C. Bosetti;F. Lucchini;P. Bertuccio;E. Negri;P. Boyle;F. Levi,2010,Annals of Oncology,"Department of Epidemiology, Istituto di Ricerche Farmacologiche ‘Mario Negri’ Institute of Medical Statistics and Biometry ‘G.A. Maccacaro’, Università degli Studi di Milano, Milan, Italy;Department of Epidemiology, Istituto di Ricerche Farmacologiche ‘Mario Negri’ E-mail: bosetti@marionegri.it;Cancer Epidemiology Unit and Cancer Registries of Vaud and Neuchâtel, Institut de médecine sociale et préventive, Centre Hospitalier Universitaire Vaudois et Université de Lausanne, Lausanne, Switzerland;Department of Epidemiology, Istituto di Ricerche Farmacologiche ‘Mario Negri’;Department of Epidemiology, Istituto di Ricerche Farmacologiche ‘Mario Negri’;International Prevention Research Institute, Lyon, France;Cancer Epidemiology Unit and Cancer Registries of Vaud and Neuchâtel, Institut de médecine sociale et préventive, Centre Hospitalier Universitaire Vaudois et Université de Lausanne, Lausanne, Switzerland",Oxford University Press,,21,6,1323,1360,0923-7534,1569-8041,copyright,"© The Author 2009. Published by Oxford University Press on behalf of the European Society for Medical Oncology. All rights reserved. For permissions, please email: journals.permissions@oxfordjournals.org",oxford,https://www.swissbib.ch/Search/Results?lookfor=nationallicenceoxford101093annoncmdp530,http://sru.swissbib.ch/sru/search/defaultdb?query=+dc.anywhere+exact+NATIONALLICENCEoxford101093annoncmdp530&operation=searchRetrieve&recordSchema=info%3Asrw%2Fschema%2F1%2Fmarcxml-v1.1-light&maximumRecords=10&startRecord=0&recordPacking=XML&availableDBs=defaultdb&sortKeys=Submit+query,http://sru.swissbib.ch/sru/search/defaultdb?query=+dc.anywhere+exact+NATIONALLICENCEoxford101093annoncmdp530&operation=searchRetrieve&recordSchema=info%3Asrw%2Fschema%2F1%2Fdc-v1.1-light&maximumRecords=10&startRecord=0&recordPacking=XML&availableDBs=defaultdb&sortKeys=Submit+query,http://sru.swissbib.ch/sru/search/defaultdb?query=+dc.anywhere+exact+NATIONALLICENCEoxford101093annoncmdp530&operation=searchRetrieve&recordSchema=info%3Asru%2Fschema%2Fjson&maximumRecords=10&startRecord=0&recordPacking=XML&availableDBs=defaultdb&sortKeys=Submit+query,
"Unité d'épidémiologie du cancer, Institut universitaire de médecine sociale et préventive, Lausanne Registre Vaudois des Tumeurs, Lausanne Registre Neuchâtelois des Tumeurs, Neuchâtel, Switzerland",F Levi,unine,10.1093/annonc/mdl490,https://doi.org/10.1093/annonc/mdl490,./ANNONC/annonc18-4/abstracts/mdl490.xml,Detailed site distribution of melanoma and sunlight exposure: aetiological patterns from a Swiss series,,J-L Bulliard;D De Weck;T Fisch;A Bordoni;F Levi,2007,Annals of Oncology,"Unité d'épidémiologie du cancer, Institut universitaire de médecine sociale et préventive, Lausanne E-mail: jean-luc.bulliard@chuv.ch;Registre Valaisan des Tumeurs, Sion;Krebsregister St.Gallen-Appenzell, St.Gallen **(currently Krebsregister Zürich, Zürich);Registro Tumori del Cantone Ticino, Locarno;Unité d'épidémiologie du cancer, Institut universitaire de médecine sociale et préventive, Lausanne Registre Vaudois des Tumeurs, Lausanne Registre Neuchâtelois des Tumeurs, Neuchâtel, Switzerland",Oxford University Press,,18,4,789,794,0923-7534,1569-8041,copyright,© 2007 European Society for Medical Oncology,oxford,https://www.swissbib.ch/Search/Results?lookfor=nationallicenceoxford101093annoncmdl490,http://sru.swissbib.ch/sru/search/defaultdb?query=+dc.anywhere+exact+NATIONALLICENCEoxford101093annoncmdl490&operation=searchRetrieve&recordSchema=info%3Asrw%2Fschema%2F1%2Fmarcxml-v1.1-light&maximumRecords=10&startRecord=0&recordPacking=XML&availableDBs=defaultdb&sortKeys=Submit+query,http://sru.swissbib.ch/sru/search/defaultdb?query=+dc.anywhere+exact+NATIONALLICENCEoxford101093annoncmdl490&operation=searchRetrieve&recordSchema=info%3Asrw%2Fschema%2F1%2Fdc-v1.1-light&maximumRecords=10&startRecord=0&recordPacking=XML&availableDBs=defaultdb&sortKeys=Submit+query,http://sru.swissbib.ch/sru/search/defaultdb?query=+dc.anywhere+exact+NATIONALLICENCEoxford101093annoncmdl490&operation=searchRetrieve&recordSchema=info%3Asru%2Fschema%2Fjson&maximumRecords=10&startRecord=0&recordPacking=XML&availableDBs=defaultdb&sortKeys=Submit+query,
"Division of Gastroenterology & Hepatology, Lausanne University Hospital, Lausanne, Switzerland Division of Gastroenterology, Hôpital Neuchâtelois, Neuchâtel, Switzerland",Christian Mottet,unine,10.1093/ecco-jcc/jju021,https://doi.org/10.1093/ecco-jcc/jju021,./eccojc/eccojc9/abstracts/jju021.xml,Acceptance of Inflammatory Bowel Disease Treatment Recommendations Based on Appropriateness Ratings: do Practicing Gastroenterologists Agree with Experts?,,"Valérie Pittet;Michel H. Maillard;Stéphanie Lauvergeon;Marjan Timmer;, Pierre Michetti;Florian Froehlich;Bernard Burnand;John-Paul Vader;Christian Mottet",2015,Journal of Crohn's and Colitis,"Healthcare Evaluation Unit, Institute of Social & Preventive Medicine (IUMSP), Lausanne University Hospital, Lausanne,Switzerland E-mail: Valerie.Pittet@chuv.ch;Division of Gastroenterology & Hepatology, Lausanne University Hospital, Lausanne, Switzerland;Healthcare Evaluation Unit, Institute of Social & Preventive Medicine (IUMSP), Lausanne University Hospital, Lausanne,Switzerland;Healthcare Evaluation Unit, Institute of Social & Preventive Medicine (IUMSP), Lausanne University Hospital, Lausanne,Switzerland;Division of Gastroenterology & Hepatology, Lausanne University Hospital, Lausanne, Switzerland Crohn and Colitis Center, Clinique La Source-Beaulieu, Lausanne, Switzerland;Division of Gastroenterology & Hepatology, Lausanne University Hospital, Lausanne, Switzerland Division of Gastroenterology & Hepatology, University Hospital Basel, Basel, Switzerland;Healthcare Evaluation Unit, Institute of Social & Preventive Medicine (IUMSP), Lausanne University Hospital, Lausanne,Switzerland;Healthcare Evaluation Unit, Institute of Social & Preventive Medicine (IUMSP), Lausanne University Hospital, Lausanne,Switzerland;Division of Gastroenterology & Hepatology, Lausanne University Hospital, Lausanne, Switzerland Division of Gastroenterology, Hôpital Neuchâtelois, Neuchâtel, Switzerland",Oxford University Press,2018-02-01,9,2,132,139,1873-9946,1876-4479,copyright,"Copyright © 2014 European Crohn’s and Colitis Organisation (ECCO). Published by Oxford University Press. All rights reserved. For permissions, please email: journals.permissions@oup.com",oxford,https://www.swissbib.ch/Search/Results?lookfor=nationallicenceoxford101093eccojccjju021,http://sru.swissbib.ch/sru/search/defaultdb?query=+dc.anywhere+exact+NATIONALLICENCEoxford101093eccojccjju021&operation=searchRetrieve&recordSchema=info%3Asrw%2Fschema%2F1%2Fmarcxml-v1.1-light&maximumRecords=10&startRecord=0&recordPacking=XML&availableDBs=defaultdb&sortKeys=Submit+query,http://sru.swissbib.ch/sru/search/defaultdb?query=+dc.anywhere+exact+NATIONALLICENCEoxford101093eccojccjju021&operation=searchRetrieve&recordSchema=info%3Asrw%2Fschema%2F1%2Fdc-v1.1-light&maximumRecords=10&startRecord=0&recordPacking=XML&availableDBs=defaultdb&sortKeys=Submit+query,http://sru.swissbib.ch/sru/search/defaultdb?query=+dc.anywhere+exact+NATIONALLICENCEoxford101093eccojccjju021&operation=searchRetrieve&recordSchema=info%3Asru%2Fschema%2Fjson&maximumRecords=10&startRecord=0&recordPacking=XML&availableDBs=defaultdb&sortKeys=Submit+query,
"Cancer Epidemiology Unit and Vaud and Neuchâtel Cancer Registries, Institute of Social and Preventive Medicine, Centre Hospitalier Universitaire Vaudois and University of Lausanne, Lausanne, Switzerland",F. Levi,unine,10.1093/annonc/mdq774,https://doi.org/10.1093/annonc/mdq774,./ANNONC/annonc22-4/abstracts/mdq774.xml,European cancer mortality predictions for the year 2011,,M. Malvezzi;A. Arfé;P. Bertuccio;F. Levi;C. La Vecchia;E. Negri,2011,Annals of Oncology,"Department of Epidemiology, Istituto di Ricerche Farmacologiche ‘Mario Negri’, Milan Department of Occupational Health, Section of Medical Statistics, University of Milan, Milan Department of Medical Statistics, Biometry and Bioinformatics, National Tumor Institute, Milan, Italy;Department of Epidemiology, Istituto di Ricerche Farmacologiche ‘Mario Negri’, Milan;Department of Epidemiology, Istituto di Ricerche Farmacologiche ‘Mario Negri’, Milan Department of Occupational Health, Section of Medical Statistics, University of Milan, Milan;Cancer Epidemiology Unit and Vaud and Neuchâtel Cancer Registries, Institute of Social and Preventive Medicine, Centre Hospitalier Universitaire Vaudois and University of Lausanne, Lausanne, Switzerland;Department of Epidemiology, Istituto di Ricerche Farmacologiche ‘Mario Negri’, Milan Department of Occupational Health, Section of Medical Statistics, University of Milan, Milan E-mail: carlo.lavecchia@marionegri.it;Department of Epidemiology, Istituto di Ricerche Farmacologiche ‘Mario Negri’, Milan E-mail: carlo.lavecchia@marionegri.it",Oxford University Press,,22,4,947,956,0923-7534,1569-8041,copyright,"© The Author 2011. Published by Oxford University Press on behalf of the European Society for Medical Oncology. All rights reserved. For permissions, please email: journals.permissions@oup.com",oxford,https://www.swissbib.ch/Search/Results?lookfor=nationallicenceoxford101093annoncmdq774,http://sru.swissbib.ch/sru/search/defaultdb?query=+dc.anywhere+exact+NATIONALLICENCEoxford101093annoncmdq774&operation=searchRetrieve&recordSchema=info%3Asrw%2Fschema%2F1%2Fmarcxml-v1.1-light&maximumRecords=10&startRecord=0&recordPacking=XML&availableDBs=defaultdb&sortKeys=Submit+query,http://sru.swissbib.ch/sru/search/defaultdb?query=+dc.anywhere+exact+NATIONALLICENCEoxford101093annoncmdq774&operation=searchRetrieve&recordSchema=info%3Asrw%2Fschema%2F1%2Fdc-v1.1-light&maximumRecords=10&startRecord=0&recordPacking=XML&availableDBs=defaultdb&sortKeys=Submit+query,http://sru.swissbib.ch/sru/search/defaultdb?query=+dc.anywhere+exact+NATIONALLICENCEoxford101093annoncmdq774&operation=searchRetrieve&recordSchema=info%3Asru%2Fschema%2Fjson&maximumRecords=10&startRecord=0&recordPacking=XML&availableDBs=defaultdb&sortKeys=Submit+query,
"Registre vaudois des tumeurs, Institut universitaire de médecine sociale et préventive, Centre Hospitalier Universitaire Vaudois, Lausanne, and Registre neuchâtelois des tumeurs Neuchâtel, Switzerland Reprint requests to Dr. Fabio Levi, Registre vaudois des tumeurs, Institut universitaire de médecine sociale et préventive, Centre Hospitalier Universitaire Vaudois, Falaises 1, Casier 15, CH-1011 Lausanne, Switzerland",Fabio Levi,unine,10.1093/oxfordjournals.aje.a009349,https://doi.org/10.1093/oxfordjournals.aje.a009349,./AJE/aje146-9/abstracts/146-9-734.xml,Incidence of Invasive Cancers Following Squamous Cell Skin Cancer,,Fabio Levi;Lalao Randimbison;Carlo La Vecchia;Georges Erler;Van-Cong Te,1997,American Journal of Epidemiology,"Registre vaudois des tumeurs, Institut universitaire de médecine sociale et préventive, Centre Hospitalier Universitaire Vaudois, Lausanne, and Registre neuchâtelois des tumeurs Neuchâtel, Switzerland Reprint requests to Dr. Fabio Levi, Registre vaudois des tumeurs, Institut universitaire de médecine sociale et préventive, Centre Hospitalier Universitaire Vaudois, Falaises 1, Casier 15, CH-1011 Lausanne, Switzerland;Registre vaudois des tumeurs, Institut universitaire de médecine sociale et préventive, Centre Hospitalier Universitaire Vaudois, Lausanne, and Registre neuchâtelois des tumeurs Neuchâtel, Switzerland;Istituto di Ricerche Farmacologiche “Mario Negri”, and Istituto di Statistica Medica e Biometria, Universitá di Milano Milan, Italy;Registre vaudois des tumeurs, Institut universitaire de médecine sociale et préventive, Centre Hospitalier Universitaire Vaudois, Lausanne, and Registre neuchâtelois des tumeurs Neuchâtel, Switzerland;Registre vaudois des tumeurs, Institut universitaire de médecine sociale et préventive, Centre Hospitalier Universitaire Vaudois, Lausanne, and Registre neuchâtelois des tumeurs Neuchâtel, Switzerland",Oxford University Press,,146,9,734,739,0002-9262,1476-6256,copyright,© 1997 by The Johns Hopkins University School of Hygiene and Public Health,oxford,https://www.swissbib.ch/Search/Results?lookfor=nationallicenceoxford101093oxfordjournalsajea009349,http://sru.swissbib.ch/sru/search/defaultdb?query=+dc.anywhere+exact+NATIONALLICENCEoxford101093oxfordjournalsajea009349&operation=searchRetrieve&recordSchema=info%3Asrw%2Fschema%2F1%2Fmarcxml-v1.1-light&maximumRecords=10&startRecord=0&recordPacking=XML&availableDBs=defaultdb&sortKeys=Submit+query,http://sru.swissbib.ch/sru/search/defaultdb?query=+dc.anywhere+exact+NATIONALLICENCEoxford101093oxfordjournalsajea009349&operation=searchRetrieve&recordSchema=info%3Asrw%2Fschema%2F1%2Fdc-v1.1-light&maximumRecords=10&startRecord=0&recordPacking=XML&availableDBs=defaultdb&sortKeys=Submit+query,http://sru.swissbib.ch/sru/search/defaultdb?query=+dc.anywhere+exact+NATIONALLICENCEoxford101093oxfordjournalsajea009349&operation=searchRetrieve&recordSchema=info%3Asru%2Fschema%2Fjson&maximumRecords=10&startRecord=0&recordPacking=XML&availableDBs=defaultdb&sortKeys=Submit+query,
