"Swiss Institute of Bioinformatics, Proteome Informatics Group, Geneva, Geneva Bioinformatics (GeneBio) S.A., Geneva, Swiss National Supercomputing Centre, Manno, University of Lugano, Faculty of Informatics, Lugano and University of Geneva, Computer Science Department, Geneva, Switzerland *To whom correspondence should be addressed.",Andreas Quandt,usi,10.1093/bioinformatics/btn139,./bioinformatics/bioinformatics24-11/abstracts/btn139.xml,swissPIT: a novel approach for pipelined analysis of mass spectrometry data,Andreas Quandt;Patricia Hernandez;Alexandre Masselot;Céline Hernandez;Sergio Maffioletti;Cesare Pautasso;Ron D. Appel;Frederique Lisacek,2008,Bioinformatics,"Swiss Institute of Bioinformatics, Proteome Informatics Group, Geneva, Geneva Bioinformatics (GeneBio) S.A., Geneva, Swiss National Supercomputing Centre, Manno, University of Lugano, Faculty of Informatics, Lugano and University of Geneva, Computer Science Department, Geneva, Switzerland *To whom correspondence should be addressed.;Swiss Institute of Bioinformatics, Proteome Informatics Group, Geneva, Geneva Bioinformatics (GeneBio) S.A., Geneva, Swiss National Supercomputing Centre, Manno, University of Lugano, Faculty of Informatics, Lugano and University of Geneva, Computer Science Department, Geneva, Switzerland;Swiss Institute of Bioinformatics, Proteome Informatics Group, Geneva, Geneva Bioinformatics (GeneBio) S.A., Geneva, Swiss National Supercomputing Centre, Manno, University of Lugano, Faculty of Informatics, Lugano and University of Geneva, Computer Science Department, Geneva, Switzerland;Swiss Institute of Bioinformatics, Proteome Informatics Group, Geneva, Geneva Bioinformatics (GeneBio) S.A., Geneva, Swiss National Supercomputing Centre, Manno, University of Lugano, Faculty of Informatics, Lugano and University of Geneva, Computer Science Department, Geneva, Switzerland;Swiss Institute of Bioinformatics, Proteome Informatics Group, Geneva, Geneva Bioinformatics (GeneBio) S.A., Geneva, Swiss National Supercomputing Centre, Manno, University of Lugano, Faculty of Informatics, Lugano and University of Geneva, Computer Science Department, Geneva, Switzerland;Swiss Institute of Bioinformatics, Proteome Informatics Group, Geneva, Geneva Bioinformatics (GeneBio) S.A., Geneva, Swiss National Supercomputing Centre, Manno, University of Lugano, Faculty of Informatics, Lugano and University of Geneva, Computer Science Department, Geneva, Switzerland;Swiss Institute of Bioinformatics, Proteome Informatics Group, Geneva, Geneva Bioinformatics (GeneBio) S.A., Geneva, Swiss National Supercomputing Centre, Manno, University of Lugano, Faculty of Informatics, Lugano and University of Geneva, Computer Science Department, Geneva, Switzerland;Swiss Institute of Bioinformatics, Proteome Informatics Group, Geneva, Geneva Bioinformatics (GeneBio) S.A., Geneva, Swiss National Supercomputing Centre, Manno, University of Lugano, Faculty of Informatics, Lugano and University of Geneva, Computer Science Department, Geneva, Switzerland",Oxford University Press,,24,11,1416,1417,1367-4803,1460-2059,copyright,"© The Author 2008. Published by Oxford University Press. All rights reserved. For Permissions, please email: journals.permissions@oxfordjournals.org",oxford,https://www.swissbib.ch/Search/Results?lookfor=nationallicenceoxford101093bioinformaticsbtn139,http://sru.swissbib.ch/sru/search/defaultdb?query=+dc.anywhere+exact+NATIONALLICENCEoxford101093bioinformaticsbtn139&operation=searchRetrieve&recordSchema=info%3Asrw%2Fschema%2F1%2Fmarcxml-v1.1-light&maximumRecords=10&startRecord=0&recordPacking=XML&availableDBs=defaultdb&sortKeys=Submit+query,http://sru.swissbib.ch/sru/search/defaultdb?query=+dc.anywhere+exact+NATIONALLICENCEoxford101093bioinformaticsbtn139&operation=searchRetrieve&recordSchema=info%3Asrw%2Fschema%2F1%2Fdc-v1.1-light&maximumRecords=10&startRecord=0&recordPacking=XML&availableDBs=defaultdb&sortKeys=Submit+query,http://sru.swissbib.ch/sru/search/defaultdb?query=+dc.anywhere+exact+NATIONALLICENCEoxford101093bioinformaticsbtn139&operation=searchRetrieve&recordSchema=info%3Asru%2Fschema%2Fjson&maximumRecords=10&startRecord=0&recordPacking=XML&availableDBs=defaultdb&sortKeys=Submit+query,
"Benedetto Lepori is at Università della Svizzera italiana and Observatoire des Sciences et Techniques, via Lambertenghi 10a, 6904 Lugano; Email: blepori@unisi.ch; Tel: +41 58 666 46 14; Fax: +41 58 666 46 19 E-mail: stig.slipersater@nifustep.no",Benedetto Lepori,usi,10.3152/030234207X239456,./spp.tar.gz/spp/abstracts/34-6-401.xml,"Between policy and science: Research councils' responsiveness in Austria, Norway and Switzerland",Stig Slipersæter;Benedetto Lepori;Michael Dinges,2007,Science and Public Policy,"NIFU STEP, Wergelandsv. 7, N-0167 Oslo, Norway; Email: stig.slipersater@nifustep.no; Tel: +47 22 59 51 81; Fax: +47 22 59 51 01 E-mail: stig.slipersater@nifustep.no;Benedetto Lepori is at Università della Svizzera italiana and Observatoire des Sciences et Techniques, via Lambertenghi 10a, 6904 Lugano; Email: blepori@unisi.ch; Tel: +41 58 666 46 14; Fax: +41 58 666 46 19 E-mail: stig.slipersater@nifustep.no;Joanneum Research Forschungsgesellschaft mbH, Institute of Technology and Regional Policy, Haus der Forschung, Sensengasse 1, 1090 Wien, Austria; Email: michael.dinges@joanneum.at; Tel: +43 1 5817520 2813; Fax: +43 1 5817520 2820 E-mail: stig.slipersater@nifustep.no",Beech Tree Publishing,,34,6,401,415,0302-3427,1471-5430,copyright,© Beech Tree Publishing 2007,oxford,https://www.swissbib.ch/Search/Results?lookfor=nationallicenceoxford103152030234207X239456,http://sru.swissbib.ch/sru/search/defaultdb?query=+dc.anywhere+exact+NATIONALLICENCEoxford103152030234207X239456&operation=searchRetrieve&recordSchema=info%3Asrw%2Fschema%2F1%2Fmarcxml-v1.1-light&maximumRecords=10&startRecord=0&recordPacking=XML&availableDBs=defaultdb&sortKeys=Submit+query,http://sru.swissbib.ch/sru/search/defaultdb?query=+dc.anywhere+exact+NATIONALLICENCEoxford103152030234207X239456&operation=searchRetrieve&recordSchema=info%3Asrw%2Fschema%2F1%2Fdc-v1.1-light&maximumRecords=10&startRecord=0&recordPacking=XML&availableDBs=defaultdb&sortKeys=Submit+query,http://sru.swissbib.ch/sru/search/defaultdb?query=+dc.anywhere+exact+NATIONALLICENCEoxford103152030234207X239456&operation=searchRetrieve&recordSchema=info%3Asru%2Fschema%2Fjson&maximumRecords=10&startRecord=0&recordPacking=XML&availableDBs=defaultdb&sortKeys=Submit+query,
"Centre for Organizational Research, Faculty of Economics, University of Lugano, via Lambertenghi 10a, 6904 Lugano, Switzerland; Email: blepori@unisi.ch E-mail: j.jablecka@uw.edu.pl",Benedetto Lepori,usi,10.3152/030234209X475263,./spp.tar.gz/spp/abstracts/36-9-697.xml,"Between historical heritage and policy learning: the reform of public research funding systems in Poland, 1989–2007",Julita Jabłecka;Benedetto Lepori,2009,Science and Public Policy,"Centre for Science Policy and Higher Education, University of Warsaw, Str. Nowy Swiat 69, 00-046 Warsaw, Poland; Email: j.jablecka@uw.edu.pl; Tel: 48 22 826 07 46 E-mail: j.jablecka@uw.edu.pl;Centre for Organizational Research, Faculty of Economics, University of Lugano, via Lambertenghi 10a, 6904 Lugano, Switzerland; Email: blepori@unisi.ch E-mail: j.jablecka@uw.edu.pl",Beech Tree Publishing,,36,9,697,708,0302-3427,1471-5430,copyright,© Beech Tree Publishing 2009,oxford,https://www.swissbib.ch/Search/Results?lookfor=nationallicenceoxford103152030234209X475263,http://sru.swissbib.ch/sru/search/defaultdb?query=+dc.anywhere+exact+NATIONALLICENCEoxford103152030234209X475263&operation=searchRetrieve&recordSchema=info%3Asrw%2Fschema%2F1%2Fmarcxml-v1.1-light&maximumRecords=10&startRecord=0&recordPacking=XML&availableDBs=defaultdb&sortKeys=Submit+query,http://sru.swissbib.ch/sru/search/defaultdb?query=+dc.anywhere+exact+NATIONALLICENCEoxford103152030234209X475263&operation=searchRetrieve&recordSchema=info%3Asrw%2Fschema%2F1%2Fdc-v1.1-light&maximumRecords=10&startRecord=0&recordPacking=XML&availableDBs=defaultdb&sortKeys=Submit+query,http://sru.swissbib.ch/sru/search/defaultdb?query=+dc.anywhere+exact+NATIONALLICENCEoxford103152030234209X475263&operation=searchRetrieve&recordSchema=info%3Asru%2Fschema%2Fjson&maximumRecords=10&startRecord=0&recordPacking=XML&availableDBs=defaultdb&sortKeys=Submit+query,
"Universita’ della Svizzera italiana, via G. Buffi 13, 6904 Lugano, Switzerland, davide.la.vecchia@usi.ch E-mail: davide.ferrari@unimore.it",Davide La Vecchia,usi,10.1093/biomet/asr061,./BIOMET/biomet99-1/abstracts/asr061.xml,On robust estimation via pseudo-additive information,Davide Ferrari;Davide La Vecchia,2012,Biometrika,"University of Modena and Reggio Emilia, via Berengario 51, 41100 Modena, Italy, davide.ferrari@unimore.it E-mail: davide.ferrari@unimore.it;Universita’ della Svizzera italiana, via G. Buffi 13, 6904 Lugano, Switzerland, davide.la.vecchia@usi.ch E-mail: davide.ferrari@unimore.it",Oxford University Press,,99,1,238,244,0006-3444,1464-3510,copyright,© 2011 Biometrika Trust,oxford,https://www.swissbib.ch/Search/Results?lookfor=nationallicenceoxford101093biometasr061,http://sru.swissbib.ch/sru/search/defaultdb?query=+dc.anywhere+exact+NATIONALLICENCEoxford101093biometasr061&operation=searchRetrieve&recordSchema=info%3Asrw%2Fschema%2F1%2Fmarcxml-v1.1-light&maximumRecords=10&startRecord=0&recordPacking=XML&availableDBs=defaultdb&sortKeys=Submit+query,http://sru.swissbib.ch/sru/search/defaultdb?query=+dc.anywhere+exact+NATIONALLICENCEoxford101093biometasr061&operation=searchRetrieve&recordSchema=info%3Asrw%2Fschema%2F1%2Fdc-v1.1-light&maximumRecords=10&startRecord=0&recordPacking=XML&availableDBs=defaultdb&sortKeys=Submit+query,http://sru.swissbib.ch/sru/search/defaultdb?query=+dc.anywhere+exact+NATIONALLICENCEoxford101093biometasr061&operation=searchRetrieve&recordSchema=info%3Asru%2Fschema%2Fjson&maximumRecords=10&startRecord=0&recordPacking=XML&availableDBs=defaultdb&sortKeys=Submit+query,
"Institute of Computational Science, University of Lugano, 6906 Lugano, Switzerland",JÖRG LÄSSIG,usi,10.1017/S001447971200004X,./EAG/EAG48_03/S001447971200004Xh.xml,A CRITICAL ASSESSMENT OF THE IMPORTANCE OF SEEDLING AGE IN THE SYSTEM OF RICE INTENSIFICATION (SRI) IN EASTERN INDIA,DEBAL DEB;JÖRG LÄSSIG;MARIUS KLOFT,2012,Experimental Agriculture,"Centre for Interdisciplinary Studies, Kolkata 700123, India E-mail: cintdis@hotmail.com;Institute of Computational Science, University of Lugano, 6906 Lugano, Switzerland;Machine Learning Laboratory, TU Berlin, 10587 Berlin, Germany",Cambridge University Press,,48,3,326,346,0014-4797,1469-4441,copyright,Copyright © Cambridge University Press 2012,cambridge,https://www.swissbib.ch/Search/Results?lookfor=nationallicencecambridge101017S001447971200004X,http://sru.swissbib.ch/sru/search/defaultdb?query=+dc.anywhere+exact+NATIONALLICENCEcambridge101017S001447971200004X&operation=searchRetrieve&recordSchema=info%3Asrw%2Fschema%2F1%2Fmarcxml-v1.1-light&maximumRecords=10&startRecord=0&recordPacking=XML&availableDBs=defaultdb&sortKeys=Submit+query,http://sru.swissbib.ch/sru/search/defaultdb?query=+dc.anywhere+exact+NATIONALLICENCEcambridge101017S001447971200004X&operation=searchRetrieve&recordSchema=info%3Asrw%2Fschema%2F1%2Fdc-v1.1-light&maximumRecords=10&startRecord=0&recordPacking=XML&availableDBs=defaultdb&sortKeys=Submit+query,http://sru.swissbib.ch/sru/search/defaultdb?query=+dc.anywhere+exact+NATIONALLICENCEcambridge101017S001447971200004X&operation=searchRetrieve&recordSchema=info%3Asru%2Fschema%2Fjson&maximumRecords=10&startRecord=0&recordPacking=XML&availableDBs=defaultdb&sortKeys=Submit+query,
"Faculty of Economics, University of Lugano, Switzerland",ALBERTO CAIMO,usi,10.1017/nws.2015.3,./NWS/NWS3_01/S205012421500003Xh.xml,Simultaneous modeling of initial conditions and time heterogeneity in dynamic networks: An application to Foreign Direct Investments,JOHAN KOSKINEN;ALBERTO CAIMO;ALESSANDRO LOMI;Luca De Benedictis;Maria Prosperina Vitale;Stanley Wasserman;JOHAN KOSKINEN;ALBERTO CAIMO;ALESSANDRO LOMI;Luca De Benedictis;Maria Prosperina Vitale;Stanley Wasserman,2015,Network Science,"Social Statistics Discipline Area, University of Manchester, Manchester M13 9PL, UK (e-mail: johan.koskinen@manchester.ac.uk) E-mail: johan.koskinen@manchester.ac.uk;Faculty of Economics, University of Lugano, Switzerland;Faculty of Economics, University of Lugano, Switzerland;Social Statistics Discipline Area, University of Manchester, Manchester M13 9PL, UK (e-mail: Faculty of Economics, University of Lugano, Switzerland E-mail: johan.koskinen@manchester.ac.uk;Social Statistics Discipline Area, University of Manchester, Manchester M13 9PL, UK (e-mail: Faculty of Economics, University of Lugano, Switzerland E-mail: johan.koskinen@manchester.ac.uk;Social Statistics Discipline Area, University of Manchester, Manchester M13 9PL, UK (e-mail: Faculty of Economics, University of Lugano, Switzerland E-mail: johan.koskinen@manchester.ac.uk;Social Statistics Discipline Area, University of Manchester, Manchester M13 9PL, UK (e-mail: johan.koskinen@manchester.ac.uk) E-mail: johan.koskinen@manchester.ac.uk;Faculty of Economics, University of Lugano, Switzerland;Faculty of Economics, University of Lugano, Switzerland;Social Statistics Discipline Area, University of Manchester, Manchester M13 9PL, UK (e-mail: Faculty of Economics, University of Lugano, Switzerland E-mail: johan.koskinen@manchester.ac.uk;Social Statistics Discipline Area, University of Manchester, Manchester M13 9PL, UK (e-mail: Faculty of Economics, University of Lugano, Switzerland E-mail: johan.koskinen@manchester.ac.uk;Social Statistics Discipline Area, University of Manchester, Manchester M13 9PL, UK (e-mail: Faculty of Economics, University of Lugano, Switzerland E-mail: johan.koskinen@manchester.ac.uk",Cambridge University Press,,3,1,58,77,2050-1242,2050-1250,copyright,Copyright © Cambridge University Press 2015 ,cambridge,https://www.swissbib.ch/Search/Results?lookfor=nationallicencecambridge101017nws20153,http://sru.swissbib.ch/sru/search/defaultdb?query=+dc.anywhere+exact+NATIONALLICENCEcambridge101017nws20153&operation=searchRetrieve&recordSchema=info%3Asrw%2Fschema%2F1%2Fmarcxml-v1.1-light&maximumRecords=10&startRecord=0&recordPacking=XML&availableDBs=defaultdb&sortKeys=Submit+query,http://sru.swissbib.ch/sru/search/defaultdb?query=+dc.anywhere+exact+NATIONALLICENCEcambridge101017nws20153&operation=searchRetrieve&recordSchema=info%3Asrw%2Fschema%2F1%2Fdc-v1.1-light&maximumRecords=10&startRecord=0&recordPacking=XML&availableDBs=defaultdb&sortKeys=Submit+query,http://sru.swissbib.ch/sru/search/defaultdb?query=+dc.anywhere+exact+NATIONALLICENCEcambridge101017nws20153&operation=searchRetrieve&recordSchema=info%3Asru%2Fschema%2Fjson&maximumRecords=10&startRecord=0&recordPacking=XML&availableDBs=defaultdb&sortKeys=Submit+query,
"Faculty of Communication Sciences, University of Lugano, via Giuseppe Buffi 13, 6904 Lugano, Switzerland Department of Electronics and Information, Politecnico di Milano, piazza Leonardo da Vinci 32, 20133 Milano, Italy; e-mail: marco.colombetti@usi.ch E-mail: marco.colombetti@usi.ch",Marco Colombetti,usi,10.1017/S0269888912000367,./KER/KER28_01/S0269888912000367h.xml,"Norms, organizations, and semantics",Olivier Boissier;Marco Colombetti;Michael Luck;John-Jules Meyer;Axel Polleres,2013,The Knowledge Engineering Review,"Institut Henri Fayol/LSTI, ENS Mines Saint-Etienne, 158 Cours Fauriel, 42023 Saint-Etienne France; e-mail: Olivier.Boissier@emse.fr E-mail: Olivier.Boissier@emse.fr;Faculty of Communication Sciences, University of Lugano, via Giuseppe Buffi 13, 6904 Lugano, Switzerland Department of Electronics and Information, Politecnico di Milano, piazza Leonardo da Vinci 32, 20133 Milano, Italy; e-mail: marco.colombetti@usi.ch E-mail: marco.colombetti@usi.ch;Department of Informatics, King's College London, Strand, London WC2R 2LS, United Kingdom; e-mail: michael.luck@kcl.ac.uk E-mail: michael.luck@kcl.ac.uk;Department of Information and Computing Sciences, Universiteit Utrecht, Buys Ballot Laboratorium, Princetonplein 5, 3508 CC Utrecht, P.O. Box 80.089, 3508 TB Utrecht, The Netherlands; e-mail: J.J.C.Meyer@uu.nl E-mail: J.J.C.Meyer@uu.nl;Siemens AG Österreich, Siemensstrasse 90, 1210 Vienna, Austria; e-mail: axel.polleres@siemens.com E-mail: axel.polleres@siemens.com",Cambridge University Press,,28,1,107,116,0269-8889,1469-8005,copyright,Copyright © Cambridge University Press 2012,cambridge,https://www.swissbib.ch/Search/Results?lookfor=nationallicencecambridge101017S0269888912000367,http://sru.swissbib.ch/sru/search/defaultdb?query=+dc.anywhere+exact+NATIONALLICENCEcambridge101017S0269888912000367&operation=searchRetrieve&recordSchema=info%3Asrw%2Fschema%2F1%2Fmarcxml-v1.1-light&maximumRecords=10&startRecord=0&recordPacking=XML&availableDBs=defaultdb&sortKeys=Submit+query,http://sru.swissbib.ch/sru/search/defaultdb?query=+dc.anywhere+exact+NATIONALLICENCEcambridge101017S0269888912000367&operation=searchRetrieve&recordSchema=info%3Asrw%2Fschema%2F1%2Fdc-v1.1-light&maximumRecords=10&startRecord=0&recordPacking=XML&availableDBs=defaultdb&sortKeys=Submit+query,http://sru.swissbib.ch/sru/search/defaultdb?query=+dc.anywhere+exact+NATIONALLICENCEcambridge101017S0269888912000367&operation=searchRetrieve&recordSchema=info%3Asru%2Fschema%2Fjson&maximumRecords=10&startRecord=0&recordPacking=XML&availableDBs=defaultdb&sortKeys=Submit+query,
"“Brenno Galli” Chair of Law and Economics, Institute of Law (IDUSI) and Institute of Economics (IDEP), Università della Svizzera italiana, Lugano, Ticino, Switzerland E-mail: vatierom@usi.ch",MASSIMILIANO VATIERO,usi,10.1017/S1744137414000198,./JOI/JOI11_02/S1744137414000198h.xml,Costly institutions as substitutes: novelty and limits of the Coasian approach,UGO PAGANO;MASSIMILIANO VATIERO,2015,Journal of Institutional Economics,"Department of Economics and Statistics, University of Siena, Siena, Tuscany, Italy E-mail: pagano@unisi.it;“Brenno Galli” Chair of Law and Economics, Institute of Law (IDUSI) and Institute of Economics (IDEP), Università della Svizzera italiana, Lugano, Ticino, Switzerland E-mail: vatierom@usi.ch",Cambridge University Press,,11,2,265,281,1744-1374,1744-1382,copyright,Copyright © Millennium Economics Ltd 2014 ,cambridge,https://www.swissbib.ch/Search/Results?lookfor=nationallicencecambridge101017S1744137414000198,http://sru.swissbib.ch/sru/search/defaultdb?query=+dc.anywhere+exact+NATIONALLICENCEcambridge101017S1744137414000198&operation=searchRetrieve&recordSchema=info%3Asrw%2Fschema%2F1%2Fmarcxml-v1.1-light&maximumRecords=10&startRecord=0&recordPacking=XML&availableDBs=defaultdb&sortKeys=Submit+query,http://sru.swissbib.ch/sru/search/defaultdb?query=+dc.anywhere+exact+NATIONALLICENCEcambridge101017S1744137414000198&operation=searchRetrieve&recordSchema=info%3Asrw%2Fschema%2F1%2Fdc-v1.1-light&maximumRecords=10&startRecord=0&recordPacking=XML&availableDBs=defaultdb&sortKeys=Submit+query,http://sru.swissbib.ch/sru/search/defaultdb?query=+dc.anywhere+exact+NATIONALLICENCEcambridge101017S1744137414000198&operation=searchRetrieve&recordSchema=info%3Asru%2Fschema%2Fjson&maximumRecords=10&startRecord=0&recordPacking=XML&availableDBs=defaultdb&sortKeys=Submit+query,
University of Lugano,"PhD Antonella Carassa,",usi,10.1515/ip-2012-0015,./j/ip.2012.9.issue-2/ip-2012-0015/ip-2012-0015.xml,"On normative cognition, and why it matters for cognitive pragmatics","PhD Antonella Carassa,;Professor of Artificial Intelligence and Knowledge Engineering Marco Colombetti,",2012,Intercultural Pragmatics,University of Lugano;University of Lugano,De Gruyter Mouton,,9,2,271,280,1612-295X,1613-365X,copyright,©[2012] by Walter de Gruyter Berlin Boston,gruyter,https://www.swissbib.ch/Search/Results?lookfor=nationallicencegruyter101515ip20120015,http://sru.swissbib.ch/sru/search/defaultdb?query=+dc.anywhere+exact+NATIONALLICENCEgruyter101515ip20120015&operation=searchRetrieve&recordSchema=info%3Asrw%2Fschema%2F1%2Fmarcxml-v1.1-light&maximumRecords=10&startRecord=0&recordPacking=XML&availableDBs=defaultdb&sortKeys=Submit+query,http://sru.swissbib.ch/sru/search/defaultdb?query=+dc.anywhere+exact+NATIONALLICENCEgruyter101515ip20120015&operation=searchRetrieve&recordSchema=info%3Asrw%2Fschema%2F1%2Fdc-v1.1-light&maximumRecords=10&startRecord=0&recordPacking=XML&availableDBs=defaultdb&sortKeys=Submit+query,http://sru.swissbib.ch/sru/search/defaultdb?query=+dc.anywhere+exact+NATIONALLICENCEgruyter101515ip20120015&operation=searchRetrieve&recordSchema=info%3Asru%2Fschema%2Fjson&maximumRecords=10&startRecord=0&recordPacking=XML&availableDBs=defaultdb&sortKeys=Submit+query,
