First Matching Affiliation,First Matching Author,Institution Guess,doi,Metadata path+filename,Article Title,Authors,Year,Journal Title,All Affiliations,Publisher,Date of Allowed Open Access Publication,Volume,Issue,Start Page,End Page,ISSN (print),ISSN (electronic),Copyright type,Copyright / Licence,Link to Swissbib,Source,Metadata in MARC XML,Metadata in Dublin Core,Metadata in Json-Marc,Comment
"Istituto Cantonale Batteriosierologico, Laboratory of Microbial Ecology, University of Geneva, Via Ospedale 6, 6904 Lugano, Switzerland E-mail: antonella.demarta@ti.ch",A. Demarta,usi,10.1111/j.1574-6968.1999.tb13474.x,./FEMSLE/femsle172-2/abstracts/172-2-239.xml,Signature region within the 16S rDNA sequences of Aeromonas popoffii,A. Demarta;M. Tonolla;A.-P. Caminada;N. Ruggeri;R. Peduzzi,1999,FEMS Microbiology Letters,"Istituto Cantonale Batteriosierologico, Laboratory of Microbial Ecology, University of Geneva, Via Ospedale 6, 6904 Lugano, Switzerland E-mail: antonella.demarta@ti.ch;Istituto Cantonale Batteriosierologico, Laboratory of Microbial Ecology, University of Geneva, Via Ospedale 6, 6904 Lugano, Switzerland;Istituto Cantonale Batteriosierologico, Laboratory of Microbial Ecology, University of Geneva, Via Ospedale 6, 6904 Lugano, Switzerland;Istituto Cantonale Batteriosierologico, Laboratory of Microbial Ecology, University of Geneva, Via Ospedale 6, 6904 Lugano, Switzerland;Istituto Cantonale Batteriosierologico, Laboratory of Microbial Ecology, University of Geneva, Via Ospedale 6, 6904 Lugano, Switzerland",Blackwell Publishing Ltd,,172,2,239,246,0378-1097,1574-6968,copyright,© 1999 Federation of European Microbiological Societies. Published by Elsevier Science B. V. All rights reserved.,oxford,https://www.swissbib.ch/Search/Results?lookfor=nationallicenceoxford101111j157469681999tb13474x,http://sru.swissbib.ch/sru/search/defaultdb?query=+dc.anywhere+exact+NATIONALLICENCEoxford101111j157469681999tb13474x&operation=searchRetrieve&recordSchema=info%3Asrw%2Fschema%2F1%2Fmarcxml-v1.1-light&maximumRecords=10&startRecord=0&recordPacking=XML&availableDBs=defaultdb&sortKeys=Submit+query,http://sru.swissbib.ch/sru/search/defaultdb?query=+dc.anywhere+exact+NATIONALLICENCEoxford101111j157469681999tb13474x&operation=searchRetrieve&recordSchema=info%3Asrw%2Fschema%2F1%2Fdc-v1.1-light&maximumRecords=10&startRecord=0&recordPacking=XML&availableDBs=defaultdb&sortKeys=Submit+query,http://sru.swissbib.ch/sru/search/defaultdb?query=+dc.anywhere+exact+NATIONALLICENCEoxford101111j157469681999tb13474x&operation=searchRetrieve&recordSchema=info%3Asru%2Fschema%2Fjson&maximumRecords=10&startRecord=0&recordPacking=XML&availableDBs=defaultdb&sortKeys=Submit+query,
"BeChange Research Group, Institute for Public Communication, University of Lugano, Switzerland E-mail: natalie.rangelov@usi.ch",N. Rangelov,usi,10.1093/eurpub/ckv168.058,./eurpub/eurpub25-suppl_3/abstracts/ckv168.058.xml,Assessing children’s eating behavior using a 7-day food log,N. Rangelov;P. Marque-Vidal;L.S. Suggs,2015,The European Journal of Public Health,"BeChange Research Group, Institute for Public Communication, University of Lugano, Switzerland E-mail: natalie.rangelov@usi.ch;Department of Internal Medicine, CHUV, University of Lausanne, Switzerland;BeChange Research Group, Institute for Public Communication, University of Lugano, Switzerland",Oxford University Press,,25,,,,1101-1262,1464-360X,copyright,© The Author 2015. Published by Oxford University Press on behalf of the European Public Health Association. All rights reserved.,oxford,https://www.swissbib.ch/Search/Results?lookfor=nationallicenceoxford101093eurpubckv168058,http://sru.swissbib.ch/sru/search/defaultdb?query=+dc.anywhere+exact+NATIONALLICENCEoxford101093eurpubckv168058&operation=searchRetrieve&recordSchema=info%3Asrw%2Fschema%2F1%2Fmarcxml-v1.1-light&maximumRecords=10&startRecord=0&recordPacking=XML&availableDBs=defaultdb&sortKeys=Submit+query,http://sru.swissbib.ch/sru/search/defaultdb?query=+dc.anywhere+exact+NATIONALLICENCEoxford101093eurpubckv168058&operation=searchRetrieve&recordSchema=info%3Asrw%2Fschema%2F1%2Fdc-v1.1-light&maximumRecords=10&startRecord=0&recordPacking=XML&availableDBs=defaultdb&sortKeys=Submit+query,http://sru.swissbib.ch/sru/search/defaultdb?query=+dc.anywhere+exact+NATIONALLICENCEoxford101093eurpubckv168058&operation=searchRetrieve&recordSchema=info%3Asru%2Fschema%2Fjson&maximumRecords=10&startRecord=0&recordPacking=XML&availableDBs=defaultdb&sortKeys=Submit+query,
"Institute of Communication and Health (ICH), Faculty of Communication Sciences, University of Lugano, Italy",P Schulz,usi,10.1093/eurpub/ckv176.232,./eurpub/eurpub25-suppl_3/abstracts/ckv176.232.xml,Hospital infections and compliance with hygiene standards,F Auxilia;S Castaldi;M Nobile;P Schulz,2015,The European Journal of Public Health,"Department of Biomedical Sciences for Health, University of Milan, Italy;Department of Biomedical Sciences for Health, University of Milan, Italy;PhD program in Public Health, University of Milan, Italy E-mail: nobilemarta5@gmail.com;Institute of Communication and Health (ICH), Faculty of Communication Sciences, University of Lugano, Italy",Oxford University Press,,25,,,,1101-1262,1464-360X,copyright,© The Author 2015. Published by Oxford University Press on behalf of the European Public Health Association. All rights reserved.,oxford,https://www.swissbib.ch/Search/Results?lookfor=nationallicenceoxford101093eurpubckv176232,http://sru.swissbib.ch/sru/search/defaultdb?query=+dc.anywhere+exact+NATIONALLICENCEoxford101093eurpubckv176232&operation=searchRetrieve&recordSchema=info%3Asrw%2Fschema%2F1%2Fmarcxml-v1.1-light&maximumRecords=10&startRecord=0&recordPacking=XML&availableDBs=defaultdb&sortKeys=Submit+query,http://sru.swissbib.ch/sru/search/defaultdb?query=+dc.anywhere+exact+NATIONALLICENCEoxford101093eurpubckv176232&operation=searchRetrieve&recordSchema=info%3Asrw%2Fschema%2F1%2Fdc-v1.1-light&maximumRecords=10&startRecord=0&recordPacking=XML&availableDBs=defaultdb&sortKeys=Submit+query,http://sru.swissbib.ch/sru/search/defaultdb?query=+dc.anywhere+exact+NATIONALLICENCEoxford101093eurpubckv176232&operation=searchRetrieve&recordSchema=info%3Asru%2Fschema%2Fjson&maximumRecords=10&startRecord=0&recordPacking=XML&availableDBs=defaultdb&sortKeys=Submit+query,
"2 Institute of Communication & Health, University of Lugano, 6900 Lugano, Switzerland",Sarah Mantwill,usi,10.1093/eurpub/ckt202,./eurpub/eurpub24-6/abstracts/ckt202.xml,The relationship between functional health literacy and the use of the health system by diabetics in Switzerland,Jasmin Franzen;Sarah Mantwill;Roland Rapold;Peter J. Schulz,2014,The European Journal of Public Health,"1 Helsana Insurance Company Ltd, Zurich, Switzerland E-mail: jasmin.franzen@helsana.ch;2 Institute of Communication & Health, University of Lugano, 6900 Lugano, Switzerland;1 Helsana Insurance Company Ltd, Zurich, Switzerland;2 Institute of Communication & Health, University of Lugano, 6900 Lugano, Switzerland",Oxford University Press,,24,6,997,1003,1101-1262,1464-360X,creative-commons,"This is an Open Access article distributed under the terms of the Creative Commons Attribution License (http://creativecommons.org/licenses/by/3.0/), which permits unrestricted reuse, distribution, and reproduction in any medium, provided the original work is properly cited.",oxford,https://www.swissbib.ch/Search/Results?lookfor=nationallicenceoxford101093eurpubckt202,http://sru.swissbib.ch/sru/search/defaultdb?query=+dc.anywhere+exact+NATIONALLICENCEoxford101093eurpubckt202&operation=searchRetrieve&recordSchema=info%3Asrw%2Fschema%2F1%2Fmarcxml-v1.1-light&maximumRecords=10&startRecord=0&recordPacking=XML&availableDBs=defaultdb&sortKeys=Submit+query,http://sru.swissbib.ch/sru/search/defaultdb?query=+dc.anywhere+exact+NATIONALLICENCEoxford101093eurpubckt202&operation=searchRetrieve&recordSchema=info%3Asrw%2Fschema%2F1%2Fdc-v1.1-light&maximumRecords=10&startRecord=0&recordPacking=XML&availableDBs=defaultdb&sortKeys=Submit+query,http://sru.swissbib.ch/sru/search/defaultdb?query=+dc.anywhere+exact+NATIONALLICENCEoxford101093eurpubckt202&operation=searchRetrieve&recordSchema=info%3Asru%2Fschema%2Fjson&maximumRecords=10&startRecord=0&recordPacking=XML&availableDBs=defaultdb&sortKeys=Submit+query,
"Affiliations of authors: Oncology Institute of Southern Switzerland, Ospedale Italiano, Viganello, Lugano, Switzerland (OP); Swiss Group for Clinical Cancer Research (SAKK), Bern, Switzerland (OP); Department of Oncology and Radiotherapy, Medical University of Gdańsk, Gdańsk, Poland (ES); Department of Surgery, Emory University School of Medicine, Atlanta, GA (WW); Medical Senology Research Unit, European Institute of Oncology, Milan, Italy (MC); Department of Medical Oncology, University Clinic Golnik, Golnik, Slovenia (TC); European Breast Cancer Coalition, Nicosia, Cyprus (SK); European School of Oncology, Milan, Italy (AC); Maugeri Foundation Breast Unit, Pavia, Italy (AC); Department of Medical Oncology, Dana-Farber Cancer Institute, Brigham and Women's Hospital, Harvard Medical School, Boston, MA (EPW); Department of Medical Oncology, Jules Bordet Institute, Brussels, Belgium (FC)",Olivia Pagani,usi,10.1093/jnci/djq029,./JNCI/jnci102-7/abstracts/djq029.xml,International Guidelines for Management of Metastatic Breast Cancer: Can Metastatic Breast Cancer Be Cured?,Olivia Pagani;Elżbieta Senkus;William Wood;Marco Colleoni;Tanja Cufer;Stella Kyriakides;Alberto Costa;Eric P. Winer;Fatima Cardoso,2010,Journal of the National Cancer Institute,"Affiliations of authors: Oncology Institute of Southern Switzerland, Ospedale Italiano, Viganello, Lugano, Switzerland (OP); Swiss Group for Clinical Cancer Research (SAKK), Bern, Switzerland (OP); Department of Oncology and Radiotherapy, Medical University of Gdańsk, Gdańsk, Poland (ES); Department of Surgery, Emory University School of Medicine, Atlanta, GA (WW); Medical Senology Research Unit, European Institute of Oncology, Milan, Italy (MC); Department of Medical Oncology, University Clinic Golnik, Golnik, Slovenia (TC); European Breast Cancer Coalition, Nicosia, Cyprus (SK); European School of Oncology, Milan, Italy (AC); Maugeri Foundation Breast Unit, Pavia, Italy (AC); Department of Medical Oncology, Dana-Farber Cancer Institute, Brigham and Women's Hospital, Harvard Medical School, Boston, MA (EPW); Department of Medical Oncology, Jules Bordet Institute, Brussels, Belgium (FC);Affiliations of authors: Oncology Institute of Southern Switzerland, Ospedale Italiano, Viganello, Lugano, Switzerland (OP); Swiss Group for Clinical Cancer Research (SAKK), Bern, Switzerland (OP); Department of Oncology and Radiotherapy, Medical University of Gdańsk, Gdańsk, Poland (ES); Department of Surgery, Emory University School of Medicine, Atlanta, GA (WW); Medical Senology Research Unit, European Institute of Oncology, Milan, Italy (MC); Department of Medical Oncology, University Clinic Golnik, Golnik, Slovenia (TC); European Breast Cancer Coalition, Nicosia, Cyprus (SK); European School of Oncology, Milan, Italy (AC); Maugeri Foundation Breast Unit, Pavia, Italy (AC); Department of Medical Oncology, Dana-Farber Cancer Institute, Brigham and Women's Hospital, Harvard Medical School, Boston, MA (EPW); Department of Medical Oncology, Jules Bordet Institute, Brussels, Belgium (FC);Affiliations of authors: Oncology Institute of Southern Switzerland, Ospedale Italiano, Viganello, Lugano, Switzerland (OP); Swiss Group for Clinical Cancer Research (SAKK), Bern, Switzerland (OP); Department of Oncology and Radiotherapy, Medical University of Gdańsk, Gdańsk, Poland (ES); Department of Surgery, Emory University School of Medicine, Atlanta, GA (WW); Medical Senology Research Unit, European Institute of Oncology, Milan, Italy (MC); Department of Medical Oncology, University Clinic Golnik, Golnik, Slovenia (TC); European Breast Cancer Coalition, Nicosia, Cyprus (SK); European School of Oncology, Milan, Italy (AC); Maugeri Foundation Breast Unit, Pavia, Italy (AC); Department of Medical Oncology, Dana-Farber Cancer Institute, Brigham and Women's Hospital, Harvard Medical School, Boston, MA (EPW); Department of Medical Oncology, Jules Bordet Institute, Brussels, Belgium (FC);Affiliations of authors: Oncology Institute of Southern Switzerland, Ospedale Italiano, Viganello, Lugano, Switzerland (OP); Swiss Group for Clinical Cancer Research (SAKK), Bern, Switzerland (OP); Department of Oncology and Radiotherapy, Medical University of Gdańsk, Gdańsk, Poland (ES); Department of Surgery, Emory University School of Medicine, Atlanta, GA (WW); Medical Senology Research Unit, European Institute of Oncology, Milan, Italy (MC); Department of Medical Oncology, University Clinic Golnik, Golnik, Slovenia (TC); European Breast Cancer Coalition, Nicosia, Cyprus (SK); European School of Oncology, Milan, Italy (AC); Maugeri Foundation Breast Unit, Pavia, Italy (AC); Department of Medical Oncology, Dana-Farber Cancer Institute, Brigham and Women's Hospital, Harvard Medical School, Boston, MA (EPW); Department of Medical Oncology, Jules Bordet Institute, Brussels, Belgium (FC);Affiliations of authors: Oncology Institute of Southern Switzerland, Ospedale Italiano, Viganello, Lugano, Switzerland (OP); Swiss Group for Clinical Cancer Research (SAKK), Bern, Switzerland (OP); Department of Oncology and Radiotherapy, Medical University of Gdańsk, Gdańsk, Poland (ES); Department of Surgery, Emory University School of Medicine, Atlanta, GA (WW); Medical Senology Research Unit, European Institute of Oncology, Milan, Italy (MC); Department of Medical Oncology, University Clinic Golnik, Golnik, Slovenia (TC); European Breast Cancer Coalition, Nicosia, Cyprus (SK); European School of Oncology, Milan, Italy (AC); Maugeri Foundation Breast Unit, Pavia, Italy (AC); Department of Medical Oncology, Dana-Farber Cancer Institute, Brigham and Women's Hospital, Harvard Medical School, Boston, MA (EPW); Department of Medical Oncology, Jules Bordet Institute, Brussels, Belgium (FC);Affiliations of authors: Oncology Institute of Southern Switzerland, Ospedale Italiano, Viganello, Lugano, Switzerland (OP); Swiss Group for Clinical Cancer Research (SAKK), Bern, Switzerland (OP); Department of Oncology and Radiotherapy, Medical University of Gdańsk, Gdańsk, Poland (ES); Department of Surgery, Emory University School of Medicine, Atlanta, GA (WW); Medical Senology Research Unit, European Institute of Oncology, Milan, Italy (MC); Department of Medical Oncology, University Clinic Golnik, Golnik, Slovenia (TC); European Breast Cancer Coalition, Nicosia, Cyprus (SK); European School of Oncology, Milan, Italy (AC); Maugeri Foundation Breast Unit, Pavia, Italy (AC); Department of Medical Oncology, Dana-Farber Cancer Institute, Brigham and Women's Hospital, Harvard Medical School, Boston, MA (EPW); Department of Medical Oncology, Jules Bordet Institute, Brussels, Belgium (FC);Affiliations of authors: Oncology Institute of Southern Switzerland, Ospedale Italiano, Viganello, Lugano, Switzerland (OP); Swiss Group for Clinical Cancer Research (SAKK), Bern, Switzerland (OP); Department of Oncology and Radiotherapy, Medical University of Gdańsk, Gdańsk, Poland (ES); Department of Surgery, Emory University School of Medicine, Atlanta, GA (WW); Medical Senology Research Unit, European Institute of Oncology, Milan, Italy (MC); Department of Medical Oncology, University Clinic Golnik, Golnik, Slovenia (TC); European Breast Cancer Coalition, Nicosia, Cyprus (SK); European School of Oncology, Milan, Italy (AC); Maugeri Foundation Breast Unit, Pavia, Italy (AC); Department of Medical Oncology, Dana-Farber Cancer Institute, Brigham and Women's Hospital, Harvard Medical School, Boston, MA (EPW); Department of Medical Oncology, Jules Bordet Institute, Brussels, Belgium (FC);Affiliations of authors: Oncology Institute of Southern Switzerland, Ospedale Italiano, Viganello, Lugano, Switzerland (OP); Swiss Group for Clinical Cancer Research (SAKK), Bern, Switzerland (OP); Department of Oncology and Radiotherapy, Medical University of Gdańsk, Gdańsk, Poland (ES); Department of Surgery, Emory University School of Medicine, Atlanta, GA (WW); Medical Senology Research Unit, European Institute of Oncology, Milan, Italy (MC); Department of Medical Oncology, University Clinic Golnik, Golnik, Slovenia (TC); European Breast Cancer Coalition, Nicosia, Cyprus (SK); European School of Oncology, Milan, Italy (AC); Maugeri Foundation Breast Unit, Pavia, Italy (AC); Department of Medical Oncology, Dana-Farber Cancer Institute, Brigham and Women's Hospital, Harvard Medical School, Boston, MA (EPW); Department of Medical Oncology, Jules Bordet Institute, Brussels, Belgium (FC);Affiliations of authors: Oncology Institute of Southern Switzerland, Ospedale Italiano, Viganello, Lugano, Switzerland (OP); Swiss Group for Clinical Cancer Research (SAKK), Bern, Switzerland (OP); Department of Oncology and Radiotherapy, Medical University of Gdańsk, Gdańsk, Poland (ES); Department of Surgery, Emory University School of Medicine, Atlanta, GA (WW); Medical Senology Research Unit, European Institute of Oncology, Milan, Italy (MC); Department of Medical Oncology, University Clinic Golnik, Golnik, Slovenia (TC); European Breast Cancer Coalition, Nicosia, Cyprus (SK); European School of Oncology, Milan, Italy (AC); Maugeri Foundation Breast Unit, Pavia, Italy (AC); Department of Medical Oncology, Dana-Farber Cancer Institute, Brigham and Women's Hospital, Harvard Medical School, Boston, MA (EPW); Department of Medical Oncology, Jules Bordet Institute, Brussels, Belgium (FC) E-mail: fatima.cardoso@bordet.be",Oxford University Press,,102,7,456,463,0027-8874,1460-2105,open-access,"This is an Open Access article distributed under the terms of the Creative Commons Attribution Non-Commercial License (http://creativecommons.org/licenses/by-nc/2.5), which permits unrestricted non-commercial use, distribution, and reproduction in any medium, provided the original work is properly cited.",oxford,https://www.swissbib.ch/Search/Results?lookfor=nationallicenceoxford101093jncidjq029,http://sru.swissbib.ch/sru/search/defaultdb?query=+dc.anywhere+exact+NATIONALLICENCEoxford101093jncidjq029&operation=searchRetrieve&recordSchema=info%3Asrw%2Fschema%2F1%2Fmarcxml-v1.1-light&maximumRecords=10&startRecord=0&recordPacking=XML&availableDBs=defaultdb&sortKeys=Submit+query,http://sru.swissbib.ch/sru/search/defaultdb?query=+dc.anywhere+exact+NATIONALLICENCEoxford101093jncidjq029&operation=searchRetrieve&recordSchema=info%3Asrw%2Fschema%2F1%2Fdc-v1.1-light&maximumRecords=10&startRecord=0&recordPacking=XML&availableDBs=defaultdb&sortKeys=Submit+query,http://sru.swissbib.ch/sru/search/defaultdb?query=+dc.anywhere+exact+NATIONALLICENCEoxford101093jncidjq029&operation=searchRetrieve&recordSchema=info%3Asru%2Fschema%2Fjson&maximumRecords=10&startRecord=0&recordPacking=XML&availableDBs=defaultdb&sortKeys=Submit+query,
"Affiliations of authors: Department of Medical Oncology, Medical Oncology & Translational Research Unit, Jules Bordet Institute, Brussels, Belgium (FC, PLB); Department of Medical Oncology, Dana-Farber Cancer Institute, Brigham and Women’s Hospital, Harvard Medical School, Boston, MA (EPW); Department of Medical Oncology, Oncology Institute of Southern Switzerland, Ospedale Italiano, Viganello, Lugano (OP); Switzerland and Swiss Group for Clinical Cancer Research, Bern, Switzerland (OP); Department of Oncology and Radiotherapy, Medical University of Gdańsk, Gdanńsk, Poland (ES-K); Department of Psycho-Oncology, Brighton & Sussex Medical School, University of Sussex, UK (LJF); European Breast Cancer Coalition, Nicosia, Cyprus (SK); European School of Oncology, Milan, Italy (AC); Maugeri Foundation Breast Unit, Pavia, Italy (AC); Department of Medical Oncology, University Clinic Golnik, Golnik, Slovenia (TC); Department of Medical Oncology, Loyola University Chicago Stritch School of Medicine, Cardinal Bernardin Cancer Center, Maywood, IL (KSA)",on behalf of the ESO-MBC Task Force,usi,10.1093/jnci/djp235,./JNCI/jnci101-17/abstracts/djp235.xml,International Guidelines for Management of Metastatic Breast Cancer: Combination vs Sequential Single-Agent Chemotherapy,on behalf of the ESO-MBC Task Force;Fatima Cardoso;Philippe L. Bedard;Eric P. Winer;Olivia Pagani;Elzbieta Senkus-Konefka;Lesley J. Fallowfield;Stella Kyriakides;Alberto Costa;Tanja Cufer;Kathy S. Albain,2009,Journal of the National Cancer Institute,"Affiliations of authors: Department of Medical Oncology, Medical Oncology & Translational Research Unit, Jules Bordet Institute, Brussels, Belgium (FC, PLB); Department of Medical Oncology, Dana-Farber Cancer Institute, Brigham and Women’s Hospital, Harvard Medical School, Boston, MA (EPW); Department of Medical Oncology, Oncology Institute of Southern Switzerland, Ospedale Italiano, Viganello, Lugano (OP); Switzerland and Swiss Group for Clinical Cancer Research, Bern, Switzerland (OP); Department of Oncology and Radiotherapy, Medical University of Gdańsk, Gdanńsk, Poland (ES-K); Department of Psycho-Oncology, Brighton & Sussex Medical School, University of Sussex, UK (LJF); European Breast Cancer Coalition, Nicosia, Cyprus (SK); European School of Oncology, Milan, Italy (AC); Maugeri Foundation Breast Unit, Pavia, Italy (AC); Department of Medical Oncology, University Clinic Golnik, Golnik, Slovenia (TC); Department of Medical Oncology, Loyola University Chicago Stritch School of Medicine, Cardinal Bernardin Cancer Center, Maywood, IL (KSA);Correspondence to: Fatima Cardoso, MD, Medical Oncology & Translational Research Unit, Jules Bordet Institute, Boulevard de Waterloo 125, 1000 Brussels, Belgium (e-mail: fatima.cardoso@bordet.be).",Oxford University Press,,101,17,1174,1181,0027-8874,1460-2105,open-access,"This is an Open Access article distributed under the terms of the Creative Commons Attribution Non-Commercial License (http://creativecommons.org/licenses/by-nc/2.0/uk/), which permits unrestricted non-commercial use, distribution, and reproduction in any medium, provided the original work is properly cited.",oxford,https://www.swissbib.ch/Search/Results?lookfor=nationallicenceoxford101093jncidjp235,http://sru.swissbib.ch/sru/search/defaultdb?query=+dc.anywhere+exact+NATIONALLICENCEoxford101093jncidjp235&operation=searchRetrieve&recordSchema=info%3Asrw%2Fschema%2F1%2Fmarcxml-v1.1-light&maximumRecords=10&startRecord=0&recordPacking=XML&availableDBs=defaultdb&sortKeys=Submit+query,http://sru.swissbib.ch/sru/search/defaultdb?query=+dc.anywhere+exact+NATIONALLICENCEoxford101093jncidjp235&operation=searchRetrieve&recordSchema=info%3Asrw%2Fschema%2F1%2Fdc-v1.1-light&maximumRecords=10&startRecord=0&recordPacking=XML&availableDBs=defaultdb&sortKeys=Submit+query,http://sru.swissbib.ch/sru/search/defaultdb?query=+dc.anywhere+exact+NATIONALLICENCEoxford101093jncidjp235&operation=searchRetrieve&recordSchema=info%3Asru%2Fschema%2Fjson&maximumRecords=10&startRecord=0&recordPacking=XML&availableDBs=defaultdb&sortKeys=Submit+query,
