"Institute of Communication and Health, Università della Svizzera italiana, Lugano, Switzerland E-mail: simone.keller@lu.unisi.ch",Simone K. Keller,usi,10.1093/eurpub/ckq065,https://doi.org/10.1093/eurpub/ckq065,./eurpub/eurpub21-3/abstracts/ckq065.xml,Distorted food pyramid in kids programmes: A content analysis of television advertising watched in Switzerland,,,2011,The European Journal of Public Health,,Oxford University Press,,21,3,300,305,1101-1262,1464-360X,copyright,© The Author 2010. Published by Oxford University Press on behalf of the European Public Health Association. All rights reserved.,oxford,https://www.swissbib.ch/Search/Results?lookfor=nationallicenceoxford101093eurpubckq065,http://sru.swissbib.ch/sru/search/defaultdb?query=+dc.anywhere+exact+NATIONALLICENCEoxford101093eurpubckq065&operation=searchRetrieve&recordSchema=info%3Asrw%2Fschema%2F1%2Fmarcxml-v1.1-light&maximumRecords=10&startRecord=0&recordPacking=XML&availableDBs=defaultdb&sortKeys=Submit+query,http://sru.swissbib.ch/sru/search/defaultdb?query=+dc.anywhere+exact+NATIONALLICENCEoxford101093eurpubckq065&operation=searchRetrieve&recordSchema=info%3Asrw%2Fschema%2F1%2Fdc-v1.1-light&maximumRecords=10&startRecord=0&recordPacking=XML&availableDBs=defaultdb&sortKeys=Submit+query,http://sru.swissbib.ch/sru/search/defaultdb?query=+dc.anywhere+exact+NATIONALLICENCEoxford101093eurpubckq065&operation=searchRetrieve&recordSchema=info%3Asru%2Fschema%2Fjson&maximumRecords=10&startRecord=0&recordPacking=XML&availableDBs=defaultdb&sortKeys=Submit+query,
"Department of Infectious Diseases, Inselspital, Bern University Hospital and University of Bern Departments of Internal Medicine and Infectious Disease, Clinica Luganese, Lugano",Christian Garzoni,usi,10.1093/cid/civ681,https://doi.org/10.1093/cid/civ681,./cid/cid61-12/abstracts/civ681.xml,Reply to Cunha et al,,,2015,Clinical Infectious Diseases,,Oxford University Press,2018-12-15,61,12,1894,1895,1058-4838,1537-6591,copyright,"© The Author 2015. Published by Oxford University Press on behalf of the Infectious Diseases Society of America. All rights reserved. For Permissions, please e-mail: journals.permissions@oup.com.",oxford,https://www.swissbib.ch/Search/Results?lookfor=nationallicenceoxford101093cidciv681,http://sru.swissbib.ch/sru/search/defaultdb?query=+dc.anywhere+exact+NATIONALLICENCEoxford101093cidciv681&operation=searchRetrieve&recordSchema=info%3Asrw%2Fschema%2F1%2Fmarcxml-v1.1-light&maximumRecords=10&startRecord=0&recordPacking=XML&availableDBs=defaultdb&sortKeys=Submit+query,http://sru.swissbib.ch/sru/search/defaultdb?query=+dc.anywhere+exact+NATIONALLICENCEoxford101093cidciv681&operation=searchRetrieve&recordSchema=info%3Asrw%2Fschema%2F1%2Fdc-v1.1-light&maximumRecords=10&startRecord=0&recordPacking=XML&availableDBs=defaultdb&sortKeys=Submit+query,http://sru.swissbib.ch/sru/search/defaultdb?query=+dc.anywhere+exact+NATIONALLICENCEoxford101093cidciv681&operation=searchRetrieve&recordSchema=info%3Asru%2Fschema%2Fjson&maximumRecords=10&startRecord=0&recordPacking=XML&availableDBs=defaultdb&sortKeys=Submit+query,
"Ospedale Italiano, Viganello. Ospedale S. Giovanni, Bellinzona. Medizinische Universitätspoliklinik , Bern, Switzerland. Address correspondance and reprint requests to Prof. Dr. med. C. Beretta-Piccoli, Ospedale Italiano di Lugano, 6962 Viganello, Switzerland.",Carlo Beretta-Piccoli,usi,10.1093/ajh/4.4.348,https://doi.org/10.1093/ajh/4.4.348,./ajh/ajh4/abstracts/4-4_Pt_1-348.xml,Cardiovascular Pressor Reactivity After Chronic Converting Enzyme Inhibition,,,1991,American Journal of Hypertension,,Oxford University Press,,4,4_Pt_1,348,355,0895-7061,1941-7225,copyright,"© 1991 by the American Journal of Hypertension, Inc.",oxford,https://www.swissbib.ch/Search/Results?lookfor=nationallicenceoxford101093ajh44348,http://sru.swissbib.ch/sru/search/defaultdb?query=+dc.anywhere+exact+NATIONALLICENCEoxford101093ajh44348&operation=searchRetrieve&recordSchema=info%3Asrw%2Fschema%2F1%2Fmarcxml-v1.1-light&maximumRecords=10&startRecord=0&recordPacking=XML&availableDBs=defaultdb&sortKeys=Submit+query,http://sru.swissbib.ch/sru/search/defaultdb?query=+dc.anywhere+exact+NATIONALLICENCEoxford101093ajh44348&operation=searchRetrieve&recordSchema=info%3Asrw%2Fschema%2F1%2Fdc-v1.1-light&maximumRecords=10&startRecord=0&recordPacking=XML&availableDBs=defaultdb&sortKeys=Submit+query,http://sru.swissbib.ch/sru/search/defaultdb?query=+dc.anywhere+exact+NATIONALLICENCEoxford101093ajh44348&operation=searchRetrieve&recordSchema=info%3Asru%2Fschema%2Fjson&maximumRecords=10&startRecord=0&recordPacking=XML&availableDBs=defaultdb&sortKeys=Submit+query,
"Department of Medicine III, University of Munich, Germany *Correspondence to: ESMO Guidelines Working Group, ESMO Head Office, Via L. Taddei 4, CH-6962 Viganello-Lugano, Switzerland;",M. Dreyling,usi,10.1093/annonc/mds228,https://doi.org/10.1093/annonc/mds228,./ANNONC/annonc23-suppl_7/abstracts/mds228.xml,"Chronic myeloid leukemia: ESMO Clinical Practice Guidelines for diagnosis, treatment and follow-up †",,,2012,Annals of Oncology,,Oxford University Press,,23,,vii72,vii77,0923-7534,1569-8041,copyright,"© The Author 2012. Published by Oxford University Press on behalf of the European Society for Medical Oncology. All rights reserved. For permissions, please email: journals.permissions@oup.com",oxford,https://www.swissbib.ch/Search/Results?lookfor=nationallicenceoxford101093annoncmds228,http://sru.swissbib.ch/sru/search/defaultdb?query=+dc.anywhere+exact+NATIONALLICENCEoxford101093annoncmds228&operation=searchRetrieve&recordSchema=info%3Asrw%2Fschema%2F1%2Fmarcxml-v1.1-light&maximumRecords=10&startRecord=0&recordPacking=XML&availableDBs=defaultdb&sortKeys=Submit+query,http://sru.swissbib.ch/sru/search/defaultdb?query=+dc.anywhere+exact+NATIONALLICENCEoxford101093annoncmds228&operation=searchRetrieve&recordSchema=info%3Asrw%2Fschema%2F1%2Fdc-v1.1-light&maximumRecords=10&startRecord=0&recordPacking=XML&availableDBs=defaultdb&sortKeys=Submit+query,http://sru.swissbib.ch/sru/search/defaultdb?query=+dc.anywhere+exact+NATIONALLICENCEoxford101093annoncmds228&operation=searchRetrieve&recordSchema=info%3Asru%2Fschema%2Fjson&maximumRecords=10&startRecord=0&recordPacking=XML&availableDBs=defaultdb&sortKeys=Submit+query,
"Department of Medical Oncology, West German Cancer Centre, University Hospital, University Duisburg-Essen, Ruhrlandklinik, Essen, Germany Correspondence to: ESMO Guidelines Working Group, ESMO Head Office, Via L. Taddei 4, CH-6962 Viganello-Lugano, Switzerland.",W. E. E. Eberhardt,usi,10.1093/annonc/mdv187,https://doi.org/10.1093/annonc/mdv187,./ANNONC/annonc26-8/abstracts/mdv187.xml,2nd ESMO Consensus Conference in Lung Cancer: locally advanced stage III non-small-cell lung cancer,,,2015,Annals of Oncology,,Oxford University Press,2018-08-01,26,8,1573,1588,0923-7534,1569-8041,copyright,"© The Author 2015. Published by Oxford University Press on behalf of the European Society for Medical Oncology. All rights reserved. For permissions, please email: journals.permissions@oup.com",oxford,https://www.swissbib.ch/Search/Results?lookfor=nationallicenceoxford101093annoncmdv187,http://sru.swissbib.ch/sru/search/defaultdb?query=+dc.anywhere+exact+NATIONALLICENCEoxford101093annoncmdv187&operation=searchRetrieve&recordSchema=info%3Asrw%2Fschema%2F1%2Fmarcxml-v1.1-light&maximumRecords=10&startRecord=0&recordPacking=XML&availableDBs=defaultdb&sortKeys=Submit+query,http://sru.swissbib.ch/sru/search/defaultdb?query=+dc.anywhere+exact+NATIONALLICENCEoxford101093annoncmdv187&operation=searchRetrieve&recordSchema=info%3Asrw%2Fschema%2F1%2Fdc-v1.1-light&maximumRecords=10&startRecord=0&recordPacking=XML&availableDBs=defaultdb&sortKeys=Submit+query,http://sru.swissbib.ch/sru/search/defaultdb?query=+dc.anywhere+exact+NATIONALLICENCEoxford101093annoncmdv187&operation=searchRetrieve&recordSchema=info%3Asru%2Fschema%2Fjson&maximumRecords=10&startRecord=0&recordPacking=XML&availableDBs=defaultdb&sortKeys=Submit+query,
"Division of Infectious Diseases and Hospital Epidemiology, University Hospital Zurich, University of Zurich, Zurich, Switzerland, 2Department of Infectious Diseases, Bern University Hospital and University of Bern, Bern, Switzerland, 3Institute of Medical Virology, University of Zurich, Zurich, Switzerland, 4Laboratory of Virology, University Hospital Geneva, Geneva, Switzerland, 5Division of Immunology and Allergy, University Hospital Lausanne, University of Lausanne, Lausanne, Switzerland, 6Department Biomedicine, University of Basel, Basel, Switzerland, 7Division of Infectious Diseases, Geneva University Hospital, Geneva, 8Division of Immunology, University Hospital Lausanne, Lausanne, Switzerland, 9Division of Infectious Diseases and Hospital Epidemiology, University Hospital Basel, Basel, 10Division of Infectious Diseases, Cantonal Hospital St Gallen, St Gallen, Switzerland and 11Division of Infectious Diseases, Regional Hospital Lugano, Lugano, Switzerland *Corresponding author. Division of Infectious Diseases and Hospital Epidemiology, University Hospital Zurich, University of Zurich, Rämistr. 100, CH-8091 Zurich, Switzerland.",Roger D Kouyos,usi,10.1093/ije/dyt276,https://doi.org/10.1093/ije/dyt276,./IJE/ije43-3/abstracts/dyt276.xml,Clustering of HCV coinfections on HIV phylogeny indicates domestic and sexual transmission of HCV,,,2014,International Journal of Epidemiology,,Oxford University Press,,43,3,887,896,0300-5771,1464-3685,copyright,© The Author 2014; all rights reserved. Published by Oxford University Press on behalf of the International Epidemiological Association,oxford,https://www.swissbib.ch/Search/Results?lookfor=nationallicenceoxford101093ijedyt276,http://sru.swissbib.ch/sru/search/defaultdb?query=+dc.anywhere+exact+NATIONALLICENCEoxford101093ijedyt276&operation=searchRetrieve&recordSchema=info%3Asrw%2Fschema%2F1%2Fmarcxml-v1.1-light&maximumRecords=10&startRecord=0&recordPacking=XML&availableDBs=defaultdb&sortKeys=Submit+query,http://sru.swissbib.ch/sru/search/defaultdb?query=+dc.anywhere+exact+NATIONALLICENCEoxford101093ijedyt276&operation=searchRetrieve&recordSchema=info%3Asrw%2Fschema%2F1%2Fdc-v1.1-light&maximumRecords=10&startRecord=0&recordPacking=XML&availableDBs=defaultdb&sortKeys=Submit+query,http://sru.swissbib.ch/sru/search/defaultdb?query=+dc.anywhere+exact+NATIONALLICENCEoxford101093ijedyt276&operation=searchRetrieve&recordSchema=info%3Asru%2Fschema%2Fjson&maximumRecords=10&startRecord=0&recordPacking=XML&availableDBs=defaultdb&sortKeys=Submit+query,
University of Lugano E-mail: stefano.peluso@usi.ch,Stefano Peluso,usi,10.1093/jjfinec/nbu017,https://doi.org/10.1093/jjfinec/nbu017,./jfinec/jfinec13/abstracts/nbu017.xml,A Bayesian High-Frequency Estimator of the Multivariate Covariance of Noisy and Asynchronous Returns,,,2015,Journal of Financial Econometrics,,Oxford University Press,2018-06-01,13,3,665,697,1479-8409,1479-8417,copyright,"© The Author, 2014. Published by Oxford University Press. All rights reserved. For Permissions, please email: journals.permissions@oup.com",oxford,https://www.swissbib.ch/Search/Results?lookfor=nationallicenceoxford101093jjfinecnbu017,http://sru.swissbib.ch/sru/search/defaultdb?query=+dc.anywhere+exact+NATIONALLICENCEoxford101093jjfinecnbu017&operation=searchRetrieve&recordSchema=info%3Asrw%2Fschema%2F1%2Fmarcxml-v1.1-light&maximumRecords=10&startRecord=0&recordPacking=XML&availableDBs=defaultdb&sortKeys=Submit+query,http://sru.swissbib.ch/sru/search/defaultdb?query=+dc.anywhere+exact+NATIONALLICENCEoxford101093jjfinecnbu017&operation=searchRetrieve&recordSchema=info%3Asrw%2Fschema%2F1%2Fdc-v1.1-light&maximumRecords=10&startRecord=0&recordPacking=XML&availableDBs=defaultdb&sortKeys=Submit+query,http://sru.swissbib.ch/sru/search/defaultdb?query=+dc.anywhere+exact+NATIONALLICENCEoxford101093jjfinecnbu017&operation=searchRetrieve&recordSchema=info%3Asru%2Fschema%2Fjson&maximumRecords=10&startRecord=0&recordPacking=XML&availableDBs=defaultdb&sortKeys=Submit+query,
"Laboratory of Molecular and Cellular Cardiology, Departments of Cardiology and Heart Surgery, Fondazione Cardiocentro Ticino, Via Tesserete 48, CH-6900 Lugano, Switzerland Department of Cardiology, Centre Hospitalier Universitaire Vaudois (CHUV), Lausanne, Switzerland E-mail: lucio.barile@cardiocentro.org",Giuseppe Vassalli,usi,10.1093/cvr/cvu167,https://doi.org/10.1093/cvr/cvu167,./cardiovascres/cardiovascres103-4/abstracts/cvu167.xml,Extracellular vesicles from human cardiac progenitor cells inhibit cardiomyocyte apoptosis and improve cardiac function after myocardial infarction,,,2014,Cardiovascular Research,,Oxford University Press,2017-09-01,103,4,530,541,0008-6363,1755-3245,copyright,Published on behalf of the European Society of Cardiology. All rights reserved. © The Author 2014. For permissions please email: journals.permissions@oup.com.,oxford,https://www.swissbib.ch/Search/Results?lookfor=nationallicenceoxford101093cvrcvu167,http://sru.swissbib.ch/sru/search/defaultdb?query=+dc.anywhere+exact+NATIONALLICENCEoxford101093cvrcvu167&operation=searchRetrieve&recordSchema=info%3Asrw%2Fschema%2F1%2Fmarcxml-v1.1-light&maximumRecords=10&startRecord=0&recordPacking=XML&availableDBs=defaultdb&sortKeys=Submit+query,http://sru.swissbib.ch/sru/search/defaultdb?query=+dc.anywhere+exact+NATIONALLICENCEoxford101093cvrcvu167&operation=searchRetrieve&recordSchema=info%3Asrw%2Fschema%2F1%2Fdc-v1.1-light&maximumRecords=10&startRecord=0&recordPacking=XML&availableDBs=defaultdb&sortKeys=Submit+query,http://sru.swissbib.ch/sru/search/defaultdb?query=+dc.anywhere+exact+NATIONALLICENCEoxford101093cvrcvu167&operation=searchRetrieve&recordSchema=info%3Asru%2Fschema%2Fjson&maximumRecords=10&startRecord=0&recordPacking=XML&availableDBs=defaultdb&sortKeys=Submit+query,
"Centre for Organizational Research, University of Lugano, Switzerland E-mail: blepori@usi.ch",Benedetto Lepori,usi,10.1093/reseval/rvs021,https://doi.org/10.1093/reseval/rvs021,./REV/rev21-4/abstracts/rvs021.xml,Evaluating the functioning and impacts of funding schemes. New methodological developments of indicators,,,2012,Research Evaluation,,Oxford University Press,,21,4,243,244,0958-2029,1471-5449,copyright,"© The Author 2012. Published by Oxford University Press. All rights reserved. For Permissions, please email: journals.permissions@oup.com",oxford,https://www.swissbib.ch/Search/Results?lookfor=nationallicenceoxford101093resevalrvs021,http://sru.swissbib.ch/sru/search/defaultdb?query=+dc.anywhere+exact+NATIONALLICENCEoxford101093resevalrvs021&operation=searchRetrieve&recordSchema=info%3Asrw%2Fschema%2F1%2Fmarcxml-v1.1-light&maximumRecords=10&startRecord=0&recordPacking=XML&availableDBs=defaultdb&sortKeys=Submit+query,http://sru.swissbib.ch/sru/search/defaultdb?query=+dc.anywhere+exact+NATIONALLICENCEoxford101093resevalrvs021&operation=searchRetrieve&recordSchema=info%3Asrw%2Fschema%2F1%2Fdc-v1.1-light&maximumRecords=10&startRecord=0&recordPacking=XML&availableDBs=defaultdb&sortKeys=Submit+query,http://sru.swissbib.ch/sru/search/defaultdb?query=+dc.anywhere+exact+NATIONALLICENCEoxford101093resevalrvs021&operation=searchRetrieve&recordSchema=info%3Asru%2Fschema%2Fjson&maximumRecords=10&startRecord=0&recordPacking=XML&availableDBs=defaultdb&sortKeys=Submit+query,
"Department of Sociology, Ghent University, Korte Meer 5, 9000 Ghent, Belgium, Faculty of Economics, Università della Svizzera Italiana, Via G. Buffi 13, CH-6904 Lugano, Switzerland and Nordic Institute for Studies in Innovation, Research and Education (NIFU), Wergelandsveien 7, 0167 Oslo, Norway E-mail: jeroen.huisman@ugent.be",Jeroen Huisman,usi,10.1093/reseval/rvv021,https://doi.org/10.1093/reseval/rvv021,./REV/rev24-4/abstracts/rvv021.xml,Measuring institutional diversity across higher education systems,,,2015,Research Evaluation,,Oxford University Press,2018-10-01,24,4,369,379,0958-2029,1471-5449,copyright,"© The Author 2015. Published by Oxford University Press. All rights reserved. For Permissions, please email: journals.permissions@oup.com",oxford,https://www.swissbib.ch/Search/Results?lookfor=nationallicenceoxford101093resevalrvv021,http://sru.swissbib.ch/sru/search/defaultdb?query=+dc.anywhere+exact+NATIONALLICENCEoxford101093resevalrvv021&operation=searchRetrieve&recordSchema=info%3Asrw%2Fschema%2F1%2Fmarcxml-v1.1-light&maximumRecords=10&startRecord=0&recordPacking=XML&availableDBs=defaultdb&sortKeys=Submit+query,http://sru.swissbib.ch/sru/search/defaultdb?query=+dc.anywhere+exact+NATIONALLICENCEoxford101093resevalrvv021&operation=searchRetrieve&recordSchema=info%3Asrw%2Fschema%2F1%2Fdc-v1.1-light&maximumRecords=10&startRecord=0&recordPacking=XML&availableDBs=defaultdb&sortKeys=Submit+query,http://sru.swissbib.ch/sru/search/defaultdb?query=+dc.anywhere+exact+NATIONALLICENCEoxford101093resevalrvv021&operation=searchRetrieve&recordSchema=info%3Asru%2Fschema%2Fjson&maximumRecords=10&startRecord=0&recordPacking=XML&availableDBs=defaultdb&sortKeys=Submit+query,
"Department of Chemistry and Applied Biosciences, ETH Zurich, Zurich CH-8006, Swizerland Facoltà di Informatica, Istituto di Scienze Computazionali (ICS), Università della Svizzera Italiana, Lugano CH-6900, Switzerland",Michele Parrinello,usi,10.1093/nar/gku1084,https://doi.org/10.1093/nar/gku1084,./NAR/nar42-21/abstracts/gku1084.xml,G-triplex structure and formation propensity,,,2014,Nucleic Acids Research,,Oxford University Press,2017-12-01,42,21,13393,13404,0305-1048,1362-4962,creative-commons,"This is an Open Access article distributed under the terms of the Creative Commons Attribution License (http://creativecommons.org/licenses/by-nc/4.0/), which permits non-commercial re-use, distribution, and reproduction in any medium, provided the original work is properly cited. For commercial re-use, please contact journals.permissions@oup.com",oxford,https://www.swissbib.ch/Search/Results?lookfor=nationallicenceoxford101093nargku1084,http://sru.swissbib.ch/sru/search/defaultdb?query=+dc.anywhere+exact+NATIONALLICENCEoxford101093nargku1084&operation=searchRetrieve&recordSchema=info%3Asrw%2Fschema%2F1%2Fmarcxml-v1.1-light&maximumRecords=10&startRecord=0&recordPacking=XML&availableDBs=defaultdb&sortKeys=Submit+query,http://sru.swissbib.ch/sru/search/defaultdb?query=+dc.anywhere+exact+NATIONALLICENCEoxford101093nargku1084&operation=searchRetrieve&recordSchema=info%3Asrw%2Fschema%2F1%2Fdc-v1.1-light&maximumRecords=10&startRecord=0&recordPacking=XML&availableDBs=defaultdb&sortKeys=Submit+query,http://sru.swissbib.ch/sru/search/defaultdb?query=+dc.anywhere+exact+NATIONALLICENCEoxford101093nargku1084&operation=searchRetrieve&recordSchema=info%3Asru%2Fschema%2Fjson&maximumRecords=10&startRecord=0&recordPacking=XML&availableDBs=defaultdb&sortKeys=Submit+query,
"Institute of Computational Science, University of Lugano, Switzerland",Rolf Krause,usi,10.1093/ejo/cjr134,https://doi.org/10.1093/ejo/cjr134,./EORTHO/eortho36-1/abstracts/cjr134.xml,The time-dependent biomechanical behaviour of the periodontal ligament—an in vitro experimental study in minipig mandibular two-rooted premolars,,,2014,The European Journal of Orthodontics,,Oxford University Press,,36,1,9,15,0141-5387,1460-2210,copyright,"© The Author 2011. Published by Oxford University Press on behalf of the European Orthodontic Society. All rights reserved. For permissions, please email: journals.permissions@oup.com",oxford,https://www.swissbib.ch/Search/Results?lookfor=nationallicenceoxford101093ejocjr134,http://sru.swissbib.ch/sru/search/defaultdb?query=+dc.anywhere+exact+NATIONALLICENCEoxford101093ejocjr134&operation=searchRetrieve&recordSchema=info%3Asrw%2Fschema%2F1%2Fmarcxml-v1.1-light&maximumRecords=10&startRecord=0&recordPacking=XML&availableDBs=defaultdb&sortKeys=Submit+query,http://sru.swissbib.ch/sru/search/defaultdb?query=+dc.anywhere+exact+NATIONALLICENCEoxford101093ejocjr134&operation=searchRetrieve&recordSchema=info%3Asrw%2Fschema%2F1%2Fdc-v1.1-light&maximumRecords=10&startRecord=0&recordPacking=XML&availableDBs=defaultdb&sortKeys=Submit+query,http://sru.swissbib.ch/sru/search/defaultdb?query=+dc.anywhere+exact+NATIONALLICENCEoxford101093ejocjr134&operation=searchRetrieve&recordSchema=info%3Asru%2Fschema%2Fjson&maximumRecords=10&startRecord=0&recordPacking=XML&availableDBs=defaultdb&sortKeys=Submit+query,
"Clinical Electrophysiology Unit, Fondazione Cardiocentro Ticino, Lugano, Switzerland University Magdeburg, Germany",Angelo Auricchio,usi,10.1093/europace/euu312,https://doi.org/10.1093/europace/euu312,./europace/europace17/abstracts/euu312.xml,European Cardiac Resynchronization Therapy Survey II: rationale and design,,,2015,EP Europace,,Oxford University Press,2018-01-01,17,1,137,141,1099-5129,1532-2092,copyright,Published on behalf of the European Society of Cardiology. All rights reserved. © The Author 2014. For permissions please email: journals.permissions@oup.com.,oxford,https://www.swissbib.ch/Search/Results?lookfor=nationallicenceoxford101093europaceeuu312,http://sru.swissbib.ch/sru/search/defaultdb?query=+dc.anywhere+exact+NATIONALLICENCEoxford101093europaceeuu312&operation=searchRetrieve&recordSchema=info%3Asrw%2Fschema%2F1%2Fmarcxml-v1.1-light&maximumRecords=10&startRecord=0&recordPacking=XML&availableDBs=defaultdb&sortKeys=Submit+query,http://sru.swissbib.ch/sru/search/defaultdb?query=+dc.anywhere+exact+NATIONALLICENCEoxford101093europaceeuu312&operation=searchRetrieve&recordSchema=info%3Asrw%2Fschema%2F1%2Fdc-v1.1-light&maximumRecords=10&startRecord=0&recordPacking=XML&availableDBs=defaultdb&sortKeys=Submit+query,http://sru.swissbib.ch/sru/search/defaultdb?query=+dc.anywhere+exact+NATIONALLICENCEoxford101093europaceeuu312&operation=searchRetrieve&recordSchema=info%3Asru%2Fschema%2Fjson&maximumRecords=10&startRecord=0&recordPacking=XML&availableDBs=defaultdb&sortKeys=Submit+query,
"Università della Svizzera italiana and Observatoire des Sciences et Techniques, via Lambertenghi 10a, 6904 Lugano, PO Box 95366, 2509 CJ Den Haag, The Netherlands, 1090 Wien, Austria, Via dei Taurini, 19, 00185 Rome, Italy, Wergelandsv. 7, N-0167 Oslo, Norway, 93 rue de Vaugirard, 75006 Paris, PO Box 217, 7500 AE Enschede, The Netherlands Università della Svizzera italiana and Observatoire des Sciences et Techniques, via Lambertenghi 10a, 6904 Lugano; Email: blepori@unisi.ch; Tel: +41 58 666 46 14; Fax: +41 58 666 46 19 Benedetto Lepori (corresponding author)",Benedetto Lepori,usi,10.3152/030234207X234578,https://doi.org/10.3152/030234207X234578,./spp.tar.gz/spp/abstracts/34-6-372.xml,Comparing the evolution of national research policies: What patterns of change?,,,2007,Science and Public Policy,,Beech Tree Publishing,,34,6,372,388,0302-3427,1471-5430,copyright,© Beech Tree Publishing 2007,oxford,https://www.swissbib.ch/Search/Results?lookfor=nationallicenceoxford103152030234207X234578,http://sru.swissbib.ch/sru/search/defaultdb?query=+dc.anywhere+exact+NATIONALLICENCEoxford103152030234207X234578&operation=searchRetrieve&recordSchema=info%3Asrw%2Fschema%2F1%2Fmarcxml-v1.1-light&maximumRecords=10&startRecord=0&recordPacking=XML&availableDBs=defaultdb&sortKeys=Submit+query,http://sru.swissbib.ch/sru/search/defaultdb?query=+dc.anywhere+exact+NATIONALLICENCEoxford103152030234207X234578&operation=searchRetrieve&recordSchema=info%3Asrw%2Fschema%2F1%2Fdc-v1.1-light&maximumRecords=10&startRecord=0&recordPacking=XML&availableDBs=defaultdb&sortKeys=Submit+query,http://sru.swissbib.ch/sru/search/defaultdb?query=+dc.anywhere+exact+NATIONALLICENCEoxford103152030234207X234578&operation=searchRetrieve&recordSchema=info%3Asru%2Fschema%2Fjson&maximumRecords=10&startRecord=0&recordPacking=XML&availableDBs=defaultdb&sortKeys=Submit+query,
"Faculty of Informatics, University of Lugano, Stabile Informatica, Via Buffi 13, 6904 Lugano, Switzerland; e-mail: fabio.crestani@lu.unisi.ch E-mail: fabio.crestani@lu.unisi.ch",Fabio Crestani,usi,10.1017/S0269888914000125,https://doi.org/10.1017/S0269888914000125,./KER/KER29_02/S0269888914000125h.xml,Ontology-driven word recommendation for mobile Web search,,,2014,The Knowledge Engineering Review,,Cambridge University Press,2019-03-01,29,2,186,200,0269-8889,1469-8005,copyright,Copyright © Cambridge University Press 2014 ,cambridge,https://www.swissbib.ch/Search/Results?lookfor=nationallicencecambridge101017S0269888914000125,http://sru.swissbib.ch/sru/search/defaultdb?query=+dc.anywhere+exact+NATIONALLICENCEcambridge101017S0269888914000125&operation=searchRetrieve&recordSchema=info%3Asrw%2Fschema%2F1%2Fmarcxml-v1.1-light&maximumRecords=10&startRecord=0&recordPacking=XML&availableDBs=defaultdb&sortKeys=Submit+query,http://sru.swissbib.ch/sru/search/defaultdb?query=+dc.anywhere+exact+NATIONALLICENCEcambridge101017S0269888914000125&operation=searchRetrieve&recordSchema=info%3Asrw%2Fschema%2F1%2Fdc-v1.1-light&maximumRecords=10&startRecord=0&recordPacking=XML&availableDBs=defaultdb&sortKeys=Submit+query,http://sru.swissbib.ch/sru/search/defaultdb?query=+dc.anywhere+exact+NATIONALLICENCEcambridge101017S0269888914000125&operation=searchRetrieve&recordSchema=info%3Asru%2Fschema%2Fjson&maximumRecords=10&startRecord=0&recordPacking=XML&availableDBs=defaultdb&sortKeys=Submit+query,
