"Fachhochschule Nordwestschweiz FHNW, Hochschule für Soziale Arbeit, Riggenbachstraße 16, 4600, Olten, Schweiz E-mail: holger.schmid@fhnw.ch","Schmid, Holger",fachhochschulen,10.1007/s11553-014-0467-9,https://doi.org/10.1007/s11553-014-0467-9,http://doc.rero.ch/record/333096/files/11553_2014_Article_467.pdf,Teilnahmebereitschaft von Jugendlichen an einem Rauchstoppprogramm über das MobiltelefonWillingness of adolescents to participate in a smoking cessation program using a mobile phone,,"Schmid, Holger;Rösch, Cornelia;Süsstrunk, Simon;Haug, Severin",2015,Prävention und Gesundheitsförderung,"Fachhochschule Nordwestschweiz FHNW, Hochschule für Soziale Arbeit, Riggenbachstraße 16, 4600, Olten, Schweiz E-mail: holger.schmid@fhnw.ch;Fachhochschule Nordwestschweiz FHNW, Hochschule für Soziale Arbeit, Riggenbachstraße 16, 4600, Olten, Schweiz E-mail: cornelia.roesch@fhnw.ch;Fachhochschule Nordwestschweiz FHNW, Hochschule für Soziale Arbeit, Riggenbachstraße 16, 4600, Olten, Schweiz E-mail: simon.suesstrunk@fhnw.ch;ISGF Schweizer Institut für Sucht- und Gesundheitsforschung, Zürich, Schweiz",Springer Berlin Heidelberg,,10,1,62,67,1861-6755,1861-6763,copyright,"Springer-Verlag Berlin Heidelberg, 2014",springer,https://www.swissbib.ch/Search/Results?lookfor=nationallicencespringer101007s1155301404679,http://sru.swissbib.ch/sru/search/defaultdb?query=+dc.anywhere+exact+NATIONALLICENCEspringer101007s1155301404679&operation=searchRetrieve&recordSchema=info%3Asrw%2Fschema%2F1%2Fmarcxml-v1.1-light&maximumRecords=10&startRecord=0&recordPacking=XML&availableDBs=defaultdb&sortKeys=Submit+query,http://sru.swissbib.ch/sru/search/defaultdb?query=+dc.anywhere+exact+NATIONALLICENCEspringer101007s1155301404679&operation=searchRetrieve&recordSchema=info%3Asrw%2Fschema%2F1%2Fdc-v1.1-light&maximumRecords=10&startRecord=0&recordPacking=XML&availableDBs=defaultdb&sortKeys=Submit+query,http://sru.swissbib.ch/sru/search/defaultdb?query=+dc.anywhere+exact+NATIONALLICENCEspringer101007s1155301404679&operation=searchRetrieve&recordSchema=info%3Asru%2Fschema%2Fjson&maximumRecords=10&startRecord=0&recordPacking=XML&availableDBs=defaultdb&sortKeys=Submit+query,It was possible to publish this article open access thanks to a Swiss National Licence with the Publisher
"Applied and Environmental Geology, Department of Environmental Sciences, University of Basel, Bernoullistrasse 32, 4056, Basel, Switzerland Endress+Hauser Metso AG, Kägenstrasse 2, 4153, Reinach, Switzerland E-mail: rebecca.page@unibas.ch","Page, Rebecca M.",fachhochschulen,10.1007/s11269-015-1039-2,https://doi.org/10.1007/s11269-015-1039-2,http://doc.rero.ch/record/332694/files/11269_2015_Article_1039.pdf,Multivariate Analysis of Groundwater-Quality Time-Series Using Self-organizing Maps and Sammon’s Mapping,,"Page, Rebecca M.;Huggenberger, Peter;Lischeid, Gunnar",2015,Water Resources Management,"Applied and Environmental Geology, Department of Environmental Sciences, University of Basel, Bernoullistrasse 32, 4056, Basel, Switzerland Endress+Hauser Metso AG, Kägenstrasse 2, 4153, Reinach, Switzerland E-mail: rebecca.page@unibas.ch;Applied and Environmental Geology, Department of Environmental Sciences, University of Basel, Bernoullistrasse 32, 4056, Basel, Switzerland;Institute of Landscape Hydrology, Leibniz Centre for Agricultural Landscape Research, Eberswalder Strasse 84, 15374, Müncheberg, Germany",Springer Netherlands,,29,11,3957,3970,0920-4741,1573-1650,copyright,"Springer Science+Business Media Dordrecht, 2015",springer,https://www.swissbib.ch/Search/Results?lookfor=nationallicencespringer101007s1126901510392,http://sru.swissbib.ch/sru/search/defaultdb?query=+dc.anywhere+exact+NATIONALLICENCEspringer101007s1126901510392&operation=searchRetrieve&recordSchema=info%3Asrw%2Fschema%2F1%2Fmarcxml-v1.1-light&maximumRecords=10&startRecord=0&recordPacking=XML&availableDBs=defaultdb&sortKeys=Submit+query,http://sru.swissbib.ch/sru/search/defaultdb?query=+dc.anywhere+exact+NATIONALLICENCEspringer101007s1126901510392&operation=searchRetrieve&recordSchema=info%3Asrw%2Fschema%2F1%2Fdc-v1.1-light&maximumRecords=10&startRecord=0&recordPacking=XML&availableDBs=defaultdb&sortKeys=Submit+query,http://sru.swissbib.ch/sru/search/defaultdb?query=+dc.anywhere+exact+NATIONALLICENCEspringer101007s1126901510392&operation=searchRetrieve&recordSchema=info%3Asru%2Fschema%2Fjson&maximumRecords=10&startRecord=0&recordPacking=XML&availableDBs=defaultdb&sortKeys=Submit+query,It was possible to publish this article open access thanks to a Swiss National Licence with the Publisher
"Haute Ecole de Gestion de Genève, University of Applied Sciences, Western Switzerland (HES-SO), Route de Drize 7, 1227, Carouge, Switzerland E-mail: alexandre.caboussat@hesge.ch","Caboussat, Alexandre",fachhochschulen,10.1007/s11401-015-0971-z,https://doi.org/10.1007/s11401-015-0971-z,http://doc.rero.ch/record/331860/files/11401_2015_Article_971.pdf,On the numerical solution of some Eikonal equations: An elliptic solver approach,,"Caboussat, Alexandre;Glowinski, Roland;Pan, Tsorng-Whay",2015,"Chinese Annals of Mathematics, Series B","Haute Ecole de Gestion de Genève, University of Applied Sciences, Western Switzerland (HES-SO), Route de Drize 7, 1227, Carouge, Switzerland E-mail: alexandre.caboussat@hesge.ch;Department of Mathematics, University of Houston, 4800 Calhoun Rd, 77204-3008, Houston, Texas, USA E-mail: roland@math.uh.edu;Department of Mathematics, University of Houston, 4800 Calhoun Rd, 77204-3008, Houston, Texas, USA E-mail: pan@math.uh.edu",Springer Berlin Heidelberg,,36,,689,702,0252-9599,1860-6261,copyright,"Fudan University and Springer-Verlag Berlin Heidelberg, 2015",springer,https://www.swissbib.ch/Search/Results?lookfor=nationallicencespringer101007s114010150971z,http://sru.swissbib.ch/sru/search/defaultdb?query=+dc.anywhere+exact+NATIONALLICENCEspringer101007s114010150971z&operation=searchRetrieve&recordSchema=info%3Asrw%2Fschema%2F1%2Fmarcxml-v1.1-light&maximumRecords=10&startRecord=0&recordPacking=XML&availableDBs=defaultdb&sortKeys=Submit+query,http://sru.swissbib.ch/sru/search/defaultdb?query=+dc.anywhere+exact+NATIONALLICENCEspringer101007s114010150971z&operation=searchRetrieve&recordSchema=info%3Asrw%2Fschema%2F1%2Fdc-v1.1-light&maximumRecords=10&startRecord=0&recordPacking=XML&availableDBs=defaultdb&sortKeys=Submit+query,http://sru.swissbib.ch/sru/search/defaultdb?query=+dc.anywhere+exact+NATIONALLICENCEspringer101007s114010150971z&operation=searchRetrieve&recordSchema=info%3Asru%2Fschema%2Fjson&maximumRecords=10&startRecord=0&recordPacking=XML&availableDBs=defaultdb&sortKeys=Submit+query,It was possible to publish this article open access thanks to a Swiss National Licence with the Publisher
"Zurich University of Applied Sciences, Technoparkstrasse 2, 8401, Winterthur, Switzerland E-mail: stot@zhaw.ch","Störmer, Tina",fachhochschulen,10.1007/s12297-014-0287-1,https://doi.org/10.1007/s12297-014-0287-1,http://doc.rero.ch/record/331906/files/12297_2014_Article_287.pdf,Optimizing insurance pricing by incorporating consumers’ perceptions of risk classification,,"Störmer, Tina",2015,Zeitschrift für die gesamte Versicherungswissenschaft,"Zurich University of Applied Sciences, Technoparkstrasse 2, 8401, Winterthur, Switzerland E-mail: stot@zhaw.ch",Springer Berlin Heidelberg,,104,1,11,37,0044-2585,1865-9748,copyright,"Springer-Verlag Berlin Heidelberg, 2014",springer,https://www.swissbib.ch/Search/Results?lookfor=nationallicencespringer101007s1229701402871,http://sru.swissbib.ch/sru/search/defaultdb?query=+dc.anywhere+exact+NATIONALLICENCEspringer101007s1229701402871&operation=searchRetrieve&recordSchema=info%3Asrw%2Fschema%2F1%2Fmarcxml-v1.1-light&maximumRecords=10&startRecord=0&recordPacking=XML&availableDBs=defaultdb&sortKeys=Submit+query,http://sru.swissbib.ch/sru/search/defaultdb?query=+dc.anywhere+exact+NATIONALLICENCEspringer101007s1229701402871&operation=searchRetrieve&recordSchema=info%3Asrw%2Fschema%2F1%2Fdc-v1.1-light&maximumRecords=10&startRecord=0&recordPacking=XML&availableDBs=defaultdb&sortKeys=Submit+query,http://sru.swissbib.ch/sru/search/defaultdb?query=+dc.anywhere+exact+NATIONALLICENCEspringer101007s1229701402871&operation=searchRetrieve&recordSchema=info%3Asru%2Fschema%2Fjson&maximumRecords=10&startRecord=0&recordPacking=XML&availableDBs=defaultdb&sortKeys=Submit+query,It was possible to publish this article open access thanks to a Swiss National Licence with the Publisher
"Hochschule für Wirtschaft, Institut für Wirtschaftsinformatik, Fachhochschule Nordwestschweiz, Bahnhofstrasse 6, 5210, Windisch, Schweiz E-mail: oliver.bendel@fhnw.ch","Bendel, Oliver",fachhochschulen,10.1365/s40702-014-0103-3,https://doi.org/10.1365/s40702-014-0103-3,http://doc.rero.ch/record/332514/files/40702_2014_Article_103.pdf,MOOCs in der Wirtschaftsinformatik,,"Bendel, Oliver",2015,HMD Praxis der Wirtschaftsinformatik,"Hochschule für Wirtschaft, Institut für Wirtschaftsinformatik, Fachhochschule Nordwestschweiz, Bahnhofstrasse 6, 5210, Windisch, Schweiz E-mail: oliver.bendel@fhnw.ch",Springer Fachmedien Wiesbaden,,52,,58,67,1436-3011,2198-2775,copyright,"Springer Fachmedien Wiesbaden, 2014",springer,https://www.swissbib.ch/Search/Results?lookfor=nationallicencespringer101365s4070201401033,http://sru.swissbib.ch/sru/search/defaultdb?query=+dc.anywhere+exact+NATIONALLICENCEspringer101365s4070201401033&operation=searchRetrieve&recordSchema=info%3Asrw%2Fschema%2F1%2Fmarcxml-v1.1-light&maximumRecords=10&startRecord=0&recordPacking=XML&availableDBs=defaultdb&sortKeys=Submit+query,http://sru.swissbib.ch/sru/search/defaultdb?query=+dc.anywhere+exact+NATIONALLICENCEspringer101365s4070201401033&operation=searchRetrieve&recordSchema=info%3Asrw%2Fschema%2F1%2Fdc-v1.1-light&maximumRecords=10&startRecord=0&recordPacking=XML&availableDBs=defaultdb&sortKeys=Submit+query,http://sru.swissbib.ch/sru/search/defaultdb?query=+dc.anywhere+exact+NATIONALLICENCEspringer101365s4070201401033&operation=searchRetrieve&recordSchema=info%3Asru%2Fschema%2Fjson&maximumRecords=10&startRecord=0&recordPacking=XML&availableDBs=defaultdb&sortKeys=Submit+query,It was possible to publish this article open access thanks to a Swiss National Licence with the Publisher
"Institute of Natural Resource Sciences (IUNR), Zurich University of Applied Sciences (ZHAW), Gruental, P.O. Box, 8820, Waedenswil, Switzerland Man–Society–Environment, Department of Environmental Sciences, University Basel, Vesalgasse 1, 4051, Basel, Switzerland E-mail: constanze.pietsch@zhaw.ch","Pietsch, Constanze",fachhochschulen,10.1007/s12550-015-0226-6,https://doi.org/10.1007/s12550-015-0226-6,http://doc.rero.ch/record/332825/files/12550_2015_Article_226.pdf,Acute and subchronic effects on immune responses of carp ( Cyprinus carpio L.) after exposure to deoxynivalenol (DON) in feed,,"Pietsch, Constanze;Katzenback, Barbara A.;Garcia-Garcia, Erick;Schulz, Carsten;Belosevic, Miodrag;Burkhardt-Holm, Patricia",2015,Mycotoxin Research,"Institute of Natural Resource Sciences (IUNR), Zurich University of Applied Sciences (ZHAW), Gruental, P.O. Box, 8820, Waedenswil, Switzerland Man–Society–Environment, Department of Environmental Sciences, University Basel, Vesalgasse 1, 4051, Basel, Switzerland E-mail: constanze.pietsch@zhaw.ch;Department of Biological Sciences, University of Alberta, T6G 2E9, Edmonton, AB, Canada Department of Biology, University of Waterloo, 200 University Ave West, Waterloo, N2L 3G1, Ontario, Canada;Department of Biological Sciences, University of Alberta, T6G 2E9, Edmonton, AB, Canada Casa d’Estudis El pont, C/Cervantes 27-bajo, 30150, Villajoyosa, Spain;Gesellschaft für Marine Aquakultur (GMA) mbH, Hafentörn 3, 25761, Büsum, Germany Institute for Animal Breeding and Husbandry, Christian Albrechts-University of Kiel, Olshausestr. 40, 24098, Kiel, Germany;Department of Biological Sciences, University of Alberta, T6G 2E9, Edmonton, AB, Canada;Man–Society–Environment, Department of Environmental Sciences, University Basel, Vesalgasse 1, 4051, Basel, Switzerland Department of Biological Sciences, University of Alberta, T6G 2E9, Edmonton, AB, Canada",Springer Berlin Heidelberg,,31,3,151,164,0178-7888,1867-1632,copyright,"Society for Mycotoxin Research and Springer-Verlag Berlin Heidelberg, 2015",springer,https://www.swissbib.ch/Search/Results?lookfor=nationallicencespringer101007s1255001502266,http://sru.swissbib.ch/sru/search/defaultdb?query=+dc.anywhere+exact+NATIONALLICENCEspringer101007s1255001502266&operation=searchRetrieve&recordSchema=info%3Asrw%2Fschema%2F1%2Fmarcxml-v1.1-light&maximumRecords=10&startRecord=0&recordPacking=XML&availableDBs=defaultdb&sortKeys=Submit+query,http://sru.swissbib.ch/sru/search/defaultdb?query=+dc.anywhere+exact+NATIONALLICENCEspringer101007s1255001502266&operation=searchRetrieve&recordSchema=info%3Asrw%2Fschema%2F1%2Fdc-v1.1-light&maximumRecords=10&startRecord=0&recordPacking=XML&availableDBs=defaultdb&sortKeys=Submit+query,http://sru.swissbib.ch/sru/search/defaultdb?query=+dc.anywhere+exact+NATIONALLICENCEspringer101007s1255001502266&operation=searchRetrieve&recordSchema=info%3Asru%2Fschema%2Fjson&maximumRecords=10&startRecord=0&recordPacking=XML&availableDBs=defaultdb&sortKeys=Submit+query,It was possible to publish this article open access thanks to a Swiss National Licence with the Publisher
"Institut für Wirtschaftsinformatik, Fachhochschule Nordwestschweiz, Riggenbachstrasse 16, 4600, Olten, Schweiz E-mail: marc.schaaf@fhnw.ch","Schaaf, Marc",fachhochschulen,10.1365/s40702-015-0149-x,https://doi.org/10.1365/s40702-015-0149-x,http://doc.rero.ch/record/331951/files/40702_2015_Article_149.pdf,Ereignisverarbeitung zur Flexiblen Dynamischen Informationsverarbeitung in Smart Cities,,"Schaaf, Marc;Wilke, Gwendolin",2015,HMD Praxis der Wirtschaftsinformatik,"Institut für Wirtschaftsinformatik, Fachhochschule Nordwestschweiz, Riggenbachstrasse 16, 4600, Olten, Schweiz E-mail: marc.schaaf@fhnw.ch;Institut für Wirtschaftsinformatik, Hochschule Luzern, Zentralstrasse 9, 6002, Luzern, Schweiz E-mail: gwendolin.wilke@hslu.ch",Springer Fachmedien Wiesbaden,,52,,562,571,1436-3011,2198-2775,copyright,"Springer Fachmedien Wiesbaden, 2015",springer,https://www.swissbib.ch/Search/Results?lookfor=nationallicencespringer101365s407020150149x,http://sru.swissbib.ch/sru/search/defaultdb?query=+dc.anywhere+exact+NATIONALLICENCEspringer101365s407020150149x&operation=searchRetrieve&recordSchema=info%3Asrw%2Fschema%2F1%2Fmarcxml-v1.1-light&maximumRecords=10&startRecord=0&recordPacking=XML&availableDBs=defaultdb&sortKeys=Submit+query,http://sru.swissbib.ch/sru/search/defaultdb?query=+dc.anywhere+exact+NATIONALLICENCEspringer101365s407020150149x&operation=searchRetrieve&recordSchema=info%3Asrw%2Fschema%2F1%2Fdc-v1.1-light&maximumRecords=10&startRecord=0&recordPacking=XML&availableDBs=defaultdb&sortKeys=Submit+query,http://sru.swissbib.ch/sru/search/defaultdb?query=+dc.anywhere+exact+NATIONALLICENCEspringer101365s407020150149x&operation=searchRetrieve&recordSchema=info%3Asru%2Fschema%2Fjson&maximumRecords=10&startRecord=0&recordPacking=XML&availableDBs=defaultdb&sortKeys=Submit+query,It was possible to publish this article open access thanks to a Swiss National Licence with the Publisher
"Hochschule für Wirtschaft, Institut für Wirtschaftsinformatik, Fachhochschule Nordwestschweiz, Bahnhofstrasse 6, 5210, Windisch, Schweiz E-mail: oliver.bendel@fhnw.ch","Bendel, Oliver",fachhochschulen,10.1365/s40702-015-0163-z,https://doi.org/10.1365/s40702-015-0163-z,http://doc.rero.ch/record/332371/files/40702_2015_Article_163.pdf,Die Industrie 4.0 aus ethischer Sicht,,"Bendel, Oliver",2015,HMD Praxis der Wirtschaftsinformatik,"Hochschule für Wirtschaft, Institut für Wirtschaftsinformatik, Fachhochschule Nordwestschweiz, Bahnhofstrasse 6, 5210, Windisch, Schweiz E-mail: oliver.bendel@fhnw.ch",Springer Fachmedien Wiesbaden,,52,,739,748,1436-3011,2198-2775,copyright,"Springer Fachmedien Wiesbaden, 2015",springer,https://www.swissbib.ch/Search/Results?lookfor=nationallicencespringer101365s407020150163z,http://sru.swissbib.ch/sru/search/defaultdb?query=+dc.anywhere+exact+NATIONALLICENCEspringer101365s407020150163z&operation=searchRetrieve&recordSchema=info%3Asrw%2Fschema%2F1%2Fmarcxml-v1.1-light&maximumRecords=10&startRecord=0&recordPacking=XML&availableDBs=defaultdb&sortKeys=Submit+query,http://sru.swissbib.ch/sru/search/defaultdb?query=+dc.anywhere+exact+NATIONALLICENCEspringer101365s407020150163z&operation=searchRetrieve&recordSchema=info%3Asrw%2Fschema%2F1%2Fdc-v1.1-light&maximumRecords=10&startRecord=0&recordPacking=XML&availableDBs=defaultdb&sortKeys=Submit+query,http://sru.swissbib.ch/sru/search/defaultdb?query=+dc.anywhere+exact+NATIONALLICENCEspringer101365s407020150163z&operation=searchRetrieve&recordSchema=info%3Asru%2Fschema%2Fjson&maximumRecords=10&startRecord=0&recordPacking=XML&availableDBs=defaultdb&sortKeys=Submit+query,It was possible to publish this article open access thanks to a Swiss National Licence with the Publisher
"Physiotherapy and Occupational Therapy Research, Directorate of Research and Education, University Hospital Zurich, Gloriastrasse 25, 8091, Zurich, Switzerland Department of Health, Institute of Physiotherapy, Zurich University of Applied Sciences, Winterthur, Switzerland Department of Epidemiology, CAPHRI School for Public Health and Primary Care, Maastricht University, PO Box 616, 6200 MD, Maastricht, The Netherlands E-mail: pierrette.baschung@usz.ch","Baschung Pfister, Pierrette",fachhochschulen,10.1007/s00296-015-3343-9,https://doi.org/10.1007/s00296-015-3343-9,http://doc.rero.ch/record/331220/files/296_2015_Article_3343.pdf,The relevance of applying exercise training principles when designing therapeutic interventions for patients with inflammatory myopathies: a systematic review,,"Baschung Pfister, Pierrette;De Bruin, Eling D.;Tobler-Ammann, Bernadette C.;Maurer, Britta;Knols, Ruud H.",2015,Rheumatology International,"Physiotherapy and Occupational Therapy Research, Directorate of Research and Education, University Hospital Zurich, Gloriastrasse 25, 8091, Zurich, Switzerland Department of Health, Institute of Physiotherapy, Zurich University of Applied Sciences, Winterthur, Switzerland Department of Epidemiology, CAPHRI School for Public Health and Primary Care, Maastricht University, PO Box 616, 6200 MD, Maastricht, The Netherlands E-mail: pierrette.baschung@usz.ch;Department of Epidemiology, CAPHRI School for Public Health and Primary Care, Maastricht University, PO Box 616, 6200 MD, Maastricht, The Netherlands Department of Health Sciences and Technology, Institute of Human Movement Sciences and Sport, ETH Zurich, Zurich, Switzerland Centre for Evidence Based Physiotherapy, Maastricht University, PO Box 616, 6200 MD, Maastricht, The Netherlands E-mail: eling.debruin@hest.ethz.ch;Physiotherapy and Occupational Therapy Research, Directorate of Research and Education, University Hospital Zurich, Gloriastrasse 25, 8091, Zurich, Switzerland Department of Epidemiology, CAPHRI School for Public Health and Primary Care, Maastricht University, PO Box 616, 6200 MD, Maastricht, The Netherlands E-mail: bernadette.tobler@usz.ch;Division of Rheumatology and Laboratory for Systemic Autoimmune Diseases, University Hospital of Zurich, Zurich, Switzerland E-mail: Britta.maurer@usz.ch;Physiotherapy and Occupational Therapy Research, Directorate of Research and Education, University Hospital Zurich, Gloriastrasse 25, 8091, Zurich, Switzerland E-mail: ruud.knols@usz.ch",Springer Berlin Heidelberg,,35,10,1641,1654,0172-8172,1437-160X,copyright,"Springer-Verlag Berlin Heidelberg, 2015",springer,https://www.swissbib.ch/Search/Results?lookfor=nationallicencespringer101007s0029601533439,http://sru.swissbib.ch/sru/search/defaultdb?query=+dc.anywhere+exact+NATIONALLICENCEspringer101007s0029601533439&operation=searchRetrieve&recordSchema=info%3Asrw%2Fschema%2F1%2Fmarcxml-v1.1-light&maximumRecords=10&startRecord=0&recordPacking=XML&availableDBs=defaultdb&sortKeys=Submit+query,http://sru.swissbib.ch/sru/search/defaultdb?query=+dc.anywhere+exact+NATIONALLICENCEspringer101007s0029601533439&operation=searchRetrieve&recordSchema=info%3Asrw%2Fschema%2F1%2Fdc-v1.1-light&maximumRecords=10&startRecord=0&recordPacking=XML&availableDBs=defaultdb&sortKeys=Submit+query,http://sru.swissbib.ch/sru/search/defaultdb?query=+dc.anywhere+exact+NATIONALLICENCEspringer101007s0029601533439&operation=searchRetrieve&recordSchema=info%3Asru%2Fschema%2Fjson&maximumRecords=10&startRecord=0&recordPacking=XML&availableDBs=defaultdb&sortKeys=Submit+query,It was possible to publish this article open access thanks to a Swiss National Licence with the Publisher
"Medos International, A Johnson & Johnson Company, Le Locle, Switzerland Institute for Surgical Technology and Biomechanics, University of Bern, Bern, Switzerland Zurich University of Applied Sciences, Institute of Mechatronic Systems, Technikumstrasse 5, CH-8401, Winterthur, Switzerland E-mail: jburger@campus.unibe.ch","Burger, J.",fachhochschulen,10.1007/s10544-015-9981-6,https://doi.org/10.1007/s10544-015-9981-6,http://doc.rero.ch/record/331296/files/10544_2015_Article_9981.pdf,Silicon micromachined ultrasonic scalpel for the dissection and coagulation of tissue,,"Lockhart, R.;Friedrich, F.;Briand, D.;Margairaz, P.;Sandoz, J.-P.;Brossard, J.;Keppner, H.;Olson, W.;Dietz, T.;Tardy, Y.;Meyer, H.;Stadelmann, P.;Robert, C.;Boegli, A.;Farine, P.-A.;De Rooij, N. F.;Burger, J.",2015,Biomedical Microdevices,"Ecole Polytechnique Fédérale de Lausanne (EPFL), Institute of Microengineering (IMT), Sensors, Actuators and Microsystems Laboratory (SAMLAB), Neuchâtel, Switzerland;Ecole Polytechnique Fédérale de Lausanne (EPFL), Institute of Microengineering (IMT), Sensors, Actuators and Microsystems Laboratory (SAMLAB), Neuchâtel, Switzerland Medos International, A Johnson & Johnson Company, Le Locle, Switzerland;Ecole Polytechnique Fédérale de Lausanne (EPFL), Institute of Microengineering (IMT), Sensors, Actuators and Microsystems Laboratory (SAMLAB), Neuchâtel, Switzerland;Medos International, A Johnson & Johnson Company, Le Locle, Switzerland;Haute Ecole Arc Ingénierie, Neuchâtel, Switzerland;Haute Ecole Arc Ingénierie, Neuchâtel, Switzerland;Haute Ecole Arc Ingénierie, Neuchâtel, Switzerland;Ethicon Endo-Surgery, Cincinnati, OH, USA;Ethicon Endo-Surgery, Cincinnati, OH, USA;Medos International, A Johnson & Johnson Company, Le Locle, Switzerland;Ecole Polytechnique Fédérale de Lausanne (EPFL), Electronics and Signal Processing Lab, Neuchâtel, Switzerland;Ecole Polytechnique Fédérale de Lausanne (EPFL), Electronics and Signal Processing Lab, Neuchâtel, Switzerland;Ecole Polytechnique Fédérale de Lausanne (EPFL), Electronics and Signal Processing Lab, Neuchâtel, Switzerland;Ecole Polytechnique Fédérale de Lausanne (EPFL), Electronics and Signal Processing Lab, Neuchâtel, Switzerland;Ecole Polytechnique Fédérale de Lausanne (EPFL), Electronics and Signal Processing Lab, Neuchâtel, Switzerland;Ecole Polytechnique Fédérale de Lausanne (EPFL), Institute of Microengineering (IMT), Sensors, Actuators and Microsystems Laboratory (SAMLAB), Neuchâtel, Switzerland;Medos International, A Johnson & Johnson Company, Le Locle, Switzerland Institute for Surgical Technology and Biomechanics, University of Bern, Bern, Switzerland Zurich University of Applied Sciences, Institute of Mechatronic Systems, Technikumstrasse 5, CH-8401, Winterthur, Switzerland E-mail: jburger@campus.unibe.ch",Springer US; http://www.springer-ny.com,,17,4,1,12,1387-2176,1572-8781,copyright,"Springer Science+Business Media New York, 2015",springer,https://www.swissbib.ch/Search/Results?lookfor=nationallicencespringer101007s1054401599816,http://sru.swissbib.ch/sru/search/defaultdb?query=+dc.anywhere+exact+NATIONALLICENCEspringer101007s1054401599816&operation=searchRetrieve&recordSchema=info%3Asrw%2Fschema%2F1%2Fmarcxml-v1.1-light&maximumRecords=10&startRecord=0&recordPacking=XML&availableDBs=defaultdb&sortKeys=Submit+query,http://sru.swissbib.ch/sru/search/defaultdb?query=+dc.anywhere+exact+NATIONALLICENCEspringer101007s1054401599816&operation=searchRetrieve&recordSchema=info%3Asrw%2Fschema%2F1%2Fdc-v1.1-light&maximumRecords=10&startRecord=0&recordPacking=XML&availableDBs=defaultdb&sortKeys=Submit+query,http://sru.swissbib.ch/sru/search/defaultdb?query=+dc.anywhere+exact+NATIONALLICENCEspringer101007s1054401599816&operation=searchRetrieve&recordSchema=info%3Asru%2Fschema%2Fjson&maximumRecords=10&startRecord=0&recordPacking=XML&availableDBs=defaultdb&sortKeys=Submit+query,It was possible to publish this article open access thanks to a Swiss National Licence with the Publisher
