"Zhejiang Provincial Key Laboratory of Plant Evolutionary Ecology and Conservation, Taizhou University, Taizhou, China Forest dynamics, Swiss Federal Research Institute WSL, Zuercherstrasse 111, Birmensdorf, Switzerland Institute of Applied Ecology, Chinese Academy of Sciences, Shenyang, China","Li, Mai-He",fachhochschulen,10.1093/treephys/tpy020,https://doi.org/10.1093/treephys/tpy020,http://doc.rero.ch/record/331902/files/TREEPHYS_38_9_1345.pdf,Active summer carbon storage for winter persistence in trees at the cold alpine treeline,,"Li, Mai-He;Jiang, Yong;Wang, Ao;Li, Xiaobin;Zhu, Wanze;Yan, Cai-Feng;Du, Zhong;Shi, Zheng;Lei, Jingpin;Schönbeck, Leonie;He, Peng;Yu, Fei-Hai;Wang, Xue;Millard, Peter",2018,Tree Physiology,"Zhejiang Provincial Key Laboratory of Plant Evolutionary Ecology and Conservation, Taizhou University, Taizhou, China Forest dynamics, Swiss Federal Research Institute WSL, Zuercherstrasse 111, Birmensdorf, Switzerland Institute of Applied Ecology, Chinese Academy of Sciences, Shenyang, China;Institute of Applied Ecology, Chinese Academy of Sciences, Shenyang, China;Zhejiang Provincial Key Laboratory of Plant Evolutionary Ecology and Conservation, Taizhou University, Taizhou, China Forest dynamics, Swiss Federal Research Institute WSL, Zuercherstrasse 111, Birmensdorf, Switzerland;State Key Laboratory for Microbial Metabolism and School of Life Sciences and Biotechnology, Shanghai Jiaotong University, Shanghai, China;Institute of Mountain Hazard and Environment, Chinese Academy of Sciences, Chengdu, China;Institute of Environment and Sustainable Development in Agriculture, Chinese Academy of Agricultural Sciences, Beijing, China;College of Land and Resources, China West Normal University, Nanchong, Sichuan, China;Research Institute of Forest Ecology, Environment and Protection, Chinese Academy of Forestry, Beijing, China;Research Institute of Forestry, Chinese Academy of Forestry, Beijing, China Co-innovation Centre for Sustainable Forestry in Southern China, Nanjing Forestry University, Nanjing, China;Forest dynamics, Swiss Federal Research Institute WSL, Zuercherstrasse 111, Birmensdorf, Switzerland;Forest dynamics, Swiss Federal Research Institute WSL, Zuercherstrasse 111, Birmensdorf, Switzerland Institute of Applied Ecology, Chinese Academy of Sciences, Shenyang, China;Zhejiang Provincial Key Laboratory of Plant Evolutionary Ecology and Conservation, Taizhou University, Taizhou, China;Zhejiang Provincial Key Laboratory of Plant Evolutionary Ecology and Conservation, Taizhou University, Taizhou, China Forest dynamics, Swiss Federal Research Institute WSL, Zuercherstrasse 111, Birmensdorf, Switzerland Institute of Applied Ecology, Chinese Academy of Sciences, Shenyang, China E-mail: wangxueiae@163.com;Zhejiang Provincial Key Laboratory of Plant Evolutionary Ecology and Conservation, Taizhou University, Taizhou, China Forest dynamics, Swiss Federal Research Institute WSL, Zuercherstrasse 111, Birmensdorf, Switzerland Institute of Applied Ecology, Chinese Academy of Sciences, Shenyang, China State Key Laboratory for Microbial Metabolism and School of Life Sciences and Biotechnology, Shanghai Jiaotong University, Shanghai, China Institute of Mountain Hazard and Environment, Chinese Academy of Sciences, Chengdu, China Institute of Environment and Sustainable Development in Agriculture, Chinese Academy of Agricultural Sciences, Beijing, China College of Land and Resources, China West Normal University, Nanchong, Sichuan, China Research Institute of Forest Ecology, Environment and Protection, Chinese Academy of Forestry, Beijing, China Research Institute of Forestry, Chinese Academy of Forestry, Beijing, China Co-innovation Centre for Sustainable Forestry in Southern China, Nanjing Forestry University, Nanjing, China",Oxford University Press,,38,9,1345,1355,,1758-4469,copyright,"© The Author(s) 2018. Published by Oxford University Press. All rights reserved. For Permissions, please email: journals.permissions@oup.com",oxford,https://www.swissbib.ch/Search/Results?lookfor=nationallicenceoxford101093treephystpy020,http://sru.swissbib.ch/sru/search/defaultdb?query=+dc.anywhere+exact+NATIONALLICENCEoxford101093treephystpy020&operation=searchRetrieve&recordSchema=info%3Asrw%2Fschema%2F1%2Fmarcxml-v1.1-light&maximumRecords=10&startRecord=0&recordPacking=XML&availableDBs=defaultdb&sortKeys=Submit+query,http://sru.swissbib.ch/sru/search/defaultdb?query=+dc.anywhere+exact+NATIONALLICENCEoxford101093treephystpy020&operation=searchRetrieve&recordSchema=info%3Asrw%2Fschema%2F1%2Fdc-v1.1-light&maximumRecords=10&startRecord=0&recordPacking=XML&availableDBs=defaultdb&sortKeys=Submit+query,http://sru.swissbib.ch/sru/search/defaultdb?query=+dc.anywhere+exact+NATIONALLICENCEoxford101093treephystpy020&operation=searchRetrieve&recordSchema=info%3Asru%2Fschema%2Fjson&maximumRecords=10&startRecord=0&recordPacking=XML&availableDBs=defaultdb&sortKeys=Submit+query,It was possible to publish this article open access thanks to a Swiss National Licence with the Publisher
"Health Division, Bern University of Applied Sciences, Murtenstrasse 10, CH-3008 Bern, Switzerland","Sommerhalder, Kathrin",fachhochschulen,10.1093/heapro/daw084,https://doi.org/10.1093/heapro/daw084,http://doc.rero.ch/record/331831/files/HEAPRO_33_3_378.pdf,Just a subtle difference? Findings from a systematic review on definitions of nutrition literacy and food literacy,,"Krause, Corinna;Sommerhalder, Kathrin;Beer-Borst, Sigrid;Abel, Thomas",2018,Health Promotion International,"Institute of Social and Preventive Medicine, University of Bern, Finkenhubelweg 11, CH-3012 Bern, Switzerland E-mail: corinna.krause@ispm.unibe.ch;Health Division, Bern University of Applied Sciences, Murtenstrasse 10, CH-3008 Bern, Switzerland;Institute of Social and Preventive Medicine, University of Bern, Finkenhubelweg 11, CH-3012 Bern, Switzerland;Institute of Social and Preventive Medicine, University of Bern, Finkenhubelweg 11, CH-3012 Bern, Switzerland",Oxford University Press,,33,3,378,389,0957-4824,1460-2245,copyright,© The Author 2016. Published by Oxford University Press.,oxford,https://www.swissbib.ch/Search/Results?lookfor=nationallicenceoxford101093heaprodaw084,http://sru.swissbib.ch/sru/search/defaultdb?query=+dc.anywhere+exact+NATIONALLICENCEoxford101093heaprodaw084&operation=searchRetrieve&recordSchema=info%3Asrw%2Fschema%2F1%2Fmarcxml-v1.1-light&maximumRecords=10&startRecord=0&recordPacking=XML&availableDBs=defaultdb&sortKeys=Submit+query,http://sru.swissbib.ch/sru/search/defaultdb?query=+dc.anywhere+exact+NATIONALLICENCEoxford101093heaprodaw084&operation=searchRetrieve&recordSchema=info%3Asrw%2Fschema%2F1%2Fdc-v1.1-light&maximumRecords=10&startRecord=0&recordPacking=XML&availableDBs=defaultdb&sortKeys=Submit+query,http://sru.swissbib.ch/sru/search/defaultdb?query=+dc.anywhere+exact+NATIONALLICENCEoxford101093heaprodaw084&operation=searchRetrieve&recordSchema=info%3Asru%2Fschema%2Fjson&maximumRecords=10&startRecord=0&recordPacking=XML&availableDBs=defaultdb&sortKeys=Submit+query,It was possible to publish this article open access thanks to a Swiss National Licence with the Publisher
"School of Health sciences, HES-SO Valais — Wallis, University of Applied sciences Western Switzerland, Chémin de l'Agasse 6, Sion, Switzerland La Source, School of Nursing Sciences, University of Applied Sciences Western Switzerland, Lausanne, Switzerland E-mail: henk.verloo@unil.ch","Verloo, Henk",fachhochschulen,10.1093/ageing/afx076,https://doi.org/10.1093/ageing/afx076,http://doc.rero.ch/record/331553/files/AGEING_46_5_747.pdf,Nurse interventions to improve medication adherence among discharged older adults: a systematic review,,"Verloo, Henk;Chiolero, Arnaud;Kiszio, Blanche;Kampel, Thomas;Santschi, Valérie",2017,Age and Ageing,"School of Health sciences, HES-SO Valais — Wallis, University of Applied sciences Western Switzerland, Chémin de l'Agasse 6, Sion, Switzerland La Source, School of Nursing Sciences, University of Applied Sciences Western Switzerland, Lausanne, Switzerland E-mail: henk.verloo@unil.ch;IUMSP, Lausanne University Hospital, Lausanne, Switzerland Institute of Primary Health Care (BIHAM), University of Bern, Bern, Switzerland;La Source, School of Nursing Sciences, University of Applied Sciences Western Switzerland, Lausanne, Switzerland;La Source, School of Nursing Sciences, University of Applied Sciences Western Switzerland, Lausanne, Switzerland;La Source, School of Nursing Sciences, University of Applied Sciences Western Switzerland, Lausanne, Switzerland Service of Nephrology and Hypertension, Lausanne University Hospital, Lausanne, Switzerland",Oxford University Press,,46,5,747,754,0002-0729,1468-2834,copyright,"© The Author 2017. Published by Oxford University Press on behalf of the British Geriatrics Society.All rights reserved. For permissions, please email: journals.permissions@oup.com",oxford,https://www.swissbib.ch/Search/Results?lookfor=nationallicenceoxford101093ageingafx076,http://sru.swissbib.ch/sru/search/defaultdb?query=+dc.anywhere+exact+NATIONALLICENCEoxford101093ageingafx076&operation=searchRetrieve&recordSchema=info%3Asrw%2Fschema%2F1%2Fmarcxml-v1.1-light&maximumRecords=10&startRecord=0&recordPacking=XML&availableDBs=defaultdb&sortKeys=Submit+query,http://sru.swissbib.ch/sru/search/defaultdb?query=+dc.anywhere+exact+NATIONALLICENCEoxford101093ageingafx076&operation=searchRetrieve&recordSchema=info%3Asrw%2Fschema%2F1%2Fdc-v1.1-light&maximumRecords=10&startRecord=0&recordPacking=XML&availableDBs=defaultdb&sortKeys=Submit+query,http://sru.swissbib.ch/sru/search/defaultdb?query=+dc.anywhere+exact+NATIONALLICENCEoxford101093ageingafx076&operation=searchRetrieve&recordSchema=info%3Asru%2Fschema%2Fjson&maximumRecords=10&startRecord=0&recordPacking=XML&availableDBs=defaultdb&sortKeys=Submit+query,It was possible to publish this article open access thanks to a Swiss National Licence with the Publisher
"Department of Psychology, Center for Cognitive Psychology and Methodology, University of Basel, Missionsstrasse 62a, 4055 Basel, Switzerland University of Applied Sciences and Arts Northwestern Switzerland School of Business, Peter Merian-Strasse 86, 4002 Basel, Switzerland","Linxen, Sebastian",fachhochschulen,10.1093/iwc/iww012,https://doi.org/10.1093/iwc/iww012,http://doc.rero.ch/record/331346/files/IWC_29_3_325.pdf,Is It Still Where I Expect It?—Users’ Current Expectations of Interface Elements on the Most Frequent Types of Websites,,"Heinz, Silvia;Linxen, Sebastian;Tuch, Alexandre N.;Fraßeck, Lars;Opwis, Klaus",2017,Interacting with Computers,"Department of Psychology, Center for Cognitive Psychology and Methodology, University of Basel, Missionsstrasse 62a, 4055 Basel, Switzerland E-mail: silvia.heinz@unibas.ch;Department of Psychology, Center for Cognitive Psychology and Methodology, University of Basel, Missionsstrasse 62a, 4055 Basel, Switzerland University of Applied Sciences and Arts Northwestern Switzerland School of Business, Peter Merian-Strasse 86, 4002 Basel, Switzerland;Department of Psychology, Center for Cognitive Psychology and Methodology, University of Basel, Missionsstrasse 62a, 4055 Basel, Switzerland;Department of Psychology, Center for Cognitive Psychology and Methodology, University of Basel, Missionsstrasse 62a, 4055 Basel, Switzerland;Department of Psychology, Center for Cognitive Psychology and Methodology, University of Basel, Missionsstrasse 62a, 4055 Basel, Switzerland",Oxford University Press,,29,3,325,344,0953-5438,1873-7951,copyright,"© The Author 2016. Published by Oxford University Press on behalf of The British Computer Society. All rights reserved.For Permissions, please email: journals.permissions@oup.com",oxford,https://www.swissbib.ch/Search/Results?lookfor=nationallicenceoxford101093iwciww012,http://sru.swissbib.ch/sru/search/defaultdb?query=+dc.anywhere+exact+NATIONALLICENCEoxford101093iwciww012&operation=searchRetrieve&recordSchema=info%3Asrw%2Fschema%2F1%2Fmarcxml-v1.1-light&maximumRecords=10&startRecord=0&recordPacking=XML&availableDBs=defaultdb&sortKeys=Submit+query,http://sru.swissbib.ch/sru/search/defaultdb?query=+dc.anywhere+exact+NATIONALLICENCEoxford101093iwciww012&operation=searchRetrieve&recordSchema=info%3Asrw%2Fschema%2F1%2Fdc-v1.1-light&maximumRecords=10&startRecord=0&recordPacking=XML&availableDBs=defaultdb&sortKeys=Submit+query,http://sru.swissbib.ch/sru/search/defaultdb?query=+dc.anywhere+exact+NATIONALLICENCEoxford101093iwciww012&operation=searchRetrieve&recordSchema=info%3Asru%2Fschema%2Fjson&maximumRecords=10&startRecord=0&recordPacking=XML&availableDBs=defaultdb&sortKeys=Submit+query,It was possible to publish this article open access thanks to a Swiss National Licence with the Publisher
"Laboratory of Human Nutrition, Institute of Food, Nutrition and Health, Swiss Federal Institute of Technology, ETH Zürich, Zurich, Switzerland Swiss Federal Institute of Sports, Magglingen, Switzerland Department of Business, Health, and Social Work, Bern University of Applied Sciences, Bern, Switzerland","Mettler, Samuel",fachhochschulen,10.1093/ajcn/nqy247,https://doi.org/10.1093/ajcn/nqy247,http://doc.rero.ch/record/332774/files/AJCN_108_6_1324.pdf,An intensified training schedule in recreational male runners is associated with increases in erythropoiesis and inflammation and a net reduction in plasma hepcidin,,"Moretti, Diego;Mettler, Samuel;Zeder, Christophe;Lundby, Carsten;Geurts-Moetspot, Anneke;Monnard, Arnaud;Swinkels, Dorine W;Brittenham, Gary M;Zimmermann, Michael B",2018,The American Journal of Clinical Nutrition,"Laboratory of Human Nutrition, Institute of Food, Nutrition and Health, Swiss Federal Institute of Technology, ETH Zürich, Zurich, Switzerland E-mail: diego.moretti@alumni.ethz.ch;Laboratory of Human Nutrition, Institute of Food, Nutrition and Health, Swiss Federal Institute of Technology, ETH Zürich, Zurich, Switzerland Swiss Federal Institute of Sports, Magglingen, Switzerland Department of Business, Health, and Social Work, Bern University of Applied Sciences, Bern, Switzerland;Laboratory of Human Nutrition, Institute of Food, Nutrition and Health, Swiss Federal Institute of Technology, ETH Zürich, Zurich, Switzerland;Zurich Center for Integrative Human Physiology, Institute of Physiology, University of Zurich, Zurich, Switzerland;Hepcidinanalysis.com and Department of Laboratory Medicine, Translational Metabolic Laboratory, Radboud University Medical Center, Nijmegen, Netherlands;Laboratory of Human Nutrition, Institute of Food, Nutrition and Health, Swiss Federal Institute of Technology, ETH Zürich, Zurich, Switzerland;Hepcidinanalysis.com and Department of Laboratory Medicine, Translational Metabolic Laboratory, Radboud University Medical Center, Nijmegen, Netherlands;Laboratory of Human Nutrition, Institute of Food, Nutrition and Health, Swiss Federal Institute of Technology, ETH Zürich, Zurich, Switzerland;Laboratory of Human Nutrition, Institute of Food, Nutrition and Health, Swiss Federal Institute of Technology, ETH Zürich, Zurich, Switzerland",Oxford University Press,2021-12-01,108,6,1324,1333,0002-9165,1938-3207,copyright,© 2018 American Society for Nutrition.,oxford,https://www.swissbib.ch/Search/Results?lookfor=nationallicenceoxford101093ajcnnqy247,http://sru.swissbib.ch/sru/search/defaultdb?query=+dc.anywhere+exact+NATIONALLICENCEoxford101093ajcnnqy247&operation=searchRetrieve&recordSchema=info%3Asrw%2Fschema%2F1%2Fmarcxml-v1.1-light&maximumRecords=10&startRecord=0&recordPacking=XML&availableDBs=defaultdb&sortKeys=Submit+query,http://sru.swissbib.ch/sru/search/defaultdb?query=+dc.anywhere+exact+NATIONALLICENCEoxford101093ajcnnqy247&operation=searchRetrieve&recordSchema=info%3Asrw%2Fschema%2F1%2Fdc-v1.1-light&maximumRecords=10&startRecord=0&recordPacking=XML&availableDBs=defaultdb&sortKeys=Submit+query,http://sru.swissbib.ch/sru/search/defaultdb?query=+dc.anywhere+exact+NATIONALLICENCEoxford101093ajcnnqy247&operation=searchRetrieve&recordSchema=info%3Asru%2Fschema%2Fjson&maximumRecords=10&startRecord=0&recordPacking=XML&availableDBs=defaultdb&sortKeys=Submit+query,It was possible to publish this article open access thanks to a Swiss National Licence with the Publisher
"Institute of Chemistry and Bioanalytics, University of Applied Sciences Northwestern Switzerland (FHNW), Gruendenstrasse 40, CH-4132 Muttenz, Switzerland","Berchtold, C.",fachhochschulen,10.1093/jat/bkw096,https://doi.org/10.1093/jat/bkw096,http://doc.rero.ch/record/332914/files/JAT_40_9_761.pdf,An Acute Ocfentanil Fatality: A Case Report with Postmortem Concentrations,,"Dussy, F.E.;Hangartner, S.;Hamberg, C.;Berchtold, C.;Scherer, U.;Schlotterbeck, G.;Wyler, D.;Briellmann, T.A.",2016,Journal of Analytical Toxicology,"Forensic Chemistry and Toxicology, Institute of Legal Medicine of the University of Basel, Pestalozzistrasse 22, CH-4056 Basel, Switzerland E-mail: franz.dussy@bs.ch;Forensic Chemistry and Toxicology, Institute of Legal Medicine of the University of Basel, Pestalozzistrasse 22, CH-4056 Basel, Switzerland;Forensic Chemistry and Toxicology, Institute of Legal Medicine of the University of Basel, Pestalozzistrasse 22, CH-4056 Basel, Switzerland;Institute of Chemistry and Bioanalytics, University of Applied Sciences Northwestern Switzerland (FHNW), Gruendenstrasse 40, CH-4132 Muttenz, Switzerland;Institute of Chemistry and Bioanalytics, University of Applied Sciences Northwestern Switzerland (FHNW), Gruendenstrasse 40, CH-4132 Muttenz, Switzerland;Institute of Chemistry and Bioanalytics, University of Applied Sciences Northwestern Switzerland (FHNW), Gruendenstrasse 40, CH-4132 Muttenz, Switzerland;Institute of Pathology and Legal Medicine, Canton Hospital Grisons, Loëstrasse 170, CH-7000 Chur, Switzerland;Forensic Chemistry and Toxicology, Institute of Legal Medicine of the University of Basel, Pestalozzistrasse 22, CH-4056 Basel, Switzerland",Oxford University Press,,40,9,761,766,0146-4760,1945-2403,copyright,"© The Author 2016. Published by Oxford University Press. All rights reserved. For Permissions, please email: journals.permissions@oup.com",oxford,https://www.swissbib.ch/Search/Results?lookfor=nationallicenceoxford101093jatbkw096,http://sru.swissbib.ch/sru/search/defaultdb?query=+dc.anywhere+exact+NATIONALLICENCEoxford101093jatbkw096&operation=searchRetrieve&recordSchema=info%3Asrw%2Fschema%2F1%2Fmarcxml-v1.1-light&maximumRecords=10&startRecord=0&recordPacking=XML&availableDBs=defaultdb&sortKeys=Submit+query,http://sru.swissbib.ch/sru/search/defaultdb?query=+dc.anywhere+exact+NATIONALLICENCEoxford101093jatbkw096&operation=searchRetrieve&recordSchema=info%3Asrw%2Fschema%2F1%2Fdc-v1.1-light&maximumRecords=10&startRecord=0&recordPacking=XML&availableDBs=defaultdb&sortKeys=Submit+query,http://sru.swissbib.ch/sru/search/defaultdb?query=+dc.anywhere+exact+NATIONALLICENCEoxford101093jatbkw096&operation=searchRetrieve&recordSchema=info%3Asru%2Fschema%2Fjson&maximumRecords=10&startRecord=0&recordPacking=XML&availableDBs=defaultdb&sortKeys=Submit+query,It was possible to publish this article open access thanks to a Swiss National Licence with the Publisher
"IDP Institute of Data Analysis and Process Design, Zurich University of Applied Sciences, Winterthur, Switzerland E-mail: thoralf.mildenberger@zhaw.ch","Mildenberger, Thoralf",fachhochschulen,10.1007/s00362-013-0577-z,https://doi.org/10.1007/s00362-013-0577-z,http://doc.rero.ch/record/333118/files/362_2013_Article_577.pdf,Simon Rogers and Mark Girolami: A first course in machine learning,"CRC Press, Boca Raton, 2012, xx + 285 pp., US $69.95, GB 36.99, € 51.80, ISBN 978-143982414-6 ","Mildenberger, Thoralf",2015,Statistical Papers,"IDP Institute of Data Analysis and Process Design, Zurich University of Applied Sciences, Winterthur, Switzerland E-mail: thoralf.mildenberger@zhaw.ch",Springer Berlin Heidelberg,,56,1,271,271,0932-5026,1613-9798,copyright,"Springer-Verlag Berlin Heidelberg, 2013",springer,https://www.swissbib.ch/Search/Results?lookfor=nationallicencespringer101007s003620130577z,http://sru.swissbib.ch/sru/search/defaultdb?query=+dc.anywhere+exact+NATIONALLICENCEspringer101007s003620130577z&operation=searchRetrieve&recordSchema=info%3Asrw%2Fschema%2F1%2Fmarcxml-v1.1-light&maximumRecords=10&startRecord=0&recordPacking=XML&availableDBs=defaultdb&sortKeys=Submit+query,http://sru.swissbib.ch/sru/search/defaultdb?query=+dc.anywhere+exact+NATIONALLICENCEspringer101007s003620130577z&operation=searchRetrieve&recordSchema=info%3Asrw%2Fschema%2F1%2Fdc-v1.1-light&maximumRecords=10&startRecord=0&recordPacking=XML&availableDBs=defaultdb&sortKeys=Submit+query,http://sru.swissbib.ch/sru/search/defaultdb?query=+dc.anywhere+exact+NATIONALLICENCEspringer101007s003620130577z&operation=searchRetrieve&recordSchema=info%3Asru%2Fschema%2Fjson&maximumRecords=10&startRecord=0&recordPacking=XML&availableDBs=defaultdb&sortKeys=Submit+query,It was possible to publish this article open access thanks to a Swiss National Licence with the Publisher
"IICT, HEIG-VD, University of Applied Sciences Western Switzerland (HES-SO), Delémont, Switzerland E-mail: hector-fabio.satizabal-mejia@heig-vd.ch","Satizábal, Héctor F.",fachhochschulen,10.1007/s00500-014-1499-y,https://doi.org/10.1007/s00500-014-1499-y,http://doc.rero.ch/record/331842/files/500_2014_Article_1499.pdf,Unsupervised template discovery in activity recognition using the Gamma Growing Neural Gas algorithm,,"Satizábal, Héctor F.;Perez-Uribe, Andres",2015,Soft Computing,"IICT, HEIG-VD, University of Applied Sciences Western Switzerland (HES-SO), Delémont, Switzerland E-mail: hector-fabio.satizabal-mejia@heig-vd.ch;IICT, HEIG-VD, University of Applied Sciences Western Switzerland (HES-SO), Delémont, Switzerland E-mail: andres.perez-uribe@heig-vd.ch",Springer Berlin Heidelberg,,19,,2435,2445,1432-7643,1433-7479,copyright,"Springer-Verlag Berlin Heidelberg, 2014",springer,https://www.swissbib.ch/Search/Results?lookfor=nationallicencespringer101007s005000141499y,http://sru.swissbib.ch/sru/search/defaultdb?query=+dc.anywhere+exact+NATIONALLICENCEspringer101007s005000141499y&operation=searchRetrieve&recordSchema=info%3Asrw%2Fschema%2F1%2Fmarcxml-v1.1-light&maximumRecords=10&startRecord=0&recordPacking=XML&availableDBs=defaultdb&sortKeys=Submit+query,http://sru.swissbib.ch/sru/search/defaultdb?query=+dc.anywhere+exact+NATIONALLICENCEspringer101007s005000141499y&operation=searchRetrieve&recordSchema=info%3Asrw%2Fschema%2F1%2Fdc-v1.1-light&maximumRecords=10&startRecord=0&recordPacking=XML&availableDBs=defaultdb&sortKeys=Submit+query,http://sru.swissbib.ch/sru/search/defaultdb?query=+dc.anywhere+exact+NATIONALLICENCEspringer101007s005000141499y&operation=searchRetrieve&recordSchema=info%3Asru%2Fschema%2Fjson&maximumRecords=10&startRecord=0&recordPacking=XML&availableDBs=defaultdb&sortKeys=Submit+query,It was possible to publish this article open access thanks to a Swiss National Licence with the Publisher
"Clinical and Interventional Angiology, Kantonsspital Aarau, Tellstrasse, 5001, Aarau, Switzerland University of Applied Sciences Furtwangen, Villingen-Schwenningen, Germany E-mail: nicolas.diehm@ksa.ch","Diehm, Nicolas",fachhochschulen,10.1007/s10439-015-1358-8,https://doi.org/10.1007/s10439-015-1358-8,http://doc.rero.ch/record/331281/files/10439_2015_Article_1358.pdf,Nitinol Stent Oversizing in Patients Undergoing Popliteal Artery Revascularization: A Finite Element Study,,"Gökgöl, Can;Diehm, Nicolas;Nezami, Farhad Rikhtegar;Büchler, Philippe",2015,Annals of Biomedical Engineering,"Institute for Surgical Technology & Biomechanics, University of Bern, Bern, Switzerland;Clinical and Interventional Angiology, Kantonsspital Aarau, Tellstrasse, 5001, Aarau, Switzerland University of Applied Sciences Furtwangen, Villingen-Schwenningen, Germany E-mail: nicolas.diehm@ksa.ch;Institute for Surgical Technology & Biomechanics, University of Bern, Bern, Switzerland Harvard-MIT Biomedical Engineering Center, Massachusetts Institute of Technology, 02139, Cambridge, MA, USA;Institute for Surgical Technology & Biomechanics, University of Bern, Bern, Switzerland",Springer US; http://www.springer-ny.com,,43,12,2868,2880,0090-6964,1573-9686,copyright,"Biomedical Engineering Society, 2015",springer,https://www.swissbib.ch/Search/Results?lookfor=nationallicencespringer101007s1043901513588,http://sru.swissbib.ch/sru/search/defaultdb?query=+dc.anywhere+exact+NATIONALLICENCEspringer101007s1043901513588&operation=searchRetrieve&recordSchema=info%3Asrw%2Fschema%2F1%2Fmarcxml-v1.1-light&maximumRecords=10&startRecord=0&recordPacking=XML&availableDBs=defaultdb&sortKeys=Submit+query,http://sru.swissbib.ch/sru/search/defaultdb?query=+dc.anywhere+exact+NATIONALLICENCEspringer101007s1043901513588&operation=searchRetrieve&recordSchema=info%3Asrw%2Fschema%2F1%2Fdc-v1.1-light&maximumRecords=10&startRecord=0&recordPacking=XML&availableDBs=defaultdb&sortKeys=Submit+query,http://sru.swissbib.ch/sru/search/defaultdb?query=+dc.anywhere+exact+NATIONALLICENCEspringer101007s1043901513588&operation=searchRetrieve&recordSchema=info%3Asru%2Fschema%2Fjson&maximumRecords=10&startRecord=0&recordPacking=XML&availableDBs=defaultdb&sortKeys=Submit+query,It was possible to publish this article open access thanks to a Swiss National Licence with the Publisher
