First Matching Affiliation,First Matching Author,Institution Guess,doi,Url to publisher,Url to fulltext in Rero Doc,Article Title,Article Subtitle,Authors,Year,Journal Title,All Affiliations,Publisher,Date of Allowed Open Access Publication (YYYY-MM-DD),Volume,Issue,Start Page,End Page,ISSN (print),ISSN (electronic),Copyright type,Copyright / Licence,Source,Link to Swissbib,Metadata in MARC XML,Metadata in Dublin Core,Metadata in Json-Marc,Comment
"IUED Institute of Translation and Interpreting, ZHAW Zurich University of Applied Sciences, Theaterstraße 15 c, 8401 Winterthur, SwitzerlandZHAW Zurich University of Applied SciencesIUED Institute of Translation and InterpretingTheaterstraße 15c8401 WinterthurSwitzerland","Massey, Gary",fachhochschulen,10.1515/les-2017-0021,https://doi.org/10.1515/les-2017-0021,http://doc.rero.ch/record/331108/files/les-2017-0021.pdf,Machine learning: Implications for translator education,,"Massey, Gary;Ehrensberger-Dow, Maureen",2017,Lebende Sprachen,"IUED Institute of Translation and Interpreting, ZHAW Zurich University of Applied Sciences, Theaterstraße 15 c, 8401 Winterthur, SwitzerlandZHAW Zurich University of Applied SciencesIUED Institute of Translation and InterpretingTheaterstraße 15c8401 WinterthurSwitzerland;IUED Institute of Translation and Interpreting, ZHAW Zurich University of Applied Sciences, Theaterstraße 15 c, 8401 Winterthur, SwitzerlandZHAW Zurich University of Applied SciencesUED Institute of Translation and InterpretingTheaterstraße 15c8401 WinterthurSwitzerland",De Gruyter Mouton,,62,2,300,312,0023-9909,1868-0267,copyright,"© 2017 Walter de Gruyter GmbH, Berlin/Boston",gruyter,https://www.swissbib.ch/Search/Results?lookfor=nationallicencegruyter101515les20170021,http://sru.swissbib.ch/sru/search/defaultdb?query=+dc.anywhere+exact+NATIONALLICENCEgruyter101515les20170021&operation=searchRetrieve&recordSchema=info%3Asrw%2Fschema%2F1%2Fmarcxml-v1.1-light&maximumRecords=10&startRecord=0&recordPacking=XML&availableDBs=defaultdb&sortKeys=Submit+query,http://sru.swissbib.ch/sru/search/defaultdb?query=+dc.anywhere+exact+NATIONALLICENCEgruyter101515les20170021&operation=searchRetrieve&recordSchema=info%3Asrw%2Fschema%2F1%2Fdc-v1.1-light&maximumRecords=10&startRecord=0&recordPacking=XML&availableDBs=defaultdb&sortKeys=Submit+query,http://sru.swissbib.ch/sru/search/defaultdb?query=+dc.anywhere+exact+NATIONALLICENCEgruyter101515les20170021&operation=searchRetrieve&recordSchema=info%3Asru%2Fschema%2Fjson&maximumRecords=10&startRecord=0&recordPacking=XML&availableDBs=defaultdb&sortKeys=Submit+query,It was possible to publish this article open access thanks to a Swiss National Licence with the Publisher
"Institute of Building Materials, ETH Zürich, Zurich, Switzerland Institut für Werkstoffe und Holztechnologie, Berner Fachhochschule Architektur, Holz und Bau, Biel, Switzerland","Clerc, Gaspard",fachhochschulen,10.1515/hf-2016-0154,https://doi.org/10.1515/hf-2016-0154,http://doc.rero.ch/record/332154/files/hf-2016-0154.pdf,Static and dynamic tensile shear test of glued lap wooden joint with four different types of adhesives,,"Bachtiar, Erik V.;Clerc, Gaspard;Brunner, Andreas J.;Kaliske, Michael;Niemz, Peter",2017,Holzforschung,"ETH Zurich – Institute for Building Materials, Zürich, Kanton Zürich, Switzerland;Institute of Building Materials, ETH Zürich, Zurich, Switzerland Institut für Werkstoffe und Holztechnologie, Berner Fachhochschule Architektur, Holz und Bau, Biel, Switzerland;Laboratory for Mechanical System Engineering, Empa, Dübendorf, Switzerland;Institute for Structural Analysis, Technische Universität Dresden, Dresden, Germany;Institute of Building Materials, ETH Zürich, Zurich, Switzerland Institut für Werkstoffe und Holztechnologie, Berner Fachhochschule Architektur, Holz und Bau, Biel, Switzerland",De Gruyter,,71,5,391,396,0018-3830,1437-434X,copyright,"©2017 Walter de Gruyter GmbH, Berlin/Boston",gruyter,https://www.swissbib.ch/Search/Results?lookfor=nationallicencegruyter101515hf20160154,http://sru.swissbib.ch/sru/search/defaultdb?query=+dc.anywhere+exact+NATIONALLICENCEgruyter101515hf20160154&operation=searchRetrieve&recordSchema=info%3Asrw%2Fschema%2F1%2Fmarcxml-v1.1-light&maximumRecords=10&startRecord=0&recordPacking=XML&availableDBs=defaultdb&sortKeys=Submit+query,http://sru.swissbib.ch/sru/search/defaultdb?query=+dc.anywhere+exact+NATIONALLICENCEgruyter101515hf20160154&operation=searchRetrieve&recordSchema=info%3Asrw%2Fschema%2F1%2Fdc-v1.1-light&maximumRecords=10&startRecord=0&recordPacking=XML&availableDBs=defaultdb&sortKeys=Submit+query,http://sru.swissbib.ch/sru/search/defaultdb?query=+dc.anywhere+exact+NATIONALLICENCEgruyter101515hf20160154&operation=searchRetrieve&recordSchema=info%3Asru%2Fschema%2Fjson&maximumRecords=10&startRecord=0&recordPacking=XML&availableDBs=defaultdb&sortKeys=Submit+query,It was possible to publish this article open access thanks to a Swiss National Licence with the Publisher
"Machine Vision Group, Institute for Production Metrology, Materials and Optics, NTB Interstate University of Applied Sciences of Technology Buchs, Werdenbergstrasse 4, 9471 Buchs Switzerland","Schöch, Alexander",fachhochschulen,10.1515/teme-2017-0012,https://doi.org/10.1515/teme-2017-0012,http://doc.rero.ch/record/331344/files/teme-2017-0012.pdf,Automated surface inspection of small customer-specific optical elementsAutomatische Oberflächeninspektion von kleinen benutzerspezifischen optischen Elementen,,"Schöch, Alexander;Perez, Patric;Linz-Dittrich, Sabine;Bach, Carlo;Ziolek, Carsten",2017,tm - Technisches Messen,"Machine Vision Group, Institute for Production Metrology, Materials and Optics, NTB Interstate University of Applied Sciences of Technology Buchs, Werdenbergstrasse 4, 9471 Buchs Switzerland;Machine Vision Group, Institute for Production Metrology, Materials and Optics, NTB Interstate University of Applied Sciences of Technology Buchs, Werdenbergstrasse 4, 9471 Buchs Switzerland;Technical Optics Group, Institute for Production Metrology, Materials and Optics, NTB Interstate University of Applied Sciences of Technology Buchs, Werdenbergstrasse 4, 9471 Buchs Switzerland;Machine Vision Group, Institute for Production Metrology, Materials and Optics, NTB Interstate University of Applied Sciences of Technology Buchs, Werdenbergstrasse 4, 9471 Buchs Switzerland;Technical Optics Group, Institute for Production Metrology, Materials and Optics, NTB Interstate University of Applied Sciences of Technology Buchs, Werdenbergstrasse 4, 9471 Buchs Switzerland",De Gruyter Oldenbourg,,84,7-8,502,511,0171-8096,2196-7113,copyright,©2017 Walter de Gruyter Berlin/Boston,gruyter,https://www.swissbib.ch/Search/Results?lookfor=nationallicencegruyter101515teme20170012,http://sru.swissbib.ch/sru/search/defaultdb?query=+dc.anywhere+exact+NATIONALLICENCEgruyter101515teme20170012&operation=searchRetrieve&recordSchema=info%3Asrw%2Fschema%2F1%2Fmarcxml-v1.1-light&maximumRecords=10&startRecord=0&recordPacking=XML&availableDBs=defaultdb&sortKeys=Submit+query,http://sru.swissbib.ch/sru/search/defaultdb?query=+dc.anywhere+exact+NATIONALLICENCEgruyter101515teme20170012&operation=searchRetrieve&recordSchema=info%3Asrw%2Fschema%2F1%2Fdc-v1.1-light&maximumRecords=10&startRecord=0&recordPacking=XML&availableDBs=defaultdb&sortKeys=Submit+query,http://sru.swissbib.ch/sru/search/defaultdb?query=+dc.anywhere+exact+NATIONALLICENCEgruyter101515teme20170012&operation=searchRetrieve&recordSchema=info%3Asru%2Fschema%2Fjson&maximumRecords=10&startRecord=0&recordPacking=XML&availableDBs=defaultdb&sortKeys=Submit+query,It was possible to publish this article open access thanks to a Swiss National Licence with the Publisher
"Departement Engineering and Information Technology, Bern University of Applied Sciences, Jlcoweg 1, CH-3400 Burgdorf, Switzerland","Heck, Horst",fachhochschulen,10.1515/jiip-2016-0019,https://doi.org/10.1515/jiip-2016-0019,http://doc.rero.ch/record/331213/files/jiip-2016-0019.pdf,Stability of the inverse boundary value problem for the biharmonic operator: Logarithmic estimates,,"Choudhury, Anupam Pal;Heck, Horst",2017,Journal of Inverse and Ill-posed Problems,"Departement Mathematik und Informatik, Universität Basel, Spiegelgasse 1, CH-4051, Basel, Switzerland;Departement Engineering and Information Technology, Bern University of Applied Sciences, Jlcoweg 1, CH-3400 Burgdorf, Switzerland",De Gruyter,,25,2,251,263,0928-0219,1569-3945,copyright,© 2017 by De Gruyter,gruyter,https://www.swissbib.ch/Search/Results?lookfor=nationallicencegruyter101515jiip20160019,http://sru.swissbib.ch/sru/search/defaultdb?query=+dc.anywhere+exact+NATIONALLICENCEgruyter101515jiip20160019&operation=searchRetrieve&recordSchema=info%3Asrw%2Fschema%2F1%2Fmarcxml-v1.1-light&maximumRecords=10&startRecord=0&recordPacking=XML&availableDBs=defaultdb&sortKeys=Submit+query,http://sru.swissbib.ch/sru/search/defaultdb?query=+dc.anywhere+exact+NATIONALLICENCEgruyter101515jiip20160019&operation=searchRetrieve&recordSchema=info%3Asrw%2Fschema%2F1%2Fdc-v1.1-light&maximumRecords=10&startRecord=0&recordPacking=XML&availableDBs=defaultdb&sortKeys=Submit+query,http://sru.swissbib.ch/sru/search/defaultdb?query=+dc.anywhere+exact+NATIONALLICENCEgruyter101515jiip20160019&operation=searchRetrieve&recordSchema=info%3Asru%2Fschema%2Fjson&maximumRecords=10&startRecord=0&recordPacking=XML&availableDBs=defaultdb&sortKeys=Submit+query,It was possible to publish this article open access thanks to a Swiss National Licence with the Publisher
"Institute for Building Materials, ETH Zürich, Zürich, Switzerland Institute for Material and Wood Technology, Bern University of Applied Sciences, Burgdorf, Switzerland","Niemz, Peter",fachhochschulen,10.1515/hf-2017-0063,https://doi.org/10.1515/hf-2017-0063,http://doc.rero.ch/record/332574/files/hf-2017-0063.pdf,Determination of mode I and mode II fracture toughness of walnut and cherry in TR and RT crack propagation system by the Arcan test,,"Murata, Koji;Bachtiar, Erik Valentine;Niemz, Peter",2017,Holzforschung,"Graduate School of Agriculture, Kyoto University, Kitashirakawa-Oiwake cho, Sakyo ku, Kyoto city, Kyoto, 606-8502, Japan;Institute for Building Materials, ETH Zürich, Zürich, Switzerland;Institute for Building Materials, ETH Zürich, Zürich, Switzerland Institute for Material and Wood Technology, Bern University of Applied Sciences, Burgdorf, Switzerland",De Gruyter,,71,12,985,990,0018-3830,1437-434X,copyright,"©2017 Walter de Gruyter GmbH, Berlin/Boston",gruyter,https://www.swissbib.ch/Search/Results?lookfor=nationallicencegruyter101515hf20170063,http://sru.swissbib.ch/sru/search/defaultdb?query=+dc.anywhere+exact+NATIONALLICENCEgruyter101515hf20170063&operation=searchRetrieve&recordSchema=info%3Asrw%2Fschema%2F1%2Fmarcxml-v1.1-light&maximumRecords=10&startRecord=0&recordPacking=XML&availableDBs=defaultdb&sortKeys=Submit+query,http://sru.swissbib.ch/sru/search/defaultdb?query=+dc.anywhere+exact+NATIONALLICENCEgruyter101515hf20170063&operation=searchRetrieve&recordSchema=info%3Asrw%2Fschema%2F1%2Fdc-v1.1-light&maximumRecords=10&startRecord=0&recordPacking=XML&availableDBs=defaultdb&sortKeys=Submit+query,http://sru.swissbib.ch/sru/search/defaultdb?query=+dc.anywhere+exact+NATIONALLICENCEgruyter101515hf20170063&operation=searchRetrieve&recordSchema=info%3Asru%2Fschema%2Fjson&maximumRecords=10&startRecord=0&recordPacking=XML&availableDBs=defaultdb&sortKeys=Submit+query,It was possible to publish this article open access thanks to a Swiss National Licence with the Publisher
"School of Engineering, Zurich University of Applied Sciences, Technikumstrasse 9, CH-8401 Winterthur, Switzerland","Samrowski, Tatiana",fachhochschulen,10.1515/rnam-2017-0025,https://doi.org/10.1515/rnam-2017-0025,http://doc.rero.ch/record/331134/files/rnam-2017-0025.pdf,A posteriori estimates for a coupled piezoelectric model,,"Langer, Ulrich;Repin, Sergey;Samrowski, Tatiana",2017,Russian Journal of Numerical Analysis and Mathematical Modelling,"Johann Radon Institute for Computational and Applied Mathematics (RICAM), Austrian Academy of Sciences Altenberger Str. 69, 4040 Linz, Austria;St. Petersburg Department of V. A. Steklov Institute of Mathematics, St. Petersburg 191024 Russia Peter the Great St. Petersburg Polytechnic University, St. Petersburg 195251, Russia University of Jyväskulä, Jyväskulä, PO Box 35, FI-40014, Finland;School of Engineering, Zurich University of Applied Sciences, Technikumstrasse 9, CH-8401 Winterthur, Switzerland",De Gruyter,,32,4,259,266,0927-6467,1569-3988,copyright,"© 2017 Walter de Gruyter GmbH, Berlin/Boston",gruyter,https://www.swissbib.ch/Search/Results?lookfor=nationallicencegruyter101515rnam20170025,http://sru.swissbib.ch/sru/search/defaultdb?query=+dc.anywhere+exact+NATIONALLICENCEgruyter101515rnam20170025&operation=searchRetrieve&recordSchema=info%3Asrw%2Fschema%2F1%2Fmarcxml-v1.1-light&maximumRecords=10&startRecord=0&recordPacking=XML&availableDBs=defaultdb&sortKeys=Submit+query,http://sru.swissbib.ch/sru/search/defaultdb?query=+dc.anywhere+exact+NATIONALLICENCEgruyter101515rnam20170025&operation=searchRetrieve&recordSchema=info%3Asrw%2Fschema%2F1%2Fdc-v1.1-light&maximumRecords=10&startRecord=0&recordPacking=XML&availableDBs=defaultdb&sortKeys=Submit+query,http://sru.swissbib.ch/sru/search/defaultdb?query=+dc.anywhere+exact+NATIONALLICENCEgruyter101515rnam20170025&operation=searchRetrieve&recordSchema=info%3Asru%2Fschema%2Fjson&maximumRecords=10&startRecord=0&recordPacking=XML&availableDBs=defaultdb&sortKeys=Submit+query,It was possible to publish this article open access thanks to a Swiss National Licence with the Publisher
"Chair Commission I.1 Green Book, Chair Mole Project, ZHAW Zurich University of Applied Sciences, ICBT Institute of Chemistry and Biotechnology, Einsiedlerstrasse 31, CH-8820 Wädenswil, Switzerland","Stohner, Jürgen",fachhochschulen,10.1515/pac-2016-0808,https://doi.org/10.1515/pac-2016-0808,http://doc.rero.ch/record/331143/files/pac-2016-0808.pdf,A critical review of the proposed definitions of fundamental chemical quantities and their impact on chemical communities (IUPAC Technical Report),,"Marquardt, Roberto;Meija, Juris;Mester, Zoltan;Towns, Marcy;Weir, Ron;Davis, Richard;Stohner, Jürgen",2017,Pure and Applied Chemistry,"Laboratoire de Chimie Quantique, Institut de Chimie, Université de Strasbourg, 1, Rue Blaise Pascal, F-67008 Strasbourg, France;National Research Council Canada, Measurement Science and Standards, 1200 Montreal Road M-12, B-12, Ottawa, ON K1A 0R6, Canada;National Research Council Canada, Measurement Science and Standards, 1200 Montreal Road M-12, G-7, Ottawa, ON K1A 0R6, Canada;Purdue University, Department of Chemistry, Office WTHR 107E, 560 Oval Drive, West Lafayette, IN 47907, USA;Royal Military College of Canada, Department of Chemistry and Chemical Engineering, P.O. Box 17000, Stn. Forces, Kingston, ON K7K 7B4, Canada;Bureau International des Poids et Mesures (BIPM), Pavillon de Breteuil, F-92312 Sèvres Cedex, France;Chair Commission I.1 Green Book, Chair Mole Project, ZHAW Zurich University of Applied Sciences, ICBT Institute of Chemistry and Biotechnology, Einsiedlerstrasse 31, CH-8820 Wädenswil, Switzerland",De Gruyter,,89,7,951,981,0033-4545,1365-3075,copyright,"©2017 IUPAC & De Gruyter. This work is licensed under a Creative Commons Attribution-NonCommercial-NoDerivatives 4.0 International License. For more information, please visit: http://creativecommons.org/licenses/by-nc-nd/4.0/",gruyter,https://www.swissbib.ch/Search/Results?lookfor=nationallicencegruyter101515pac20160808,http://sru.swissbib.ch/sru/search/defaultdb?query=+dc.anywhere+exact+NATIONALLICENCEgruyter101515pac20160808&operation=searchRetrieve&recordSchema=info%3Asrw%2Fschema%2F1%2Fmarcxml-v1.1-light&maximumRecords=10&startRecord=0&recordPacking=XML&availableDBs=defaultdb&sortKeys=Submit+query,http://sru.swissbib.ch/sru/search/defaultdb?query=+dc.anywhere+exact+NATIONALLICENCEgruyter101515pac20160808&operation=searchRetrieve&recordSchema=info%3Asrw%2Fschema%2F1%2Fdc-v1.1-light&maximumRecords=10&startRecord=0&recordPacking=XML&availableDBs=defaultdb&sortKeys=Submit+query,http://sru.swissbib.ch/sru/search/defaultdb?query=+dc.anywhere+exact+NATIONALLICENCEgruyter101515pac20160808&operation=searchRetrieve&recordSchema=info%3Asru%2Fschema%2Fjson&maximumRecords=10&startRecord=0&recordPacking=XML&availableDBs=defaultdb&sortKeys=Submit+query,It was possible to publish this article open access thanks to a Swiss National Licence with the Publisher
"Faculty of Psychology and Educational Sciences, University of Geneva, Geneva, Switzerland Geneva Neuroscience Center, University of Geneva, Geneva, Switzerland HES-SO University of Applied Sciences and Arts Western Switzerland, School of Health Sciences, Geneva, Switzerland","James, Clara E",fachhochschulen,10.1093/cercor/bhx033,https://doi.org/10.1093/cercor/bhx033,http://doc.rero.ch/record/333126/files/CERCOR_28_4_1209.pdf,Tracking Training-Related Plasticity by Combining fMRI and DTI: The Right Hemisphere Ventral Stream Mediates Musical Syntax Processing,,"Oechslin, Mathias S;Gschwind, Markus;James, Clara E",2018,Cerebral Cortex,"Faculty of Psychology and Educational Sciences, University of Geneva, Geneva, Switzerland Department of Education and Culture of the Canton of Thurgau, Frauenfeld, Switzerland;Department of Neurology, Geneva University Hospitals, Geneva, Switzerland Department of Neuroscience, Campus Biotech, University of Geneva, Geneva, Switzerland E-mail: markus.gschwind@unige.ch;Faculty of Psychology and Educational Sciences, University of Geneva, Geneva, Switzerland Geneva Neuroscience Center, University of Geneva, Geneva, Switzerland HES-SO University of Applied Sciences and Arts Western Switzerland, School of Health Sciences, Geneva, Switzerland",Oxford University Press,,28,4,1209,1218,1047-3211,1460-2199,copyright,"© The Author 2017. Published by Oxford University Press. All rights reserved. For Permissions, please e-mail: journals.permissions@oup.com",oxford,https://www.swissbib.ch/Search/Results?lookfor=nationallicenceoxford101093cercorbhx033,http://sru.swissbib.ch/sru/search/defaultdb?query=+dc.anywhere+exact+NATIONALLICENCEoxford101093cercorbhx033&operation=searchRetrieve&recordSchema=info%3Asrw%2Fschema%2F1%2Fmarcxml-v1.1-light&maximumRecords=10&startRecord=0&recordPacking=XML&availableDBs=defaultdb&sortKeys=Submit+query,http://sru.swissbib.ch/sru/search/defaultdb?query=+dc.anywhere+exact+NATIONALLICENCEoxford101093cercorbhx033&operation=searchRetrieve&recordSchema=info%3Asrw%2Fschema%2F1%2Fdc-v1.1-light&maximumRecords=10&startRecord=0&recordPacking=XML&availableDBs=defaultdb&sortKeys=Submit+query,http://sru.swissbib.ch/sru/search/defaultdb?query=+dc.anywhere+exact+NATIONALLICENCEoxford101093cercorbhx033&operation=searchRetrieve&recordSchema=info%3Asru%2Fschema%2Fjson&maximumRecords=10&startRecord=0&recordPacking=XML&availableDBs=defaultdb&sortKeys=Submit+query,It was possible to publish this article open access thanks to a Swiss National Licence with the Publisher
