"From HarvestPlus, International Center for Tropical Agriculture (CIAT), Cali, Colombia; the Division of Human Nutrition (IDB and AM-B) and the Cell Biology and Immunology Group (HV), Wageningen University, Wageningen, Netherlands; the Medical Research Council (MRC) International Nutrition Group, London School of Hygiene and Tropical Medicine, London, United Kingdom (HV); MRC Keneba, Keneba, The Gambia (HV); Applied Nutrition Program, Department of Food Technology and Nutrition, University of Nairobi, Nairobi, Kenya (GNKM); the Laboratory for Clinical Chemistry, Meander Medical Center, Amersfoort, Netherlands (AYD); HarvestPlus, International Food Policy Research Institute, Washington, DC (EB); and the Human Nutrition Laboratory, Institute of Food, Nutrition, and Health, Department of Health Sciences and Technology, Swiss Federal Institute of Technology (ETH), Zurich, Switzerland (MBZ). E-mail: elisetalsma@gmail.com","Talsma, Elise Francina",fachhochschulen,10.3945/ajcn.116.135715,https://doi.org/10.3945/ajcn.116.135715,http://doc.rero.ch/record/331926/files/AJCN_104_1_236.pdf,Reply to SA Tanumihardjo et al.,,"Talsma, Elise Francina;Brouwer, Inge D;Verhoef, Hans;Mbera, Gloria Nk;Demir, Ayşe Y;Boy, Erick;Zimmermann, Michael B;Melse-Boonstra, Alida",2016,The American Journal of Clinical Nutrition,"From HarvestPlus, International Center for Tropical Agriculture (CIAT), Cali, Colombia; the Division of Human Nutrition (IDB and AM-B) and the Cell Biology and Immunology Group (HV), Wageningen University, Wageningen, Netherlands; the Medical Research Council (MRC) International Nutrition Group, London School of Hygiene and Tropical Medicine, London, United Kingdom (HV); MRC Keneba, Keneba, The Gambia (HV); Applied Nutrition Program, Department of Food Technology and Nutrition, University of Nairobi, Nairobi, Kenya (GNKM); the Laboratory for Clinical Chemistry, Meander Medical Center, Amersfoort, Netherlands (AYD); HarvestPlus, International Food Policy Research Institute, Washington, DC (EB); and the Human Nutrition Laboratory, Institute of Food, Nutrition, and Health, Department of Health Sciences and Technology, Swiss Federal Institute of Technology (ETH), Zurich, Switzerland (MBZ). E-mail: elisetalsma@gmail.com;From HarvestPlus, International Center for Tropical Agriculture (CIAT), Cali, Colombia; the Division of Human Nutrition (IDB and AM-B) and the Cell Biology and Immunology Group (HV), Wageningen University, Wageningen, Netherlands; the Medical Research Council (MRC) International Nutrition Group, London School of Hygiene and Tropical Medicine, London, United Kingdom (HV); MRC Keneba, Keneba, The Gambia (HV); Applied Nutrition Program, Department of Food Technology and Nutrition, University of Nairobi, Nairobi, Kenya (GNKM); the Laboratory for Clinical Chemistry, Meander Medical Center, Amersfoort, Netherlands (AYD); HarvestPlus, International Food Policy Research Institute, Washington, DC (EB); and the Human Nutrition Laboratory, Institute of Food, Nutrition, and Health, Department of Health Sciences and Technology, Swiss Federal Institute of Technology (ETH), Zurich, Switzerland (MBZ).;From HarvestPlus, International Center for Tropical Agriculture (CIAT), Cali, Colombia; the Division of Human Nutrition (IDB and AM-B) and the Cell Biology and Immunology Group (HV), Wageningen University, Wageningen, Netherlands; the Medical Research Council (MRC) International Nutrition Group, London School of Hygiene and Tropical Medicine, London, United Kingdom (HV); MRC Keneba, Keneba, The Gambia (HV); Applied Nutrition Program, Department of Food Technology and Nutrition, University of Nairobi, Nairobi, Kenya (GNKM); the Laboratory for Clinical Chemistry, Meander Medical Center, Amersfoort, Netherlands (AYD); HarvestPlus, International Food Policy Research Institute, Washington, DC (EB); and the Human Nutrition Laboratory, Institute of Food, Nutrition, and Health, Department of Health Sciences and Technology, Swiss Federal Institute of Technology (ETH), Zurich, Switzerland (MBZ).;From HarvestPlus, International Center for Tropical Agriculture (CIAT), Cali, Colombia; the Division of Human Nutrition (IDB and AM-B) and the Cell Biology and Immunology Group (HV), Wageningen University, Wageningen, Netherlands; the Medical Research Council (MRC) International Nutrition Group, London School of Hygiene and Tropical Medicine, London, United Kingdom (HV); MRC Keneba, Keneba, The Gambia (HV); Applied Nutrition Program, Department of Food Technology and Nutrition, University of Nairobi, Nairobi, Kenya (GNKM); the Laboratory for Clinical Chemistry, Meander Medical Center, Amersfoort, Netherlands (AYD); HarvestPlus, International Food Policy Research Institute, Washington, DC (EB); and the Human Nutrition Laboratory, Institute of Food, Nutrition, and Health, Department of Health Sciences and Technology, Swiss Federal Institute of Technology (ETH), Zurich, Switzerland (MBZ).;From HarvestPlus, International Center for Tropical Agriculture (CIAT), Cali, Colombia; the Division of Human Nutrition (IDB and AM-B) and the Cell Biology and Immunology Group (HV), Wageningen University, Wageningen, Netherlands; the Medical Research Council (MRC) International Nutrition Group, London School of Hygiene and Tropical Medicine, London, United Kingdom (HV); MRC Keneba, Keneba, The Gambia (HV); Applied Nutrition Program, Department of Food Technology and Nutrition, University of Nairobi, Nairobi, Kenya (GNKM); the Laboratory for Clinical Chemistry, Meander Medical Center, Amersfoort, Netherlands (AYD); HarvestPlus, International Food Policy Research Institute, Washington, DC (EB); and the Human Nutrition Laboratory, Institute of Food, Nutrition, and Health, Department of Health Sciences and Technology, Swiss Federal Institute of Technology (ETH), Zurich, Switzerland (MBZ).;From HarvestPlus, International Center for Tropical Agriculture (CIAT), Cali, Colombia; the Division of Human Nutrition (IDB and AM-B) and the Cell Biology and Immunology Group (HV), Wageningen University, Wageningen, Netherlands; the Medical Research Council (MRC) International Nutrition Group, London School of Hygiene and Tropical Medicine, London, United Kingdom (HV); MRC Keneba, Keneba, The Gambia (HV); Applied Nutrition Program, Department of Food Technology and Nutrition, University of Nairobi, Nairobi, Kenya (GNKM); the Laboratory for Clinical Chemistry, Meander Medical Center, Amersfoort, Netherlands (AYD); HarvestPlus, International Food Policy Research Institute, Washington, DC (EB); and the Human Nutrition Laboratory, Institute of Food, Nutrition, and Health, Department of Health Sciences and Technology, Swiss Federal Institute of Technology (ETH), Zurich, Switzerland (MBZ).;From HarvestPlus, International Center for Tropical Agriculture (CIAT), Cali, Colombia; the Division of Human Nutrition (IDB and AM-B) and the Cell Biology and Immunology Group (HV), Wageningen University, Wageningen, Netherlands; the Medical Research Council (MRC) International Nutrition Group, London School of Hygiene and Tropical Medicine, London, United Kingdom (HV); MRC Keneba, Keneba, The Gambia (HV); Applied Nutrition Program, Department of Food Technology and Nutrition, University of Nairobi, Nairobi, Kenya (GNKM); the Laboratory for Clinical Chemistry, Meander Medical Center, Amersfoort, Netherlands (AYD); HarvestPlus, International Food Policy Research Institute, Washington, DC (EB); and the Human Nutrition Laboratory, Institute of Food, Nutrition, and Health, Department of Health Sciences and Technology, Swiss Federal Institute of Technology (ETH), Zurich, Switzerland (MBZ).;From HarvestPlus, International Center for Tropical Agriculture (CIAT), Cali, Colombia; the Division of Human Nutrition (IDB and AM-B) and the Cell Biology and Immunology Group (HV), Wageningen University, Wageningen, Netherlands; the Medical Research Council (MRC) International Nutrition Group, London School of Hygiene and Tropical Medicine, London, United Kingdom (HV); MRC Keneba, Keneba, The Gambia (HV); Applied Nutrition Program, Department of Food Technology and Nutrition, University of Nairobi, Nairobi, Kenya (GNKM); the Laboratory for Clinical Chemistry, Meander Medical Center, Amersfoort, Netherlands (AYD); HarvestPlus, International Food Policy Research Institute, Washington, DC (EB); and the Human Nutrition Laboratory, Institute of Food, Nutrition, and Health, Department of Health Sciences and Technology, Swiss Federal Institute of Technology (ETH), Zurich, Switzerland (MBZ).",Oxford University Press,,104,1,236,237,0002-9165,1938-3207,copyright,© 2016 American Society for Nutrition,oxford,https://www.swissbib.ch/Search/Results?lookfor=nationallicenceoxford103945ajcn116135715,http://sru.swissbib.ch/sru/search/defaultdb?query=+dc.anywhere+exact+NATIONALLICENCEoxford103945ajcn116135715&operation=searchRetrieve&recordSchema=info%3Asrw%2Fschema%2F1%2Fmarcxml-v1.1-light&maximumRecords=10&startRecord=0&recordPacking=XML&availableDBs=defaultdb&sortKeys=Submit+query,http://sru.swissbib.ch/sru/search/defaultdb?query=+dc.anywhere+exact+NATIONALLICENCEoxford103945ajcn116135715&operation=searchRetrieve&recordSchema=info%3Asrw%2Fschema%2F1%2Fdc-v1.1-light&maximumRecords=10&startRecord=0&recordPacking=XML&availableDBs=defaultdb&sortKeys=Submit+query,http://sru.swissbib.ch/sru/search/defaultdb?query=+dc.anywhere+exact+NATIONALLICENCEoxford103945ajcn116135715&operation=searchRetrieve&recordSchema=info%3Asru%2Fschema%2Fjson&maximumRecords=10&startRecord=0&recordPacking=XML&availableDBs=defaultdb&sortKeys=Submit+query,It was possible to publish this article open access thanks to a Swiss National Licence with the Publisher
"Department of Human Protein Sciences, University of Geneva, Geneva, Switzerland Swiss Centre for Applied Human Toxicology, Geneva, Switzerland E-mail: olivier.sorg@unige.ch","Sorg, Olivier",fachhochschulen,10.1093/toxsci/kfx179,https://doi.org/10.1093/toxsci/kfx179,http://doc.rero.ch/record/331483/files/TOXSCI_160_2_230.pdf,From the Cover: High Susceptibility of Lrig1 Sebaceous Stem Cells to TCDD in Mice,,"Fontao, Fabienne;Barnes, Laurent;Kaya, Guerkan;Saurat, Jean-Hilaire;Sorg, Olivier",2017,Toxicological Sciences,"Department of Human Protein Sciences, University of Geneva, Geneva, Switzerland;Dermatology Department, University Hospital, Geneva, Switzerland;;Dermatology Department, University Hospital, Geneva, Switzerland;;Swiss Centre for Applied Human Toxicology, Geneva, Switzerland;Department of Human Protein Sciences, University of Geneva, Geneva, Switzerland Swiss Centre for Applied Human Toxicology, Geneva, Switzerland E-mail: olivier.sorg@unige.ch",Oxford University Press,,160,2,230,243,1096-6080,1096-0929,copyright,"© The Author 2017. Published by Oxford University Press on behalf of the Society of Toxicology. All rights reserved. For Permissions, please e-mail: journals.permissions@oup.com",oxford,https://www.swissbib.ch/Search/Results?lookfor=nationallicenceoxford101093toxscikfx179,http://sru.swissbib.ch/sru/search/defaultdb?query=+dc.anywhere+exact+NATIONALLICENCEoxford101093toxscikfx179&operation=searchRetrieve&recordSchema=info%3Asrw%2Fschema%2F1%2Fmarcxml-v1.1-light&maximumRecords=10&startRecord=0&recordPacking=XML&availableDBs=defaultdb&sortKeys=Submit+query,http://sru.swissbib.ch/sru/search/defaultdb?query=+dc.anywhere+exact+NATIONALLICENCEoxford101093toxscikfx179&operation=searchRetrieve&recordSchema=info%3Asrw%2Fschema%2F1%2Fdc-v1.1-light&maximumRecords=10&startRecord=0&recordPacking=XML&availableDBs=defaultdb&sortKeys=Submit+query,http://sru.swissbib.ch/sru/search/defaultdb?query=+dc.anywhere+exact+NATIONALLICENCEoxford101093toxscikfx179&operation=searchRetrieve&recordSchema=info%3Asru%2Fschema%2Fjson&maximumRecords=10&startRecord=0&recordPacking=XML&availableDBs=defaultdb&sortKeys=Submit+query,It was possible to publish this article open access thanks to a Swiss National Licence with the Publisher
"Applied Research and Development Unit, School of Health Sciences Fribourg (HEdS‑FR), University of Applied Sciences and Arts Westrn Switzerland (HES-SO), Route des Cliniques 15, Fribourg, Switzerland Center for the Understanding of Social Processes University of Neuchâtel, Breguet 1, Neuchâtel, Switzerland","Iglesias, Katia",fachhochschulen,10.1093/intqhc/mzy091,https://doi.org/10.1093/intqhc/mzy091,http://doc.rero.ch/record/331070/files/INTQHC_30_10_743.pdf,The use of the Patient Assessment of Chronic Illness Care (PACIC) instrument in diabetes care: a systematic review and meta-analysis,,"Arditi, Chantal;Iglesias, Katia;Peytremann-Bridevaux, Isabelle",2018,International Journal for Quality in Health Care,"Health Care Evaluation Unit (UES), Institute of Social and Preventive Medicine (IUMSP), Lausanne University Hospital, Biopôle 2, Lausanne, Switzerland E-mail: chantal.arditi@chuv.ch;Applied Research and Development Unit, School of Health Sciences Fribourg (HEdS‑FR), University of Applied Sciences and Arts Westrn Switzerland (HES-SO), Route des Cliniques 15, Fribourg, Switzerland Center for the Understanding of Social Processes University of Neuchâtel, Breguet 1, Neuchâtel, Switzerland;Health Care Evaluation Unit (UES), Institute of Social and Preventive Medicine (IUMSP), Lausanne University Hospital, Biopôle 2, Lausanne, Switzerland",Oxford University Press,2021-12-01,30,10,743,750,1353-4505,1464-3677,copyright,"© The Author(s) 2018. Published by Oxford University Press in association with the International Society for Quality in Health Care. All rights reserved. For permissions, please e-mail: journals.permissions@oup.com",oxford,https://www.swissbib.ch/Search/Results?lookfor=nationallicenceoxford101093intqhcmzy091,http://sru.swissbib.ch/sru/search/defaultdb?query=+dc.anywhere+exact+NATIONALLICENCEoxford101093intqhcmzy091&operation=searchRetrieve&recordSchema=info%3Asrw%2Fschema%2F1%2Fmarcxml-v1.1-light&maximumRecords=10&startRecord=0&recordPacking=XML&availableDBs=defaultdb&sortKeys=Submit+query,http://sru.swissbib.ch/sru/search/defaultdb?query=+dc.anywhere+exact+NATIONALLICENCEoxford101093intqhcmzy091&operation=searchRetrieve&recordSchema=info%3Asrw%2Fschema%2F1%2Fdc-v1.1-light&maximumRecords=10&startRecord=0&recordPacking=XML&availableDBs=defaultdb&sortKeys=Submit+query,http://sru.swissbib.ch/sru/search/defaultdb?query=+dc.anywhere+exact+NATIONALLICENCEoxford101093intqhcmzy091&operation=searchRetrieve&recordSchema=info%3Asru%2Fschema%2Fjson&maximumRecords=10&startRecord=0&recordPacking=XML&availableDBs=defaultdb&sortKeys=Submit+query,It was possible to publish this article open access thanks to a Swiss National Licence with the Publisher
"University of Basel, National Centre of Competence in Research (NCCR) Swiss Etiological Study of Adjustment and Mental Health (sesam), 4055 Basel, Switzerland Zurich University of Applied Sciences, School of Health Professions, 8401 Winterthur, Switzerland","Nast, Irina",fachhochschulen,10.1093/scan/nsw051,https://doi.org/10.1093/scan/nsw051,http://doc.rero.ch/record/332372/files/SCAN_11_9_1460.pdf,Maternal adversities during pregnancy and cord blood oxytocin receptor (OXTR) DNA methylation,,"Unternaehrer, Eva;Bolten, Margarete;Nast, Irina;Staehli, Simon;Meyer, Andrea H.;Dempster, Emma;Hellhammer, Dirk H.;Lieb, Roselind;Meinlschmidt, Gunther",2016,Social Cognitive and Affective Neuroscience,"University of Basel, Department of Psychology, Division of Clinical Psychology and Epidemiology, 4055 Basel, Switzerland University of Basel, National Centre of Competence in Research (NCCR) Swiss Etiological Study of Adjustment and Mental Health (sesam), 4055 Basel, Switzerland Douglas Mental Health University Institute, McGill University, 6875 La Salle Boulevard, Montreal, QC H4H 1R3, Canada;University of Basel, Child and Adolescent Psychiatric Hospital, 4058 Basel, Switzerland Ludwig-Maximilians-University Munich, Department of Psychology, 80802 Munich, Germany;University of Basel, National Centre of Competence in Research (NCCR) Swiss Etiological Study of Adjustment and Mental Health (sesam), 4055 Basel, Switzerland Zurich University of Applied Sciences, School of Health Professions, 8401 Winterthur, Switzerland;University of Trier, Institute of Psychobiology, 54296 Trier, Germany;University of Basel, Department of Psychology, Division of Clinical Psychology and Epidemiology, 4055 Basel, Switzerland;University of Exeter Medical School, Exeter EX1 2LU, UK;Institute for Stress Medicine Trier, 54295 Trier, Germany;University of Basel, Department of Psychology, Division of Clinical Psychology and Epidemiology, 4055 Basel, Switzerland University of Basel, National Centre of Competence in Research (NCCR) Swiss Etiological Study of Adjustment and Mental Health (sesam), 4055 Basel, Switzerland;University of Basel, Department of Psychology, Division of Clinical Psychology and Epidemiology, 4055 Basel, Switzerland University of Basel, National Centre of Competence in Research (NCCR) Swiss Etiological Study of Adjustment and Mental Health (sesam), 4055 Basel, Switzerland Ruhr-University Bochum, Faculty of Medicine, Universitaetsstrasse 150, 44801 Bochum, Germany E-mail: gunther.meinlschmidt@unibas.ch",Oxford University Press,,11,9,1460,1470,1749-5016,1749-5024,copyright,© The Author(s) (2016). Published by Oxford University Press.,oxford,https://www.swissbib.ch/Search/Results?lookfor=nationallicenceoxford101093scannsw051,http://sru.swissbib.ch/sru/search/defaultdb?query=+dc.anywhere+exact+NATIONALLICENCEoxford101093scannsw051&operation=searchRetrieve&recordSchema=info%3Asrw%2Fschema%2F1%2Fmarcxml-v1.1-light&maximumRecords=10&startRecord=0&recordPacking=XML&availableDBs=defaultdb&sortKeys=Submit+query,http://sru.swissbib.ch/sru/search/defaultdb?query=+dc.anywhere+exact+NATIONALLICENCEoxford101093scannsw051&operation=searchRetrieve&recordSchema=info%3Asrw%2Fschema%2F1%2Fdc-v1.1-light&maximumRecords=10&startRecord=0&recordPacking=XML&availableDBs=defaultdb&sortKeys=Submit+query,http://sru.swissbib.ch/sru/search/defaultdb?query=+dc.anywhere+exact+NATIONALLICENCEoxford101093scannsw051&operation=searchRetrieve&recordSchema=info%3Asru%2Fschema%2Fjson&maximumRecords=10&startRecord=0&recordPacking=XML&availableDBs=defaultdb&sortKeys=Submit+query,It was possible to publish this article open access thanks to a Swiss National Licence with the Publisher
"Department of Clinical Nutrition, College of Applied Medical Sciences, Umm Al-Qura University, Mecca, Saudi Arabia Metabolic Medicine Research Unit, Division of Medicine, Imperial College London, Hammersmith Hospital, London, United Kingdom","Al Essimii, Haya",fachhochschulen,10.1093/ajcn/nqy040,https://doi.org/10.1093/ajcn/nqy040,http://doc.rero.ch/record/331475/files/AJCN_108_1_101.pdf,Pregnancy loss of control over eating: a longitudinal study of maternal and child outcomes,,"Micali, Nadia;Al Essimii, Haya;Field, Alison E;Treasure, Janet",2018,The American Journal of Clinical Nutrition,"Department of Psychiatry, Faculty of Medicine, University of Geneva, Geneva, Switzerland Great Ormond Street Institute of Child Health, Child and Adolescent Mental Health, Palliative Care and Pediatrics Section, University College London, London, United Kingdom Department of Psychiatry, Icahn School of Medicine at Mount Sinai, New York, NY Service de Psychiatrie de l'enfant et de l'adolescent, Department of Children and Adolescents (DEA), University Hospital of Geneva (HUG), Geneva, Switzerland E-mail: nadia.micali@unige.ch;Department of Clinical Nutrition, College of Applied Medical Sciences, Umm Al-Qura University, Mecca, Saudi Arabia Metabolic Medicine Research Unit, Division of Medicine, Imperial College London, Hammersmith Hospital, London, United Kingdom;Department of Epidemiology, Brown University School of Public Health, Providence, RI Department of Pediatrics, Warren Alpert School of Medicine of Brown University, Providence, RI;Department of Psychological Medicine, Institute of Psychiatry, Psychology and Neurosciences, King's College London, London, United Kingdom",Oxford University Press,,108,1,101,107,0002-9165,1938-3207,copyright,© 2018 American Society for Nutrition.,oxford,https://www.swissbib.ch/Search/Results?lookfor=nationallicenceoxford101093ajcnnqy040,http://sru.swissbib.ch/sru/search/defaultdb?query=+dc.anywhere+exact+NATIONALLICENCEoxford101093ajcnnqy040&operation=searchRetrieve&recordSchema=info%3Asrw%2Fschema%2F1%2Fmarcxml-v1.1-light&maximumRecords=10&startRecord=0&recordPacking=XML&availableDBs=defaultdb&sortKeys=Submit+query,http://sru.swissbib.ch/sru/search/defaultdb?query=+dc.anywhere+exact+NATIONALLICENCEoxford101093ajcnnqy040&operation=searchRetrieve&recordSchema=info%3Asrw%2Fschema%2F1%2Fdc-v1.1-light&maximumRecords=10&startRecord=0&recordPacking=XML&availableDBs=defaultdb&sortKeys=Submit+query,http://sru.swissbib.ch/sru/search/defaultdb?query=+dc.anywhere+exact+NATIONALLICENCEoxford101093ajcnnqy040&operation=searchRetrieve&recordSchema=info%3Asru%2Fschema%2Fjson&maximumRecords=10&startRecord=0&recordPacking=XML&availableDBs=defaultdb&sortKeys=Submit+query,It was possible to publish this article open access thanks to a Swiss National Licence with the Publisher
