"Department of Neurosurgery, Spine Center, Schulthess Clinic, Lengghalde 2, 8008, Zurich, Switzerland E-mail: JanKarl.Burkhardt@gmail.com","Burkhardt, Jan-Karl",,10.1007/s00586-014-3456-y,https://doi.org/10.1007/s00586-014-3456-y,,The influence of cervical plate fixation with either autologous bone or cage insertion on radiographic and patient-rated outcomes after two-level anterior cervical discectomy and fusion,,"Burkhardt, Jan-Karl;Mannion, Anne F.;Marbacher, Serge;Kleinstück, Frank S.;Jeszenszky, Dezsö;Porchet, François",2015,European Spine Journal,"Department of Neurosurgery, Spine Center, Schulthess Clinic, Lengghalde 2, 8008, Zurich, Switzerland E-mail: JanKarl.Burkhardt@gmail.com;Department of Research and Development, Spine Center, Schulthess Clinic, Zurich, Switzerland;Department of Neurosurgery, Spine Center, Schulthess Clinic, Lengghalde 2, 8008, Zurich, Switzerland;Department of Orthopedic Surgery, Spine Center, Schulthess Clinic, Zurich, Switzerland;Department of Orthopedic Surgery, Spine Center, Schulthess Clinic, Zurich, Switzerland;Department of Neurosurgery, Spine Center, Schulthess Clinic, Lengghalde 2, 8008, Zurich, Switzerland",Springer Berlin Heidelberg,,24,1,113,119,0940-6719,1432-0932,copyright,"Springer-Verlag Berlin Heidelberg, 2014",springer,https://www.swissbib.ch/Search/Results?lookfor=nationallicencespringer101007s005860143456y,http://sru.swissbib.ch/sru/search/defaultdb?query=+dc.anywhere+exact+NATIONALLICENCEspringer101007s005860143456y&operation=searchRetrieve&recordSchema=info%3Asrw%2Fschema%2F1%2Fmarcxml-v1.1-light&maximumRecords=10&startRecord=0&recordPacking=XML&availableDBs=defaultdb&sortKeys=Submit+query,http://sru.swissbib.ch/sru/search/defaultdb?query=+dc.anywhere+exact+NATIONALLICENCEspringer101007s005860143456y&operation=searchRetrieve&recordSchema=info%3Asrw%2Fschema%2F1%2Fdc-v1.1-light&maximumRecords=10&startRecord=0&recordPacking=XML&availableDBs=defaultdb&sortKeys=Submit+query,http://sru.swissbib.ch/sru/search/defaultdb?query=+dc.anywhere+exact+NATIONALLICENCEspringer101007s005860143456y&operation=searchRetrieve&recordSchema=info%3Asru%2Fschema%2Fjson&maximumRecords=10&startRecord=0&recordPacking=XML&availableDBs=defaultdb&sortKeys=Submit+query,It was possible to publish this article open access thanks to a Swiss National Licence with the Publisher
"Alte Kantonsschule Aarau, Bahnhofstrasse 91, 5001, Aarau, Switzerland E-mail: hb.hunziker@bluewin.ch","Hunziker, Herbert",,10.1007/s00016-014-0153-5,https://doi.org/10.1007/s00016-014-0153-5,,Albert Einstein’s Magic Mountain: An Aarau Education*,,"Hunziker, Herbert",2015,Physics in Perspective,"Alte Kantonsschule Aarau, Bahnhofstrasse 91, 5001, Aarau, Switzerland E-mail: hb.hunziker@bluewin.ch",Springer Basel,,17,1,55,69,1422-6944,1422-6960,copyright,"Springer Basel, 2015",springer,https://www.swissbib.ch/Search/Results?lookfor=nationallicencespringer101007s0001601401535,http://sru.swissbib.ch/sru/search/defaultdb?query=+dc.anywhere+exact+NATIONALLICENCEspringer101007s0001601401535&operation=searchRetrieve&recordSchema=info%3Asrw%2Fschema%2F1%2Fmarcxml-v1.1-light&maximumRecords=10&startRecord=0&recordPacking=XML&availableDBs=defaultdb&sortKeys=Submit+query,http://sru.swissbib.ch/sru/search/defaultdb?query=+dc.anywhere+exact+NATIONALLICENCEspringer101007s0001601401535&operation=searchRetrieve&recordSchema=info%3Asrw%2Fschema%2F1%2Fdc-v1.1-light&maximumRecords=10&startRecord=0&recordPacking=XML&availableDBs=defaultdb&sortKeys=Submit+query,http://sru.swissbib.ch/sru/search/defaultdb?query=+dc.anywhere+exact+NATIONALLICENCEspringer101007s0001601401535&operation=searchRetrieve&recordSchema=info%3Asru%2Fschema%2Fjson&maximumRecords=10&startRecord=0&recordPacking=XML&availableDBs=defaultdb&sortKeys=Submit+query,It was possible to publish this article open access thanks to a Swiss National Licence with the Publisher
"Natural History Museum Geneva, 1 Route de Malagnou, 1208, Geneva, Switzerland E-mail: edwin.gnos@ville-ge.ch","Gnos, Edwin",,10.1007/s00015-015-0178-z,https://doi.org/10.1007/s00015-015-0178-z,,Age of cleft monazites in the eastern Tauern Window: constraints on crystallization conditions of hydrothermal monazite,,"Gnos, Edwin;Janots, Emilie;Berger, Alfons;Whitehouse, Martin;Walter, Franz;Pettke, Thomas;Bergemann, Christian",2015,Swiss Journal of Geosciences,"Natural History Museum Geneva, 1 Route de Malagnou, 1208, Geneva, Switzerland E-mail: edwin.gnos@ville-ge.ch;ISTerre, 1381 Rue de la Piscine, 38041, Grenoble, France;Institut für Geologie, Baltzerstrasse 1 + 3, 3012, Bern, Switzerland;Swedish Museum of Natural History, Box 50007, 104-05, Stockholm, Sweden;Institut für Erdwissenschaften, Karl-Franzens-Universität, Universitätsplatz 2, 8010, Graz, Austria;Institut für Geologie, Baltzerstrasse 1 + 3, 3012, Bern, Switzerland;Earth and Environmental Sciences, University of Geneva, Rue de Maraichers 13, 1205, Geneva, Switzerland",Springer Basel,,108,1,55,74,1661-8726,1661-8734,copyright,"Swiss Geological Society, 2015",springer,https://www.swissbib.ch/Search/Results?lookfor=nationallicencespringer101007s000150150178z,http://sru.swissbib.ch/sru/search/defaultdb?query=+dc.anywhere+exact+NATIONALLICENCEspringer101007s000150150178z&operation=searchRetrieve&recordSchema=info%3Asrw%2Fschema%2F1%2Fmarcxml-v1.1-light&maximumRecords=10&startRecord=0&recordPacking=XML&availableDBs=defaultdb&sortKeys=Submit+query,http://sru.swissbib.ch/sru/search/defaultdb?query=+dc.anywhere+exact+NATIONALLICENCEspringer101007s000150150178z&operation=searchRetrieve&recordSchema=info%3Asrw%2Fschema%2F1%2Fdc-v1.1-light&maximumRecords=10&startRecord=0&recordPacking=XML&availableDBs=defaultdb&sortKeys=Submit+query,http://sru.swissbib.ch/sru/search/defaultdb?query=+dc.anywhere+exact+NATIONALLICENCEspringer101007s000150150178z&operation=searchRetrieve&recordSchema=info%3Asru%2Fschema%2Fjson&maximumRecords=10&startRecord=0&recordPacking=XML&availableDBs=defaultdb&sortKeys=Submit+query,It was possible to publish this article open access thanks to a Swiss National Licence with the Publisher
"Federal Office of Topography swisstopo, Wabern, Switzerland E-mail: alain.morard@swisstopo.ch","Morard, Alain",,10.1007/s00015-015-0198-8,https://doi.org/10.1007/s00015-015-0198-8,,The Oxfordian/Kimmeridgian stage boundary in Late Jurassic sedimentary rocks of the Swiss Jura range,,"Gygi, Reinhart A.;Morard, Alain",2015,Swiss Journal of Geosciences,"Federal Office of Topography swisstopo, Wabern, Switzerland E-mail: alain.morard@swisstopo.ch",Springer Basel,,108,2-3,201,211,1661-8726,1661-8734,copyright,"Swiss Geological Society, 2015",springer,https://www.swissbib.ch/Search/Results?lookfor=nationallicencespringer101007s0001501501988,http://sru.swissbib.ch/sru/search/defaultdb?query=+dc.anywhere+exact+NATIONALLICENCEspringer101007s0001501501988&operation=searchRetrieve&recordSchema=info%3Asrw%2Fschema%2F1%2Fmarcxml-v1.1-light&maximumRecords=10&startRecord=0&recordPacking=XML&availableDBs=defaultdb&sortKeys=Submit+query,http://sru.swissbib.ch/sru/search/defaultdb?query=+dc.anywhere+exact+NATIONALLICENCEspringer101007s0001501501988&operation=searchRetrieve&recordSchema=info%3Asrw%2Fschema%2F1%2Fdc-v1.1-light&maximumRecords=10&startRecord=0&recordPacking=XML&availableDBs=defaultdb&sortKeys=Submit+query,http://sru.swissbib.ch/sru/search/defaultdb?query=+dc.anywhere+exact+NATIONALLICENCEspringer101007s0001501501988&operation=searchRetrieve&recordSchema=info%3Asru%2Fschema%2Fjson&maximumRecords=10&startRecord=0&recordPacking=XML&availableDBs=defaultdb&sortKeys=Submit+query,It was possible to publish this article open access thanks to a Swiss National Licence with the Publisher
"Hompelistrasse 22, 9008, St. Gallen, Schweiz E-mail: kast@swissonline.ch","Kast, Verena",,10.1007/s00278-015-0007-x,https://doi.org/10.1007/s00278-015-0007-x,,TraumzeitDreamtime,,"Kast, Verena",2015,Psychotherapeut,"Hompelistrasse 22, 9008, St. Gallen, Schweiz E-mail: kast@swissonline.ch",Springer Berlin Heidelberg,,60,2,110,117,0935-6185,1432-2080,copyright,"Springer-Verlag Berlin Heidelberg, 2015",springer,https://www.swissbib.ch/Search/Results?lookfor=nationallicencespringer101007s002780150007x,http://sru.swissbib.ch/sru/search/defaultdb?query=+dc.anywhere+exact+NATIONALLICENCEspringer101007s002780150007x&operation=searchRetrieve&recordSchema=info%3Asrw%2Fschema%2F1%2Fmarcxml-v1.1-light&maximumRecords=10&startRecord=0&recordPacking=XML&availableDBs=defaultdb&sortKeys=Submit+query,http://sru.swissbib.ch/sru/search/defaultdb?query=+dc.anywhere+exact+NATIONALLICENCEspringer101007s002780150007x&operation=searchRetrieve&recordSchema=info%3Asrw%2Fschema%2F1%2Fdc-v1.1-light&maximumRecords=10&startRecord=0&recordPacking=XML&availableDBs=defaultdb&sortKeys=Submit+query,http://sru.swissbib.ch/sru/search/defaultdb?query=+dc.anywhere+exact+NATIONALLICENCEspringer101007s002780150007x&operation=searchRetrieve&recordSchema=info%3Asru%2Fschema%2Fjson&maximumRecords=10&startRecord=0&recordPacking=XML&availableDBs=defaultdb&sortKeys=Submit+query,It was possible to publish this article open access thanks to a Swiss National Licence with the Publisher
"Department of Trauma Surgery, Cantonal Hospital Lucerne, Spitalstrasse, 6000, Lucerne, Switzerland E-mail: a-r.brunner@web.de","Brunner, Alexander",,10.1007/s00402-015-2202-1,https://doi.org/10.1007/s00402-015-2202-1,,Is the cortical thickness index a valid parameter to assess bone mineral density in geriatric patients with hip fractures?,,"Baumgärtner, Ralf;Heeren, Nickolaus;Quast, Daniel;Babst, Reto;Brunner, Alexander",2015,Archives of Orthopaedic and Trauma Surgery,"Department of Trauma Surgery, Cantonal Hospital Lucerne, Spitalstrasse, 6000, Lucerne, Switzerland;Department of Trauma Surgery, Cantonal Hospital Lucerne, Spitalstrasse, 6000, Lucerne, Switzerland;Department of Trauma Surgery, Cantonal Hospital Lucerne, Spitalstrasse, 6000, Lucerne, Switzerland;Department of Trauma Surgery, Cantonal Hospital Lucerne, Spitalstrasse, 6000, Lucerne, Switzerland;Department of Trauma Surgery, Cantonal Hospital Lucerne, Spitalstrasse, 6000, Lucerne, Switzerland E-mail: a-r.brunner@web.de",Springer Berlin Heidelberg,,135,6,805,810,0936-8051,1434-3916,copyright,"Springer-Verlag Berlin Heidelberg, 2015",springer,https://www.swissbib.ch/Search/Results?lookfor=nationallicencespringer101007s0040201522021,http://sru.swissbib.ch/sru/search/defaultdb?query=+dc.anywhere+exact+NATIONALLICENCEspringer101007s0040201522021&operation=searchRetrieve&recordSchema=info%3Asrw%2Fschema%2F1%2Fmarcxml-v1.1-light&maximumRecords=10&startRecord=0&recordPacking=XML&availableDBs=defaultdb&sortKeys=Submit+query,http://sru.swissbib.ch/sru/search/defaultdb?query=+dc.anywhere+exact+NATIONALLICENCEspringer101007s0040201522021&operation=searchRetrieve&recordSchema=info%3Asrw%2Fschema%2F1%2Fdc-v1.1-light&maximumRecords=10&startRecord=0&recordPacking=XML&availableDBs=defaultdb&sortKeys=Submit+query,http://sru.swissbib.ch/sru/search/defaultdb?query=+dc.anywhere+exact+NATIONALLICENCEspringer101007s0040201522021&operation=searchRetrieve&recordSchema=info%3Asru%2Fschema%2Fjson&maximumRecords=10&startRecord=0&recordPacking=XML&availableDBs=defaultdb&sortKeys=Submit+query,It was possible to publish this article open access thanks to a Swiss National Licence with the Publisher
"Research and Development, Schulthess Clinic, Lengghalde 2, 8008, Zurich, Switzerland E-mail: laurent.audige@kws.ch","Audigé, Laurent",,10.1007/s00402-015-2322-7,https://doi.org/10.1007/s00402-015-2322-7,,Platelet-rich plasma for chronic lateral epicondylitis: Is one injection sufficient?,,"Glanzmann, Michael C.;Audigé, Laurent",2015,Archives of Orthopaedic and Trauma Surgery,"Upper Extremities, Schulthess Clinic, Lengghalde 2, 8008, Zurich, Switzerland;Research and Development, Schulthess Clinic, Lengghalde 2, 8008, Zurich, Switzerland E-mail: laurent.audige@kws.ch",Springer Berlin Heidelberg,,135,12,1637,1645,0936-8051,1434-3916,copyright,"Springer-Verlag Berlin Heidelberg, 2015",springer,https://www.swissbib.ch/Search/Results?lookfor=nationallicencespringer101007s0040201523227,http://sru.swissbib.ch/sru/search/defaultdb?query=+dc.anywhere+exact+NATIONALLICENCEspringer101007s0040201523227&operation=searchRetrieve&recordSchema=info%3Asrw%2Fschema%2F1%2Fmarcxml-v1.1-light&maximumRecords=10&startRecord=0&recordPacking=XML&availableDBs=defaultdb&sortKeys=Submit+query,http://sru.swissbib.ch/sru/search/defaultdb?query=+dc.anywhere+exact+NATIONALLICENCEspringer101007s0040201523227&operation=searchRetrieve&recordSchema=info%3Asrw%2Fschema%2F1%2Fdc-v1.1-light&maximumRecords=10&startRecord=0&recordPacking=XML&availableDBs=defaultdb&sortKeys=Submit+query,http://sru.swissbib.ch/sru/search/defaultdb?query=+dc.anywhere+exact+NATIONALLICENCEspringer101007s0040201523227&operation=searchRetrieve&recordSchema=info%3Asru%2Fschema%2Fjson&maximumRecords=10&startRecord=0&recordPacking=XML&availableDBs=defaultdb&sortKeys=Submit+query,It was possible to publish this article open access thanks to a Swiss National Licence with the Publisher
"Viszeralchirurgie, St. Claraspital, Kleinriehenstrasse 30, 4016, Basel, Schweiz E-mail: Ralph.Peterli@claraspital.ch","Peterli, R.",,10.1007/s00104-015-0098-5,https://doi.org/10.1007/s00104-015-0098-5,,Management von Komplikationen nach AdipositaschirurgieManagement of complications after bariatric surgery,,"Wölnerhanssen, B.;Peterli, R.",2015,Der Chirurg,"Departement Biomedizin Universitätsspital, Basel, Schweiz;Viszeralchirurgie, St. Claraspital, Kleinriehenstrasse 30, 4016, Basel, Schweiz E-mail: Ralph.Peterli@claraspital.ch",Springer Berlin Heidelberg,,86,12,1114,1120,0009-4722,1433-0385,copyright,"Springer-Verlag Berlin Heidelberg, 2015",springer,https://www.swissbib.ch/Search/Results?lookfor=nationallicencespringer101007s0010401500985,http://sru.swissbib.ch/sru/search/defaultdb?query=+dc.anywhere+exact+NATIONALLICENCEspringer101007s0010401500985&operation=searchRetrieve&recordSchema=info%3Asrw%2Fschema%2F1%2Fmarcxml-v1.1-light&maximumRecords=10&startRecord=0&recordPacking=XML&availableDBs=defaultdb&sortKeys=Submit+query,http://sru.swissbib.ch/sru/search/defaultdb?query=+dc.anywhere+exact+NATIONALLICENCEspringer101007s0010401500985&operation=searchRetrieve&recordSchema=info%3Asrw%2Fschema%2F1%2Fdc-v1.1-light&maximumRecords=10&startRecord=0&recordPacking=XML&availableDBs=defaultdb&sortKeys=Submit+query,http://sru.swissbib.ch/sru/search/defaultdb?query=+dc.anywhere+exact+NATIONALLICENCEspringer101007s0010401500985&operation=searchRetrieve&recordSchema=info%3Asru%2Fschema%2Fjson&maximumRecords=10&startRecord=0&recordPacking=XML&availableDBs=defaultdb&sortKeys=Submit+query,It was possible to publish this article open access thanks to a Swiss National Licence with the Publisher
"Kantonsspital St. Gallen, Standort Flawil, Krankenhausstr. 23, 9230, Flawil, St. Gallen, Schweiz E-mail: letta.claudio@gmx.ch","Letta, C.",,10.1007/s00104-014-2953-1,https://doi.org/10.1007/s00104-014-2953-1,,Eine seltene Differenzialdiagnose der akuten AppendizitisA rare differential diagnosis of acute appendicitis,,"Holtz, A.;Plebani, A.;Talsky, N.;Itin, H.;Letta, C.",2015,Der Chirurg,"Kantonsspital St. Gallen, Standort Flawil, Krankenhausstr. 23, 9230, Flawil, St. Gallen, Schweiz;Kantonsspital St. Gallen, Standort Flawil, Krankenhausstr. 23, 9230, Flawil, St. Gallen, Schweiz;Kantonsspital St. Gallen, Standort Flawil, Krankenhausstr. 23, 9230, Flawil, St. Gallen, Schweiz;Kantonsspital St. Gallen, Standort Flawil, Krankenhausstr. 23, 9230, Flawil, St. Gallen, Schweiz;Kantonsspital St. Gallen, Standort Flawil, Krankenhausstr. 23, 9230, Flawil, St. Gallen, Schweiz E-mail: letta.claudio@gmx.ch",Springer Berlin Heidelberg,,86,8,797,799,0009-4722,1433-0385,copyright,"Springer-Verlag Berlin Heidelberg, 2015",springer,https://www.swissbib.ch/Search/Results?lookfor=nationallicencespringer101007s0010401429531,http://sru.swissbib.ch/sru/search/defaultdb?query=+dc.anywhere+exact+NATIONALLICENCEspringer101007s0010401429531&operation=searchRetrieve&recordSchema=info%3Asrw%2Fschema%2F1%2Fmarcxml-v1.1-light&maximumRecords=10&startRecord=0&recordPacking=XML&availableDBs=defaultdb&sortKeys=Submit+query,http://sru.swissbib.ch/sru/search/defaultdb?query=+dc.anywhere+exact+NATIONALLICENCEspringer101007s0010401429531&operation=searchRetrieve&recordSchema=info%3Asrw%2Fschema%2F1%2Fdc-v1.1-light&maximumRecords=10&startRecord=0&recordPacking=XML&availableDBs=defaultdb&sortKeys=Submit+query,http://sru.swissbib.ch/sru/search/defaultdb?query=+dc.anywhere+exact+NATIONALLICENCEspringer101007s0010401429531&operation=searchRetrieve&recordSchema=info%3Asru%2Fschema%2Fjson&maximumRecords=10&startRecord=0&recordPacking=XML&availableDBs=defaultdb&sortKeys=Submit+query,It was possible to publish this article open access thanks to a Swiss National Licence with the Publisher
"National Research University MPEI, Mexico, Switzerland E-mail: sergey.grigoriev@outlook.com","Grigoriev, S. A.",,10.1134/S1023193515090062,https://doi.org/10.1134/S1023193515090062,,Study of nanostructured electrocatalysts synthesized by the platinum magnetron–ion-beam sputtering onto metallized nanostructured carbonaceous support,,"Grigoriev, S. A.;Fedotov, A. A.;Murzin, V. Yu.;Khramov, E. V.;Zubavichus, Ya. V.;Millet, P.;Lyutikova, E. K.;Martemianov, S. A.;Fateev, V. N.",2015,Russian Journal of Electrochemistry,"National Research University MPEI, Mexico, Switzerland E-mail: sergey.grigoriev@outlook.com;Russian Research Center Kurchatov Institute, pl. Kurchatova 1, 123182, Moscow, Russia;Russian Research Center Kurchatov Institute, pl. Kurchatova 1, 123182, Moscow, Russia Topchiev Institute of petrochemical synthesis, Leninskii prosp. 29, 119991, Moscow, Russia;Russian Research Center Kurchatov Institute, pl. Kurchatova 1, 123182, Moscow, Russia;Russian Research Center Kurchatov Institute, pl. Kurchatova 1, 123182, Moscow, Russia;Paris University Sud-11, CNRS UPR 8182, 91405, Orsay, France;Russian Research Center Kurchatov Institute, pl. Kurchatova 1, 123182, Moscow, Russia;Institut P’, Université de Poitiers, CNRS UPR 3346, avenue R. Pinot, 86022, Poitiers, France;Russian Research Center Kurchatov Institute, pl. Kurchatova 1, 123182, Moscow, Russia",Pleiades Publishing,,51,9,807,819,1023-1935,1608-3342,copyright,"Pleiades Publishing, Ltd., 2015",springer,https://www.swissbib.ch/Search/Results?lookfor=nationallicencespringer101134S1023193515090062,http://sru.swissbib.ch/sru/search/defaultdb?query=+dc.anywhere+exact+NATIONALLICENCEspringer101134S1023193515090062&operation=searchRetrieve&recordSchema=info%3Asrw%2Fschema%2F1%2Fmarcxml-v1.1-light&maximumRecords=10&startRecord=0&recordPacking=XML&availableDBs=defaultdb&sortKeys=Submit+query,http://sru.swissbib.ch/sru/search/defaultdb?query=+dc.anywhere+exact+NATIONALLICENCEspringer101134S1023193515090062&operation=searchRetrieve&recordSchema=info%3Asrw%2Fschema%2F1%2Fdc-v1.1-light&maximumRecords=10&startRecord=0&recordPacking=XML&availableDBs=defaultdb&sortKeys=Submit+query,http://sru.swissbib.ch/sru/search/defaultdb?query=+dc.anywhere+exact+NATIONALLICENCEspringer101134S1023193515090062&operation=searchRetrieve&recordSchema=info%3Asru%2Fschema%2Fjson&maximumRecords=10&startRecord=0&recordPacking=XML&availableDBs=defaultdb&sortKeys=Submit+query,It was possible to publish this article open access thanks to a Swiss National Licence with the Publisher
"Institute for Foot and Ankle Reconstruction Zurich, Kappelistrasse 7, 8002, Zurich, Switzerland E-mail: espinosa@fussinstitut.ch","Espinosa, N.",,10.1007/s00068-015-0590-0,https://doi.org/10.1007/s00068-015-0590-0,,Peroneal tendon dislocation,,"Espinosa, N.;Maurer, M. A.",2015,European Journal of Trauma and Emergency Surgery,"Institute for Foot and Ankle Reconstruction Zurich, Kappelistrasse 7, 8002, Zurich, Switzerland E-mail: espinosa@fussinstitut.ch;Institute for Foot and Ankle Reconstruction Zurich, Kappelistrasse 7, 8002, Zurich, Switzerland",Springer Berlin Heidelberg,,41,6,631,637,1863-9933,1863-9941,copyright,"Springer-Verlag Berlin Heidelberg, 2015",springer,https://www.swissbib.ch/Search/Results?lookfor=nationallicencespringer101007s0006801505900,http://sru.swissbib.ch/sru/search/defaultdb?query=+dc.anywhere+exact+NATIONALLICENCEspringer101007s0006801505900&operation=searchRetrieve&recordSchema=info%3Asrw%2Fschema%2F1%2Fmarcxml-v1.1-light&maximumRecords=10&startRecord=0&recordPacking=XML&availableDBs=defaultdb&sortKeys=Submit+query,http://sru.swissbib.ch/sru/search/defaultdb?query=+dc.anywhere+exact+NATIONALLICENCEspringer101007s0006801505900&operation=searchRetrieve&recordSchema=info%3Asrw%2Fschema%2F1%2Fdc-v1.1-light&maximumRecords=10&startRecord=0&recordPacking=XML&availableDBs=defaultdb&sortKeys=Submit+query,http://sru.swissbib.ch/sru/search/defaultdb?query=+dc.anywhere+exact+NATIONALLICENCEspringer101007s0006801505900&operation=searchRetrieve&recordSchema=info%3Asru%2Fschema%2Fjson&maximumRecords=10&startRecord=0&recordPacking=XML&availableDBs=defaultdb&sortKeys=Submit+query,It was possible to publish this article open access thanks to a Swiss National Licence with the Publisher
"Augenzentrum Olten, Pallas Kliniken, Louis Giroud-Str. 20, 4600, Olten, Schweiz E-mail: helga.reinshagen@email.de","Reinshagen, H.",,10.1007/s00347-014-3213-y,https://doi.org/10.1007/s00347-014-3213-y,,Aktivitäten der Sektion Gewebetransplantation und Biotechnologie der Deutschen Ophthalmologischen GesellschaftActivities of the tissue transplantation and biotechnology section of the German Ophthalmological Society,4. Leistungsbericht 20134. Performance report 2013,"Reinshagen, H.;Boehringer, D.;Seitz, B.;Reinhard, T.",2015,Der Ophthalmologe,"Augenzentrum Olten, Pallas Kliniken, Louis Giroud-Str. 20, 4600, Olten, Schweiz E-mail: helga.reinshagen@email.de;Universitäts-Augenklinik Freiburg, Freiburg, Deutschland;Klinik für Augenheilkunde, Universitätsklinikum des Saarlandes, Homburg/Saar, Deutschland;Universitäts-Augenklinik Freiburg, Freiburg, Deutschland",Springer Berlin Heidelberg,,112,1,70,72,0941-293X,1433-0423,copyright,"Springer-Verlag Berlin Heidelberg, 2015",springer,https://www.swissbib.ch/Search/Results?lookfor=nationallicencespringer101007s003470143213y,http://sru.swissbib.ch/sru/search/defaultdb?query=+dc.anywhere+exact+NATIONALLICENCEspringer101007s003470143213y&operation=searchRetrieve&recordSchema=info%3Asrw%2Fschema%2F1%2Fmarcxml-v1.1-light&maximumRecords=10&startRecord=0&recordPacking=XML&availableDBs=defaultdb&sortKeys=Submit+query,http://sru.swissbib.ch/sru/search/defaultdb?query=+dc.anywhere+exact+NATIONALLICENCEspringer101007s003470143213y&operation=searchRetrieve&recordSchema=info%3Asrw%2Fschema%2F1%2Fdc-v1.1-light&maximumRecords=10&startRecord=0&recordPacking=XML&availableDBs=defaultdb&sortKeys=Submit+query,http://sru.swissbib.ch/sru/search/defaultdb?query=+dc.anywhere+exact+NATIONALLICENCEspringer101007s003470143213y&operation=searchRetrieve&recordSchema=info%3Asru%2Fschema%2Fjson&maximumRecords=10&startRecord=0&recordPacking=XML&availableDBs=defaultdb&sortKeys=Submit+query,It was possible to publish this article open access thanks to a Swiss National Licence with the Publisher
"Global Health Economics, Amgen (Europe) GmbH, Dammstrasse 23, 6301, Zug, Switzerland E-mail: hechmati@amgen.com","Hechmati, Guy",,10.1007/s00520-014-2309-x,https://doi.org/10.1007/s00520-014-2309-x,,"Patients’ preferences for bone metastases treatments in France, Germany and the United Kingdom",,"Hechmati, Guy;Hauber, A. Brett;Arellano, Jorge;Mohamed, Ateesha F.;Qian, Yi;Gatta, Francesca;Haynes, Ian;Bahl, Amit;Von Moos, Roger;Body, Jean-Jacques",2015,Supportive Care in Cancer,"Global Health Economics, Amgen (Europe) GmbH, Dammstrasse 23, 6301, Zug, Switzerland E-mail: hechmati@amgen.com;RTI Health Solutions, Research Triangle Park, Durham, NC, USA;Amgen Inc, Thousand Oaks, CA, USA;RTI Health Solutions, Research Triangle Park, Durham, NC, USA;Amgen Inc, Thousand Oaks, CA, USA;Global Health Economics, Amgen (Europe) GmbH, Dammstrasse 23, 6301, Zug, Switzerland;Amgen Limited, Uxbridge, UK;Bristol Haematology and Oncology Centre, University Hospitals Bristol, Bristol, UK;Medical Oncology, Kantonsspital, Graubünden, Chur, Switzerland;CHUBrugmann, Department of Medicine, Université Libre de Bruxelles, Brussels, Belgium",Springer Berlin Heidelberg,,23,,21,28,0941-4355,1433-7339,copyright,"The Author(s), 2014",springer,https://www.swissbib.ch/Search/Results?lookfor=nationallicencespringer101007s005200142309x,http://sru.swissbib.ch/sru/search/defaultdb?query=+dc.anywhere+exact+NATIONALLICENCEspringer101007s005200142309x&operation=searchRetrieve&recordSchema=info%3Asrw%2Fschema%2F1%2Fmarcxml-v1.1-light&maximumRecords=10&startRecord=0&recordPacking=XML&availableDBs=defaultdb&sortKeys=Submit+query,http://sru.swissbib.ch/sru/search/defaultdb?query=+dc.anywhere+exact+NATIONALLICENCEspringer101007s005200142309x&operation=searchRetrieve&recordSchema=info%3Asrw%2Fschema%2F1%2Fdc-v1.1-light&maximumRecords=10&startRecord=0&recordPacking=XML&availableDBs=defaultdb&sortKeys=Submit+query,http://sru.swissbib.ch/sru/search/defaultdb?query=+dc.anywhere+exact+NATIONALLICENCEspringer101007s005200142309x&operation=searchRetrieve&recordSchema=info%3Asru%2Fschema%2Fjson&maximumRecords=10&startRecord=0&recordPacking=XML&availableDBs=defaultdb&sortKeys=Submit+query,It was possible to publish this article open access thanks to a Swiss National Licence with the Publisher
