"Department of Biosystems Science and Engineering and SIB Swiss Institute of Bioinformatics, CH-4058 Basel, Switzerland","Golumbeanu, Monica",,10.1093/bioinformatics/btv520,https://doi.org/10.1093/bioinformatics/btv520,,BMix: probabilistic modeling of occurring substitutions in PAR-CLIP data,,"Golumbeanu, Monica;Mohammadi, Pejman;Beerenwinkel, Niko",2016,Bioinformatics,"Department of Biosystems Science and Engineering and SIB Swiss Institute of Bioinformatics, CH-4058 Basel, Switzerland;Department of Biosystems Science and Engineering and SIB Swiss Institute of Bioinformatics, CH-4058 Basel, Switzerland;Department of Biosystems Science and Engineering and SIB Swiss Institute of Bioinformatics, CH-4058 Basel, Switzerland *To whom correspondence should be addressed.",Oxford University Press,,32,7,976,983,1367-4803,1460-2059,copyright,"© The Author 2015. Published by Oxford University Press. All rights reserved. For Permissions, please e-mail: journals.permissions@oup.com",oxford,https://www.swissbib.ch/Search/Results?lookfor=nationallicenceoxford101093bioinformaticsbtv520,http://sru.swissbib.ch/sru/search/defaultdb?query=+dc.anywhere+exact+NATIONALLICENCEoxford101093bioinformaticsbtv520&operation=searchRetrieve&recordSchema=info%3Asrw%2Fschema%2F1%2Fmarcxml-v1.1-light&maximumRecords=10&startRecord=0&recordPacking=XML&availableDBs=defaultdb&sortKeys=Submit+query,http://sru.swissbib.ch/sru/search/defaultdb?query=+dc.anywhere+exact+NATIONALLICENCEoxford101093bioinformaticsbtv520&operation=searchRetrieve&recordSchema=info%3Asrw%2Fschema%2F1%2Fdc-v1.1-light&maximumRecords=10&startRecord=0&recordPacking=XML&availableDBs=defaultdb&sortKeys=Submit+query,http://sru.swissbib.ch/sru/search/defaultdb?query=+dc.anywhere+exact+NATIONALLICENCEoxford101093bioinformaticsbtv520&operation=searchRetrieve&recordSchema=info%3Asru%2Fschema%2Fjson&maximumRecords=10&startRecord=0&recordPacking=XML&availableDBs=defaultdb&sortKeys=Submit+query,It was possible to publish this article open access thanks to a Swiss National Licence with the Publisher
"Department of HIV, World Health Organization, Geneva, Switzerland E-mail: fordn@who.int","Ford, Nathan",,10.1093/ije/dyw137,https://doi.org/10.1093/ije/dyw137,,Commentary: Increasing uptake of HIV testing: gifts are good but more is needed,,"Ford, Nathan;Mills, Edward J",2016,International Journal of Epidemiology,"Department of HIV, World Health Organization, Geneva, Switzerland E-mail: fordn@who.int;Precision Global Health, Vancouver, Canada",Oxford University Press,,45,6,2109,2111,0300-5771,1464-3685,copyright,© The Author 2016; all rights reserved. Published by Oxford University Press on behalf of the International Epidemiological Association,oxford,https://www.swissbib.ch/Search/Results?lookfor=nationallicenceoxford101093ijedyw137,http://sru.swissbib.ch/sru/search/defaultdb?query=+dc.anywhere+exact+NATIONALLICENCEoxford101093ijedyw137&operation=searchRetrieve&recordSchema=info%3Asrw%2Fschema%2F1%2Fmarcxml-v1.1-light&maximumRecords=10&startRecord=0&recordPacking=XML&availableDBs=defaultdb&sortKeys=Submit+query,http://sru.swissbib.ch/sru/search/defaultdb?query=+dc.anywhere+exact+NATIONALLICENCEoxford101093ijedyw137&operation=searchRetrieve&recordSchema=info%3Asrw%2Fschema%2F1%2Fdc-v1.1-light&maximumRecords=10&startRecord=0&recordPacking=XML&availableDBs=defaultdb&sortKeys=Submit+query,http://sru.swissbib.ch/sru/search/defaultdb?query=+dc.anywhere+exact+NATIONALLICENCEoxford101093ijedyw137&operation=searchRetrieve&recordSchema=info%3Asru%2Fschema%2Fjson&maximumRecords=10&startRecord=0&recordPacking=XML&availableDBs=defaultdb&sortKeys=Submit+query,It was possible to publish this article open access thanks to a Swiss National Licence with the Publisher
"Daniel P. Stiehl, MD, is Group Head of Data Exploration & Analysis in Discovery and Investigative Safety, Translational Medicine at the Novartis Institutes of Biomedical Research, Novartis Pharma AG in Basel, Switzerland. Elaine Tritto, PhD, is Genomics Expert in Discovery and Investigative Safety, Translational Medicine at the Novartis Institutes of Biomedical Research, Novartis Pharma AG in Basel, Switzerland. Salah-Dine Chibout, PhD, is Global Head of Investigative Safety, Translational Medicine at the Novartis Institutes of Biomedical Research, Novartis Pharma AG in Basel, Switzerland. André Cordier, MD, is Distinguished Scientific Consultant for Discovery and Investigative Safety, Translational Medicine at the Novartis Institutes of Biomedical Research, Novartis Pharma AG in Basel, Switzerland. Pierre Moulin, MD, PhD, is Director of Discovery and Investigative Pathology in Discovery and Investigative Safety, Translational Medicine at the Novartis Institutes of Biomedical Research, Novartis Pharma AG in Basel, Switzerland. E-mail: daniel.stiehl@novatis.com","Stiehl, Daniel P.",,10.1093/ilar/ilx016,https://doi.org/10.1093/ilar/ilx016,,The Utility of Gene Expression Profiling from Tissue Samples to Support Drug Safety Assessments,,"Stiehl, Daniel P.;Tritto, Elaine;Chibout, Salah-Dine;Cordier, André;Moulin, Pierre",2017,ILAR Journal,"Daniel P. Stiehl, MD, is Group Head of Data Exploration & Analysis in Discovery and Investigative Safety, Translational Medicine at the Novartis Institutes of Biomedical Research, Novartis Pharma AG in Basel, Switzerland. Elaine Tritto, PhD, is Genomics Expert in Discovery and Investigative Safety, Translational Medicine at the Novartis Institutes of Biomedical Research, Novartis Pharma AG in Basel, Switzerland. Salah-Dine Chibout, PhD, is Global Head of Investigative Safety, Translational Medicine at the Novartis Institutes of Biomedical Research, Novartis Pharma AG in Basel, Switzerland. André Cordier, MD, is Distinguished Scientific Consultant for Discovery and Investigative Safety, Translational Medicine at the Novartis Institutes of Biomedical Research, Novartis Pharma AG in Basel, Switzerland. Pierre Moulin, MD, PhD, is Director of Discovery and Investigative Pathology in Discovery and Investigative Safety, Translational Medicine at the Novartis Institutes of Biomedical Research, Novartis Pharma AG in Basel, Switzerland. E-mail: daniel.stiehl@novatis.com;Daniel P. Stiehl, MD, is Group Head of Data Exploration & Analysis in Discovery and Investigative Safety, Translational Medicine at the Novartis Institutes of Biomedical Research, Novartis Pharma AG in Basel, Switzerland. Elaine Tritto, PhD, is Genomics Expert in Discovery and Investigative Safety, Translational Medicine at the Novartis Institutes of Biomedical Research, Novartis Pharma AG in Basel, Switzerland. Salah-Dine Chibout, PhD, is Global Head of Investigative Safety, Translational Medicine at the Novartis Institutes of Biomedical Research, Novartis Pharma AG in Basel, Switzerland. André Cordier, MD, is Distinguished Scientific Consultant for Discovery and Investigative Safety, Translational Medicine at the Novartis Institutes of Biomedical Research, Novartis Pharma AG in Basel, Switzerland. Pierre Moulin, MD, PhD, is Director of Discovery and Investigative Pathology in Discovery and Investigative Safety, Translational Medicine at the Novartis Institutes of Biomedical Research, Novartis Pharma AG in Basel, Switzerland.;Daniel P. Stiehl, MD, is Group Head of Data Exploration & Analysis in Discovery and Investigative Safety, Translational Medicine at the Novartis Institutes of Biomedical Research, Novartis Pharma AG in Basel, Switzerland. Elaine Tritto, PhD, is Genomics Expert in Discovery and Investigative Safety, Translational Medicine at the Novartis Institutes of Biomedical Research, Novartis Pharma AG in Basel, Switzerland. Salah-Dine Chibout, PhD, is Global Head of Investigative Safety, Translational Medicine at the Novartis Institutes of Biomedical Research, Novartis Pharma AG in Basel, Switzerland. André Cordier, MD, is Distinguished Scientific Consultant for Discovery and Investigative Safety, Translational Medicine at the Novartis Institutes of Biomedical Research, Novartis Pharma AG in Basel, Switzerland. Pierre Moulin, MD, PhD, is Director of Discovery and Investigative Pathology in Discovery and Investigative Safety, Translational Medicine at the Novartis Institutes of Biomedical Research, Novartis Pharma AG in Basel, Switzerland.;Daniel P. Stiehl, MD, is Group Head of Data Exploration & Analysis in Discovery and Investigative Safety, Translational Medicine at the Novartis Institutes of Biomedical Research, Novartis Pharma AG in Basel, Switzerland. Elaine Tritto, PhD, is Genomics Expert in Discovery and Investigative Safety, Translational Medicine at the Novartis Institutes of Biomedical Research, Novartis Pharma AG in Basel, Switzerland. Salah-Dine Chibout, PhD, is Global Head of Investigative Safety, Translational Medicine at the Novartis Institutes of Biomedical Research, Novartis Pharma AG in Basel, Switzerland. André Cordier, MD, is Distinguished Scientific Consultant for Discovery and Investigative Safety, Translational Medicine at the Novartis Institutes of Biomedical Research, Novartis Pharma AG in Basel, Switzerland. Pierre Moulin, MD, PhD, is Director of Discovery and Investigative Pathology in Discovery and Investigative Safety, Translational Medicine at the Novartis Institutes of Biomedical Research, Novartis Pharma AG in Basel, Switzerland.;Daniel P. Stiehl, MD, is Group Head of Data Exploration & Analysis in Discovery and Investigative Safety, Translational Medicine at the Novartis Institutes of Biomedical Research, Novartis Pharma AG in Basel, Switzerland. Elaine Tritto, PhD, is Genomics Expert in Discovery and Investigative Safety, Translational Medicine at the Novartis Institutes of Biomedical Research, Novartis Pharma AG in Basel, Switzerland. Salah-Dine Chibout, PhD, is Global Head of Investigative Safety, Translational Medicine at the Novartis Institutes of Biomedical Research, Novartis Pharma AG in Basel, Switzerland. André Cordier, MD, is Distinguished Scientific Consultant for Discovery and Investigative Safety, Translational Medicine at the Novartis Institutes of Biomedical Research, Novartis Pharma AG in Basel, Switzerland. Pierre Moulin, MD, PhD, is Director of Discovery and Investigative Pathology in Discovery and Investigative Safety, Translational Medicine at the Novartis Institutes of Biomedical Research, Novartis Pharma AG in Basel, Switzerland. E-mail: daniel.stiehl@novatis.com",Oxford University Press,,58,1,69,79,1084-2020,1930-6180,copyright,"© The Author 2017. Published by Oxford University Press on behalf of the Institute for Laboratory Animal Research. All rights reserved. For permissions, please email: journals.permissions@oup.com",oxford,https://www.swissbib.ch/Search/Results?lookfor=nationallicenceoxford101093ilarilx016,http://sru.swissbib.ch/sru/search/defaultdb?query=+dc.anywhere+exact+NATIONALLICENCEoxford101093ilarilx016&operation=searchRetrieve&recordSchema=info%3Asrw%2Fschema%2F1%2Fmarcxml-v1.1-light&maximumRecords=10&startRecord=0&recordPacking=XML&availableDBs=defaultdb&sortKeys=Submit+query,http://sru.swissbib.ch/sru/search/defaultdb?query=+dc.anywhere+exact+NATIONALLICENCEoxford101093ilarilx016&operation=searchRetrieve&recordSchema=info%3Asrw%2Fschema%2F1%2Fdc-v1.1-light&maximumRecords=10&startRecord=0&recordPacking=XML&availableDBs=defaultdb&sortKeys=Submit+query,http://sru.swissbib.ch/sru/search/defaultdb?query=+dc.anywhere+exact+NATIONALLICENCEoxford101093ilarilx016&operation=searchRetrieve&recordSchema=info%3Asru%2Fschema%2Fjson&maximumRecords=10&startRecord=0&recordPacking=XML&availableDBs=defaultdb&sortKeys=Submit+query,It was possible to publish this article open access thanks to a Swiss National Licence with the Publisher
,,,10.5740/jaoacint.17-0093,https://doi.org/10.5740/jaoacint.17-0093,,"Certified Reference Material for Use in 1H, 31P, and 19F Quantitative NMR, Ensuring Traceability to the International System of Units",,"Rigger, Romana;Rück, Alexander;Hellriegel, Christine;Sauermoser, Robert;Morf, Fabienne;Breitruck, Kathrin;Obkircher, Markus",2017,Journal of AOAC International,"Sigma-Aldrich ProductionGmbH, Industriestrasse 25, 9471 Buchs,Switzerland;Sigma-Aldrich ProductionGmbH, Industriestrasse 25, 9471 Buchs,Switzerland;Sigma-Aldrich ProductionGmbH, Industriestrasse 25, 9471 Buchs,Switzerland;Sigma-Aldrich ProductionGmbH, Industriestrasse 25, 9471 Buchs,Switzerland;Sigma-Aldrich ProductionGmbH, Industriestrasse 25, 9471 Buchs,Switzerland;Sigma-Aldrich ProductionGmbH, Industriestrasse 25, 9471 Buchs,Switzerland;Sigma-Aldrich ProductionGmbH, Industriestrasse 25, 9471 Buchs,Switzerland E-mail: markus.obkircher@sial.com",Oxford University Press,,100,5,1365,1375,1060-3271,1944-7922,copyright,© Journal of AOAC International,oxford,https://www.swissbib.ch/Search/Results?lookfor=nationallicenceoxford105740jaoacint170093,http://sru.swissbib.ch/sru/search/defaultdb?query=+dc.anywhere+exact+NATIONALLICENCEoxford105740jaoacint170093&operation=searchRetrieve&recordSchema=info%3Asrw%2Fschema%2F1%2Fmarcxml-v1.1-light&maximumRecords=10&startRecord=0&recordPacking=XML&availableDBs=defaultdb&sortKeys=Submit+query,http://sru.swissbib.ch/sru/search/defaultdb?query=+dc.anywhere+exact+NATIONALLICENCEoxford105740jaoacint170093&operation=searchRetrieve&recordSchema=info%3Asrw%2Fschema%2F1%2Fdc-v1.1-light&maximumRecords=10&startRecord=0&recordPacking=XML&availableDBs=defaultdb&sortKeys=Submit+query,http://sru.swissbib.ch/sru/search/defaultdb?query=+dc.anywhere+exact+NATIONALLICENCEoxford105740jaoacint170093&operation=searchRetrieve&recordSchema=info%3Asru%2Fschema%2Fjson&maximumRecords=10&startRecord=0&recordPacking=XML&availableDBs=defaultdb&sortKeys=Submit+query,It was possible to publish this article open access thanks to a Swiss National Licence with the Publisher
"Cardiology Department, Kantonsspital St. Gallen, St. Gallen, Switzerland E-mail: Micha.maeder@kssg.ch","Maeder, Micha T",,10.1093/ajh/hpy122,https://doi.org/10.1093/ajh/hpy122,,Resting Heart Rate “Kinetics”: Paradox or Means to Understand the Link Between Hypertension and Heart Failure?,,"Maeder, Micha T;Brenner, Roman",2018,American Journal of Hypertension,"Cardiology Department, Kantonsspital St. Gallen, St. Gallen, Switzerland E-mail: Micha.maeder@kssg.ch;Cardiology Department, Kantonsspital St. Gallen, St. Gallen, Switzerland",Oxford University Press,2021-09-11,31,10,1090,1092,0895-7061,1941-7225,copyright,"© American Journal of Hypertension, Ltd 2018. All rights reserved. For Permissions, please email: journals.permissions@oup.com",oxford,https://www.swissbib.ch/Search/Results?lookfor=nationallicenceoxford101093ajhhpy122,http://sru.swissbib.ch/sru/search/defaultdb?query=+dc.anywhere+exact+NATIONALLICENCEoxford101093ajhhpy122&operation=searchRetrieve&recordSchema=info%3Asrw%2Fschema%2F1%2Fmarcxml-v1.1-light&maximumRecords=10&startRecord=0&recordPacking=XML&availableDBs=defaultdb&sortKeys=Submit+query,http://sru.swissbib.ch/sru/search/defaultdb?query=+dc.anywhere+exact+NATIONALLICENCEoxford101093ajhhpy122&operation=searchRetrieve&recordSchema=info%3Asrw%2Fschema%2F1%2Fdc-v1.1-light&maximumRecords=10&startRecord=0&recordPacking=XML&availableDBs=defaultdb&sortKeys=Submit+query,http://sru.swissbib.ch/sru/search/defaultdb?query=+dc.anywhere+exact+NATIONALLICENCEoxford101093ajhhpy122&operation=searchRetrieve&recordSchema=info%3Asru%2Fschema%2Fjson&maximumRecords=10&startRecord=0&recordPacking=XML&availableDBs=defaultdb&sortKeys=Submit+query,It was possible to publish this article open access thanks to a Swiss National Licence with the Publisher
"Nestlé Institute of Health Sciences, Lausanne, Switzerland","Meyer, Antonin",,10.1093/ajcn/nqy087,https://doi.org/10.1093/ajcn/nqy087,,"Plasma metabolites and lipids predict insulin sensitivity improvement in obese, nondiabetic individuals after a 2-phase dietary intervention",,"Meyer, Antonin;Montastier, Emilie;Hager, Jörg;Saris, Wim H M;Astrup, Arne;Viguerie, Nathalie;Valsesia, Armand",2018,The American Journal of Clinical Nutrition,"Nestlé Institute of Health Sciences, Lausanne, Switzerland;Institut National de la Santé et de la Recherche Médicale (INSERM) Unité 1048, Institute of Metabolic and Cardiovascular Diseases, University of Toulouse, Toulouse, France Department of Clinical Biochemistry and Nutrition, Toulouse University Hospital, Toulouse, France;Nestlé Institute of Health Sciences, Lausanne, Switzerland;Department of Human Biology, School of Nutrition and Translational Research in Metabolism, Maastricht University Medical Centre, Maastricht, Netherlands;Department of Nutrition, Exercise, and Sports, Faculty of Science, University of Copenhagen, Copenhagen, Denmark;Institut National de la Santé et de la Recherche Médicale (INSERM) Unité 1048, Institute of Metabolic and Cardiovascular Diseases, University of Toulouse, Toulouse, France;Nestlé Institute of Health Sciences, Lausanne, Switzerland E-mail: Armand.Valsesia@rd.nestle.com",Oxford University Press,2021-07-01,108,1,13,23,0002-9165,1938-3207,copyright,© 2018 American Society for Nutrition.,oxford,https://www.swissbib.ch/Search/Results?lookfor=nationallicenceoxford101093ajcnnqy087,http://sru.swissbib.ch/sru/search/defaultdb?query=+dc.anywhere+exact+NATIONALLICENCEoxford101093ajcnnqy087&operation=searchRetrieve&recordSchema=info%3Asrw%2Fschema%2F1%2Fmarcxml-v1.1-light&maximumRecords=10&startRecord=0&recordPacking=XML&availableDBs=defaultdb&sortKeys=Submit+query,http://sru.swissbib.ch/sru/search/defaultdb?query=+dc.anywhere+exact+NATIONALLICENCEoxford101093ajcnnqy087&operation=searchRetrieve&recordSchema=info%3Asrw%2Fschema%2F1%2Fdc-v1.1-light&maximumRecords=10&startRecord=0&recordPacking=XML&availableDBs=defaultdb&sortKeys=Submit+query,http://sru.swissbib.ch/sru/search/defaultdb?query=+dc.anywhere+exact+NATIONALLICENCEoxford101093ajcnnqy087&operation=searchRetrieve&recordSchema=info%3Asru%2Fschema%2Fjson&maximumRecords=10&startRecord=0&recordPacking=XML&availableDBs=defaultdb&sortKeys=Submit+query,It was possible to publish this article open access thanks to a Swiss National Licence with the Publisher
"Polio Eradication Department, World Health Organization, Geneva, Switzerland E-mail: macho@who.int","Mach, Ondrej",,10.1093/infdis/jiy389,https://doi.org/10.1093/infdis/jiy389,,Boosting of Mucosal Immunity After Fractional-Dose Inactivated Poliovirus Vaccine,,"Gamage, Deepa;Mach, Ondrej;Palihawadana, Paba;Zhang, Yiting;Weldon, William C;Oberste, M Steven;Gunasena, Sunethra;Sutter, Roland W",2018,The Journal of Infectious Diseases,"Epidemiology Unit, Ministry of Health, Colombo, Sri Lanka;Polio Eradication Department, World Health Organization, Geneva, Switzerland E-mail: macho@who.int;Epidemiology Unit, Ministry of Health, Colombo, Sri Lanka;Division of Viral Diseases, Centers for Disease Control and Prevention, Atlanta, Georgia;Division of Viral Diseases, Centers for Disease Control and Prevention, Atlanta, Georgia;Division of Viral Diseases, Centers for Disease Control and Prevention, Atlanta, Georgia;Medical Research Institute, Colombo, Sri Lanka;Polio Eradication Department, World Health Organization, Geneva, Switzerland",Oxford University Press,2021-11-05,218,12,1876,1882,0022-1899,1537-6613,copyright,"© The Author(s) 2018. Published by Oxford University Press for the Infectious Diseases Society of America. All rights reserved. For permissions, e-mail: journals.permissions@oup.com.",oxford,https://www.swissbib.ch/Search/Results?lookfor=nationallicenceoxford101093infdisjiy389,http://sru.swissbib.ch/sru/search/defaultdb?query=+dc.anywhere+exact+NATIONALLICENCEoxford101093infdisjiy389&operation=searchRetrieve&recordSchema=info%3Asrw%2Fschema%2F1%2Fmarcxml-v1.1-light&maximumRecords=10&startRecord=0&recordPacking=XML&availableDBs=defaultdb&sortKeys=Submit+query,http://sru.swissbib.ch/sru/search/defaultdb?query=+dc.anywhere+exact+NATIONALLICENCEoxford101093infdisjiy389&operation=searchRetrieve&recordSchema=info%3Asrw%2Fschema%2F1%2Fdc-v1.1-light&maximumRecords=10&startRecord=0&recordPacking=XML&availableDBs=defaultdb&sortKeys=Submit+query,http://sru.swissbib.ch/sru/search/defaultdb?query=+dc.anywhere+exact+NATIONALLICENCEoxford101093infdisjiy389&operation=searchRetrieve&recordSchema=info%3Asru%2Fschema%2Fjson&maximumRecords=10&startRecord=0&recordPacking=XML&availableDBs=defaultdb&sortKeys=Submit+query,It was possible to publish this article open access thanks to a Swiss National Licence with the Publisher
"Foundation for Innovative New Diagnostics (FIND), Geneva, Switzerland E-mail: seda.yerlikaya@finddx.org","Yerlikaya, Seda",,10.1093/infdis/jiy150,https://doi.org/10.1093/infdis/jiy150,,"A Systematic Review: Performance of Rapid Diagnostic Tests for the Detection of Plasmodium knowlesi, Plasmodium malariae, and Plasmodium ovale Monoinfections in Human Blood",,"Yerlikaya, Seda;Campillo, Ana;Gonzalez, Iveth J",2018,The Journal of Infectious Diseases,"Foundation for Innovative New Diagnostics (FIND), Geneva, Switzerland E-mail: seda.yerlikaya@finddx.org;Foundation for Innovative New Diagnostics (FIND), Geneva, Switzerland;Foundation for Innovative New Diagnostics (FIND), Geneva, Switzerland",Oxford University Press,2021-06-20,218,2,265,276,0022-1899,1537-6613,copyright,© The Author(s) 2018. Published by Oxford University Press for the Infectious Diseases Society of America.,oxford,https://www.swissbib.ch/Search/Results?lookfor=nationallicenceoxford101093infdisjiy150,http://sru.swissbib.ch/sru/search/defaultdb?query=+dc.anywhere+exact+NATIONALLICENCEoxford101093infdisjiy150&operation=searchRetrieve&recordSchema=info%3Asrw%2Fschema%2F1%2Fmarcxml-v1.1-light&maximumRecords=10&startRecord=0&recordPacking=XML&availableDBs=defaultdb&sortKeys=Submit+query,http://sru.swissbib.ch/sru/search/defaultdb?query=+dc.anywhere+exact+NATIONALLICENCEoxford101093infdisjiy150&operation=searchRetrieve&recordSchema=info%3Asrw%2Fschema%2F1%2Fdc-v1.1-light&maximumRecords=10&startRecord=0&recordPacking=XML&availableDBs=defaultdb&sortKeys=Submit+query,http://sru.swissbib.ch/sru/search/defaultdb?query=+dc.anywhere+exact+NATIONALLICENCEoxford101093infdisjiy150&operation=searchRetrieve&recordSchema=info%3Asru%2Fschema%2Fjson&maximumRecords=10&startRecord=0&recordPacking=XML&availableDBs=defaultdb&sortKeys=Submit+query,It was possible to publish this article open access thanks to a Swiss National Licence with the Publisher
"From the Institute of Animal Breeding and Genetics, University of Veterinary Medicine Vienna, Veterinärplatz 1, 1220 Vienna, Austria (Druml, Neuditschko, Neuhauser, and Brem); Pöckau 41, Arnoldstein, Austria (Grilz-Seger); and Agroscope, Swiss National Stud Farm, Les Longs Pres, Avenches, Switzerland (Neuditschko).","Druml, Thomas",,10.1093/jhered/esx039,https://doi.org/10.1093/jhered/esx039,,Phenotypic and Genetic Analysis of the Leopard Complex Spotting in Noriker Horses,,"Druml, Thomas;Grilz-Seger, Gertrud;Neuditschko, Markus;Neuhauser, Barbara;Brem, Gottfried",2017,Journal Of Heredity,"From the Institute of Animal Breeding and Genetics, University of Veterinary Medicine Vienna, Veterinärplatz 1, 1220 Vienna, Austria (Druml, Neuditschko, Neuhauser, and Brem); Pöckau 41, Arnoldstein, Austria (Grilz-Seger); and Agroscope, Swiss National Stud Farm, Les Longs Pres, Avenches, Switzerland (Neuditschko).;From the Institute of Animal Breeding and Genetics, University of Veterinary Medicine Vienna, Veterinärplatz 1, 1220 Vienna, Austria (Druml, Neuditschko, Neuhauser, and Brem); Pöckau 41, Arnoldstein, Austria (Grilz-Seger); and Agroscope, Swiss National Stud Farm, Les Longs Pres, Avenches, Switzerland (Neuditschko).;From the Institute of Animal Breeding and Genetics, University of Veterinary Medicine Vienna, Veterinärplatz 1, 1220 Vienna, Austria (Druml, Neuditschko, Neuhauser, and Brem); Pöckau 41, Arnoldstein, Austria (Grilz-Seger); and Agroscope, Swiss National Stud Farm, Les Longs Pres, Avenches, Switzerland (Neuditschko).;From the Institute of Animal Breeding and Genetics, University of Veterinary Medicine Vienna, Veterinärplatz 1, 1220 Vienna, Austria (Druml, Neuditschko, Neuhauser, and Brem); Pöckau 41, Arnoldstein, Austria (Grilz-Seger); and Agroscope, Swiss National Stud Farm, Les Longs Pres, Avenches, Switzerland (Neuditschko).;From the Institute of Animal Breeding and Genetics, University of Veterinary Medicine Vienna, Veterinärplatz 1, 1220 Vienna, Austria (Druml, Neuditschko, Neuhauser, and Brem); Pöckau 41, Arnoldstein, Austria (Grilz-Seger); and Agroscope, Swiss National Stud Farm, Les Longs Pres, Avenches, Switzerland (Neuditschko).",Oxford University Press,,108,5,505,514,0022-1503,1465-7333,copyright,"© The American Genetic Association 2017. All rights reserved. For permissions, please e-mail: journals.permissions@oup.com",oxford,https://www.swissbib.ch/Search/Results?lookfor=nationallicenceoxford101093jheredesx039,http://sru.swissbib.ch/sru/search/defaultdb?query=+dc.anywhere+exact+NATIONALLICENCEoxford101093jheredesx039&operation=searchRetrieve&recordSchema=info%3Asrw%2Fschema%2F1%2Fmarcxml-v1.1-light&maximumRecords=10&startRecord=0&recordPacking=XML&availableDBs=defaultdb&sortKeys=Submit+query,http://sru.swissbib.ch/sru/search/defaultdb?query=+dc.anywhere+exact+NATIONALLICENCEoxford101093jheredesx039&operation=searchRetrieve&recordSchema=info%3Asrw%2Fschema%2F1%2Fdc-v1.1-light&maximumRecords=10&startRecord=0&recordPacking=XML&availableDBs=defaultdb&sortKeys=Submit+query,http://sru.swissbib.ch/sru/search/defaultdb?query=+dc.anywhere+exact+NATIONALLICENCEoxford101093jheredesx039&operation=searchRetrieve&recordSchema=info%3Asru%2Fschema%2Fjson&maximumRecords=10&startRecord=0&recordPacking=XML&availableDBs=defaultdb&sortKeys=Submit+query,It was possible to publish this article open access thanks to a Swiss National Licence with the Publisher
