"CABI, Rue des Grillons 1, 2800, Delémont, Switzerland E-mail: r.eschen@cabi.org","Eschen, René",,10.1007/s10530-015-0883-6,https://doi.org/10.1007/s10530-015-0883-6,,Phytosanitary inspection of woody plants for planting at European Union entry points: a practical enquiry,,"Eschen, René;Rigaux, Ludovic;Sukovata, Lidia;Vettraino, Anna Maria;Marzano, Mariella;Grégoire, Jean-Claude",2015,Biological Invasions,"CABI, Rue des Grillons 1, 2800, Delémont, Switzerland E-mail: r.eschen@cabi.org;Lutte biologique et Écologie spatiale, Université Libre de Bruxelles, 50 Avenue FD Roosevelt, 1050, Brussels, Belgium;Forest Protection Department, Forest Research Institute, Braci Lesnej St. 3, Sekocin Stary, 05090, Raszyn, Poland;Department for Innovation in Biological, Agro-Food and Forest Systems (DIBAF), Università degli Studi della Tuscia, Via S. Camillo de Lellis snc, 01100, Viterbo, Italy;Forest Research, Northern Research Station, EH25 9SY, Roslin, Midlothian, UK;Lutte biologique et Écologie spatiale, Université Libre de Bruxelles, 50 Avenue FD Roosevelt, 1050, Brussels, Belgium",Springer International Publishing,,17,8,2403,2413,1387-3547,1573-1464,copyright,"Springer International Publishing Switzerland, 2015",springer,https://www.swissbib.ch/Search/Results?lookfor=nationallicencespringer101007s1053001508836,http://sru.swissbib.ch/sru/search/defaultdb?query=+dc.anywhere+exact+NATIONALLICENCEspringer101007s1053001508836&operation=searchRetrieve&recordSchema=info%3Asrw%2Fschema%2F1%2Fmarcxml-v1.1-light&maximumRecords=10&startRecord=0&recordPacking=XML&availableDBs=defaultdb&sortKeys=Submit+query,http://sru.swissbib.ch/sru/search/defaultdb?query=+dc.anywhere+exact+NATIONALLICENCEspringer101007s1053001508836&operation=searchRetrieve&recordSchema=info%3Asrw%2Fschema%2F1%2Fdc-v1.1-light&maximumRecords=10&startRecord=0&recordPacking=XML&availableDBs=defaultdb&sortKeys=Submit+query,http://sru.swissbib.ch/sru/search/defaultdb?query=+dc.anywhere+exact+NATIONALLICENCEspringer101007s1053001508836&operation=searchRetrieve&recordSchema=info%3Asru%2Fschema%2Fjson&maximumRecords=10&startRecord=0&recordPacking=XML&availableDBs=defaultdb&sortKeys=Submit+query,It was possible to publish this article open access thanks to a Swiss National Licence with the Publisher
"Pallas Kliniken, Bahnhofplatz 4, CH-5000, Aarau, Switzerland E-mail: carsten.meyer@pallas-kliniken.ch","Meyer, Carsten H.",,10.1007/s00417-014-2775-3,https://doi.org/10.1007/s00417-014-2775-3,,"Good News From Switzerland: A History of Retinal Reattachment Surgery Authors: Peter Leaver, Richard Keeler 2013 ISBN: 978-1-85315-993-0 RSM Press",,"Meyer, Carsten H.",2015,Graefe's Archive for Clinical and Experimental Ophthalmology,"Pallas Kliniken, Bahnhofplatz 4, CH-5000, Aarau, Switzerland E-mail: carsten.meyer@pallas-kliniken.ch",Springer Berlin Heidelberg,,253,12,2345,2345,0721-832X,1435-702X,copyright,"Springer-Verlag Berlin Heidelberg, 2014",springer,https://www.swissbib.ch/Search/Results?lookfor=nationallicencespringer101007s0041701427753,http://sru.swissbib.ch/sru/search/defaultdb?query=+dc.anywhere+exact+NATIONALLICENCEspringer101007s0041701427753&operation=searchRetrieve&recordSchema=info%3Asrw%2Fschema%2F1%2Fmarcxml-v1.1-light&maximumRecords=10&startRecord=0&recordPacking=XML&availableDBs=defaultdb&sortKeys=Submit+query,http://sru.swissbib.ch/sru/search/defaultdb?query=+dc.anywhere+exact+NATIONALLICENCEspringer101007s0041701427753&operation=searchRetrieve&recordSchema=info%3Asrw%2Fschema%2F1%2Fdc-v1.1-light&maximumRecords=10&startRecord=0&recordPacking=XML&availableDBs=defaultdb&sortKeys=Submit+query,http://sru.swissbib.ch/sru/search/defaultdb?query=+dc.anywhere+exact+NATIONALLICENCEspringer101007s0041701427753&operation=searchRetrieve&recordSchema=info%3Asru%2Fschema%2Fjson&maximumRecords=10&startRecord=0&recordPacking=XML&availableDBs=defaultdb&sortKeys=Submit+query,It was possible to publish this article open access thanks to a Swiss National Licence with the Publisher
"Department Environmental Systems Science, ETZ Zürich, Brüggliäcker 37, 8050, Zurich, Switzerland E-mail: jph.s@bluewin.ch","Schütz, Jean-Philippe",,10.1007/s10342-015-0865-3,https://doi.org/10.1007/s10342-015-0865-3,,Optimising the yield of Douglas-fir with an appropriate thinning regime,,"Schütz, Jean-Philippe;Ammann, Peter Lukas;Zingg, Andreas",2015,European Journal of Forest Research,"Department Environmental Systems Science, ETZ Zürich, Brüggliäcker 37, 8050, Zurich, Switzerland E-mail: jph.s@bluewin.ch;Swiss Silviculture Competence Center, 3250, Lyss, Switzerland;Swiss Federal Research Institute WSL, 8093, Birmensdorf, Switzerland",Springer Berlin Heidelberg,,134,3,469,480,1612-4669,1612-4677,copyright,"Springer-Verlag Berlin Heidelberg, 2015",springer,https://www.swissbib.ch/Search/Results?lookfor=nationallicencespringer101007s1034201508653,http://sru.swissbib.ch/sru/search/defaultdb?query=+dc.anywhere+exact+NATIONALLICENCEspringer101007s1034201508653&operation=searchRetrieve&recordSchema=info%3Asrw%2Fschema%2F1%2Fmarcxml-v1.1-light&maximumRecords=10&startRecord=0&recordPacking=XML&availableDBs=defaultdb&sortKeys=Submit+query,http://sru.swissbib.ch/sru/search/defaultdb?query=+dc.anywhere+exact+NATIONALLICENCEspringer101007s1034201508653&operation=searchRetrieve&recordSchema=info%3Asrw%2Fschema%2F1%2Fdc-v1.1-light&maximumRecords=10&startRecord=0&recordPacking=XML&availableDBs=defaultdb&sortKeys=Submit+query,http://sru.swissbib.ch/sru/search/defaultdb?query=+dc.anywhere+exact+NATIONALLICENCEspringer101007s1034201508653&operation=searchRetrieve&recordSchema=info%3Asru%2Fschema%2Fjson&maximumRecords=10&startRecord=0&recordPacking=XML&availableDBs=defaultdb&sortKeys=Submit+query,It was possible to publish this article open access thanks to a Swiss National Licence with the Publisher
"Pädiatrische Endokrinologie/Diabetologie, Ostschweizer Kinderspital, St. Gallen, Claudiusstr. 6, 9006, St. Gallen, Schweiz E-mail: dagmar.lallemand@kispisg.ch","L’Allemand, D.",,10.1007/s00129-014-3501-2,https://doi.org/10.1007/s00129-014-3501-2,,Vitamin-D-Mangel in der Schwangerschaft − ein lebenslanges Gesundheitsrisiko für die Kinder?Vitamin D deficiency during pregnancy – a lifelong health risk for children?,Schwangere und Stillende aus Risikogruppen benötigen eine Anpassung der Vitamin-D-SupplementierungGravidae and lactating mothers from risk groups need adjustment of vitamin D supplementation,"L’Allemand, D.",2015,Der Gynäkologe,"Pädiatrische Endokrinologie/Diabetologie, Ostschweizer Kinderspital, St. Gallen, Claudiusstr. 6, 9006, St. Gallen, Schweiz E-mail: dagmar.lallemand@kispisg.ch",Springer Berlin Heidelberg,,48,5,372,376,0017-5994,1433-0393,copyright,"Springer-Verlag Berlin Heidelberg, 2015",springer,https://www.swissbib.ch/Search/Results?lookfor=nationallicencespringer101007s0012901435012,http://sru.swissbib.ch/sru/search/defaultdb?query=+dc.anywhere+exact+NATIONALLICENCEspringer101007s0012901435012&operation=searchRetrieve&recordSchema=info%3Asrw%2Fschema%2F1%2Fmarcxml-v1.1-light&maximumRecords=10&startRecord=0&recordPacking=XML&availableDBs=defaultdb&sortKeys=Submit+query,http://sru.swissbib.ch/sru/search/defaultdb?query=+dc.anywhere+exact+NATIONALLICENCEspringer101007s0012901435012&operation=searchRetrieve&recordSchema=info%3Asrw%2Fschema%2F1%2Fdc-v1.1-light&maximumRecords=10&startRecord=0&recordPacking=XML&availableDBs=defaultdb&sortKeys=Submit+query,http://sru.swissbib.ch/sru/search/defaultdb?query=+dc.anywhere+exact+NATIONALLICENCEspringer101007s0012901435012&operation=searchRetrieve&recordSchema=info%3Asru%2Fschema%2Fjson&maximumRecords=10&startRecord=0&recordPacking=XML&availableDBs=defaultdb&sortKeys=Submit+query,It was possible to publish this article open access thanks to a Swiss National Licence with the Publisher
"Department of CNS-Pharmacology, Actelion Pharmaceuticals Ltd, Gewerbestrasse 16, 4123, Allschwil, Switzerland E-mail: michel.steiner@actelion.com","Steiner, Michel A.",,10.1007/s00213-014-3769-x,https://doi.org/10.1007/s00213-014-3769-x,,Orexin neuropeptides contribute to the development and persistence of generalized avoidance behavior in the rat,,"Viviani, Daniele;Haegler, Patrizia;Jenck, Francois;Steiner, Michel A.",2015,Psychopharmacology,"Department of CNS-Pharmacology, Actelion Pharmaceuticals Ltd, Gewerbestrasse 16, 4123, Allschwil, Switzerland Novartis Pharma Schweiz AG, Monbijoustrasse 118, 3007, Bern, Switzerland;Department of CNS-Pharmacology, Actelion Pharmaceuticals Ltd, Gewerbestrasse 16, 4123, Allschwil, Switzerland Clinical Pharmacology Group, Department of Biomedicine, University Hospital Basel, Hebelstrasse 20, 4031, Basel, Switzerland;Department of CNS-Pharmacology, Actelion Pharmaceuticals Ltd, Gewerbestrasse 16, 4123, Allschwil, Switzerland;Department of CNS-Pharmacology, Actelion Pharmaceuticals Ltd, Gewerbestrasse 16, 4123, Allschwil, Switzerland E-mail: michel.steiner@actelion.com",Springer Berlin Heidelberg,,232,8,1383,1393,0033-3158,1432-2072,copyright,"Springer-Verlag Berlin Heidelberg, 2014",springer,https://www.swissbib.ch/Search/Results?lookfor=nationallicencespringer101007s002130143769x,http://sru.swissbib.ch/sru/search/defaultdb?query=+dc.anywhere+exact+NATIONALLICENCEspringer101007s002130143769x&operation=searchRetrieve&recordSchema=info%3Asrw%2Fschema%2F1%2Fmarcxml-v1.1-light&maximumRecords=10&startRecord=0&recordPacking=XML&availableDBs=defaultdb&sortKeys=Submit+query,http://sru.swissbib.ch/sru/search/defaultdb?query=+dc.anywhere+exact+NATIONALLICENCEspringer101007s002130143769x&operation=searchRetrieve&recordSchema=info%3Asrw%2Fschema%2F1%2Fdc-v1.1-light&maximumRecords=10&startRecord=0&recordPacking=XML&availableDBs=defaultdb&sortKeys=Submit+query,http://sru.swissbib.ch/sru/search/defaultdb?query=+dc.anywhere+exact+NATIONALLICENCEspringer101007s002130143769x&operation=searchRetrieve&recordSchema=info%3Asru%2Fschema%2Fjson&maximumRecords=10&startRecord=0&recordPacking=XML&availableDBs=defaultdb&sortKeys=Submit+query,It was possible to publish this article open access thanks to a Swiss National Licence with the Publisher
"Dufourstr. 169, 8008, Zürich, Schweiz E-mail: wolfgang.roell@me.com","Roell, Wolfgang",,10.1007/s00451-015-0204-9,https://doi.org/10.1007/s00451-015-0204-9,,Zur Beziehung zwischen körperlicher Bewegung und ZeitverständnisThe relationship between body movement and the comprehension of time,,"Roell, Wolfgang",2015,Forum der Psychoanalyse,"Dufourstr. 169, 8008, Zürich, Schweiz E-mail: wolfgang.roell@me.com",Springer Berlin Heidelberg,,31,3,231,238,0178-7667,1437-0751,copyright,"Springer-Verlag Berlin Heidelberg, 2015",springer,https://www.swissbib.ch/Search/Results?lookfor=nationallicencespringer101007s0045101502049,http://sru.swissbib.ch/sru/search/defaultdb?query=+dc.anywhere+exact+NATIONALLICENCEspringer101007s0045101502049&operation=searchRetrieve&recordSchema=info%3Asrw%2Fschema%2F1%2Fmarcxml-v1.1-light&maximumRecords=10&startRecord=0&recordPacking=XML&availableDBs=defaultdb&sortKeys=Submit+query,http://sru.swissbib.ch/sru/search/defaultdb?query=+dc.anywhere+exact+NATIONALLICENCEspringer101007s0045101502049&operation=searchRetrieve&recordSchema=info%3Asrw%2Fschema%2F1%2Fdc-v1.1-light&maximumRecords=10&startRecord=0&recordPacking=XML&availableDBs=defaultdb&sortKeys=Submit+query,http://sru.swissbib.ch/sru/search/defaultdb?query=+dc.anywhere+exact+NATIONALLICENCEspringer101007s0045101502049&operation=searchRetrieve&recordSchema=info%3Asru%2Fschema%2Fjson&maximumRecords=10&startRecord=0&recordPacking=XML&availableDBs=defaultdb&sortKeys=Submit+query,It was possible to publish this article open access thanks to a Swiss National Licence with the Publisher
"Research Institute for Sustainable Humanosphere, Kyoto University, Kyoto, Japan Applied Wood Materials, Swiss Federal Laboratories for Materials Science and Technology, Duebendorf, Switzerland E-mail: cohothu@gmail.com","Ho, Thao Thi Thu",,10.1007/s10570-014-0518-6,https://doi.org/10.1007/s10570-014-0518-6,,Nanofibrillation of pulp fibers by twin-screw extrusion,,"Ho, Thao Thi Thu;Abe, Kentaro;Zimmermann, Tanja;Yano, Hiroyuki",2015,Cellulose,"Research Institute for Sustainable Humanosphere, Kyoto University, Kyoto, Japan Applied Wood Materials, Swiss Federal Laboratories for Materials Science and Technology, Duebendorf, Switzerland E-mail: cohothu@gmail.com;Research Institute for Sustainable Humanosphere, Kyoto University, Kyoto, Japan;Applied Wood Materials, Swiss Federal Laboratories for Materials Science and Technology, Duebendorf, Switzerland;Research Institute for Sustainable Humanosphere, Kyoto University, Kyoto, Japan",Springer Netherlands,,22,1,421,433,0969-0239,1572-882X,copyright,"Springer Science+Business Media Dordrecht, 2014",springer,https://www.swissbib.ch/Search/Results?lookfor=nationallicencespringer101007s1057001405186,http://sru.swissbib.ch/sru/search/defaultdb?query=+dc.anywhere+exact+NATIONALLICENCEspringer101007s1057001405186&operation=searchRetrieve&recordSchema=info%3Asrw%2Fschema%2F1%2Fmarcxml-v1.1-light&maximumRecords=10&startRecord=0&recordPacking=XML&availableDBs=defaultdb&sortKeys=Submit+query,http://sru.swissbib.ch/sru/search/defaultdb?query=+dc.anywhere+exact+NATIONALLICENCEspringer101007s1057001405186&operation=searchRetrieve&recordSchema=info%3Asrw%2Fschema%2F1%2Fdc-v1.1-light&maximumRecords=10&startRecord=0&recordPacking=XML&availableDBs=defaultdb&sortKeys=Submit+query,http://sru.swissbib.ch/sru/search/defaultdb?query=+dc.anywhere+exact+NATIONALLICENCEspringer101007s1057001405186&operation=searchRetrieve&recordSchema=info%3Asru%2Fschema%2Fjson&maximumRecords=10&startRecord=0&recordPacking=XML&availableDBs=defaultdb&sortKeys=Submit+query,It was possible to publish this article open access thanks to a Swiss National Licence with the Publisher
"Division of Infectious Diseases and Hospital Epidemiology, Kantonsspital St. Gallen, Rorschacherstrasse 95, 9007, St. Gallen, Switzerland E-mail: Werner.albrich@kssg.ch","Albrich, Werner C.",,10.1007/s00134-015-3978-8,https://doi.org/10.1007/s00134-015-3978-8,,Pros and cons of using biomarkers versus clinical decisions in start and stop decisions for antibiotics in the critical care setting,,"Albrich, Werner C.;Harbarth, Stephan",2015,Intensive Care Medicine,"Division of Infectious Diseases and Hospital Epidemiology, Kantonsspital St. Gallen, Rorschacherstrasse 95, 9007, St. Gallen, Switzerland E-mail: Werner.albrich@kssg.ch;Division of Infectious Diseases and Hospital Epidemiology, Faculty of Medicine, Geneva University Hospitals, Geneva, Switzerland E-mail: Stephan.harbarth@hcuge.ch",Springer Berlin Heidelberg,,41,10,1739,1751,0342-4642,1432-1238,copyright,"Springer-Verlag Berlin Heidelberg and ESICM, 2015",springer,https://www.swissbib.ch/Search/Results?lookfor=nationallicencespringer101007s0013401539788,http://sru.swissbib.ch/sru/search/defaultdb?query=+dc.anywhere+exact+NATIONALLICENCEspringer101007s0013401539788&operation=searchRetrieve&recordSchema=info%3Asrw%2Fschema%2F1%2Fmarcxml-v1.1-light&maximumRecords=10&startRecord=0&recordPacking=XML&availableDBs=defaultdb&sortKeys=Submit+query,http://sru.swissbib.ch/sru/search/defaultdb?query=+dc.anywhere+exact+NATIONALLICENCEspringer101007s0013401539788&operation=searchRetrieve&recordSchema=info%3Asrw%2Fschema%2F1%2Fdc-v1.1-light&maximumRecords=10&startRecord=0&recordPacking=XML&availableDBs=defaultdb&sortKeys=Submit+query,http://sru.swissbib.ch/sru/search/defaultdb?query=+dc.anywhere+exact+NATIONALLICENCEspringer101007s0013401539788&operation=searchRetrieve&recordSchema=info%3Asru%2Fschema%2Fjson&maximumRecords=10&startRecord=0&recordPacking=XML&availableDBs=defaultdb&sortKeys=Submit+query,It was possible to publish this article open access thanks to a Swiss National Licence with the Publisher
"Gelenkzentrum Zürich, Toblerstrasse 51, 8044, Zürich, Schweiz E-mail: vonknoch@gelenkzentrum.com","Von Knoch, F.",,10.1007/s00132-015-3127-7,https://doi.org/10.1007/s00132-015-3127-7,,Mediale Gonarthrose mit juxtaartikulärer tibialer Varusdeformität,Kombinierte unikondyläre Kniearthroplastik und aufklappende hohe Tibiaosteotomie. Videobeitrag,"Drobny, L.;Preiss, S.;Harder, L.;Von Knoch, F.",2015,Der Orthopäde,"Schulthess Klinik Zürich, Zürich, Schweiz;Schulthess Klinik Zürich, Zürich, Schweiz;Schulthess Klinik Zürich, Zürich, Schweiz;Gelenkzentrum Zürich, Toblerstrasse 51, 8044, Zürich, Schweiz E-mail: vonknoch@gelenkzentrum.com",Springer Berlin Heidelberg,,44,8,595,598,0085-4530,1433-0431,copyright,"Springer-Verlag Berlin Heidelberg, 2015",springer,https://www.swissbib.ch/Search/Results?lookfor=nationallicencespringer101007s0013201531277,http://sru.swissbib.ch/sru/search/defaultdb?query=+dc.anywhere+exact+NATIONALLICENCEspringer101007s0013201531277&operation=searchRetrieve&recordSchema=info%3Asrw%2Fschema%2F1%2Fmarcxml-v1.1-light&maximumRecords=10&startRecord=0&recordPacking=XML&availableDBs=defaultdb&sortKeys=Submit+query,http://sru.swissbib.ch/sru/search/defaultdb?query=+dc.anywhere+exact+NATIONALLICENCEspringer101007s0013201531277&operation=searchRetrieve&recordSchema=info%3Asrw%2Fschema%2F1%2Fdc-v1.1-light&maximumRecords=10&startRecord=0&recordPacking=XML&availableDBs=defaultdb&sortKeys=Submit+query,http://sru.swissbib.ch/sru/search/defaultdb?query=+dc.anywhere+exact+NATIONALLICENCEspringer101007s0013201531277&operation=searchRetrieve&recordSchema=info%3Asru%2Fschema%2Fjson&maximumRecords=10&startRecord=0&recordPacking=XML&availableDBs=defaultdb&sortKeys=Submit+query,It was possible to publish this article open access thanks to a Swiss National Licence with the Publisher
"Study Center Gerzensee, Dorfstrasse 2, P.O. Box 21, 3115, Gerzensee, Switzerland E-mail: nils.herger@szgerzensee.ch","Herger, Nils",,10.1007/s11079-014-9331-y,https://doi.org/10.1007/s11079-014-9331-y,,Market Entries and Exits and the Nonlinear Behaviour of the Exchange Rate Pass-Through into Import Prices,,"Herger, Nils",2015,Open Economies Review,"Study Center Gerzensee, Dorfstrasse 2, P.O. Box 21, 3115, Gerzensee, Switzerland E-mail: nils.herger@szgerzensee.ch",Springer US; http://www.springer-ny.com,,26,2,313,332,0923-7992,1573-708X,copyright,"Springer Science+Business Media New York, 2014",springer,https://www.swissbib.ch/Search/Results?lookfor=nationallicencespringer101007s110790149331y,http://sru.swissbib.ch/sru/search/defaultdb?query=+dc.anywhere+exact+NATIONALLICENCEspringer101007s110790149331y&operation=searchRetrieve&recordSchema=info%3Asrw%2Fschema%2F1%2Fmarcxml-v1.1-light&maximumRecords=10&startRecord=0&recordPacking=XML&availableDBs=defaultdb&sortKeys=Submit+query,http://sru.swissbib.ch/sru/search/defaultdb?query=+dc.anywhere+exact+NATIONALLICENCEspringer101007s110790149331y&operation=searchRetrieve&recordSchema=info%3Asrw%2Fschema%2F1%2Fdc-v1.1-light&maximumRecords=10&startRecord=0&recordPacking=XML&availableDBs=defaultdb&sortKeys=Submit+query,http://sru.swissbib.ch/sru/search/defaultdb?query=+dc.anywhere+exact+NATIONALLICENCEspringer101007s110790149331y&operation=searchRetrieve&recordSchema=info%3Asru%2Fschema%2Fjson&maximumRecords=10&startRecord=0&recordPacking=XML&availableDBs=defaultdb&sortKeys=Submit+query,It was possible to publish this article open access thanks to a Swiss National Licence with the Publisher
"Chinese Ministry of Agriculture - CABI Joint Laboratory for Biosafety, Institute of Plant Protection, Chinese Academy of Agricultural Sciences, Yuanmingyuan Western Road 2, 100193, Beijing, People’s Republic of China CABI, Rue des Grillons 1, 2800, Delémont, Switzerland E-mail: s.toepfer@cabi.org","Toepfer, Stefan",,10.1007/s10340-014-0575-5,https://doi.org/10.1007/s10340-014-0575-5,,Field survival analyses of adult Diabrotica virgifera virgifera (Coleoptera: Chrysomelidae),,"Toepfer, Stefan;Zellner, Michael;Szalai, Mark;Kuhlmann, Ulrich",2015,Journal of Pest Science,"Chinese Ministry of Agriculture - CABI Joint Laboratory for Biosafety, Institute of Plant Protection, Chinese Academy of Agricultural Sciences, Yuanmingyuan Western Road 2, 100193, Beijing, People’s Republic of China CABI, Rue des Grillons 1, 2800, Delémont, Switzerland E-mail: s.toepfer@cabi.org;Bavarian State Research Centre for Agriculture, Lange Point 10, 85354, Freising, Germany E-mail: michael.zellner@lfl.bayern.de;Plant Protection Institute, Szent Istvan University, Pater K. u. 1, 2100, Godollo, Hungary E-mail: szalai.mark@mkk.szie.hu;CABI, Rue des Grillons 1, 2800, Delémont, Switzerland E-mail: u.kuhlmann@cabi.org",Springer Berlin Heidelberg,,88,1,25,35,1612-4758,1612-4766,copyright,"Springer-Verlag Berlin Heidelberg, 2014",springer,https://www.swissbib.ch/Search/Results?lookfor=nationallicencespringer101007s1034001405755,http://sru.swissbib.ch/sru/search/defaultdb?query=+dc.anywhere+exact+NATIONALLICENCEspringer101007s1034001405755&operation=searchRetrieve&recordSchema=info%3Asrw%2Fschema%2F1%2Fmarcxml-v1.1-light&maximumRecords=10&startRecord=0&recordPacking=XML&availableDBs=defaultdb&sortKeys=Submit+query,http://sru.swissbib.ch/sru/search/defaultdb?query=+dc.anywhere+exact+NATIONALLICENCEspringer101007s1034001405755&operation=searchRetrieve&recordSchema=info%3Asrw%2Fschema%2F1%2Fdc-v1.1-light&maximumRecords=10&startRecord=0&recordPacking=XML&availableDBs=defaultdb&sortKeys=Submit+query,http://sru.swissbib.ch/sru/search/defaultdb?query=+dc.anywhere+exact+NATIONALLICENCEspringer101007s1034001405755&operation=searchRetrieve&recordSchema=info%3Asru%2Fschema%2Fjson&maximumRecords=10&startRecord=0&recordPacking=XML&availableDBs=defaultdb&sortKeys=Submit+query,It was possible to publish this article open access thanks to a Swiss National Licence with the Publisher
"CABI, Rue des Grillons 1, 2800, Delémont, Switzerland MoA-CABI Joint Laboratory for Biosafety, 2 Yuanmingyuan West Road, 100193, Beijing, China E-mail: t.haye@cabi.org","Haye, T.",,10.1007/s10340-015-0671-1,https://doi.org/10.1007/s10340-015-0671-1,,"Can native egg parasitoids adopt the invasive brown marmorated stink bug, Halyomorpha halys (Heteroptera: Pentatomidae), in Europe?",,"Haye, T.;Fischer, S.;Zhang, J.;Gariepy, T.",2015,Journal of Pest Science,"CABI, Rue des Grillons 1, 2800, Delémont, Switzerland MoA-CABI Joint Laboratory for Biosafety, 2 Yuanmingyuan West Road, 100193, Beijing, China E-mail: t.haye@cabi.org;Agroscope Changins-Wädenswil, Route de Duillier 50, CP 1012, 1260, Nyon, Switzerland;MoA-CABI Joint Laboratory for Biosafety, 2 Yuanmingyuan West Road, 100193, Beijing, China;Southern Crop Protection and Food Research Centre, Agriculture and Agri-Food Canada, 1391 Sandford Street, N5V 4T3, London, ON, Canada",Springer Berlin Heidelberg,,88,4,693,705,1612-4758,1612-4766,copyright,"Springer-Verlag Berlin Heidelberg, 2015",springer,https://www.swissbib.ch/Search/Results?lookfor=nationallicencespringer101007s1034001506711,http://sru.swissbib.ch/sru/search/defaultdb?query=+dc.anywhere+exact+NATIONALLICENCEspringer101007s1034001506711&operation=searchRetrieve&recordSchema=info%3Asrw%2Fschema%2F1%2Fmarcxml-v1.1-light&maximumRecords=10&startRecord=0&recordPacking=XML&availableDBs=defaultdb&sortKeys=Submit+query,http://sru.swissbib.ch/sru/search/defaultdb?query=+dc.anywhere+exact+NATIONALLICENCEspringer101007s1034001506711&operation=searchRetrieve&recordSchema=info%3Asrw%2Fschema%2F1%2Fdc-v1.1-light&maximumRecords=10&startRecord=0&recordPacking=XML&availableDBs=defaultdb&sortKeys=Submit+query,http://sru.swissbib.ch/sru/search/defaultdb?query=+dc.anywhere+exact+NATIONALLICENCEspringer101007s1034001506711&operation=searchRetrieve&recordSchema=info%3Asru%2Fschema%2Fjson&maximumRecords=10&startRecord=0&recordPacking=XML&availableDBs=defaultdb&sortKeys=Submit+query,It was possible to publish this article open access thanks to a Swiss National Licence with the Publisher
"Department of Computer Science and Engineering, Indian Institute of Technology Madras, Chennai, India Idiap Institute of Research, Martigny, Switzerland E-mail: mrsrikanth86@gmail.com","Madikeri, Srikanth R.",,10.1007/s10772-014-9243-7,https://doi.org/10.1007/s10772-014-9243-7,,Modified group delay feature based total variability space modelling for speaker recognition,,"Madikeri, Srikanth R.;Talambedu, Asha;Murthy, Hema A.",2015,International Journal of Speech Technology,"Department of Computer Science and Engineering, Indian Institute of Technology Madras, Chennai, India Idiap Institute of Research, Martigny, Switzerland E-mail: mrsrikanth86@gmail.com;Department of Computer Science and Engineering, Indian Institute of Technology Madras, Chennai, India E-mail: asha.tbasha.talambedu@gmail.com;Department of Computer Science and Engineering, Indian Institute of Technology Madras, Chennai, India E-mail: hema@cse.iitm.ac.in",Springer US; http://www.springer-ny.com,,18,1,17,23,1381-2416,1572-8110,copyright,"Springer Science+Business Media New York, 2014",springer,https://www.swissbib.ch/Search/Results?lookfor=nationallicencespringer101007s1077201492437,http://sru.swissbib.ch/sru/search/defaultdb?query=+dc.anywhere+exact+NATIONALLICENCEspringer101007s1077201492437&operation=searchRetrieve&recordSchema=info%3Asrw%2Fschema%2F1%2Fmarcxml-v1.1-light&maximumRecords=10&startRecord=0&recordPacking=XML&availableDBs=defaultdb&sortKeys=Submit+query,http://sru.swissbib.ch/sru/search/defaultdb?query=+dc.anywhere+exact+NATIONALLICENCEspringer101007s1077201492437&operation=searchRetrieve&recordSchema=info%3Asrw%2Fschema%2F1%2Fdc-v1.1-light&maximumRecords=10&startRecord=0&recordPacking=XML&availableDBs=defaultdb&sortKeys=Submit+query,http://sru.swissbib.ch/sru/search/defaultdb?query=+dc.anywhere+exact+NATIONALLICENCEspringer101007s1077201492437&operation=searchRetrieve&recordSchema=info%3Asru%2Fschema%2Fjson&maximumRecords=10&startRecord=0&recordPacking=XML&availableDBs=defaultdb&sortKeys=Submit+query,It was possible to publish this article open access thanks to a Swiss National Licence with the Publisher
