"Albert Einstein Center for Fundamental Physics, Laboratory for High Energy Physics, University of Bern, 3012, Bern, Switzerland E-mail: james.storey@cern.ch","Storey, J.",unibe,10.1007/s10751-014-1055-2,https://doi.org/10.1007/s10751-014-1055-2,http://doc.rero.ch/record/324853/files/10751_2014_Article_1055.pdf,Measuring the gravitational free-fall of antihydrogen,,"Storey, J.;Aghion, S.;Ahlén, O.;Amsler, C.;Ariga, A.;Ariga, T.;Belov, A. S.;Bonomi, G.;Bräunig, P.;Bremer, J.;S. Brusa, R.;Cabaret, L.;Canali, C.;Caravita, R.;Castelli, F.;Cerchiari, G.;Cialdi, S.;Comparat, D.;Consolati, G.;Derking, J. H.;Domizio, S. Di;Noto, L. Di;Doser, M.;Dudarev, A.;Ereditato, A.;Ferragut, R.;Fontana, A.;Genova, P.;Giammarchi, M.;Gligorova, A.;Gninenko, S. N.;Haider, S.;Hogan, S. D.;Huse, T.;Jordan, E.;Jørgensen, L. V.;Kaltenbacher, T.;Kawada, J.;Kellerbauer, A.;Kimura, M.;Knecht, A.;Krasnický, D.;Lagomarsino, V.;Lehner, S.;Malbrunot, C.;Mariazzi, S.;Matveev, V. A.;Merkt, F.;Moia, F.;Nebbia, G.;Nédélec, P.;Oberthaler, M. K.;Pacifico, N.;Petráček, V.;Pistillo, C.;Prelz, F.;Prevedelli, M.;Regenfus, C.;Riccardi, C.;Røhne, O.;Rotondi, A.;Sandaker, H.;Scampoli, P.;Subieta Vasquez, M. A.;Špaček, M.;Testera, G.;Trezzi, D.;Vaccarone, R.;Widmann, E.;Zavatarelli, S.;Zmeskal, J.",2014,Hyperfine Interactions,"Albert Einstein Center for Fundamental Physics, Laboratory for High Energy Physics, University of Bern, 3012, Bern, Switzerland E-mail: james.storey@cern.ch;Politecnico di Milano, Piazza Leonardo da Vinci 32, 20133, Milano, Italy Istituto Nazionale di Fisica Nucleare, Sez. di Milano, Via Celoria 16, 20133, Milano, Italy;Physics Department, European Organisation for Nuclear Research, 1211, Geneva 23, Switzerland;Albert Einstein Center for Fundamental Physics, Laboratory for High Energy Physics, University of Bern, 3012, Bern, Switzerland;Albert Einstein Center for Fundamental Physics, Laboratory for High Energy Physics, University of Bern, 3012, Bern, Switzerland;Albert Einstein Center for Fundamental Physics, Laboratory for High Energy Physics, University of Bern, 3012, Bern, Switzerland;Institute for Nuclear Research of the Russian Academy of Sciences, 117312, Moscow, Russia;Department of Mechanical and Industrial Engineering, University of Brescia, Via Branze 38, 25133, Brescia, Italy Istituto Nazionale di Fisica Nucleare, Sez. di Pavia, Via Agostino Bassi 6, 27100, Pavia, Italy;Kirchhoff Institute for Physics, University of Heidelberg, Im Neuenheimer Feld 227, 69120, Heidelberg, Germany;Physics Department, European Organisation for Nuclear Research, 1211, Geneva 23, Switzerland;Dipartimento di Fisica, Università di Trento and INFN, Gruppo Collegato di Trento, Via Som- marive 14, 38050, Povo, Trento, Italy;Laboratoire Aimé Cotton, CNRS, Université Paris Sud, ENS Cachan, Bâtiment 505, Campus dOrsay, 91405, Orsay Cedex, France;Physics Institute, University of Zurich, Winterthurerstrasse 190, 8057, Zurich, Switzerland;Department of Physics, University of Milano, Via Celoria 16, 20133, Milano, Italy;Department of Physics, University of Milano, Via Celoria 16, 20133, Milano, Italy;Department of Physics, University of Milano, Via Celoria 16, 20133, Milano, Italy;Department of Physics, University of Milano, Via Celoria 16, 20133, Milano, Italy;Laboratoire Aimé Cotton, CNRS, Université Paris Sud, ENS Cachan, Bâtiment 505, Campus dOrsay, 91405, Orsay Cedex, France;Politecnico di Milano, Piazza Leonardo da Vinci 32, 20133, Milano, Italy Istituto Nazionale di Fisica Nucleare, Sez. di Milano, Via Celoria 16, 20133, Milano, Italy;Physics Department, European Organisation for Nuclear Research, 1211, Geneva 23, Switzerland;Istituto Nazionale di Fisica Nucleare, Sez. di Genova, Via Dodecaneso 33, 16146, Genova, Italy;Dipartimento di Fisica, Università di Trento and INFN, Gruppo Collegato di Trento, Via Som- marive 14, 38050, Povo, Trento, Italy;Physics Department, European Organisation for Nuclear Research, 1211, Geneva 23, Switzerland;Physics Department, European Organisation for Nuclear Research, 1211, Geneva 23, Switzerland;Albert Einstein Center for Fundamental Physics, Laboratory for High Energy Physics, University of Bern, 3012, Bern, Switzerland;Politecnico di Milano, Piazza Leonardo da Vinci 32, 20133, Milano, Italy Istituto Nazionale di Fisica Nucleare, Sez. di Milano, Via Celoria 16, 20133, Milano, Italy;Istituto Nazionale di Fisica Nucleare, Sez. di Pavia, Via Agostino Bassi 6, 27100, Pavia, Italy;Istituto Nazionale di Fisica Nucleare, Sez. di Pavia, Via Agostino Bassi 6, 27100, Pavia, Italy;Istituto Nazionale di Fisica Nucleare, Sez. di Milano, Via Celoria 16, 20133, Milano, Italy;Institute of Physics and Technology, University of Bergen, Alleegaten 55, 5007, Bergen, Norway;Institute for Nuclear Research of the Russian Academy of Sciences, 117312, Moscow, Russia;Physics Department, European Organisation for Nuclear Research, 1211, Geneva 23, Switzerland;Department of Physics and Astronomy, University College London, Gower Street, WC1E 6BT, London, UK;Department of Physics, University of Oslo, Sem Sælands vei 24, 0371, Oslo, Norway;Max Planck Institute for Nuclear Physics, Saupfercheckweg 1, 69117, Heidelberg, Germany;Physics Department, European Organisation for Nuclear Research, 1211, Geneva 23, Switzerland;Physics Department, European Organisation for Nuclear Research, 1211, Geneva 23, Switzerland;Albert Einstein Center for Fundamental Physics, Laboratory for High Energy Physics, University of Bern, 3012, Bern, Switzerland;Max Planck Institute for Nuclear Physics, Saupfercheckweg 1, 69117, Heidelberg, Germany;Albert Einstein Center for Fundamental Physics, Laboratory for High Energy Physics, University of Bern, 3012, Bern, Switzerland;Physics Department, European Organisation for Nuclear Research, 1211, Geneva 23, Switzerland;Department of Physics, University of Genoa, Via Dodecaneso 33, 16146, Genova, Italy;Department of Physics, University of Genoa, Via Dodecaneso 33, 16146, Genova, Italy;Stefan Meyer Institute for Subatomic Physics, Austrian Academy of Sciences, Boltzmanngasse 3, 1090, Vienna, Austria;Stefan Meyer Institute for Subatomic Physics, Austrian Academy of Sciences, Boltzmanngasse 3, 1090, Vienna, Austria;Dipartimento di Fisica, Università di Trento and INFN, Gruppo Collegato di Trento, Via Som- marive 14, 38050, Povo, Trento, Italy;Institute for Nuclear Research of the Russian Academy of Sciences, 117312, Moscow, Russia Joint Institute for Nuclear Research, 141980, Dubna, Russia;ETH Zurich, Laboratory for Physical Chemistry, 8093, Zurich, Switzerland;Politecnico di Milano, Piazza Leonardo da Vinci 32, 20133, Milano, Italy Istituto Nazionale di Fisica Nucleare, Sez. di Milano, Via Celoria 16, 20133, Milano, Italy;Istituto Nazionale di Fisica Nucleare, Sez. di Padova, Via Marzolo 8, 35131, Padova, Italy;Institut de Physique Nucléaire de Lyon, Claude Bernard University Lyon 1, 4 Rue Enrico Fermi, 69622, Villeurbanne, France;Kirchhoff Institute for Physics, University of Heidelberg, Im Neuenheimer Feld 227, 69120, Heidelberg, Germany;Institute of Physics and Technology, University of Bergen, Alleegaten 55, 5007, Bergen, Norway;FNSPE, Břehová, Czech Technical University in Prague, 11519, Praha 1, Czech Republic;Albert Einstein Center for Fundamental Physics, Laboratory for High Energy Physics, University of Bern, 3012, Bern, Switzerland;Istituto Nazionale di Fisica Nucleare, Sez. di Milano, Via Celoria 16, 20133, Milano, Italy;Department of Physics, University of Bologna, Via Irnerio 46, 40126, Bologna, Italy;Physics Institute, University of Zurich, Winterthurerstrasse 190, 8057, Zurich, Switzerland;Istituto Nazionale di Fisica Nucleare, Sez. di Pavia, Via Agostino Bassi 6, 27100, Pavia, Italy Department of Nuclear and Theoretical Physics, University of Pavia, Via Bassi 6, 27100, Pavia, Italy;Department of Physics, University of Oslo, Sem Sælands vei 24, 0371, Oslo, Norway;Istituto Nazionale di Fisica Nucleare, Sez. di Pavia, Via Agostino Bassi 6, 27100, Pavia, Italy Department of Nuclear and Theoretical Physics, University of Pavia, Via Bassi 6, 27100, Pavia, Italy;Institute of Physics and Technology, University of Bergen, Alleegaten 55, 5007, Bergen, Norway;Albert Einstein Center for Fundamental Physics, Laboratory for High Energy Physics, University of Bern, 3012, Bern, Switzerland Department of Physics, University of Napoli Federico II, Via Cinthia, 80126, Napoli, Italy;Department of Mechanical and Industrial Engineering, University of Brescia, Via Branze 38, 25133, Brescia, Italy Istituto Nazionale di Fisica Nucleare, Sez. di Pavia, Via Agostino Bassi 6, 27100, Pavia, Italy;FNSPE, Břehová, Czech Technical University in Prague, 11519, Praha 1, Czech Republic;Istituto Nazionale di Fisica Nucleare, Sez. di Genova, Via Dodecaneso 33, 16146, Genova, Italy;Istituto Nazionale di Fisica Nucleare, Sez. di Milano, Via Celoria 16, 20133, Milano, Italy;Istituto Nazionale di Fisica Nucleare, Sez. di Genova, Via Dodecaneso 33, 16146, Genova, Italy;Stefan Meyer Institute for Subatomic Physics, Austrian Academy of Sciences, Boltzmanngasse 3, 1090, Vienna, Austria;Istituto Nazionale di Fisica Nucleare, Sez. di Genova, Via Dodecaneso 33, 16146, Genova, Italy;Stefan Meyer Institute for Subatomic Physics, Austrian Academy of Sciences, Boltzmanngasse 3, 1090, Vienna, Austria",Springer International Publishing,2019-10-01,228,,151,157,0304-3843,1572-9540,copyright,"Springer International Publishing Switzerland, 2014",springer,https://www.swissbib.ch/Search/Results?lookfor=nationallicencespringer101007s1075101410552,http://sru.swissbib.ch/sru/search/defaultdb?query=+dc.anywhere+exact+NATIONALLICENCEspringer101007s1075101410552&operation=searchRetrieve&recordSchema=info%3Asrw%2Fschema%2F1%2Fmarcxml-v1.1-light&maximumRecords=10&startRecord=0&recordPacking=XML&availableDBs=defaultdb&sortKeys=Submit+query,http://sru.swissbib.ch/sru/search/defaultdb?query=+dc.anywhere+exact+NATIONALLICENCEspringer101007s1075101410552&operation=searchRetrieve&recordSchema=info%3Asrw%2Fschema%2F1%2Fdc-v1.1-light&maximumRecords=10&startRecord=0&recordPacking=XML&availableDBs=defaultdb&sortKeys=Submit+query,http://sru.swissbib.ch/sru/search/defaultdb?query=+dc.anywhere+exact+NATIONALLICENCEspringer101007s1075101410552&operation=searchRetrieve&recordSchema=info%3Asru%2Fschema%2Fjson&maximumRecords=10&startRecord=0&recordPacking=XML&availableDBs=defaultdb&sortKeys=Submit+query,It was possible to publish this article open access thanks to a Swiss National Licence with the Publisher
"Department of Pediatrics, Mendrisio and Bellinzona Hospitals, University of Bern, Bern, Switzerland San Giovanni Hospital, 6500, Bellinzona, Switzerland E-mail: mario.bianchetti@pediatrician.ch","Bianchetti, Mario G.",unibe,10.1007/s00467-013-2621-6,https://doi.org/10.1007/s00467-013-2621-6,http://doc.rero.ch/record/325780/files/467_2013_Article_2621.pdf,Ureteral or vesical involvement in Henoch–Schönlein syndrome: a systematic review of the literature,,"Siegenthaler, Giordano M.;Rizzi, Mattia;Bettinelli, Alberto;Simonetti, Giacomo D.;Ferrarini, Alessandra;Bianchetti, Mario G.",2014,Pediatric Nephrology,"Department of Pediatrics, Mendrisio and Bellinzona Hospitals, University of Bern, Bern, Switzerland;Department of Pediatrics, Mendrisio and Bellinzona Hospitals, University of Bern, Bern, Switzerland;Department of Pediatrics, Mandic Hospital, Merate, Lecco, Italy;Department of Pediatrics, University Children’s Hospital Bern and University of Bern, Bern, Switzerland;Department of Pediatrics, Mendrisio and Bellinzona Hospitals, University of Bern, Bern, Switzerland;Department of Pediatrics, Mendrisio and Bellinzona Hospitals, University of Bern, Bern, Switzerland San Giovanni Hospital, 6500, Bellinzona, Switzerland E-mail: mario.bianchetti@pediatrician.ch",Springer Berlin Heidelberg,,29,2,235,239,0931-041X,1432-198X,copyright,"IPNA, 2013",springer,https://www.swissbib.ch/Search/Results?lookfor=nationallicencespringer101007s0046701326216,http://sru.swissbib.ch/sru/search/defaultdb?query=+dc.anywhere+exact+NATIONALLICENCEspringer101007s0046701326216&operation=searchRetrieve&recordSchema=info%3Asrw%2Fschema%2F1%2Fmarcxml-v1.1-light&maximumRecords=10&startRecord=0&recordPacking=XML&availableDBs=defaultdb&sortKeys=Submit+query,http://sru.swissbib.ch/sru/search/defaultdb?query=+dc.anywhere+exact+NATIONALLICENCEspringer101007s0046701326216&operation=searchRetrieve&recordSchema=info%3Asrw%2Fschema%2F1%2Fdc-v1.1-light&maximumRecords=10&startRecord=0&recordPacking=XML&availableDBs=defaultdb&sortKeys=Submit+query,http://sru.swissbib.ch/sru/search/defaultdb?query=+dc.anywhere+exact+NATIONALLICENCEspringer101007s0046701326216&operation=searchRetrieve&recordSchema=info%3Asru%2Fschema%2Fjson&maximumRecords=10&startRecord=0&recordPacking=XML&availableDBs=defaultdb&sortKeys=Submit+query,It was possible to publish this article open access thanks to a Swiss National Licence with the Publisher
"University Institute of Diagnostic and Interventional Neuroradiology, University of Bern/Inselspital, Freiburgstrasse 4, 3010, Bern, Switzerland E-mail: christian.weisstanner@insel.ch","Weisstanner, C.",unibe,10.1007/s00062-013-0263-5,https://doi.org/10.1007/s00062-013-0263-5,http://doc.rero.ch/record/325123/files/62_2013_Article_263.pdf,Dose Reduction in Standard Head CT: First Results from a New Scanner Using Iterative Reconstruction and a New Detector Type in Comparison with Two Previous Generations of Multi-slice CT,,"Ozdoba, C.;Slotboom, J.;Schroth, G.;Ulzheimer, S.;Kottke, R.;Watzal, H.;Weisstanner, C.",2014,Clinical Neuroradiology,"University Institute of Diagnostic and Interventional Neuroradiology, University of Bern/Inselspital, Freiburgstrasse 4, 3010, Bern, Switzerland;University Institute of Diagnostic and Interventional Neuroradiology, University of Bern/Inselspital, Freiburgstrasse 4, 3010, Bern, Switzerland;University Institute of Diagnostic and Interventional Neuroradiology, University of Bern/Inselspital, Freiburgstrasse 4, 3010, Bern, Switzerland;Computed Tomography, Siemens Healthcare, Forchheim, Germany;University Institute of Diagnostic and Interventional Neuroradiology, University of Bern/Inselspital, Freiburgstrasse 4, 3010, Bern, Switzerland;University Institute of Diagnostic and Interventional Neuroradiology, University of Bern/Inselspital, Freiburgstrasse 4, 3010, Bern, Switzerland;University Institute of Diagnostic and Interventional Neuroradiology, University of Bern/Inselspital, Freiburgstrasse 4, 3010, Bern, Switzerland E-mail: christian.weisstanner@insel.ch",Springer Berlin Heidelberg,,24,1,23,28,1869-1439,1869-1447,copyright,"The Author(s), 2013",springer,https://www.swissbib.ch/Search/Results?lookfor=nationallicencespringer101007s0006201302635,http://sru.swissbib.ch/sru/search/defaultdb?query=+dc.anywhere+exact+NATIONALLICENCEspringer101007s0006201302635&operation=searchRetrieve&recordSchema=info%3Asrw%2Fschema%2F1%2Fmarcxml-v1.1-light&maximumRecords=10&startRecord=0&recordPacking=XML&availableDBs=defaultdb&sortKeys=Submit+query,http://sru.swissbib.ch/sru/search/defaultdb?query=+dc.anywhere+exact+NATIONALLICENCEspringer101007s0006201302635&operation=searchRetrieve&recordSchema=info%3Asrw%2Fschema%2F1%2Fdc-v1.1-light&maximumRecords=10&startRecord=0&recordPacking=XML&availableDBs=defaultdb&sortKeys=Submit+query,http://sru.swissbib.ch/sru/search/defaultdb?query=+dc.anywhere+exact+NATIONALLICENCEspringer101007s0006201302635&operation=searchRetrieve&recordSchema=info%3Asru%2Fschema%2Fjson&maximumRecords=10&startRecord=0&recordPacking=XML&availableDBs=defaultdb&sortKeys=Submit+query,It was possible to publish this article open access thanks to a Swiss National Licence with the Publisher
"Department of Haematology and Central Haematology Laboratory, Inselspital University Hospital, 3010, Berne, Switzerland E-mail: mic.n@gmx.ch","Nagler, Michael",unibe,10.1007/s00277-014-2059-3,https://doi.org/10.1007/s00277-014-2059-3,http://doc.rero.ch/record/325960/files/277_2014_Article_2059.pdf,Thromboelastometry changes in myeloproliferative neoplasms—surrogate for a procoagulant haemostatic imbalance or a consequence of technical reasons?,Comment on  A. Tripodi et al. Ann Hematol (2013) 92:1633–1639                   ,"Nagler, Michael;Ten Cate, Hugo",2014,Annals of Hematology,"Department of Haematology and Central Haematology Laboratory, Inselspital University Hospital, 3010, Berne, Switzerland E-mail: mic.n@gmx.ch;Department of Internal Medicine, Laboratory of Clinical Thrombosis and Haemostasis, and Cardiovascular Research Institute, Maastricht University Medical Center, Maastricht, The Netherlands",Springer Berlin Heidelberg,2019-10-01,93,10,1781,1782,0939-5555,1432-0584,copyright,"Springer-Verlag Berlin Heidelberg, 2014",springer,https://www.swissbib.ch/Search/Results?lookfor=nationallicencespringer101007s0027701420593,http://sru.swissbib.ch/sru/search/defaultdb?query=+dc.anywhere+exact+NATIONALLICENCEspringer101007s0027701420593&operation=searchRetrieve&recordSchema=info%3Asrw%2Fschema%2F1%2Fmarcxml-v1.1-light&maximumRecords=10&startRecord=0&recordPacking=XML&availableDBs=defaultdb&sortKeys=Submit+query,http://sru.swissbib.ch/sru/search/defaultdb?query=+dc.anywhere+exact+NATIONALLICENCEspringer101007s0027701420593&operation=searchRetrieve&recordSchema=info%3Asrw%2Fschema%2F1%2Fdc-v1.1-light&maximumRecords=10&startRecord=0&recordPacking=XML&availableDBs=defaultdb&sortKeys=Submit+query,http://sru.swissbib.ch/sru/search/defaultdb?query=+dc.anywhere+exact+NATIONALLICENCEspringer101007s0027701420593&operation=searchRetrieve&recordSchema=info%3Asru%2Fschema%2Fjson&maximumRecords=10&startRecord=0&recordPacking=XML&availableDBs=defaultdb&sortKeys=Submit+query,It was possible to publish this article open access thanks to a Swiss National Licence with the Publisher
"Institute of Applied Physics, University of Bern, Sidlerstrasse 5, CH-3012, Bern, Switzerland E-mail: michael.bruegmann@iap.unibe.ch","Brügmann, Michael H.",unibe,10.1007/s00339-014-8233-6,https://doi.org/10.1007/s00339-014-8233-6,http://doc.rero.ch/record/325637/files/339_2014_Article_8233.pdf,Comparative theoretical analysis of continuous wave laser cutting of metals at 1 and 10 μm wavelength,,"Brügmann, Michael H.;Feurer, Thomas",2014,Applied Physics A,"Institute of Applied Physics, University of Bern, Sidlerstrasse 5, CH-3012, Bern, Switzerland E-mail: michael.bruegmann@iap.unibe.ch;Institute of Applied Physics, University of Bern, Sidlerstrasse 5, CH-3012, Bern, Switzerland E-mail: thomas.feurer@iap.unibe.ch",Springer Berlin Heidelberg,2019-09-01,116,,1353,1364,0947-8396,1432-0630,copyright,"Springer-Verlag Berlin Heidelberg, 2014",springer,https://www.swissbib.ch/Search/Results?lookfor=nationallicencespringer101007s0033901482336,http://sru.swissbib.ch/sru/search/defaultdb?query=+dc.anywhere+exact+NATIONALLICENCEspringer101007s0033901482336&operation=searchRetrieve&recordSchema=info%3Asrw%2Fschema%2F1%2Fmarcxml-v1.1-light&maximumRecords=10&startRecord=0&recordPacking=XML&availableDBs=defaultdb&sortKeys=Submit+query,http://sru.swissbib.ch/sru/search/defaultdb?query=+dc.anywhere+exact+NATIONALLICENCEspringer101007s0033901482336&operation=searchRetrieve&recordSchema=info%3Asrw%2Fschema%2F1%2Fdc-v1.1-light&maximumRecords=10&startRecord=0&recordPacking=XML&availableDBs=defaultdb&sortKeys=Submit+query,http://sru.swissbib.ch/sru/search/defaultdb?query=+dc.anywhere+exact+NATIONALLICENCEspringer101007s0033901482336&operation=searchRetrieve&recordSchema=info%3Asru%2Fschema%2Fjson&maximumRecords=10&startRecord=0&recordPacking=XML&availableDBs=defaultdb&sortKeys=Submit+query,It was possible to publish this article open access thanks to a Swiss National Licence with the Publisher
"Institute of Forensic Medicine, University of Bern, Buehlstrasse 20, 3012, Bern, Switzerland E-mail: Wolf-Dieter.Zech@irm.unibe.ch","Zech, Wolf-Dieter",unibe,10.1007/s00414-014-1030-0,https://doi.org/10.1007/s00414-014-1030-0,http://doc.rero.ch/record/325009/files/414_2014_Article_1030.pdf,"Characterization and differentiation of body fluids, putrefaction fluid, and blood using Hounsfield unit in postmortem CT",,"Zech, Wolf-Dieter;Jackowski, Christian;Buetikofer, Yanik;Kara, Levent",2014,International Journal of Legal Medicine,"Institute of Forensic Medicine, University of Bern, Buehlstrasse 20, 3012, Bern, Switzerland E-mail: Wolf-Dieter.Zech@irm.unibe.ch;Institute of Forensic Medicine, University of Bern, Buehlstrasse 20, 3012, Bern, Switzerland;Institute of Forensic Medicine, University of Bern, Buehlstrasse 20, 3012, Bern, Switzerland;Institute of Forensic Medicine, University of Bern, Buehlstrasse 20, 3012, Bern, Switzerland",Springer Berlin Heidelberg,2019-09-01,128,5,795,802,0937-9827,1437-1596,copyright,"Springer-Verlag Berlin Heidelberg, 2014",springer,https://www.swissbib.ch/Search/Results?lookfor=nationallicencespringer101007s0041401410300,http://sru.swissbib.ch/sru/search/defaultdb?query=+dc.anywhere+exact+NATIONALLICENCEspringer101007s0041401410300&operation=searchRetrieve&recordSchema=info%3Asrw%2Fschema%2F1%2Fmarcxml-v1.1-light&maximumRecords=10&startRecord=0&recordPacking=XML&availableDBs=defaultdb&sortKeys=Submit+query,http://sru.swissbib.ch/sru/search/defaultdb?query=+dc.anywhere+exact+NATIONALLICENCEspringer101007s0041401410300&operation=searchRetrieve&recordSchema=info%3Asrw%2Fschema%2F1%2Fdc-v1.1-light&maximumRecords=10&startRecord=0&recordPacking=XML&availableDBs=defaultdb&sortKeys=Submit+query,http://sru.swissbib.ch/sru/search/defaultdb?query=+dc.anywhere+exact+NATIONALLICENCEspringer101007s0041401410300&operation=searchRetrieve&recordSchema=info%3Asru%2Fschema%2Fjson&maximumRecords=10&startRecord=0&recordPacking=XML&availableDBs=defaultdb&sortKeys=Submit+query,It was possible to publish this article open access thanks to a Swiss National Licence with the Publisher
"Department of Linguistics, University of Bern, Länggassstrasse 49, 3012, Bern, Switzerland E-mail: fernando.zuniga@isw.unibe.ch","Zúñiga, Fernando",unibe,10.1007/s11525-014-9244-x,https://doi.org/10.1007/s11525-014-9244-x,http://doc.rero.ch/record/325904/files/11525_2014_Article_9244.pdf,(Anti-)cliticization in Mapudungun,,"Zúñiga, Fernando",2014,Morphology,"Department of Linguistics, University of Bern, Länggassstrasse 49, 3012, Bern, Switzerland E-mail: fernando.zuniga@isw.unibe.ch",Springer Netherlands,2019-09-01,24,,161,175,1871-5621,1871-5656,copyright,"Springer Science+Business Media Dordrecht, 2014",springer,https://www.swissbib.ch/Search/Results?lookfor=nationallicencespringer101007s115250149244x,http://sru.swissbib.ch/sru/search/defaultdb?query=+dc.anywhere+exact+NATIONALLICENCEspringer101007s115250149244x&operation=searchRetrieve&recordSchema=info%3Asrw%2Fschema%2F1%2Fmarcxml-v1.1-light&maximumRecords=10&startRecord=0&recordPacking=XML&availableDBs=defaultdb&sortKeys=Submit+query,http://sru.swissbib.ch/sru/search/defaultdb?query=+dc.anywhere+exact+NATIONALLICENCEspringer101007s115250149244x&operation=searchRetrieve&recordSchema=info%3Asrw%2Fschema%2F1%2Fdc-v1.1-light&maximumRecords=10&startRecord=0&recordPacking=XML&availableDBs=defaultdb&sortKeys=Submit+query,http://sru.swissbib.ch/sru/search/defaultdb?query=+dc.anywhere+exact+NATIONALLICENCEspringer101007s115250149244x&operation=searchRetrieve&recordSchema=info%3Asru%2Fschema%2Fjson&maximumRecords=10&startRecord=0&recordPacking=XML&availableDBs=defaultdb&sortKeys=Submit+query,It was possible to publish this article open access thanks to a Swiss National Licence with the Publisher
