"Universitätsinstitut für Diagnostische, Interventionelle und Pädiatrische Radiologie, Inselspital, Universität Bern, 3010, Bern, Schweiz E-mail: andreas.joeres@gmx.de","Jöres, A.P.W.",unibe,10.1007/s00117-014-2747-y,https://doi.org/10.1007/s00117-014-2747-y,http://doc.rero.ch/record/325922/files/117_2014_Article_2747.pdf,Neu aufgetretene Dyspnoe bei einer jungen erwachsenen Patientin mit beidseitigen renalen AngiomyolipomenNewly developed dyspnea in a young adult female patient with known bilateral renal angiomyolipoma,,"Jöres, A.P.W.;Klink, T.",2014,Der Radiologe,"Universitätsinstitut für Diagnostische, Interventionelle und Pädiatrische Radiologie, Inselspital, Universität Bern, 3010, Bern, Schweiz E-mail: andreas.joeres@gmx.de;Universitätsinstitut für Diagnostische, Interventionelle und Pädiatrische Radiologie, Inselspital, Universität Bern, 3010, Bern, Schweiz",Springer Berlin Heidelberg,2019-12-01,54,12,1213,1216,0033-832X,1432-2102,copyright,"Springer-Verlag Berlin Heidelberg, 2014",springer,https://www.swissbib.ch/Search/Results?lookfor=nationallicencespringer101007s001170142747y,http://sru.swissbib.ch/sru/search/defaultdb?query=+dc.anywhere+exact+NATIONALLICENCEspringer101007s001170142747y&operation=searchRetrieve&recordSchema=info%3Asrw%2Fschema%2F1%2Fmarcxml-v1.1-light&maximumRecords=10&startRecord=0&recordPacking=XML&availableDBs=defaultdb&sortKeys=Submit+query,http://sru.swissbib.ch/sru/search/defaultdb?query=+dc.anywhere+exact+NATIONALLICENCEspringer101007s001170142747y&operation=searchRetrieve&recordSchema=info%3Asrw%2Fschema%2F1%2Fdc-v1.1-light&maximumRecords=10&startRecord=0&recordPacking=XML&availableDBs=defaultdb&sortKeys=Submit+query,http://sru.swissbib.ch/sru/search/defaultdb?query=+dc.anywhere+exact+NATIONALLICENCEspringer101007s001170142747y&operation=searchRetrieve&recordSchema=info%3Asru%2Fschema%2Fjson&maximumRecords=10&startRecord=0&recordPacking=XML&availableDBs=defaultdb&sortKeys=Submit+query,It was possible to publish this article open access thanks to a Swiss National Licence with the Publisher
"Oeschger Centre for Climate Change Research, University of Bern, Zähringerstrasse 25, 3012, Bern, Switzerland Institute of Geography, Hydrology Group, University of Bern, Hallerstrasse 12, 3012, Bern, Switzerland E-mail: nina.koeplin@web.de","Köplin, N.",unibe,10.1007/s10584-013-1015-x,https://doi.org/10.1007/s10584-013-1015-x,http://doc.rero.ch/record/326155/files/10584_2013_Article_1015.pdf,Robust estimates of climate-induced hydrological change in a temperate mountainous region,,"Köplin, N.;Rößler, O.;Schädler, B.;Weingartner, R.",2014,Climatic Change,"Oeschger Centre for Climate Change Research, University of Bern, Zähringerstrasse 25, 3012, Bern, Switzerland Institute of Geography, Hydrology Group, University of Bern, Hallerstrasse 12, 3012, Bern, Switzerland E-mail: nina.koeplin@web.de;Oeschger Centre for Climate Change Research, University of Bern, Zähringerstrasse 25, 3012, Bern, Switzerland Institute of Geography, Hydrology Group, University of Bern, Hallerstrasse 12, 3012, Bern, Switzerland;Oeschger Centre for Climate Change Research, University of Bern, Zähringerstrasse 25, 3012, Bern, Switzerland Institute of Geography, Hydrology Group, University of Bern, Hallerstrasse 12, 3012, Bern, Switzerland;Oeschger Centre for Climate Change Research, University of Bern, Zähringerstrasse 25, 3012, Bern, Switzerland Institute of Geography, Hydrology Group, University of Bern, Hallerstrasse 12, 3012, Bern, Switzerland",Springer Netherlands,,122,,171,184,0165-0009,1573-1480,copyright,"Springer Science+Business Media Dordrecht, 2013",springer,https://www.swissbib.ch/Search/Results?lookfor=nationallicencespringer101007s105840131015x,http://sru.swissbib.ch/sru/search/defaultdb?query=+dc.anywhere+exact+NATIONALLICENCEspringer101007s105840131015x&operation=searchRetrieve&recordSchema=info%3Asrw%2Fschema%2F1%2Fmarcxml-v1.1-light&maximumRecords=10&startRecord=0&recordPacking=XML&availableDBs=defaultdb&sortKeys=Submit+query,http://sru.swissbib.ch/sru/search/defaultdb?query=+dc.anywhere+exact+NATIONALLICENCEspringer101007s105840131015x&operation=searchRetrieve&recordSchema=info%3Asrw%2Fschema%2F1%2Fdc-v1.1-light&maximumRecords=10&startRecord=0&recordPacking=XML&availableDBs=defaultdb&sortKeys=Submit+query,http://sru.swissbib.ch/sru/search/defaultdb?query=+dc.anywhere+exact+NATIONALLICENCEspringer101007s105840131015x&operation=searchRetrieve&recordSchema=info%3Asru%2Fschema%2Fjson&maximumRecords=10&startRecord=0&recordPacking=XML&availableDBs=defaultdb&sortKeys=Submit+query,It was possible to publish this article open access thanks to a Swiss National Licence with the Publisher
"Oeschger Centre for Climate Change Research, University of Bern, Bern, Switzerland Institute of History, Section of Economic, Social and Environmental History (WSU), University of Bern, Erlachstrasse 9a, 9 3000, Bern, Switzerland E-mail: oliver.wetter@hist.unibe.ch","Wetter, Oliver",unibe,10.1007/s10584-014-1193-1,https://doi.org/10.1007/s10584-014-1193-1,http://doc.rero.ch/record/326266/files/10584_2014_Article_1193.pdf,Erratum to: The year-long unprecedented European heat and drought of 1540 – a worst case,,"Wetter, Oliver;Pfister, Christian;Werner, Johannes P.;Zorita, Eduardo;Wagner, Sebastian;Seneviratne, Sonia I.;Herget, Jürgen;Grünewald, Uwe;Luterbacher, Jürg;Alcoforado, Maria-Joao;Barriendos, Mariano;Bieber, Ursula;Brázdil, Rudolf;Burmeister, Karl H.;Camenisch, Chantal;Contino, Antonio;Dobrovolný, Petr;Glaser, Rüdiger;Himmelsbach, Iso;Kiss, Andrea;Kotyza, Oldřich;Labbé, Thomas;Limanówka, Danuta;Litzenburger, Laurent;Nordli, Øyvind;Pribyl, Kathleen;Retsö, Dag;Riemann, Dirk;Rohr, Christian;Siegfried, Werner;Söderberg, Johan;Spring, Jean-Laurent",2014,Climatic Change,"Oeschger Centre for Climate Change Research, University of Bern, Bern, Switzerland Institute of History, Section of Economic, Social and Environmental History (WSU), University of Bern, Erlachstrasse 9a, 9 3000, Bern, Switzerland E-mail: oliver.wetter@hist.unibe.ch;Oeschger Centre for Climate Change Research, University of Bern, Bern, Switzerland E-mail: christian.pfister@hist.unibe.ch;Department of Geography; Climatology, Climate Dynamics and Climate Change, Justus Liebig University of Giessen, Senckenbergstrasse 1, 35390, Giessen, Germany E-mail: johannes.werner@geogr.uni-giessen.de;Institute of Coastal Research, Helmholtz Centre Geesthacht, Max-Planck-Strasse 1, 21502, Geesthacht, Germany E-mail: eduardo.zorita@hzg.de;Institute of Coastal Research, Helmholtz Centre Geesthacht, Max-Planck-Strasse 1, 21502, Geesthacht, Germany;Institute for Atmospheric and Climate Science, ETH Zurich, CHN N11, Universitätstrasse 16, 8092, Zurich, Switzerland E-mail: sonia.seneviratne@env.ethz.ch;Department of Geography, Rheinische Friedrich Wilhelms University, Meckenheimer Allee 166, D-53115, Bonn, Germany E-mail: herget@giub.uni-bonn.de;Chair Hydrology and Water Resources Management, Faculty of Environmental Sciences and Process Engineering, Brandenburg University of Technology Cottbus – Senftenberg, Konrad-Wachsmann-Allee 6, 03046, Cottbus, Germany E-mail: uwe.gruenewald@tu-cottbus.de;Department of Geography; Climatology, Climate Dynamics and Climate Change, Justus Liebig University of Giessen, Senckenbergstrasse 1, 35390, Giessen, Germany E-mail: juerg.luterbacher@geogr.uni-giessen.de;Centre of Geographical Studies, Institute of Geography and Planning, University of Lisbon, Edifício da Fac. de Letras, Alameda da Universidade, 1600-214, Lisboa, Portugal E-mail: mjalcoforado@campus.ul.pt;Catalan Institute for Climate Sciences (IC3), Doctor Trueta 203, 08005, Barcelona, Spain Department of Modern History, University of Barcelona, Montalegre 6, 08003, Barcelona, Spain E-mail: mbarriendos@ub.edu;Department of Slavonic Studies and Interdisciplinary Centre of Medieval Studies, University of Salzburg, Erzabt-Klotz-Strasse 1, 5020, Salzburg, Austria E-mail: ursula.bieber@sbg.ac.at;Institute of Geography, Masaryk University, Kotlářská 2, 611 37, Brno, Czech Republic Global Change Research Centre AS CR, Bĕlidla 956/4a, 603 00, Brno, Czech Republic E-mail: brazdil@sci.muni.cz;Hoyerberg, Am Staeuben 18, Hoyerberg, 88131, Bodolz, Germany E-mail: k.h.a.burmeister@web.de;Oeschger Centre for Climate Change Research, University of Bern, Bern, Switzerland Institute of History, Section of Economic, Social and Environmental History (WSU), University of Bern, Erlachstrasse 9a, 9 3000, Bern, Switzerland;Department of Earth and Sea Sciences (DiSTeM), University of Palermo, Via Archirafi 26, 90123, Palermo, Italy E-mail: ntncontino@gmail.com;Institute of Geography, Masaryk University, Kotlářská 2, 611 37, Brno, Czech Republic Global Change Research Centre AS CR, Bĕlidla 956/4a, 603 00, Brno, Czech Republic;Department of Environmental Social Studies and Geography - Physical Geography, Albert-Ludwigs University Freiburg i.Br., Werthmannstrasse 4, 79102, Freiburg, Germany E-mail: ruediger.glaser@geographie.uni-freiburg.de;Department of Environmental Social Studies and Geography - Physical Geography, Albert-Ludwigs University Freiburg i.Br., Werthmannstrasse 4, 79102, Freiburg, Germany;Institute of Hydraulic Engineering and Water Resources Management, Vienna University of Technology, Karlsplatz 13, 1040, Vienna, Austria E-mail: kiss@hydro.tuwien.ac.at;Regional Museum, Dlouhá 139, 412 01, Litoměřice, Czech Republic E-mail: muzeum.ltm@telecom.cz;Institute of History, Technische Universität (TU) of Darmstadt, Residenzschloss, 64283, Darmstadt, Germany E-mail: labbe@pg.tu-darmstadt.de;Institute of Meteorology and Water Management National Research Institute (IMGW-PIB), Center for Poland’s Climate Monitoring, Podleśna, 01-673, Warsaw, Poland E-mail: danuta.limanowka@imgw.pl;Lorraine University Center for Historical Research (CRULH), University of Lorraine, Campus Lettres et Sciences Humaines, Place Godefroy de Bouillon, BP 3397, 54015, Nancy Cedex, France E-mail: l.litzenburger@free.fr;Norwegian Meteorological Institute, Research and Development Department, Division for Model and Climate Analysis, Henrik Mohns plass 1, P.O. Box 43, N-0313, Blindern, Norway E-mail: oyvind.nordli@met.no;Climatic Research Unit, School of Environmental Sciences, University of East Anglia, Norwich Research Park, NR4 7TJ, Norwich, UK E-mail: k.pribyl@uea.ac.uk;Department of Economic History, Stockholm University, SE-106 91, Stockholm, Sweden E-mail: dag.retso@lai.su.se;Department of Environmental Social Studies and Geography - Physical Geography, Albert-Ludwigs University Freiburg i.Br., Werthmannstrasse 4, 79102, Freiburg, Germany;Oeschger Centre for Climate Change Research, University of Bern, Bern, Switzerland Institute of History, Section of Economic, Social and Environmental History (WSU), University of Bern, Erlachstrasse 9a, 9 3000, Bern, Switzerland;Agroscope Research Station ACW, Extension Wine, Schloss 1 Postfach, 8820, Wädenswil, Switzerland E-mail: werner.siegfried@acw.admin.ch;Department of Economic History, Stockholm University, SE-106 91, Stockholm, Sweden E-mail: johan.soderberg@ekohist.su.se;Station de recherche Agroscope à Pully, 21 av. de Rochettaz, CH-1009, Pully, Switzerland E-mail: jean-laurent.spring@agroscope.admin.ch",Springer Netherlands,2019-08-01,125,,365,367,0165-0009,1573-1480,copyright,"Springer Science+Business Media Dordrecht, 2014",springer,https://www.swissbib.ch/Search/Results?lookfor=nationallicencespringer101007s1058401411931,http://sru.swissbib.ch/sru/search/defaultdb?query=+dc.anywhere+exact+NATIONALLICENCEspringer101007s1058401411931&operation=searchRetrieve&recordSchema=info%3Asrw%2Fschema%2F1%2Fmarcxml-v1.1-light&maximumRecords=10&startRecord=0&recordPacking=XML&availableDBs=defaultdb&sortKeys=Submit+query,http://sru.swissbib.ch/sru/search/defaultdb?query=+dc.anywhere+exact+NATIONALLICENCEspringer101007s1058401411931&operation=searchRetrieve&recordSchema=info%3Asrw%2Fschema%2F1%2Fdc-v1.1-light&maximumRecords=10&startRecord=0&recordPacking=XML&availableDBs=defaultdb&sortKeys=Submit+query,http://sru.swissbib.ch/sru/search/defaultdb?query=+dc.anywhere+exact+NATIONALLICENCEspringer101007s1058401411931&operation=searchRetrieve&recordSchema=info%3Asru%2Fschema%2Fjson&maximumRecords=10&startRecord=0&recordPacking=XML&availableDBs=defaultdb&sortKeys=Submit+query,It was possible to publish this article open access thanks to a Swiss National Licence with the Publisher
"Oeschger Center for Climate Change Research, University of Bern, Bern, Switzerland Institute of Geography, University of Bern, Erlachstrasse 9a T3, 3012, Bern, Switzerland E-mail: benjamin.amann@giub.unibe.ch","Amann, Benjamin",unibe,10.1007/s10933-013-9761-3,https://doi.org/10.1007/s10933-013-9761-3,http://doc.rero.ch/record/326398/files/10933_2013_Article_9761.pdf,"Quantitative high-resolution warm season rainfall recorded in varved sediments of Lake Oeschinen, northern Swiss Alps: calibration and validation AD 1901–2008",,"Amann, Benjamin;Mauchle, Fabian;Grosjean, Martin",2014,Journal of Paleolimnology,"Oeschger Center for Climate Change Research, University of Bern, Bern, Switzerland Institute of Geography, University of Bern, Erlachstrasse 9a T3, 3012, Bern, Switzerland E-mail: benjamin.amann@giub.unibe.ch;MeteoSwiss, Krähbühlstrasse 58, Zurich, Switzerland E-mail: fabian.mauchle@meteoswiss.ch;Oeschger Center for Climate Change Research, University of Bern, Bern, Switzerland E-mail: martin.grosjean@oeschger.unibe.ch",Springer Netherlands,,51,3,375,391,0921-2728,1573-0417,copyright,"Springer Science+Business Media Dordrecht, 2014",springer,https://www.swissbib.ch/Search/Results?lookfor=nationallicencespringer101007s1093301397613,http://sru.swissbib.ch/sru/search/defaultdb?query=+dc.anywhere+exact+NATIONALLICENCEspringer101007s1093301397613&operation=searchRetrieve&recordSchema=info%3Asrw%2Fschema%2F1%2Fmarcxml-v1.1-light&maximumRecords=10&startRecord=0&recordPacking=XML&availableDBs=defaultdb&sortKeys=Submit+query,http://sru.swissbib.ch/sru/search/defaultdb?query=+dc.anywhere+exact+NATIONALLICENCEspringer101007s1093301397613&operation=searchRetrieve&recordSchema=info%3Asrw%2Fschema%2F1%2Fdc-v1.1-light&maximumRecords=10&startRecord=0&recordPacking=XML&availableDBs=defaultdb&sortKeys=Submit+query,http://sru.swissbib.ch/sru/search/defaultdb?query=+dc.anywhere+exact+NATIONALLICENCEspringer101007s1093301397613&operation=searchRetrieve&recordSchema=info%3Asru%2Fschema%2Fjson&maximumRecords=10&startRecord=0&recordPacking=XML&availableDBs=defaultdb&sortKeys=Submit+query,It was possible to publish this article open access thanks to a Swiss National Licence with the Publisher
"Theodor Kocher Institute, University of Bern, Freiestrasse 1, 3012, Bern, Switzerland E-mail: bengel@tki.unibe.ch","Engelhardt, Britta",unibe,10.1007/s00441-014-1811-2,https://doi.org/10.1007/s00441-014-1811-2,http://doc.rero.ch/record/326350/files/441_2014_Article_1811.pdf,Novel insights into the development and maintenance of the blood–brain barrier,,"Engelhardt, Britta;Liebner, Stefan",2014,Cell and Tissue Research,"Theodor Kocher Institute, University of Bern, Freiestrasse 1, 3012, Bern, Switzerland E-mail: bengel@tki.unibe.ch;Institute of Neurology (Edinger Institute), University Hospital Frankfurt, Heinrich-Hoffmann-Strasse 7, 60528, Frankfurt/Main, Germany E-mail: stefan.liebner@kgu.de",Springer Berlin Heidelberg,,355,,687,699,0302-766X,1432-0878,copyright,"The Author(s), 2014",springer,https://www.swissbib.ch/Search/Results?lookfor=nationallicencespringer101007s0044101418112,http://sru.swissbib.ch/sru/search/defaultdb?query=+dc.anywhere+exact+NATIONALLICENCEspringer101007s0044101418112&operation=searchRetrieve&recordSchema=info%3Asrw%2Fschema%2F1%2Fmarcxml-v1.1-light&maximumRecords=10&startRecord=0&recordPacking=XML&availableDBs=defaultdb&sortKeys=Submit+query,http://sru.swissbib.ch/sru/search/defaultdb?query=+dc.anywhere+exact+NATIONALLICENCEspringer101007s0044101418112&operation=searchRetrieve&recordSchema=info%3Asrw%2Fschema%2F1%2Fdc-v1.1-light&maximumRecords=10&startRecord=0&recordPacking=XML&availableDBs=defaultdb&sortKeys=Submit+query,http://sru.swissbib.ch/sru/search/defaultdb?query=+dc.anywhere+exact+NATIONALLICENCEspringer101007s0044101418112&operation=searchRetrieve&recordSchema=info%3Asru%2Fschema%2Fjson&maximumRecords=10&startRecord=0&recordPacking=XML&availableDBs=defaultdb&sortKeys=Submit+query,It was possible to publish this article open access thanks to a Swiss National Licence with the Publisher
"Department of Population Medicine, Ontario Veterinary College, University of Guelph, N1G 2 W1, Guelph, ON, Canada Veterinary Public Health Institute, Vetsuisse Faculty, University of Bern, Schwarzenburgstrasse 155, 3097, Liebefeld, Switzerland E-mail: laura.falzon@vetsuisse.unibe.ch","Falzon, L. C.",unibe,10.1007/s00436-014-3886-9,https://doi.org/10.1007/s00436-014-3886-9,http://doc.rero.ch/record/326041/files/436_2014_Article_3886.pdf,Comparison of calculation methods used for the determination of anthelmintic resistance in sheep in a temperate continental climate,,"Falzon, L. C.;Van Leeuwen, J.;Menzies, P. I.;Jones-Bitton, A.;Sears, W.;Jansen, J. T.;Peregrine, A. S.",2014,Parasitology Research,"Department of Population Medicine, Ontario Veterinary College, University of Guelph, N1G 2 W1, Guelph, ON, Canada Veterinary Public Health Institute, Vetsuisse Faculty, University of Bern, Schwarzenburgstrasse 155, 3097, Liebefeld, Switzerland E-mail: laura.falzon@vetsuisse.unibe.ch;Centre for Veterinary Epidemiological Research, Department of Health Management, Atlantic Veterinary College, University of Prince Edward Island, C1A 4P3, Charlottetown, PE, Canada;Department of Population Medicine, Ontario Veterinary College, University of Guelph, N1G 2 W1, Guelph, ON, Canada;Department of Population Medicine, Ontario Veterinary College, University of Guelph, N1G 2 W1, Guelph, ON, Canada;Department of Population Medicine, Ontario Veterinary College, University of Guelph, N1G 2 W1, Guelph, ON, Canada;Veterinary Science and Policy, Ontario Ministry of Agriculture and Food, N0B 1S0, Elora, ON, Canada;Department of Pathobiology, Ontario Veterinary College, University of Guelph, N1G 2 W1, Guelph, Ontario, Canada",Springer Berlin Heidelberg,2019-06-01,113,6,2311,2322,0932-0113,1432-1955,copyright,"Springer-Verlag Berlin Heidelberg, 2014",springer,https://www.swissbib.ch/Search/Results?lookfor=nationallicencespringer101007s0043601438869,http://sru.swissbib.ch/sru/search/defaultdb?query=+dc.anywhere+exact+NATIONALLICENCEspringer101007s0043601438869&operation=searchRetrieve&recordSchema=info%3Asrw%2Fschema%2F1%2Fmarcxml-v1.1-light&maximumRecords=10&startRecord=0&recordPacking=XML&availableDBs=defaultdb&sortKeys=Submit+query,http://sru.swissbib.ch/sru/search/defaultdb?query=+dc.anywhere+exact+NATIONALLICENCEspringer101007s0043601438869&operation=searchRetrieve&recordSchema=info%3Asrw%2Fschema%2F1%2Fdc-v1.1-light&maximumRecords=10&startRecord=0&recordPacking=XML&availableDBs=defaultdb&sortKeys=Submit+query,http://sru.swissbib.ch/sru/search/defaultdb?query=+dc.anywhere+exact+NATIONALLICENCEspringer101007s0043601438869&operation=searchRetrieve&recordSchema=info%3Asru%2Fschema%2Fjson&maximumRecords=10&startRecord=0&recordPacking=XML&availableDBs=defaultdb&sortKeys=Submit+query,It was possible to publish this article open access thanks to a Swiss National Licence with the Publisher
"Institut für Philosophie, Abteilung Logik und theoretische Philosophie, University of Bern, Unitobler, Länggassstrasse 49a, 3000 , Bern 9, Switzerland E-mail: dale.jacquette@philo.unibe.ch","Jacquette, Dale",unibe,10.1007/s11153-014-9456-3,https://doi.org/10.1007/s11153-014-9456-3,http://doc.rero.ch/record/325343/files/11153_2014_Article_9456.pdf,Collingwood on religious atonement,,"Jacquette, Dale",2014,International Journal for Philosophy of Religion,"Institut für Philosophie, Abteilung Logik und theoretische Philosophie, University of Bern, Unitobler, Länggassstrasse 49a, 3000 , Bern 9, Switzerland E-mail: dale.jacquette@philo.unibe.ch",Springer Netherlands,2019-10-01,76,2,151,170,0020-7047,1572-8684,copyright,"Springer Science+Business Media Dordrecht, 2014",springer,https://www.swissbib.ch/Search/Results?lookfor=nationallicencespringer101007s1115301494563,http://sru.swissbib.ch/sru/search/defaultdb?query=+dc.anywhere+exact+NATIONALLICENCEspringer101007s1115301494563&operation=searchRetrieve&recordSchema=info%3Asrw%2Fschema%2F1%2Fmarcxml-v1.1-light&maximumRecords=10&startRecord=0&recordPacking=XML&availableDBs=defaultdb&sortKeys=Submit+query,http://sru.swissbib.ch/sru/search/defaultdb?query=+dc.anywhere+exact+NATIONALLICENCEspringer101007s1115301494563&operation=searchRetrieve&recordSchema=info%3Asrw%2Fschema%2F1%2Fdc-v1.1-light&maximumRecords=10&startRecord=0&recordPacking=XML&availableDBs=defaultdb&sortKeys=Submit+query,http://sru.swissbib.ch/sru/search/defaultdb?query=+dc.anywhere+exact+NATIONALLICENCEspringer101007s1115301494563&operation=searchRetrieve&recordSchema=info%3Asru%2Fschema%2Fjson&maximumRecords=10&startRecord=0&recordPacking=XML&availableDBs=defaultdb&sortKeys=Submit+query,It was possible to publish this article open access thanks to a Swiss National Licence with the Publisher
"Centre for Development and Environment (CDE), University of Bern, Hallerstrasse 10, 3012, Bern, Switzerland E-mail: gudrun.schwilch@cde.unibe.ch","Schwilch, G.",unibe,10.1007/s00267-013-0071-3,https://doi.org/10.1007/s00267-013-0071-3,http://doc.rero.ch/record/325726/files/267_2013_Article_71.pdf,Sustainable Land Management (SLM) Practices in Drylands: How Do They Address Desertification Threats?,,"Schwilch, G.;Liniger, H. P.;Hurni, H.",2014,Environmental Management,"Centre for Development and Environment (CDE), University of Bern, Hallerstrasse 10, 3012, Bern, Switzerland E-mail: gudrun.schwilch@cde.unibe.ch;Centre for Development and Environment (CDE), University of Bern, Hallerstrasse 10, 3012, Bern, Switzerland;Institute of Geography, University of Bern, Hallerstrasse 12, 3012, Bern, Switzerland",Springer US; http://www.springer-ny.com,2019-11-01,54,,983,1004,0364-152X,1432-1009,copyright,"Springer Science+Business Media New York, 2013",springer,https://www.swissbib.ch/Search/Results?lookfor=nationallicencespringer101007s0026701300713,http://sru.swissbib.ch/sru/search/defaultdb?query=+dc.anywhere+exact+NATIONALLICENCEspringer101007s0026701300713&operation=searchRetrieve&recordSchema=info%3Asrw%2Fschema%2F1%2Fmarcxml-v1.1-light&maximumRecords=10&startRecord=0&recordPacking=XML&availableDBs=defaultdb&sortKeys=Submit+query,http://sru.swissbib.ch/sru/search/defaultdb?query=+dc.anywhere+exact+NATIONALLICENCEspringer101007s0026701300713&operation=searchRetrieve&recordSchema=info%3Asrw%2Fschema%2F1%2Fdc-v1.1-light&maximumRecords=10&startRecord=0&recordPacking=XML&availableDBs=defaultdb&sortKeys=Submit+query,http://sru.swissbib.ch/sru/search/defaultdb?query=+dc.anywhere+exact+NATIONALLICENCEspringer101007s0026701300713&operation=searchRetrieve&recordSchema=info%3Asru%2Fschema%2Fjson&maximumRecords=10&startRecord=0&recordPacking=XML&availableDBs=defaultdb&sortKeys=Submit+query,It was possible to publish this article open access thanks to a Swiss National Licence with the Publisher
"Abteilung für Gynäkologische Endokrinologie und Reproduktionsmedizin, Universitätsklinik für Frauenheilkunde, Inselspital Bern, Effingerstr. 102, 3010, Bern, Schweiz E-mail: petra.stute@insel.ch","Stute, P.",unibe,10.1007/s10304-013-0618-7,https://doi.org/10.1007/s10304-013-0618-7,http://doc.rero.ch/record/325077/files/10304_2013_Article_618.pdf,Hormonale KontrazeptionHormonal contraception,Vorgehensweise nach aktuellen EmpfehlungenApproach according to current recommendations,"Stute, P.",2014,Gynäkologische Endokrinologie,"Abteilung für Gynäkologische Endokrinologie und Reproduktionsmedizin, Universitätsklinik für Frauenheilkunde, Inselspital Bern, Effingerstr. 102, 3010, Bern, Schweiz E-mail: petra.stute@insel.ch",Springer Berlin Heidelberg,2019-11-01,12,4,233,248,1610-2894,1610-2908,copyright,"Springer-Verlag Berlin Heidelberg, 2014",springer,https://www.swissbib.ch/Search/Results?lookfor=nationallicencespringer101007s1030401306187,http://sru.swissbib.ch/sru/search/defaultdb?query=+dc.anywhere+exact+NATIONALLICENCEspringer101007s1030401306187&operation=searchRetrieve&recordSchema=info%3Asrw%2Fschema%2F1%2Fmarcxml-v1.1-light&maximumRecords=10&startRecord=0&recordPacking=XML&availableDBs=defaultdb&sortKeys=Submit+query,http://sru.swissbib.ch/sru/search/defaultdb?query=+dc.anywhere+exact+NATIONALLICENCEspringer101007s1030401306187&operation=searchRetrieve&recordSchema=info%3Asrw%2Fschema%2F1%2Fdc-v1.1-light&maximumRecords=10&startRecord=0&recordPacking=XML&availableDBs=defaultdb&sortKeys=Submit+query,http://sru.swissbib.ch/sru/search/defaultdb?query=+dc.anywhere+exact+NATIONALLICENCEspringer101007s1030401306187&operation=searchRetrieve&recordSchema=info%3Asru%2Fschema%2Fjson&maximumRecords=10&startRecord=0&recordPacking=XML&availableDBs=defaultdb&sortKeys=Submit+query,It was possible to publish this article open access thanks to a Swiss National Licence with the Publisher
