"Department of Colorectal Surgery, Oxford University Hospitals, Churchill Hospital, Old Road, OX3 7LJ, Oxford, Headington, UK Service of Visceral Surgery, Geneva University Hospital and Medical School, 4 rue Gabrielle-Perret-Gentil, 1211, Geneva, Switzerland E-mail: Frederic.Ris@hcuge.ch","Ris, Frederic",unige,10.1007/s00464-014-3432-y,https://doi.org/10.1007/s00464-014-3432-y,,Near-infrared (NIR) perfusion angiography in minimally invasive colorectal surgery,,"Ris, Frederic;Hompes, Roel;Cunningham, Chris;Lindsey, Ian;Guy, Richard;Jones, Oliver;George, Bruce;Cahill, Ronan A.;Mortensen, Neil J.",2014,Surgical Endoscopy,"Department of Colorectal Surgery, Oxford University Hospitals, Churchill Hospital, Old Road, OX3 7LJ, Oxford, Headington, UK Service of Visceral Surgery, Geneva University Hospital and Medical School, 4 rue Gabrielle-Perret-Gentil, 1211, Geneva, Switzerland E-mail: Frederic.Ris@hcuge.ch;Department of Colorectal Surgery, Oxford University Hospitals, Churchill Hospital, Old Road, OX3 7LJ, Oxford, Headington, UK;Department of Colorectal Surgery, Oxford University Hospitals, Churchill Hospital, Old Road, OX3 7LJ, Oxford, Headington, UK;Department of Colorectal Surgery, Oxford University Hospitals, Churchill Hospital, Old Road, OX3 7LJ, Oxford, Headington, UK;Department of Colorectal Surgery, Oxford University Hospitals, Churchill Hospital, Old Road, OX3 7LJ, Oxford, Headington, UK;Department of Colorectal Surgery, Oxford University Hospitals, Churchill Hospital, Old Road, OX3 7LJ, Oxford, Headington, UK;Department of Colorectal Surgery, Oxford University Hospitals, Churchill Hospital, Old Road, OX3 7LJ, Oxford, Headington, UK;Department of Colorectal Surgery, Oxford University Hospitals, Churchill Hospital, Old Road, OX3 7LJ, Oxford, Headington, UK Department of Colorectal Surgery, Beaumont Hospital, Beaumont Road, Dublin, Ireland;Department of Colorectal Surgery, Oxford University Hospitals, Churchill Hospital, Old Road, OX3 7LJ, Oxford, Headington, UK E-mail: neil.mortensen@nds.ox.ac.uk",Springer US; http://www.springer-ny.com,2019-07-01,28,7,2221,2226,0930-2794,1432-2218,copyright,"The Author(s), 2014",springer,https://www.swissbib.ch/Search/Results?lookfor=nationallicencespringer101007s004640143432y,http://sru.swissbib.ch/sru/search/defaultdb?query=+dc.anywhere+exact+NATIONALLICENCEspringer101007s004640143432y&operation=searchRetrieve&recordSchema=info%3Asrw%2Fschema%2F1%2Fmarcxml-v1.1-light&maximumRecords=10&startRecord=0&recordPacking=XML&availableDBs=defaultdb&sortKeys=Submit+query,http://sru.swissbib.ch/sru/search/defaultdb?query=+dc.anywhere+exact+NATIONALLICENCEspringer101007s004640143432y&operation=searchRetrieve&recordSchema=info%3Asrw%2Fschema%2F1%2Fdc-v1.1-light&maximumRecords=10&startRecord=0&recordPacking=XML&availableDBs=defaultdb&sortKeys=Submit+query,http://sru.swissbib.ch/sru/search/defaultdb?query=+dc.anywhere+exact+NATIONALLICENCEspringer101007s004640143432y&operation=searchRetrieve&recordSchema=info%3Asru%2Fschema%2Fjson&maximumRecords=10&startRecord=0&recordPacking=XML&availableDBs=defaultdb&sortKeys=Submit+query,It was possible to publish this article open access thanks to a Swiss National Licence with the Publisher
"Geneva Neuroscience Center, University of Geneva, Geneva, Switzerland Faculty of Psychology and Educational Sciences, University of Geneva, Uni Mail, 40 Bd Du Pont d’Arve, 1205, Geneva, Switzerland University of Applied Sciences of Western Switzerland, Health, Geneva, Switzerland E-mail: clara.james@unige.ch","James, Clara E.",unige,10.1007/s00429-013-0504-z,https://doi.org/10.1007/s00429-013-0504-z,,Musical training intensity yields opposite effects on grey matter density in cognitive versus sensorimotor networks,,"James, Clara E.;Oechslin, Mathias S.;Van De Ville, Dimitri;Hauert, Claude-Alain;Descloux, Céline;Lazeyras, François",2014,Brain Structure and Function,"Geneva Neuroscience Center, University of Geneva, Geneva, Switzerland Faculty of Psychology and Educational Sciences, University of Geneva, Uni Mail, 40 Bd Du Pont d’Arve, 1205, Geneva, Switzerland University of Applied Sciences of Western Switzerland, Health, Geneva, Switzerland E-mail: clara.james@unige.ch;Geneva Neuroscience Center, University of Geneva, Geneva, Switzerland Faculty of Psychology and Educational Sciences, University of Geneva, Uni Mail, 40 Bd Du Pont d’Arve, 1205, Geneva, Switzerland;Geneva Neuroscience Center, University of Geneva, Geneva, Switzerland Faculty of Medicine, Department of Radiology and Medical Informatics, University of Geneva, Geneva, Switzerland Institute of Bioengineering, École Polytechnique Fédérale de Lausanne, Lausanne, Switzerland;Geneva Neuroscience Center, University of Geneva, Geneva, Switzerland Faculty of Psychology and Educational Sciences, University of Geneva, Uni Mail, 40 Bd Du Pont d’Arve, 1205, Geneva, Switzerland;Medical University of Lausanne, Lausanne, Switzerland;Faculty of Medicine, Department of Radiology and Medical Informatics, University of Geneva, Geneva, Switzerland",Springer Berlin Heidelberg,,219,1,353,366,1863-2653,1863-2661,copyright,"Springer-Verlag Berlin Heidelberg, 2013",springer,https://www.swissbib.ch/Search/Results?lookfor=nationallicencespringer101007s004290130504z,http://sru.swissbib.ch/sru/search/defaultdb?query=+dc.anywhere+exact+NATIONALLICENCEspringer101007s004290130504z&operation=searchRetrieve&recordSchema=info%3Asrw%2Fschema%2F1%2Fmarcxml-v1.1-light&maximumRecords=10&startRecord=0&recordPacking=XML&availableDBs=defaultdb&sortKeys=Submit+query,http://sru.swissbib.ch/sru/search/defaultdb?query=+dc.anywhere+exact+NATIONALLICENCEspringer101007s004290130504z&operation=searchRetrieve&recordSchema=info%3Asrw%2Fschema%2F1%2Fdc-v1.1-light&maximumRecords=10&startRecord=0&recordPacking=XML&availableDBs=defaultdb&sortKeys=Submit+query,http://sru.swissbib.ch/sru/search/defaultdb?query=+dc.anywhere+exact+NATIONALLICENCEspringer101007s004290130504z&operation=searchRetrieve&recordSchema=info%3Asru%2Fschema%2Fjson&maximumRecords=10&startRecord=0&recordPacking=XML&availableDBs=defaultdb&sortKeys=Submit+query,It was possible to publish this article open access thanks to a Swiss National Licence with the Publisher
"Département de philosophie, Université de Genève, Rue de Candolle 2, 1205, Genève, Switzerland E-mail: Arturs.Logins@unige.ch","Logins, Arturs",unige,10.1007/s12136-014-0220-1,https://doi.org/10.1007/s12136-014-0220-1,,The Problem of Massive Deception for Justification Norms of Action,,"Logins, Arturs",2014,Acta Analytica,"Département de philosophie, Université de Genève, Rue de Candolle 2, 1205, Genève, Switzerland E-mail: Arturs.Logins@unige.ch",Springer Netherlands,2019-12-01,29,4,457,468,0353-5150,1874-6349,copyright,"Springer Science+Business Media Dordrecht, 2014",springer,https://www.swissbib.ch/Search/Results?lookfor=nationallicencespringer101007s1213601402201,http://sru.swissbib.ch/sru/search/defaultdb?query=+dc.anywhere+exact+NATIONALLICENCEspringer101007s1213601402201&operation=searchRetrieve&recordSchema=info%3Asrw%2Fschema%2F1%2Fmarcxml-v1.1-light&maximumRecords=10&startRecord=0&recordPacking=XML&availableDBs=defaultdb&sortKeys=Submit+query,http://sru.swissbib.ch/sru/search/defaultdb?query=+dc.anywhere+exact+NATIONALLICENCEspringer101007s1213601402201&operation=searchRetrieve&recordSchema=info%3Asrw%2Fschema%2F1%2Fdc-v1.1-light&maximumRecords=10&startRecord=0&recordPacking=XML&availableDBs=defaultdb&sortKeys=Submit+query,http://sru.swissbib.ch/sru/search/defaultdb?query=+dc.anywhere+exact+NATIONALLICENCEspringer101007s1213601402201&operation=searchRetrieve&recordSchema=info%3Asru%2Fschema%2Fjson&maximumRecords=10&startRecord=0&recordPacking=XML&availableDBs=defaultdb&sortKeys=Submit+query,It was possible to publish this article open access thanks to a Swiss National Licence with the Publisher
"Neurosurgery Division, Department of Clinical Neurosciences, Faculty of Medicine, Geneva University Medical Center, Rue Gabrielle-Perret-Gentil 4, 1211, Genève 14, Switzerland E-mail: ivan.cabrilo@hcuge.ch","Cabrilo, Ivan",unige,10.1007/s00701-014-2183-9,https://doi.org/10.1007/s00701-014-2183-9,,Augmented reality in the surgery of cerebral arteriovenous malformations: technique assessment and considerations,,"Cabrilo, Ivan;Bijlenga, Philippe;Schaller, Karl",2014,Acta Neurochirurgica,"Neurosurgery Division, Department of Clinical Neurosciences, Faculty of Medicine, Geneva University Medical Center, Rue Gabrielle-Perret-Gentil 4, 1211, Genève 14, Switzerland E-mail: ivan.cabrilo@hcuge.ch;Neurosurgery Division, Department of Clinical Neurosciences, Faculty of Medicine, Geneva University Medical Center, Rue Gabrielle-Perret-Gentil 4, 1211, Genève 14, Switzerland;Neurosurgery Division, Department of Clinical Neurosciences, Faculty of Medicine, Geneva University Medical Center, Rue Gabrielle-Perret-Gentil 4, 1211, Genève 14, Switzerland",Springer Vienna,2019-09-01,156,9,1769,1774,0001-6268,0942-0940,copyright,"Springer-Verlag Wien, 2014",springer,https://www.swissbib.ch/Search/Results?lookfor=nationallicencespringer101007s0070101421839,http://sru.swissbib.ch/sru/search/defaultdb?query=+dc.anywhere+exact+NATIONALLICENCEspringer101007s0070101421839&operation=searchRetrieve&recordSchema=info%3Asrw%2Fschema%2F1%2Fmarcxml-v1.1-light&maximumRecords=10&startRecord=0&recordPacking=XML&availableDBs=defaultdb&sortKeys=Submit+query,http://sru.swissbib.ch/sru/search/defaultdb?query=+dc.anywhere+exact+NATIONALLICENCEspringer101007s0070101421839&operation=searchRetrieve&recordSchema=info%3Asrw%2Fschema%2F1%2Fdc-v1.1-light&maximumRecords=10&startRecord=0&recordPacking=XML&availableDBs=defaultdb&sortKeys=Submit+query,http://sru.swissbib.ch/sru/search/defaultdb?query=+dc.anywhere+exact+NATIONALLICENCEspringer101007s0070101421839&operation=searchRetrieve&recordSchema=info%3Asru%2Fschema%2Fjson&maximumRecords=10&startRecord=0&recordPacking=XML&availableDBs=defaultdb&sortKeys=Submit+query,It was possible to publish this article open access thanks to a Swiss National Licence with the Publisher
"Neurosurgical Department, Hirslanden Klinik, Zurich, Switzerland Neurosurgical Department, University of Geneva, Geneva, Switzerland Klinik Hirslanden, Witellikerstrasse 40, 8032, Zurich, Switzerland E-mail: mpayer@hotmail.com","Payer, Michael",unige,10.1007/s00701-014-2018-8,https://doi.org/10.1007/s00701-014-2018-8,,Erratum to: Dynamic transpedicular stabilisation and decompression in single-level degenerative anterolisthesis and stenosis,,"Payer, Michael;Smoll, Nicolas R.;Oezkan, Neriman;Tessitore, Enrico",2014,Acta Neurochirurgica,"Neurosurgical Department, Hirslanden Klinik, Zurich, Switzerland Neurosurgical Department, University of Geneva, Geneva, Switzerland Klinik Hirslanden, Witellikerstrasse 40, 8032, Zurich, Switzerland E-mail: mpayer@hotmail.com;Department of Surgery, Frankston Hospital, Frankston, Victoria, Australia;Neurosurgical Department, Universitätsklinikum Essen, Essen, Germany;Neurosurgical Department, University of Geneva, Geneva, Switzerland",Springer Vienna,,156,4,759,759,0001-6268,0942-0940,copyright,"Springer-Verlag Wien, 2014",springer,https://www.swissbib.ch/Search/Results?lookfor=nationallicencespringer101007s0070101420188,http://sru.swissbib.ch/sru/search/defaultdb?query=+dc.anywhere+exact+NATIONALLICENCEspringer101007s0070101420188&operation=searchRetrieve&recordSchema=info%3Asrw%2Fschema%2F1%2Fmarcxml-v1.1-light&maximumRecords=10&startRecord=0&recordPacking=XML&availableDBs=defaultdb&sortKeys=Submit+query,http://sru.swissbib.ch/sru/search/defaultdb?query=+dc.anywhere+exact+NATIONALLICENCEspringer101007s0070101420188&operation=searchRetrieve&recordSchema=info%3Asrw%2Fschema%2F1%2Fdc-v1.1-light&maximumRecords=10&startRecord=0&recordPacking=XML&availableDBs=defaultdb&sortKeys=Submit+query,http://sru.swissbib.ch/sru/search/defaultdb?query=+dc.anywhere+exact+NATIONALLICENCEspringer101007s0070101420188&operation=searchRetrieve&recordSchema=info%3Asru%2Fschema%2Fjson&maximumRecords=10&startRecord=0&recordPacking=XML&availableDBs=defaultdb&sortKeys=Submit+query,It was possible to publish this article open access thanks to a Swiss National Licence with the Publisher
"Neurosurgical Department, Hirslanden Klinik, Witellikerstrasse 40, 8032, Zürich, Switzerland Neurosurgical Department, University of Geneva, Geneva, Switzerland E-mail: mpayer@hotmail.com","Payer, Michael",unige,10.1007/s00701-014-2005-0,https://doi.org/10.1007/s00701-014-2005-0,,L5/S1 disc herniation and S1 pedicle aplasia: case report and review of the literature,,"Payer, Michael;Tessitore, Enrico",2014,Acta Neurochirurgica,"Neurosurgical Department, Hirslanden Klinik, Witellikerstrasse 40, 8032, Zürich, Switzerland Neurosurgical Department, University of Geneva, Geneva, Switzerland E-mail: mpayer@hotmail.com;Neurosurgical Department, University of Geneva, Geneva, Switzerland",Springer Vienna,,156,4,757,758,0001-6268,0942-0940,copyright,"Springer-Verlag Wien, 2014",springer,https://www.swissbib.ch/Search/Results?lookfor=nationallicencespringer101007s0070101420050,http://sru.swissbib.ch/sru/search/defaultdb?query=+dc.anywhere+exact+NATIONALLICENCEspringer101007s0070101420050&operation=searchRetrieve&recordSchema=info%3Asrw%2Fschema%2F1%2Fmarcxml-v1.1-light&maximumRecords=10&startRecord=0&recordPacking=XML&availableDBs=defaultdb&sortKeys=Submit+query,http://sru.swissbib.ch/sru/search/defaultdb?query=+dc.anywhere+exact+NATIONALLICENCEspringer101007s0070101420050&operation=searchRetrieve&recordSchema=info%3Asrw%2Fschema%2F1%2Fdc-v1.1-light&maximumRecords=10&startRecord=0&recordPacking=XML&availableDBs=defaultdb&sortKeys=Submit+query,http://sru.swissbib.ch/sru/search/defaultdb?query=+dc.anywhere+exact+NATIONALLICENCEspringer101007s0070101420050&operation=searchRetrieve&recordSchema=info%3Asru%2Fschema%2Fjson&maximumRecords=10&startRecord=0&recordPacking=XML&availableDBs=defaultdb&sortKeys=Submit+query,It was possible to publish this article open access thanks to a Swiss National Licence with the Publisher
"Department of Philosophy, University of Geneva, 2, rue de Candolle, 1211, Geneva, Switzerland E-mail: Olivier.Massin@unige.ch","Massin, Olivier",unige,10.1007/s13164-014-0179-2,https://doi.org/10.1007/s13164-014-0179-2,,Pleasure and Its Contraries,,"Massin, Olivier",2014,Review of Philosophy and Psychology,"Department of Philosophy, University of Geneva, 2, rue de Candolle, 1211, Geneva, Switzerland E-mail: Olivier.Massin@unige.ch",Springer Netherlands,,5,,15,40,1878-5158,1878-5166,copyright,"Springer Science+Business Media Dordrecht, 2014",springer,https://www.swissbib.ch/Search/Results?lookfor=nationallicencespringer101007s1316401401792,http://sru.swissbib.ch/sru/search/defaultdb?query=+dc.anywhere+exact+NATIONALLICENCEspringer101007s1316401401792&operation=searchRetrieve&recordSchema=info%3Asrw%2Fschema%2F1%2Fmarcxml-v1.1-light&maximumRecords=10&startRecord=0&recordPacking=XML&availableDBs=defaultdb&sortKeys=Submit+query,http://sru.swissbib.ch/sru/search/defaultdb?query=+dc.anywhere+exact+NATIONALLICENCEspringer101007s1316401401792&operation=searchRetrieve&recordSchema=info%3Asrw%2Fschema%2F1%2Fdc-v1.1-light&maximumRecords=10&startRecord=0&recordPacking=XML&availableDBs=defaultdb&sortKeys=Submit+query,http://sru.swissbib.ch/sru/search/defaultdb?query=+dc.anywhere+exact+NATIONALLICENCEspringer101007s1316401401792&operation=searchRetrieve&recordSchema=info%3Asru%2Fschema%2Fjson&maximumRecords=10&startRecord=0&recordPacking=XML&availableDBs=defaultdb&sortKeys=Submit+query,It was possible to publish this article open access thanks to a Swiss National Licence with the Publisher
"Clinic for Visceral and Transplantation Surgery, Department of Surgery, University Hospital of Geneva, Rue Gabrielle-Perret-Gentil 4, 1211, Geneva 14, Switzerland E-mail: nicolas.c.buchs@hcuge.ch","Buchs, Nicolas C.",unige,10.1007/s11695-014-1335-6,https://doi.org/10.1007/s11695-014-1335-6,,Laparoscopic Versus Robotic Roux-En-Y Gastric Bypass: Lessons and Long-Term Follow-Up Learned From a Large Prospective Monocentric Study,,"Buchs, Nicolas C.;Morel, Philippe;Azagury, Dan E.;Jung, Minoa;Chassot, Gilles;Huber, Olivier;Hagen, Monika E.;Pugin, François",2014,Obesity Surgery,"Clinic for Visceral and Transplantation Surgery, Department of Surgery, University Hospital of Geneva, Rue Gabrielle-Perret-Gentil 4, 1211, Geneva 14, Switzerland E-mail: nicolas.c.buchs@hcuge.ch;Clinic for Visceral and Transplantation Surgery, Department of Surgery, University Hospital of Geneva, Rue Gabrielle-Perret-Gentil 4, 1211, Geneva 14, Switzerland;Clinic for Visceral and Transplantation Surgery, Department of Surgery, University Hospital of Geneva, Rue Gabrielle-Perret-Gentil 4, 1211, Geneva 14, Switzerland;Clinic for Visceral and Transplantation Surgery, Department of Surgery, University Hospital of Geneva, Rue Gabrielle-Perret-Gentil 4, 1211, Geneva 14, Switzerland;Clinic for Visceral and Transplantation Surgery, Department of Surgery, University Hospital of Geneva, Rue Gabrielle-Perret-Gentil 4, 1211, Geneva 14, Switzerland;Clinic for Visceral and Transplantation Surgery, Department of Surgery, University Hospital of Geneva, Rue Gabrielle-Perret-Gentil 4, 1211, Geneva 14, Switzerland;Clinic for Visceral and Transplantation Surgery, Department of Surgery, University Hospital of Geneva, Rue Gabrielle-Perret-Gentil 4, 1211, Geneva 14, Switzerland;Clinic for Visceral and Transplantation Surgery, Department of Surgery, University Hospital of Geneva, Rue Gabrielle-Perret-Gentil 4, 1211, Geneva 14, Switzerland",Springer US; http://www.springer-ny.com,2019-12-01,24,12,2031,2039,0960-8923,1708-0428,copyright,"Springer Science+Business Media New York, 2014",springer,https://www.swissbib.ch/Search/Results?lookfor=nationallicencespringer101007s1169501413356,http://sru.swissbib.ch/sru/search/defaultdb?query=+dc.anywhere+exact+NATIONALLICENCEspringer101007s1169501413356&operation=searchRetrieve&recordSchema=info%3Asrw%2Fschema%2F1%2Fmarcxml-v1.1-light&maximumRecords=10&startRecord=0&recordPacking=XML&availableDBs=defaultdb&sortKeys=Submit+query,http://sru.swissbib.ch/sru/search/defaultdb?query=+dc.anywhere+exact+NATIONALLICENCEspringer101007s1169501413356&operation=searchRetrieve&recordSchema=info%3Asrw%2Fschema%2F1%2Fdc-v1.1-light&maximumRecords=10&startRecord=0&recordPacking=XML&availableDBs=defaultdb&sortKeys=Submit+query,http://sru.swissbib.ch/sru/search/defaultdb?query=+dc.anywhere+exact+NATIONALLICENCEspringer101007s1169501413356&operation=searchRetrieve&recordSchema=info%3Asru%2Fschema%2Fjson&maximumRecords=10&startRecord=0&recordPacking=XML&availableDBs=defaultdb&sortKeys=Submit+query,It was possible to publish this article open access thanks to a Swiss National Licence with the Publisher
"Geneva University Hospitals and Faculty of Medicine, 1211, Geneva 14, Switzerland E-mail: Rene.Rizzoli@unige.ch","Rizzoli, R.",unige,10.1007/s11657-014-0187-y,https://doi.org/10.1007/s11657-014-0187-y,,Epidemiology and economic burden of osteoporosis in Switzerland,,"Svedbom, A.;Ivergård, M.;Hernlund, E.;Rizzoli, R.;Kanis, J. A.",2014,Archives of Osteoporosis,"OptumInsight, Stockholm, Sweden;OptumInsight, Stockholm, Sweden;OptumInsight, Stockholm, Sweden Unit of Dermatology and Venerology, Department of Medicine, Karlolinska Institutet, Stockholm, Sweden;Geneva University Hospitals and Faculty of Medicine, 1211, Geneva 14, Switzerland E-mail: Rene.Rizzoli@unige.ch;Centre for Metabolic Bone Diseases, University of Sheffield, Sheffield, UK",Springer London,2019-12-01,9,1,1,8,1862-3522,1862-3514,copyright,"International Osteoporosis Foundation and National Osteoporosis Foundation, 2014",springer,https://www.swissbib.ch/Search/Results?lookfor=nationallicencespringer101007s116570140187y,http://sru.swissbib.ch/sru/search/defaultdb?query=+dc.anywhere+exact+NATIONALLICENCEspringer101007s116570140187y&operation=searchRetrieve&recordSchema=info%3Asrw%2Fschema%2F1%2Fmarcxml-v1.1-light&maximumRecords=10&startRecord=0&recordPacking=XML&availableDBs=defaultdb&sortKeys=Submit+query,http://sru.swissbib.ch/sru/search/defaultdb?query=+dc.anywhere+exact+NATIONALLICENCEspringer101007s116570140187y&operation=searchRetrieve&recordSchema=info%3Asrw%2Fschema%2F1%2Fdc-v1.1-light&maximumRecords=10&startRecord=0&recordPacking=XML&availableDBs=defaultdb&sortKeys=Submit+query,http://sru.swissbib.ch/sru/search/defaultdb?query=+dc.anywhere+exact+NATIONALLICENCEspringer101007s116570140187y&operation=searchRetrieve&recordSchema=info%3Asru%2Fschema%2Fjson&maximumRecords=10&startRecord=0&recordPacking=XML&availableDBs=defaultdb&sortKeys=Submit+query,It was possible to publish this article open access thanks to a Swiss National Licence with the Publisher
"Laboratory of Cognitive Neurorehabilitation, Faculty of Medicine, University of Geneva, Geneva, Switzerland Division of Neurorehabilitation, Department of Clinical Neurosciences, University Hospitals Geneva, Av. de Beau-Séjour 26, 1211, Geneva 14, Switzerland Faculty of Psychology and Educational Sciences, University of Geneva, Geneva, Switzerland E-mail: radek.ptak@hcuge.ch","Ptak, Radek",unige,10.1007/s00221-014-3839-7,https://doi.org/10.1007/s00221-014-3839-7,,Exploring the world with Bálint syndrome: biased bottom-up guidance of gaze by local saliency differences,,"Ptak, Radek;Fellrath, Julia",2014,Experimental Brain Research,"Laboratory of Cognitive Neurorehabilitation, Faculty of Medicine, University of Geneva, Geneva, Switzerland Division of Neurorehabilitation, Department of Clinical Neurosciences, University Hospitals Geneva, Av. de Beau-Séjour 26, 1211, Geneva 14, Switzerland Faculty of Psychology and Educational Sciences, University of Geneva, Geneva, Switzerland E-mail: radek.ptak@hcuge.ch;Laboratory of Cognitive Neurorehabilitation, Faculty of Medicine, University of Geneva, Geneva, Switzerland",Springer Berlin Heidelberg,,232,4,1233,1240,0014-4819,1432-1106,copyright,"Springer-Verlag Berlin Heidelberg, 2014",springer,https://www.swissbib.ch/Search/Results?lookfor=nationallicencespringer101007s0022101438397,http://sru.swissbib.ch/sru/search/defaultdb?query=+dc.anywhere+exact+NATIONALLICENCEspringer101007s0022101438397&operation=searchRetrieve&recordSchema=info%3Asrw%2Fschema%2F1%2Fmarcxml-v1.1-light&maximumRecords=10&startRecord=0&recordPacking=XML&availableDBs=defaultdb&sortKeys=Submit+query,http://sru.swissbib.ch/sru/search/defaultdb?query=+dc.anywhere+exact+NATIONALLICENCEspringer101007s0022101438397&operation=searchRetrieve&recordSchema=info%3Asrw%2Fschema%2F1%2Fdc-v1.1-light&maximumRecords=10&startRecord=0&recordPacking=XML&availableDBs=defaultdb&sortKeys=Submit+query,http://sru.swissbib.ch/sru/search/defaultdb?query=+dc.anywhere+exact+NATIONALLICENCEspringer101007s0022101438397&operation=searchRetrieve&recordSchema=info%3Asru%2Fschema%2Fjson&maximumRecords=10&startRecord=0&recordPacking=XML&availableDBs=defaultdb&sortKeys=Submit+query,It was possible to publish this article open access thanks to a Swiss National Licence with the Publisher
