"Functional Brain Mapping Laboratory, Department of Fundamental Neuroscience, CMU, University of Geneva, Rue Michel-Servet 1, 1206, Geneva, Switzerland E-mail: vincent.rochas@unige.ch","Rochas, Vincent",unige,10.1007/s00221-014-3843-y,https://doi.org/10.1007/s00221-014-3843-y,,Very early processing of emotional words revealed in temporoparietal junctions of both hemispheres by EEG and TMS,,"Rochas, Vincent;Rihs, Tonia A.;Rosenberg, Nadia;Landis, Theodor;Michel, Christoph M.",2014,Experimental Brain Research,"Functional Brain Mapping Laboratory, Department of Fundamental Neuroscience, CMU, University of Geneva, Rue Michel-Servet 1, 1206, Geneva, Switzerland E-mail: vincent.rochas@unige.ch;Functional Brain Mapping Laboratory, Department of Fundamental Neuroscience, CMU, University of Geneva, Rue Michel-Servet 1, 1206, Geneva, Switzerland;Functional Brain Mapping Laboratory, Department of Fundamental Neuroscience, CMU, University of Geneva, Rue Michel-Servet 1, 1206, Geneva, Switzerland;Functional Brain Mapping Laboratory, Department of Fundamental Neuroscience, CMU, University of Geneva, Rue Michel-Servet 1, 1206, Geneva, Switzerland;Functional Brain Mapping Laboratory, Department of Fundamental Neuroscience, CMU, University of Geneva, Rue Michel-Servet 1, 1206, Geneva, Switzerland",Springer Berlin Heidelberg,,232,4,1267,1281,0014-4819,1432-1106,copyright,"Springer-Verlag Berlin Heidelberg, 2014",springer,https://www.swissbib.ch/Search/Results?lookfor=nationallicencespringer101007s002210143843y,http://sru.swissbib.ch/sru/search/defaultdb?query=+dc.anywhere+exact+NATIONALLICENCEspringer101007s002210143843y&operation=searchRetrieve&recordSchema=info%3Asrw%2Fschema%2F1%2Fmarcxml-v1.1-light&maximumRecords=10&startRecord=0&recordPacking=XML&availableDBs=defaultdb&sortKeys=Submit+query,http://sru.swissbib.ch/sru/search/defaultdb?query=+dc.anywhere+exact+NATIONALLICENCEspringer101007s002210143843y&operation=searchRetrieve&recordSchema=info%3Asrw%2Fschema%2F1%2Fdc-v1.1-light&maximumRecords=10&startRecord=0&recordPacking=XML&availableDBs=defaultdb&sortKeys=Submit+query,http://sru.swissbib.ch/sru/search/defaultdb?query=+dc.anywhere+exact+NATIONALLICENCEspringer101007s002210143843y&operation=searchRetrieve&recordSchema=info%3Asru%2Fschema%2Fjson&maximumRecords=10&startRecord=0&recordPacking=XML&availableDBs=defaultdb&sortKeys=Submit+query,It was possible to publish this article open access thanks to a Swiss National Licence with the Publisher
"GAP-Biophotonics, Université de Genève, Chemin de Pinchat 22, 1211, Geneva 4, Switzerland E-mail: andrey.stepanov@unige.ch","Stepanov, A. G.",unige,10.1007/s00340-013-5619-7,https://doi.org/10.1007/s00340-013-5619-7,,Erratum to: Mobile source of high-energy single-cycle terahertz pulses,,"Stepanov, A. G.;Henin, S.;Petit, Y.;Bonacina, L.;Kasparian, J.;Wolf, J.-P.",2014,Applied Physics B,"GAP-Biophotonics, Université de Genève, Chemin de Pinchat 22, 1211, Geneva 4, Switzerland E-mail: andrey.stepanov@unige.ch;GAP-Biophotonics, Université de Genève, Chemin de Pinchat 22, 1211, Geneva 4, Switzerland;GAP-Biophotonics, Université de Genève, Chemin de Pinchat 22, 1211, Geneva 4, Switzerland CNRS, University Bordeaux, ICMCB, UPR 9048, 33600, Pessac, France;GAP-Biophotonics, Université de Genève, Chemin de Pinchat 22, 1211, Geneva 4, Switzerland;GAP-Biophotonics, Université de Genève, Chemin de Pinchat 22, 1211, Geneva 4, Switzerland;GAP-Biophotonics, Université de Genève, Chemin de Pinchat 22, 1211, Geneva 4, Switzerland E-mail: jean-pierre.wolf@unige.ch",Springer Berlin Heidelberg,2019-05-01,115,2,293,293,0946-2171,1432-0649,copyright,"Springer-Verlag Berlin Heidelberg, 2014",springer,https://www.swissbib.ch/Search/Results?lookfor=nationallicencespringer101007s0034001356197,http://sru.swissbib.ch/sru/search/defaultdb?query=+dc.anywhere+exact+NATIONALLICENCEspringer101007s0034001356197&operation=searchRetrieve&recordSchema=info%3Asrw%2Fschema%2F1%2Fmarcxml-v1.1-light&maximumRecords=10&startRecord=0&recordPacking=XML&availableDBs=defaultdb&sortKeys=Submit+query,http://sru.swissbib.ch/sru/search/defaultdb?query=+dc.anywhere+exact+NATIONALLICENCEspringer101007s0034001356197&operation=searchRetrieve&recordSchema=info%3Asrw%2Fschema%2F1%2Fdc-v1.1-light&maximumRecords=10&startRecord=0&recordPacking=XML&availableDBs=defaultdb&sortKeys=Submit+query,http://sru.swissbib.ch/sru/search/defaultdb?query=+dc.anywhere+exact+NATIONALLICENCEspringer101007s0034001356197&operation=searchRetrieve&recordSchema=info%3Asru%2Fschema%2Fjson&maximumRecords=10&startRecord=0&recordPacking=XML&availableDBs=defaultdb&sortKeys=Submit+query,It was possible to publish this article open access thanks to a Swiss National Licence with the Publisher
"GAP-Nonlinear, Université de Genève, Chemin de Pinchat 22, 1211, Genève 4, Switzerland E-mail: jerome.kasparian@unige.ch","Kasparian, J.",unige,10.1007/s00340-014-5881-3,https://doi.org/10.1007/s00340-014-5881-3,,Pump-probe differential Lidar to quantify atmospheric supersaturation and particle-forming trace gases,,"Chagas, J. C. S.;Leisner, T.;Kasparian, J.",2014,Applied Physics B,"GAP-Nonlinear, Université de Genève, Chemin de Pinchat 22, 1211, Genève 4, Switzerland Center for Weather Forecast and Climate Studies-CPTEC, National Institute for Space Research-INPE, Cachoeira Paulista, SP, Brazil;Institute for Meteorology and Climate Research, Karlsruhe Institute of Technology, Karlsruhe, Germany;GAP-Nonlinear, Université de Genève, Chemin de Pinchat 22, 1211, Genève 4, Switzerland E-mail: jerome.kasparian@unige.ch",Springer Berlin Heidelberg,2019-11-01,117,2,667,672,0946-2171,1432-0649,copyright,"Springer-Verlag Berlin Heidelberg, 2014",springer,https://www.swissbib.ch/Search/Results?lookfor=nationallicencespringer101007s0034001458813,http://sru.swissbib.ch/sru/search/defaultdb?query=+dc.anywhere+exact+NATIONALLICENCEspringer101007s0034001458813&operation=searchRetrieve&recordSchema=info%3Asrw%2Fschema%2F1%2Fmarcxml-v1.1-light&maximumRecords=10&startRecord=0&recordPacking=XML&availableDBs=defaultdb&sortKeys=Submit+query,http://sru.swissbib.ch/sru/search/defaultdb?query=+dc.anywhere+exact+NATIONALLICENCEspringer101007s0034001458813&operation=searchRetrieve&recordSchema=info%3Asrw%2Fschema%2F1%2Fdc-v1.1-light&maximumRecords=10&startRecord=0&recordPacking=XML&availableDBs=defaultdb&sortKeys=Submit+query,http://sru.swissbib.ch/sru/search/defaultdb?query=+dc.anywhere+exact+NATIONALLICENCEspringer101007s0034001458813&operation=searchRetrieve&recordSchema=info%3Asru%2Fschema%2Fjson&maximumRecords=10&startRecord=0&recordPacking=XML&availableDBs=defaultdb&sortKeys=Submit+query,It was possible to publish this article open access thanks to a Swiss National Licence with the Publisher
"Département de Physique Théorique, Université de Genève, 1211 , Genève 4, Switzerland Section de Mathématiques, Université de Genève, 1211 , Genève 4, Switzerland E-mail: jean-pierre.eckmann@unige.ch","Eckmann, J.-P.",unige,10.1007/s10955-014-0992-0,https://doi.org/10.1007/s10955-014-0992-0,,The Colored Hofstadter Butterfly for the Honeycomb Lattice,,"Agazzi, A.;Eckmann, J.-P.;Graf, G. M.",2014,Journal of Statistical Physics,"Département de Physique Théorique, Université de Genève, 1211 , Genève 4, Switzerland;Département de Physique Théorique, Université de Genève, 1211 , Genève 4, Switzerland Section de Mathématiques, Université de Genève, 1211 , Genève 4, Switzerland E-mail: jean-pierre.eckmann@unige.ch;Institut für Theoretische Physik, ETH, 8093 , Zürich, Switzerland",Springer US; http://www.springer-ny.com,2019-08-01,156,3,417,426,0022-4715,1572-9613,copyright,"Springer Science+Business Media New York, 2014",springer,https://www.swissbib.ch/Search/Results?lookfor=nationallicencespringer101007s1095501409920,http://sru.swissbib.ch/sru/search/defaultdb?query=+dc.anywhere+exact+NATIONALLICENCEspringer101007s1095501409920&operation=searchRetrieve&recordSchema=info%3Asrw%2Fschema%2F1%2Fmarcxml-v1.1-light&maximumRecords=10&startRecord=0&recordPacking=XML&availableDBs=defaultdb&sortKeys=Submit+query,http://sru.swissbib.ch/sru/search/defaultdb?query=+dc.anywhere+exact+NATIONALLICENCEspringer101007s1095501409920&operation=searchRetrieve&recordSchema=info%3Asrw%2Fschema%2F1%2Fdc-v1.1-light&maximumRecords=10&startRecord=0&recordPacking=XML&availableDBs=defaultdb&sortKeys=Submit+query,http://sru.swissbib.ch/sru/search/defaultdb?query=+dc.anywhere+exact+NATIONALLICENCEspringer101007s1095501409920&operation=searchRetrieve&recordSchema=info%3Asru%2Fschema%2Fjson&maximumRecords=10&startRecord=0&recordPacking=XML&availableDBs=defaultdb&sortKeys=Submit+query,It was possible to publish this article open access thanks to a Swiss National Licence with the Publisher
"Department of Theoretical Physics, University of Geneva, Ecole de Physique, 24 quai-Ernest-Ansermet, 1211, Geneva 4, Switzerland E-mail: tatiana.yarmola@unige.ch E-mail: tanya.yarmola@gmail.com","Yarmola, Tatiana",unige,10.1007/s10955-014-1014-y,https://doi.org/10.1007/s10955-014-1014-y,,Sub-exponential Mixing of Open Systems with Particle–Disk Interactions,,"Yarmola, Tatiana",2014,Journal of Statistical Physics,"Department of Theoretical Physics, University of Geneva, Ecole de Physique, 24 quai-Ernest-Ansermet, 1211, Geneva 4, Switzerland E-mail: tatiana.yarmola@unige.ch E-mail: tanya.yarmola@gmail.com",Springer US; http://www.springer-ny.com,2019-08-01,156,3,473,492,0022-4715,1572-9613,copyright,"Springer Science+Business Media New York, 2014",springer,https://www.swissbib.ch/Search/Results?lookfor=nationallicencespringer101007s109550141014y,http://sru.swissbib.ch/sru/search/defaultdb?query=+dc.anywhere+exact+NATIONALLICENCEspringer101007s109550141014y&operation=searchRetrieve&recordSchema=info%3Asrw%2Fschema%2F1%2Fmarcxml-v1.1-light&maximumRecords=10&startRecord=0&recordPacking=XML&availableDBs=defaultdb&sortKeys=Submit+query,http://sru.swissbib.ch/sru/search/defaultdb?query=+dc.anywhere+exact+NATIONALLICENCEspringer101007s109550141014y&operation=searchRetrieve&recordSchema=info%3Asrw%2Fschema%2F1%2Fdc-v1.1-light&maximumRecords=10&startRecord=0&recordPacking=XML&availableDBs=defaultdb&sortKeys=Submit+query,http://sru.swissbib.ch/sru/search/defaultdb?query=+dc.anywhere+exact+NATIONALLICENCEspringer101007s109550141014y&operation=searchRetrieve&recordSchema=info%3Asru%2Fschema%2Fjson&maximumRecords=10&startRecord=0&recordPacking=XML&availableDBs=defaultdb&sortKeys=Submit+query,It was possible to publish this article open access thanks to a Swiss National Licence with the Publisher
"Faculty of science, Forel Institute and Institute of Environmental Sciences, University of Geneva, CP 416, 1290, Versoix, Switzerland Department of Chemistry, Faculty of Science, University of Kinshasa (UNIKIN), B.P. 190, Kinshasa XI, Democratic Republic of Congo Université Pédagogique Nationale (UPN), Croisement Route de Matadi et Avenue de la Libération. Quartier Binza/UPN, B.P. 8815, Kinshasa, Democratic Republic of Congo E-mail: john.pote@unige.ch","Poté, John",unige,10.1007/s10661-014-3951-y,https://doi.org/10.1007/s10661-014-3951-y,,"Erratum to: Assessment of pathogenic bacteria in water and sediment from a water reservoir under tropical conditions (Lake Ma Vallée), Kinshasa Democratic Republic of Congo",,"Mwanamoki, Paola M.;Devarajan, Naresh;Thevenon, Florian;Atibu, Emmanuel K.;Tshibanda, Joseph B.;Ngelinkoto, Patience;Mpiana, Pius T.;Prabakar, Kandasamy;Mubedi, Josué I.;Kabele, Christophe G.;Wildi, Walter;Poté, John",2014,Environmental Monitoring and Assessment,"Section Nutrition diététique, Institut Supérieur des Techniques Médicales/Kinshasa, B.P. 774, Kinshasa XI, Democratic Republic of Congo;Faculty of science, Forel Institute and Institute of Environmental Sciences, University of Geneva, CP 416, 1290, Versoix, Switzerland Postgraduate and Research Department of Zoology, Jamal Mohamed College, 620020, Tiruchirappalli, Tamil Nadu, India;Faculty of science, Forel Institute and Institute of Environmental Sciences, University of Geneva, CP 416, 1290, Versoix, Switzerland;Department of Chemistry, Faculty of Science, University of Kinshasa (UNIKIN), B.P. 190, Kinshasa XI, Democratic Republic of Congo;Department of Chemistry, Faculty of Science, University of Kinshasa (UNIKIN), B.P. 190, Kinshasa XI, Democratic Republic of Congo;Université Pédagogique Nationale (UPN), Croisement Route de Matadi et Avenue de la Libération. Quartier Binza/UPN, B.P. 8815, Kinshasa, Democratic Republic of Congo;Department of Chemistry, Faculty of Science, University of Kinshasa (UNIKIN), B.P. 190, Kinshasa XI, Democratic Republic of Congo;Postgraduate and Research Department of Zoology, Jamal Mohamed College, 620020, Tiruchirappalli, Tamil Nadu, India;Université Pédagogique Nationale (UPN), Croisement Route de Matadi et Avenue de la Libération. Quartier Binza/UPN, B.P. 8815, Kinshasa, Democratic Republic of Congo;Section Nutrition diététique, Institut Supérieur des Techniques Médicales/Kinshasa, B.P. 774, Kinshasa XI, Democratic Republic of Congo;Faculty of science, Forel Institute and Institute of Environmental Sciences, University of Geneva, CP 416, 1290, Versoix, Switzerland;Faculty of science, Forel Institute and Institute of Environmental Sciences, University of Geneva, CP 416, 1290, Versoix, Switzerland Department of Chemistry, Faculty of Science, University of Kinshasa (UNIKIN), B.P. 190, Kinshasa XI, Democratic Republic of Congo Université Pédagogique Nationale (UPN), Croisement Route de Matadi et Avenue de la Libération. Quartier Binza/UPN, B.P. 8815, Kinshasa, Democratic Republic of Congo E-mail: john.pote@unige.ch",Springer International Publishing,2019-10-01,186,10,6831,6831,0167-6369,1573-2959,copyright,"Springer International Publishing Switzerland, 2014",springer,https://www.swissbib.ch/Search/Results?lookfor=nationallicencespringer101007s106610143951y,http://sru.swissbib.ch/sru/search/defaultdb?query=+dc.anywhere+exact+NATIONALLICENCEspringer101007s106610143951y&operation=searchRetrieve&recordSchema=info%3Asrw%2Fschema%2F1%2Fmarcxml-v1.1-light&maximumRecords=10&startRecord=0&recordPacking=XML&availableDBs=defaultdb&sortKeys=Submit+query,http://sru.swissbib.ch/sru/search/defaultdb?query=+dc.anywhere+exact+NATIONALLICENCEspringer101007s106610143951y&operation=searchRetrieve&recordSchema=info%3Asrw%2Fschema%2F1%2Fdc-v1.1-light&maximumRecords=10&startRecord=0&recordPacking=XML&availableDBs=defaultdb&sortKeys=Submit+query,http://sru.swissbib.ch/sru/search/defaultdb?query=+dc.anywhere+exact+NATIONALLICENCEspringer101007s106610143951y&operation=searchRetrieve&recordSchema=info%3Asru%2Fschema%2Fjson&maximumRecords=10&startRecord=0&recordPacking=XML&availableDBs=defaultdb&sortKeys=Submit+query,It was possible to publish this article open access thanks to a Swiss National Licence with the Publisher
"Agroscope, Air pollution/Climate Group, Reckenholzstrasse 191, 8046, Zürich, Switzerland Institute for Environmental Sciences, University of Geneva, 7 route de Drize, 1227, Carouge, Switzerland Wegener Center for Climate and Global Change, University of Graz, Brandhofgasse 5, 8010, Graz, Austria E-mail: pascalle.smith@laposte.net","Smith, Pascalle C.",unige,10.1007/s10584-014-1263-4,https://doi.org/10.1007/s10584-014-1263-4,,Station-scale bias correction and uncertainty analysis for the estimation of irrigation water requirements in the Swiss Rhone catchment under climate change,,"Smith, Pascalle C.;Heinrich, Georg;Suklitsch, Martin;Gobiet, Andreas;Stoffel, Markus;Fuhrer, Jürg",2014,Climatic Change,"Agroscope, Air pollution/Climate Group, Reckenholzstrasse 191, 8046, Zürich, Switzerland Institute for Environmental Sciences, University of Geneva, 7 route de Drize, 1227, Carouge, Switzerland Wegener Center for Climate and Global Change, University of Graz, Brandhofgasse 5, 8010, Graz, Austria E-mail: pascalle.smith@laposte.net;Wegener Center for Climate and Global Change, University of Graz, Brandhofgasse 5, 8010, Graz, Austria;Wegener Center for Climate and Global Change, University of Graz, Brandhofgasse 5, 8010, Graz, Austria Central Institute for Meteorology and Geodynamics, Hohe Warte 38, 1190, Vienna, Austria;Wegener Center for Climate and Global Change, University of Graz, Brandhofgasse 5, 8010, Graz, Austria;Institute for Environmental Sciences, University of Geneva, 7 route de Drize, 1227, Carouge, Switzerland;Agroscope, Air pollution/Climate Group, Reckenholzstrasse 191, 8046, Zürich, Switzerland",Springer Netherlands,2019-12-01,127,,521,534,0165-0009,1573-1480,copyright,"Springer Science+Business Media Dordrecht, 2014",springer,https://www.swissbib.ch/Search/Results?lookfor=nationallicencespringer101007s1058401412634,http://sru.swissbib.ch/sru/search/defaultdb?query=+dc.anywhere+exact+NATIONALLICENCEspringer101007s1058401412634&operation=searchRetrieve&recordSchema=info%3Asrw%2Fschema%2F1%2Fmarcxml-v1.1-light&maximumRecords=10&startRecord=0&recordPacking=XML&availableDBs=defaultdb&sortKeys=Submit+query,http://sru.swissbib.ch/sru/search/defaultdb?query=+dc.anywhere+exact+NATIONALLICENCEspringer101007s1058401412634&operation=searchRetrieve&recordSchema=info%3Asrw%2Fschema%2F1%2Fdc-v1.1-light&maximumRecords=10&startRecord=0&recordPacking=XML&availableDBs=defaultdb&sortKeys=Submit+query,http://sru.swissbib.ch/sru/search/defaultdb?query=+dc.anywhere+exact+NATIONALLICENCEspringer101007s1058401412634&operation=searchRetrieve&recordSchema=info%3Asru%2Fschema%2Fjson&maximumRecords=10&startRecord=0&recordPacking=XML&availableDBs=defaultdb&sortKeys=Submit+query,It was possible to publish this article open access thanks to a Swiss National Licence with the Publisher
"Thumos Group, Geneva University, Geneva, Switzerland 5 chemin d’Amoz, 1257, Charrot, Switzerland E-mail: vivian@mizrahi.ch","Mizrahi, Vivian",unige,10.1007/s11098-013-0265-9,https://doi.org/10.1007/s11098-013-0265-9,,"Sniff, smell, and stuff",,"Mizrahi, Vivian",2014,Philosophical Studies,"Thumos Group, Geneva University, Geneva, Switzerland 5 chemin d’Amoz, 1257, Charrot, Switzerland E-mail: vivian@mizrahi.ch",Springer Netherlands,2019-11-01,171,2,233,250,0031-8116,1573-0883,copyright,"Springer Science+Business Media Dordrecht, 2013",springer,https://www.swissbib.ch/Search/Results?lookfor=nationallicencespringer101007s1109801302659,http://sru.swissbib.ch/sru/search/defaultdb?query=+dc.anywhere+exact+NATIONALLICENCEspringer101007s1109801302659&operation=searchRetrieve&recordSchema=info%3Asrw%2Fschema%2F1%2Fmarcxml-v1.1-light&maximumRecords=10&startRecord=0&recordPacking=XML&availableDBs=defaultdb&sortKeys=Submit+query,http://sru.swissbib.ch/sru/search/defaultdb?query=+dc.anywhere+exact+NATIONALLICENCEspringer101007s1109801302659&operation=searchRetrieve&recordSchema=info%3Asrw%2Fschema%2F1%2Fdc-v1.1-light&maximumRecords=10&startRecord=0&recordPacking=XML&availableDBs=defaultdb&sortKeys=Submit+query,http://sru.swissbib.ch/sru/search/defaultdb?query=+dc.anywhere+exact+NATIONALLICENCEspringer101007s1109801302659&operation=searchRetrieve&recordSchema=info%3Asru%2Fschema%2Fjson&maximumRecords=10&startRecord=0&recordPacking=XML&availableDBs=defaultdb&sortKeys=Submit+query,It was possible to publish this article open access thanks to a Swiss National Licence with the Publisher
"Department of Pathology and Immunology, CMU, University of Geneva, Geneva, Switzerland E-mail: sarah.garrido-urbani@unige.ch","Garrido-Urbani, S.",unige,10.1007/s00441-014-1820-1,https://doi.org/10.1007/s00441-014-1820-1,,Tight junction dynamics: the role of junctional adhesion molecules (JAMs),,"Garrido-Urbani, S.;Bradfield, P. F.;Imhof, B. A.",2014,Cell and Tissue Research,"Department of Pathology and Immunology, CMU, University of Geneva, Geneva, Switzerland E-mail: sarah.garrido-urbani@unige.ch;Department of Pathology and Immunology, CMU, University of Geneva, Geneva, Switzerland;Department of Pathology and Immunology, CMU, University of Geneva, Geneva, Switzerland E-mail: beat.imhof@unige.ch",Springer Berlin Heidelberg,,355,,701,715,0302-766X,1432-0878,copyright,"Springer-Verlag Berlin Heidelberg, 2014",springer,https://www.swissbib.ch/Search/Results?lookfor=nationallicencespringer101007s0044101418201,http://sru.swissbib.ch/sru/search/defaultdb?query=+dc.anywhere+exact+NATIONALLICENCEspringer101007s0044101418201&operation=searchRetrieve&recordSchema=info%3Asrw%2Fschema%2F1%2Fmarcxml-v1.1-light&maximumRecords=10&startRecord=0&recordPacking=XML&availableDBs=defaultdb&sortKeys=Submit+query,http://sru.swissbib.ch/sru/search/defaultdb?query=+dc.anywhere+exact+NATIONALLICENCEspringer101007s0044101418201&operation=searchRetrieve&recordSchema=info%3Asrw%2Fschema%2F1%2Fdc-v1.1-light&maximumRecords=10&startRecord=0&recordPacking=XML&availableDBs=defaultdb&sortKeys=Submit+query,http://sru.swissbib.ch/sru/search/defaultdb?query=+dc.anywhere+exact+NATIONALLICENCEspringer101007s0044101418201&operation=searchRetrieve&recordSchema=info%3Asru%2Fschema%2Fjson&maximumRecords=10&startRecord=0&recordPacking=XML&availableDBs=defaultdb&sortKeys=Submit+query,It was possible to publish this article open access thanks to a Swiss National Licence with the Publisher
"Department of Imaging, Divisions of Radiology and Nuclear Medicine, Geneva University Hospital, Rue Gabrielle Perret Gentil 4, CH-1211, Geneva 14, Switzerland E-mail: Minerva.Becker@hcuge.ch","Becker, Minerva",unige,10.1007/s00259-013-2580-y,https://doi.org/10.1007/s00259-013-2580-y,,Detection and quantification of focal uptake in head and neck tumours: 18F-FDG PET/MR versus PET/CT,,"Varoquaux, Arthur;Rager, Olivier;Poncet, Antoine;Delattre, Bénédicte M. A.;Ratib, Osman;Becker, Christoph D.;Dulguerov, Pavel;Dulguerov, Nicolas;Zaidi, Habib;Becker, Minerva",2014,European Journal of Nuclear Medicine and Molecular Imaging,"Department of Imaging, Divisions of Radiology and Nuclear Medicine, Geneva University Hospital, Rue Gabrielle Perret Gentil 4, CH-1211, Geneva 14, Switzerland;Department of Imaging, Divisions of Radiology and Nuclear Medicine, Geneva University Hospital, Rue Gabrielle Perret Gentil 4, CH-1211, Geneva 14, Switzerland;Center for Clinical Research, Geneva University Hospital, Geneva, Switzerland;Department of Imaging, Divisions of Radiology and Nuclear Medicine, Geneva University Hospital, Rue Gabrielle Perret Gentil 4, CH-1211, Geneva 14, Switzerland Nuclear Medicine Division, Philips Healthcare AG, Gland, Switzerland;Department of Imaging, Divisions of Radiology and Nuclear Medicine, Geneva University Hospital, Rue Gabrielle Perret Gentil 4, CH-1211, Geneva 14, Switzerland;Department of Imaging, Divisions of Radiology and Nuclear Medicine, Geneva University Hospital, Rue Gabrielle Perret Gentil 4, CH-1211, Geneva 14, Switzerland;Clinic of Otorhinolaryngology Head and Neck Surgery, Geneva University Hospital, Geneva, Switzerland;Clinic of Otorhinolaryngology Head and Neck Surgery, Geneva University Hospital, Geneva, Switzerland;Department of Imaging, Divisions of Radiology and Nuclear Medicine, Geneva University Hospital, Rue Gabrielle Perret Gentil 4, CH-1211, Geneva 14, Switzerland;Department of Imaging, Divisions of Radiology and Nuclear Medicine, Geneva University Hospital, Rue Gabrielle Perret Gentil 4, CH-1211, Geneva 14, Switzerland E-mail: Minerva.Becker@hcuge.ch",Springer Berlin Heidelberg,,41,3,462,475,1619-7070,1619-7089,copyright,"The Author(s), 2013",springer,https://www.swissbib.ch/Search/Results?lookfor=nationallicencespringer101007s002590132580y,http://sru.swissbib.ch/sru/search/defaultdb?query=+dc.anywhere+exact+NATIONALLICENCEspringer101007s002590132580y&operation=searchRetrieve&recordSchema=info%3Asrw%2Fschema%2F1%2Fmarcxml-v1.1-light&maximumRecords=10&startRecord=0&recordPacking=XML&availableDBs=defaultdb&sortKeys=Submit+query,http://sru.swissbib.ch/sru/search/defaultdb?query=+dc.anywhere+exact+NATIONALLICENCEspringer101007s002590132580y&operation=searchRetrieve&recordSchema=info%3Asrw%2Fschema%2F1%2Fdc-v1.1-light&maximumRecords=10&startRecord=0&recordPacking=XML&availableDBs=defaultdb&sortKeys=Submit+query,http://sru.swissbib.ch/sru/search/defaultdb?query=+dc.anywhere+exact+NATIONALLICENCEspringer101007s002590132580y&operation=searchRetrieve&recordSchema=info%3Asru%2Fschema%2Fjson&maximumRecords=10&startRecord=0&recordPacking=XML&availableDBs=defaultdb&sortKeys=Submit+query,It was possible to publish this article open access thanks to a Swiss National Licence with the Publisher
